"'1','2013-04-01','Even as the value of goods produced in the United States has grown as a share of the economy, the need for workers to make them has shrunk. The total number of jobs dedicated to manufacturing peaked in the late 1970s and now accounts for less than 9 percent of all jobs.'"
"'2','2013-04-01','The Nikon Coolpix A is the latest compact camera with a big sensor to hit the market. But something is missing here....'"
"'3','2013-04-01','The parent company of the Nasdaq stock exchange said Tuesday that it would buy the electronic bond-trading platform eSpeed for $750 million, amid consolidation in the industry....'"
"'4','2013-04-01','A 16-day program, driven by a government mandate, teaches potential board candidates about corporate governance and lets them form networks....'"
"'5','2013-04-01','Many fans remember Freddy Schuman at the stadium carrying signs and banging on a pot with a wooden spoon he bought at a nearby thrift store....'"
"'6','2013-04-01','There are a number of theories about why official Chinese media outlets are attacking Apple. And while many Chinese commentators online are mocking the state media, the company does appear to have a problem with Beijing....'"
"'7','2013-04-01','A wave of e-commerce companies are trying to build premium brands at discount prices by cutting out middlemen and going straight to manufacturers, Claire Cain Miller and Stephanie Clifford report Monday in The New York Times....'"
"'8','2013-04-01','The home builder Taylor Morrison said on Monday that it planned to raise as much as $602 million in an initial public offering, seeking to take advantage of a nascent revival in the housing markets....'"
"'9','2013-04-01','The stock market closes at a record high. Daily deals are no longer driving restaurant traffic. You may now power up your electronic devices. But are your ducks in a row?...'"
"'10','2013-04-01','An Astros fan caught in the rain outside Minute Maid Park, where Houston opened the season against Texas....'"
"'11','2013-04-01','D. A. Points came back from a long rain delay and made four pars Sunday, the last one giving him a one-shot victory in the Houston Open and a trip to the Masters. With a putter he once borrowed from his mother and never returned, Points rolled in a putt from just outside 12 feet on the final hole to polish off a six-under 66 and avoid a sudden-death playoff with Henrik Stenson and Billy Horschel.

It was quite a turnaround for Points, whose only other PGA Tour win was at Pebble Beach two years ago. He started the year by missing the cut seven times in nine tournaments. He arrived at the tournament at Redstone Golf Club in Humble, Texas, having not broken 70 in his last nine rounds. But he stayed in the hunt after opening with a 64, and he kept his calm when he returned to the golf course after a rain delay of nearly three hours.'"
"'12','2013-04-01','MCCRACKEN--Hugh C.,70, in New York on March 29, 2013. Session guitarist extra ordinaire, loving husband, son, father, grandfather and friend. Profoundly missed by wife Holly, children Scot, Jodi, Marc and Kim, mother, brother and sister, grandchil...'"
"'13','2013-04-02','Hillary Rodham Clinton made her public debut in her new role as prospective presidential candidate on Tuesday night by returning to the issue of empowerment of women around the globe....'"
"'14','2013-04-02','In its upfront presentation to advertisers, Bravo explained how it can incorporate brands into scenes from its reality shows....'"
"'15','2013-04-02','A beet and bulgur salad from Telepan on the Upper West Side is earthy, bright and exuberantly different....'"
"'16','2013-04-02','A light but flavorful ham stock can be substituted for chicken stock in many recipes....'"
"'17','2013-04-02','Few people engaged in the battle to protect women can match the firsthand experience prosecuting domestic abuse and rape cases that Cindy Dyer of Vital Voices brings to the front lines....'"
"'18','2013-04-02','Civil War prisons contributed to the growth of baseball....'"
"'19','2013-04-02','A recent crop of programs is trying a new approach to increasing the number of women in the technology field: Teaching teenage girls how to write computer code....'"
"'20','2013-04-02','The police force is grossly short of female officers....'"
"'21','2013-04-02','Fans packed Yankee Stadium and Citi Field to watch the Yankees and Mets open their seasons at home at the same time, something that has not happened between two New York teams since 1956....'"
"'22','2013-04-02','MTV has suspended production on its reality series  &#x201C;Buckwild&#x201D;  in the wake of news that one of its most popular cast members, Shain Gandee, was found dead on Monday. Details about Mr. Gandee&#x2019;s death remained unclear on Monday...'"
"'23','2013-04-02','Thriftland U.S.A., a large second-hand store in the South Bronx, seems an unlikely place to claim a piece of New York Yankees history. &#xa;   &#xa;&#x201C;I hate the Yankees &#x2014; every time there&#x2019;s a home game, it totally messes up the...'"
"'24','2013-04-03','Federal authorities plan to issue a stinging critique of how banking regulators responded to wide-ranging foreclosure abuses, blaming officials for a bureaucratic maze that delayed relief to homeowners....'"
"'25','2013-04-03','The recent spurt in bank business lending is starting to flash some warning signs. The concern is that banks are making loans to businesses at rates that are so low that they may end up being unprofitable for the lenders....'"
"'26','2013-04-03','The photographer Greg Kessler captures the transformations of real women, with professional makeup by Tina Turnbow....'"
"'27','2013-04-03','A consultant offers advice on picking the right system to manage customer relations....'"
"'28','2013-04-03','A Consumer Reports analysis of five generic drugs found Costco offered the lowest prices....'"
"'29','2013-04-03','The pro-choice side is usually on the defensive. But active attempts to protect reproductive freedom are not unheard of....'"
"'30','2013-04-03','Recent graduates do not question or doubt a job that has a tough mission. They know how to survive, will follow a vision and want to make a difference....'"
"'31','2013-04-03','Brian Lindeman, the director of financial aid at Macalester College, answers questions about understanding financial aid packages....'"
"'32','2013-04-03','The phone has not stopped ringing for the last two weeks at  Tujague&#x2019;s , the century-and-a-half-old restaurant in the French Quarter of New Orleans. But it&#x2019;s not just popularity driving business. It&#x2019;s panic. &#xa;   &#xa;&#x20...'"
"'33','2013-04-03','LOS ANGELES &#x2013; With every ad campaign won or lost by Sterling Cooper Draper Pryce, every whiskey swigged, every cigarette smoked and every errant lipstick stain that turns up on the wrong collar,  &#x201C;Mad Men&#x201D;  draws nearer to its...'"
"'34','2013-04-03','It&#x2019;s easy to be fascinated by our own dreams. Yet when the dreams of others are recounted to us, so much gets lost in translation. Or, to put it more plainly: suffering through someone else&#x2019;s jump cuts and surreal metaphors can be te...'"
"'35','2013-04-03','WHEN Julia Geist was asked to draw a picture of a computer scientist last year, the 16-year-old sketched a businessman wearing glasses and a tie. Looking around at her classmates&#x2019; drawings, she saw similar depictions of men.&#xa;   &#xa;Now...'"
"'36','2013-04-03','PRICE--Alice, mother of Monroe and Vivian, born in Vienna, 1910, died Tuesday. A memorial service will be held today at 11:30am at Riverside Memorial Chapel, 180 W. 76 St...'"
"'37','2013-04-04','Best Buy on Wednesday took its best guess that the latest iPads are coming soon from Apple by slashing prices on one line of the Apple tablets by 30 percent....'"
"'38','2013-04-04','Alleged terrorist plots, each more improbable than the last, emerge every few years in Cambodia, often conveniently involving members of the opposition....'"
"'39','2013-04-04','It has been a controversial European tour for Justin Bieber, the Canadian superstar singer. Is there something new about the youth culture phenomenon he represents, or was it always like this?...'"
"'40','2013-04-04','Our account executives are really good at closing deals when they have the opportunity to meet with a company in person. How do we increase the number of in-person meetings?...'"
"'41','2013-04-04','BARSHOP--Morton. Our heartfelt condolences to Cindy and Howard on the loss of your beloved father, and to Ruth on the loss of your dear husband, Morton Barshop. The completely bare family...'"
"'42','2013-04-04','7:43 p.m. | Updated LONDON &#x2014; The push to change Barclays from a predominantly British retail bank to a global financial giant over the last two decades created a culture that put profit before customers, according to an independent report r...'"
"'43','2013-04-04','When he left physics, John Breit had the choice of a job in naval intelligence or on Wall Street. &#x201C;My wife said I couldn&#x2019;t be a spy. She hates capitalism, but said to go to Wall Street,&#x201D; he told me recently. &#x201C;And then I...'"
"'44','2013-04-04','Not every critic makes waves when he says that he&#x2019;ll be writing fewer than 300 reviews in a year, but then not every critic is  Roger Ebert . &#xa;   &#xa;Mr. Ebert, the influential film writer for The Chicago Sun-Times,  wrote on his blog ...'"
"'45','2013-04-05','Members of the Renaissance Street Singers perform free concerts in Grand Central Terminal over the winter months.'"
"'46','2013-04-05','The technology reporters and editors of The New York Times scour the Web for important and peculiar items. For Saturday, selections include the Drug Enforcement Administration complaining that it could not intercept messages between Apple devices ...'"
"'47','2013-04-05','Not since 1979 has such a small share of the population been working or actively looking for a job.'"
"'48','2013-04-05','Despite efforts by Twitter to check for fake accounts, the underground market is becoming more sophisticated....'"
"'49','2013-04-05','Bucks readers share their experiences in working overseas....'"
"'50','2013-04-05','You can make chicken stock from just the back....'"
"'51','2013-04-05','The earnings yield on stocks is now higher than the investment yield on junk bonds. Either stocks are cheap or junk bonds are expensive. Or both....'"
"'52','2013-04-05','More liabilities, but more assets too....'"
"'53','2013-04-05','The question is whether the bondholders can get the bankruptcy court to force Stockton out of Calpers, perhaps as the price for continuing its Chapter 9 case....'"
"'54','2013-04-05','Hillary Rodham Clinton offered a glimpse on Friday of how she will fill her at least temporary role as a private advocate for women and girls in a speech at the Women in the World Conference....'"
"'55','2013-04-05','Male pattern baldness, the kind that starts at the top or back of the head, may indicate an increased risk for coronary heart disease, according to a new analysis....'"
"'56','2013-04-05','Austerity USA....'"
"'57','2013-04-05','Matt Bettencourt and Peter Tomasulo shot five-under par 67s to earn the surprising lead after the first round of the Texas Open in San Antonio.'"
"'58','2013-04-05','Dodging soldiers on the mountain and ramming through road barricades part of the fun, foreign skiers say....'"
"'59','2013-04-05','It&#x2019;s no longer just a dream in the hearts of  &#x201C;Arrested Development&#x201D;  fans, a wild scheme in the mind of the series creator Mitchell Hurwitz or a question for its cast members to answer in every interview they have given since...'"
"'60','2013-04-05','MEXICO CITY &#x2014; When Banco Santander held the $4.13 billion public stock offering of its Mexico subsidiary here last September, a mariachi band and Mexican folk dancers set the festive mood for a media breakfast in a sun-filled dining room at...'"
"'61','2013-04-05','Mutual Funds in the First Quarter'"
"'62','2013-04-06','Credit: Adam Dean for The New York Times'"
"'63','2013-04-06','A police detective who was killed along with a murder suspect at police headquarters in Jackson was shot with his own gun, the authorities said Friday. Jeremy Powell, 23, seized the gun from Detective Eric Smith, 40, on Thursday while being questioned about a stabbing death, a Mississippi Bureau of Investigation spokesman said. Mr. Powell shot the officer four times before killing himself, the authorities said.'"
"'64','2013-04-06','Hugh McCracken, a virtuoso guitarist who was in such demand as a studio musician that he could afford to turn down Paul McCartney&#x2019;s invitation to join the band Wings in 1971, died on Friday in Manhattan. He was 70.&#xa;   &#xa;The cause was...'"
"'65','2013-04-07','Using a contentious medium to try to shape its future....'"
"'66','2013-04-07','Auroras Encore, a 66-1 long shot, won the Grand National Steeplechase by nine lengths Saturday in Aintree, England, in a race shadowed by recent horse deaths. All 40 horses in the event returned unscathed after only 17 finished the 4.5-mile course. Four horses died in the previous two editions of the race, prompting organizers to modify the course. Cappa Bleu was second and Teaforthree was third. Sue Smith became the third woman to train a National winner.'"
"'67','2013-04-07','This Is Who Rules the Bars of New York'"
"'68','2013-04-07','This Is Who Rules the Bars of New York'"
"'69','2013-04-07','NEMIROFF--David G.,69, retired psychologist, died suddenly March 23 after a long struggle with Parkinson's Disease at Hebrew Rehabilitation Center, Roslindale, MA. Predeceased by his wife, Helene; survived by his son, Larry, his sisters Sandra, Ju...'"
"'70','2013-04-07','Ground Cover Over several chilly days in late March, the photographer Benjamin Lowy set out to walk across Brooklyn to document the change in seasons. Starting out in Dumbo, Lowy made his way to Vinegar Hill, Williamsburg and Greenpoint, then down...'"
"'71','2013-04-07','MCCRACKEN--Hugh C.,70, in New York on March 29, 2013. Session guitarist extra ordinaire, loving husband, son, father, grandfather and friend. Profoundly missed by wife Holly, children Scot, Jodi, Marc and Kim, mother, brother and sister, grandchil...'"
"'72','2013-04-07','. . . going behind the counter at the   vegan joint   that portends the fast-food industry&#x27;s future (Page 26), eavesdropping on a butcher who thinks we don&#x2019;t eat enough   pig&#x2019;s head   (Page 36),peering into the kitchen when the ...'"
"'73','2013-04-07','&#xA0;&#xa;   &#xa;The European Commission has recently proposed a number of measures that would strengthen the rights that passengers have while flying in the European Union. The rules would ensure that travelers have better information, treatmen...'"
"'74','2013-04-08','As more trading takes place away from the public exchanges, regulators have been examining whether so-called dark pools create an uneven investment playing field....'"
"'75','2013-04-08','Microsoft is planning to reveal details about its new Xbox video game console at an event in May, as the games industry prepares for a new generation of hardware that it hopes will lift sales....'"
"'76','2013-04-08','The Senate on Monday confirmed Mary Jo White to lead the Securities and Exchange Commission, dismissing concerns about her close ties to the Wall Street banks she will now oversee....'"
"'77','2013-04-08','The imprecise rules governing insider trading are an ineffective means to regulate how political intelligence firms operate, the author writes....'"
"'78','2013-04-08','Who actually got let off the hook?...'"
"'79','2013-04-08','Sometimes, the phone rings with an entrepreneur whose business is on life support and who is looking for a last breath of life. Sometimes, I decline to help.,...'"
"'80','2013-04-08','Louisville topped Michigan, 82-76, and Rick Pitino became the first coach to win a national title at two schools. Mike Huguenin and other Times reporters provide highlights and analysis of the championship game....'"
"'81','2013-04-08','Dozens of interactive kiosks are to be installed in 16 subway stations in the next few months, designed to help commuters navigate the system....'"
"'82','2013-04-08','Clean Power Finance, an online platform that provides software and financial services to solar professionals and investors, has raised a fresh $37 million, in a sign that enthusiasm for the solar sector has not dimmed entirely....'"
"'83','2013-04-08','India may have conducted its first nuclear test to counter an economic slowdown and other revelations....'"
"'84','2013-04-08','PRICE--Selma Kaplan, Price Rahav Realty has lost its founder and its beacon of fast and brilliant business thinking, Selma K. Price. Through her guidance and generosity, Selma K. Price allowed the growth of our company, never ever forgetting, not ...'"
"'85','2013-04-08','PRICE--Selma Kaplan, Selma Kaplan Price passed away peacefully, on April 6, at the age of 103, at her home, in her granddaughter's arms. Selma is survived by three loving children, six grandchildren, and 14 great-grandchildren. Funeral services at...'"
"'86','2013-04-08','PRICE--Selma Kaplan, The Chelsmore Apartments Organization mourns the passing of its legendary founder, Selma K. Price. With her gift for language she coined the word Chelsmore for a building she daringly bought in Chelsea, Manhattan almost 60 yea...'"
"'87','2013-04-08','&#x201C;Shoot the first anti-advertising ad&#x201D; is the pitch for a contest sponsored by Adblock Plus, the popular software that whites out Web site advertisements. The winning 30- to 90-second video submission, Adblock Plus says, will receive ...'"
"'88','2013-04-09','The mortgage finance companies Fannie Mae and Freddie Mac are in conservatorship and the government wants to wind them down. Yet their share prices have jumped this year....'"
"'89','2013-04-09','A ten day rickshaw ride, from Delhi to Mumbai, to visit inspirational women in India....'"
"'90','2013-04-09','There remains a strangely high unemployment rate relative to the job openings rate, at least when compared with the relationship these two variables had before the recession....'"
"'91','2013-04-09','Months after brokering a settlement with banks over mortgage foreclosure abuses, the Federal Reserve and the Office of the Comptroller of the Currency are set to dole out roughly $1.2 billion in cash relief....'"
"'92','2013-04-09','Federal prosecutors and regulators in Los Angeles are said to be investigating a former senior partner at the auditing firm on suspicion that he leaked information to a trader....'"
"'93','2013-04-09','Metropolitan Diary: Anticipating that her 3-month-old might cry in flight, a mother gave out goody bags, including earplugs, to nearby passengers....'"
"'94','2013-04-09','Credit: Thomas Cristofoletti for The New York Times'"
"'95','2013-04-09','Coastal development has soared, and this rush toward the sea is the biggest factor in the rising costs of storm bailouts....'"
"'96','2013-04-09','Baldness may indicate an increased risk for coronary heart disease.&#xa;   &#xa;The risk is associated only with male pattern baldness, the kind that starts at the top or back of the head, and not with a receding hairline, according to researchers...'"
"'97','2013-04-09','The Senate on Monday confirmed  Mary Jo White  as head of the  Securities and Exchange Commission , dismissing concerns about her close ties to the Wall Street banks she will now oversee.&#xa;   &#xa;Ms. White, a former federal prosecutor who spen...'"
"'98','2013-04-09','The chief executives of the three largest stock exchanges are joining forces for the first time to push regulators to rein in the increasing amount of trading that is moving off public exchanges and onto platforms like so-called dark pools.&#xa;  ...'"
"'99','2013-04-09','Coming this summer to as many as 120 screens around New York City: &#x201C;On the Go!&#x201D;&#xa;   &#xa;Thrill to your own personal journey underground, as bright ribbons of color snake through the boroughs, showing you how to get from here to t...'"
"'100','2013-04-10','The fresh look at internal practices came after news that a senior partner at KPMG gave confidential information about two clients....'"
"'101','2013-04-10','Banks are shedding risky assets to show that they are not as vulnerable as they once were, but in some cases that just means shifting the risk to a less regulated area of Wall Street....'"
"'102','2013-04-10','There is something about chirping birds that makes us want to say goodbye to earth tones. Some makeup picks for this spring season.'"
"'103','2013-04-10','A judge has approved a request from Donald Longueuil, a former employee of the hedge fund SAC Capital Advisors, to take a three-week honeymoon to Africa after his prison sentence is over....'"
"'104','2013-04-10','Five seminal British plays that would never have come about without Margaret Thatcher....'"
"'105','2013-04-10','General Electric is announcing a deal with Quirky, a start-up that crowd-sources the development of products, in an attempt to turn industrial patents into Internet-connected devices for consumers....'"
"'106','2013-04-10','The police say a 35-year-old man burned a dozen Jewish doorway adornments known as mezuzot in Brooklyn this week....'"
"'107','2013-04-10','George E. Logue Sr. collected scores of tractors and bulldozers over the years. Now that he has passed away, his collection is up for grabs....'"
"'108','2013-04-10','Networking and content management providers are working with cable companies and other broadcasters to deal with competition from the Internet by controlling the mobile video experience and offering extras....'"
"'109','2013-04-10','An elephant in the Ringling Brothers and Barnum & Bailey Circus was injured in a drive-by shooting on Tuesday, and the police were searching for suspects, law enforcement and circus officials said.

The 39-year-old Asian elephant, named Carol, was resting in an enclosure outside the BancorpSouth Arena in Tupelo when a shot fired from a passing vehicle hit her shoulder, an arena spokesman said. The elephant is expected to fully recover, the circus said.'"
"'110','2013-04-10','Crews dug through a gutted Detroit medical building on Tuesday, searching for two people unaccounted for after shots were fired inside and the structure was set on fire, the police said. A man believed responsible for the shooting and a woman who worked at the site, the Park Medical Centers, had not been found, said Dwane Blackmon, a Detroit police homicide inspector. He did not release their names.'"
"'111','2013-04-10','The University of Maine fired Coach Tim Whitehead after 12 seasons. Whitehead had a record of 250-171-54 at Maine, and took the team to the national championship game in 2002 and 2004. But his teams had losing records for the past six seasons.'"
"'112','2013-04-10','8:28 p.m. | Updated &#xa;&#xa;   &#xa;For a company that promotes clean living, the nutritional supplement maker  Herbalife  has had a messy history....'"
"'113','2013-04-10','The nation&#x2019;s top banking regulators have some good news for some troubled homeowners: the checks will be in the mail soon.&#xa;   &#xa;Months after brokering a multibillion-dollar settlement with banks over mortgage foreclosure abuses, the ...'"
"'114','2013-04-10','The mortgage giants  Fannie Mae  and  Freddie Mac  continue to astound &#x2014; and not in a very encouraging way.&#xa;   &#xa;The share price of each company has tripled in the last few months, pointing to the foolishness of Wall Street, this tim...'"
"'115','2013-04-11','As Verizon began recovering from the destruction caused at its headquarters in Lower Manhattan, it became clear that the flooding had even affected 12 monumental ceiling frescoes....'"
"'116','2013-04-11','Seeking to project strength, banks sometimes shift risk without actually moving assets. | Lawmakers could be stymied in efforts to rein in banking consultants. | A KPMG executive who was fired by the firm leaked secret information to a friend on t...'"
"'117','2013-04-11','This word has appeared in nine New York Times articles in the past year....'"
"'118','2013-04-11','Banks have been shedding risky assets to show regulators that they are not as vulnerable as they were during the financial crisis. In some cases, however, the assets don&#x2019;t actually move &#x2014; the bank just shifts the risk to another inst...'"
"'119','2013-04-11','The Business of Being | India Hicks'"
"'120','2013-04-12','Wells Fargo and JPMorgan Chase reported strong earnings, but added that mortgage income was declining....'"
"'121','2013-04-12','Nike has introduced its latest line of lightweight, limited-edition footwear at the Salone Internazionale del Mobile in Milan....'"
"'122','2013-04-12','Kareem Serageldin, a former senior trader at Credit Suisse, admitted in court on Friday that he fraudulently inflated the value of mortgage bonds as the housing market collapsed....'"
"'123','2013-04-12','From fine jewelry to home goods to tropical properties, T breaks down the world of the designer India Hicks....'"
"'124','2013-04-12','A reconfigured 42nd-floor apartment comes with impressive views of Central Park, the Hudson River and the cityscape....'"
"'125','2013-04-12','This week, our collaborators in New Jersey got playful with both their Times choices and the writing activities they suggest for them....'"
"'126','2013-04-12','Jason Day led the Masters after the second round, shooting a four-under 68 for a six-under 138 total and giving him a one-stroke lead over Fred Couples and Marc Leishman. The  14-year-old Guan Tianlang finished 10 shots off the lead....'"
"'127','2013-04-12','Bayern Munich faces Barcelona in the first Champions League semifinal; Dortmund will play Real Madrid....'"
