"'140','2014-01-23','Cheap servers were a drag on Big Blue. Now the company plans to focus on computer hardware with better profit margins....'"
"'141','2014-01-23','Is there a tsunami of retail closings on the way? How one video store stays open....'"
"'142','2014-01-23','The British police expect that austerity measures will lead to continued protest....'"
"'143','2014-01-23','Hou Xin, a former journalist who participated in a protest against official corruption, is one of at least eight activists in China being tried this week....'"
"'144','2014-01-23','The findings are laid out in a report that represent the first major public statement by the Privacy and Civil Liberties Oversight Board, which Congress made an independent agency in 2007 and which only recently became fully operational....'"
"'145','2014-01-23','Daniel S. Loeb of Third Point and Paul E. Singer of Elliott Management spoke of the seeming unlikelihood that prominent investors would take a stand on gay rights....'"
"'146','2014-01-23','A disagreement over the price had held up the sale of the division a year earlier....'"
"'147','2014-01-23','Why are more and more women beginning to run American restaurant kitchens?...'"
"'148','2014-01-23','Xu Zhiyong, who is on trial in Beijing and accused of disturbing order by organizing public gatherings calling for equal rights to education and for officials to reveal their wealth, laid out his ideas for the New Citizens Movement....'"
"'149','2014-01-23','India Ink spoke with Mr. Ghemawat, who co-authored a study that measured the globalization levels of 139 countries, about why India ranked near the bottom of his rankings....'"
"'150','2014-01-23','While progress has been made, crucial battle are ahead in bringing the biggest banks under effective control, an economist writes....'"
"'151','2014-01-24','The Australia and New Zealand Banking Group, known as ANZ, is making big bets to court China, including Chinese-language signage and displays at the Australian Open tournament....'"
"'152','2014-01-24','Currencies in formerly fast-growing emerging markets have been falling sharply this week....'"
"'153','2014-01-24','The film, featuring Nicole Kidman as Grace Kelly, will lead 12 days of festival programming....'"
"'154','2014-01-24','Walmart wants to encourage U.S. manufacturing. Legal marijuana businesses may be able to use banks. And how to save money on car rentals....'"
"'155','2014-01-24','The top executives of MasterCard and Western Union spoke about the escalating battle to keep financial transaction systems secure....'"
"'156','2014-01-24','At the World Economic Forum, Ban Ki-moon, the United Nations secretary general, said he wanted banks and other financial companies to focus their lending in the future on the development of sustainable energy sources and businesses with low carbon...'"
"'157','2014-01-24','Apollo Tyres of India is looking for future strategic acquisitions, possibly in growth markets like Brazil, Africa and parts of Asia, its vice chairman said....'"
"'158','2014-01-24','The director Ashim Ahluwalia said he never thought his movie about the sex-horror film industry of 1980s Mumbai would get past the Indian review board, much less draw an enthusiastic response from local audiences....'"
"'159','2014-01-25','David Rockefeller made his mark in the world of finance and foreign affairs as chairman and chief executive of Chase Manhattan bank.'"
"'160','2014-01-26','WEISS--Irwin, born January 23, 1921, son of Max and Anna, beloved husband of over 65 years to Naomi, loving father of Laurie Berke-Weiss (Brian Berke), Sara Weiss (Dr. Lawrence Wasser) and Barbara Finnerty (John Finnerty), proud grandfather of Rac...'"
"'161','2014-01-26','Some customers were prevented from making large cash withdrawals after they refused to present evidence about why they needed the money....'"
"'162','2014-01-27','KRAMER--Bernice Weissberg, (Meme) of Sarasota, FL and Cliffside Park, NJ, died on January 25th, 2014. Daughter of the late Rubin and Minnie Denmark. She was predeceased by her husband Stanley Weissberg and daughter Elyse Weissberg Spero (of blesse...'"
"'163','2014-01-27','Also on the Minute, three years in space and interactive art at the ballet....'"
"'164','2014-01-27','Americans have tended to marry someone whose economic status is about the same as theirs, and that has contributed to growing income inequality in the United States....'"
"'165','2014-01-27','United Technologies is considering Sikorsky, the maker of the Black Hawk helicopter, as a candidate for a tax-free spinoff or potentially a sale to a rival....'"
"'166','2014-01-27','A prominent player in the Bitcoin universe, Charles Shrem, was arrested on Sunday and accused of helping people making drug transactions on the now defunct online bazaar Silk Road....'"
"'167','2014-01-27','Google has acquired DeepMind, a British start-up whose founders include Demis Hassabis, a computer game designer, neuroscientist and former child chess prodigy....'"
"'168','2014-01-27','Gas prices fall. How PayPal is changing. Another retailer may have had a data breach....'"
"'169','2014-01-27','1. Heat oil over medium heat in a large heavy casserole or skillet, or in an earthenware casserole set on a flame tamer. Add the onion and cook, stirring often, until golden, about 10 minutes. If they begin to stick to the pan add a generous pinch of salt. Add another generous pinch of salt and the peppers and cook, stirring often, until they begin to soften, about 5 minutes. Add the garlic and cook, stirring, until fragrant, 30 seconds to a minute. Add the cabbage, chiles, coriander seeds, cumin and caraway and cook, stirring, until cabbage has wilted, about 5 minutes. Stir in the harissa or cayenne, salt and pepper, stir together and add the tomatoes. Bring to a simmer, cover partially, reduce heat to medium-low and cook, stirring from time to time, until tomatoes have cooked down and the mixture is thick and fragrant, about 20 to 25 minutes. Stir in all but 2 teaspoons of the parsley or cilantro, taste and adjust seasonings.

Note: If you are using an earthenware casserole, the cooking times will be longer. It will take about 10 minutes for the peppers to soften, and 30 to 40 minutes for the mixture to cook down.

2. With the back of your spoon, make 6 depressions in the vegetables. Break an egg into each depression. Cover and cook for 5 to 6 minutes, until the eggs are set. Sprinkle the eggs with salt, pepper and the remaining parsley and serve.

Advance preparation: This can be made a few days ahead through Step 1, and it will taste even better on the second day.

Nutritional information per serving: 182 calories; 10 grams fat; 2 grams saturated fat; 2 grams polyunsaturated fat; 5 grams monounsaturated fat; 186 milligrams cholesterol; 15 grams carbohydrates; 4 grams dietary fiber; 100 milligrams sodium (does not include salt to taste); 9 grams protein'"
"'170','2014-01-27','An analysis commissioned by the Green Party in the European Parliament estimates that the cost of the implicit guarantee that governments will back large financial institutions was about 234 billion euros in 2012....'"
"'171','2014-01-27','Extending the disability-insurance model to help defray the costs of care for children, elderly and sick family members could help employees, with minimal impact on business, an economist writes....'"
"'172','2014-01-28','Many Questions, Few Answers on U.S. Claims of Iran Violations'"
"'173','2014-01-28','Testimony by the chief counsel at SAC could allow prosecutors to scrutinize compliance at the multibillion-dollar hedge fund founded by Steven A. Cohen....'"
"'174','2014-01-28','One hedge fund, Fir Tree Partners, is even trying to coax other investors out of participating in the $4.5 billion JPMorgan Chase settlement with private investors....'"
"'175','2014-01-28','Skylight Group creates event spaces in large, distinctive, typically historic locations for corporate clients that include Google, Ralph Lauren and Nike....'"
"'176','2014-01-28','Carl C. Icahn took to his favorite broadcasting tool, Twitter, on Tuesday to disclose that he had purchased an additional $500 million shares in the iPhone maker....'"
"'177','2014-01-28','The deal will return about $84 billion to shareholders in what Vodafone said was the single largest return of value in history, according to a presentation on its website....'"
"'178','2014-01-28','The Royal Bank of Scotland will reduce the range of foreign exchange benchmarks it offers to clients amid investigations into whether some traders colluded to manipulate the $5-trillion-a-day currency markets....'"
"'179','2014-01-28','Casablanca Capital, an activist hedge fund, disclosed on Tuesday that it had taken a 5.2 percent stake in Cliffs Natural Resources, while urging the mining company to spin off its international assets and make other changes....'"
"'180','2014-01-28','The government did not explain why Zhu Changhong, a former fund manager at Pimco, was no longer the chief investment officer at the State Administration of Foreign Exchange....'"
"'181','2014-01-29','A large new study found that prescription testosterone raised the risk of heart attacks, prompting some experts on Wednesday to call for more extensive warning labels on the drugs....'"
"'182','2014-01-29','The European Union revealed a long-awaited proposal to reduce the systemic risk posed by big banks like the Volcker Rule in the United States, but it may be a long time before the European Parliament considers it....'"
"'183','2014-01-29','For Donna Speigel, the interest in special education started with her grandson, Dayton....'"
"'184','2014-01-29','How to trigger a tax audit. And what poor email etiquette says about your business....'"
"'185','2014-01-29','The company appeared to rebuff a proposal by the activist hedge fund manager Daniel S. Loeb, as it also announced measures intended to make shareholders happy....'"
"'186','2014-01-29','Apple TV got its own section of the Apple Store. This comes after rumors that the company is working on an update to the TV box that could include apps and hardware upgrades....'"
"'187','2014-01-29','Max Baucus, who was nominated as the new United States ambassador to China, responded diplomatically to assertions that China represented a rising threat to the United States....'"
"'188','2014-01-29','Major League Baseball is seeking the dismissal of a suit by Yankees third baseman Alex Rodriguez that challenges a season-long suspension for the use of prohibited performance-enhancing substances.

Howard Ganz, an M.L.B. lawyer, said in a letter to United States District Court Judge Edgardo Ramos that the suit should be dismissed because a court is not empowered to re-examine an arbitration award.'"
"'189','2014-01-29','Dell said it would offer networking equipment that was built with nonspecialized semiconductors and an open-source operating system, as opposed to the highly proprietary gear and software from like Cisco Systems and Hewlett-Packard. While that is unlikely to be a huge business soon for Dell, it lends credibility and muscle to what has been a growing effort to dislodge these incumbents through cheaper, easier-to-build equipment. If Dell and others can do that, a result would be lower costs at the large data centers run by Google, Facebook and large banks and companies. Cheaper networking could also make the Internet even more ubiquitous.'"
"'190','2014-01-30','Lloyd C. Blankfein, the chief executive of Goldman Sachs, was awarded 10.5 percent more than in the previous year....'"
"'191','2014-01-30','Ms. Fleming and Ms. Rivera will make their debuts at the theater festival in the Berkshires....'"
"'192','2014-01-30','A letter to the president from the top four House officials is a classic exercise in political disguise and deceit....'"
"'193','2014-01-30','The government used explosives and bulldozers to demolish thousands of residential buildings to punish civilians in neighborhoods where the army has clashed with opposition fighters, the group said....'"
"'194','2014-01-30','The President of World Jewish Congress on Thursday called for the creation of a new panel that resolve the issue of how to resolve the issue of art that was looted by the Nazis from Jewish families and dealers....'"
"'195','2014-01-30','Low vitamin D levels were associated with an increased risk for severe preeclampsia, a serious and sometimes fatal disorder of pregnancy....'"
"'196','2014-01-30','Metropolitan Diary: An argument over a missing $10 turned into a scam accusation, with a surprising ending and a show of honesty....'"
"'197','2014-01-30','What you need to know for Thursday: Taking advantage of empty local spaces during the Super Bowl, a sweep on counterfeit merchandise and a reprieve from the extreme cold....'"
"'198','2014-01-30','Banco Santander of Spain benefited from lower charges for bad loans as its profit rose to 1.06 billion euros in the fourth quarter, but earnings declined in Spain and Latin America....'"
"'199','2014-01-30','The United States Supreme Court denied last-minute appeals on Wednesday to halt the execution of a Missouri man convicted of killing a jewelry store owner during a 1991 robbery. The prisoner, Herbert Smulls, 56, who was scheduled to die by lethal injection on Wednesday at a Missouri prison, had been granted a temporary stay by the court on a series of challenges, including objections to the drugs to be used in his execution.'"
"'200','2014-01-30','A proposal like the Volcker Rule in the United States to rein in risk-taking by Europe&#8217;s big banks has been introduced, but the European Parliament is not expected to act on it anytime soon....'"
"'201','2014-01-31','GREAVES--Jemima K. January 31st, 1995 The years go by but the loving memory of mom remains. Son Reynold...'"
"'202','2014-01-31','WEISS--Rhoda. Beloved wife of the late Harry Weiss, mother of Kenny and Mike Weiss, grandmother of Josh, Bessie, Nick and Casey and great grandmother of Mason, Audrey and Ricky. Formerly of Bayside, NY. Rhoda died peacefully amidst her family on J...'"
"'203','2014-01-31','Verizon expects to upgrade its network with the new broadcasting technology by the third quarter this year....'"
"'204','2014-01-31','A glimpse at what guys and gals are wearing this season....'"
"'205','2014-01-31','Amazon considers raising its fees. And two business owners debate the merits of the Affordable Care Act....'"
"'206','2014-01-31','The production, being adapted by Robert Zemeckis, Bob Gale and Jamie Lloyd, will include new music as well as songs from the 1985 film....'"
"'207','2014-01-31','New Yorkers in truly affordable apartments sometimes find their sweet deals come with sacrifices.'"
"'208','2014-01-31','The tool, which was introduced this week, is designed to help small businesses manage their online profiles....'"
"'209','2014-01-31','Discussion of the merits of all-volunteer armed forces is incomplete without an acknowledgment of how little risk is taken on by those who declare war, an economist writes....'"
