"'1','2014-01-01','In which I lose a middle initial....'"
"'2','2014-01-01','The United States accounted for 43 percent of all deals worldwide, the biggest proportion since 2001....'"
"'3','2014-01-01','BATS Global Markets is aiming to serve as an evangelist for the American way of trading, focusing on low costs, competition and high-speed trading....'"
"'4','2014-01-01','In his inauguration speech in front of City Hall, Bill de Blasio laid out a mayoralty that emphasized social and economic justice.'"
"'5','2014-01-01','In his introduction of Mayor Bill de Blasio, former President Bill Clinton praised both the new mayor and the outgoing mayor, Michael R. Bloomberg....'"
"'6','2014-01-02','Thousands of flights were delayed or canceled, and drivers faced treacherous driving conditions as the storm dumped piles of snow overnight....'"
"'7','2014-01-02','A British study has found that having shingles can increase the risk for heart attacks, strokes and other problems....'"
"'8','2014-01-02','A study finds that the music of Bruno Mars was illegally downloaded nearly 6 million times in 2013....'"
"'9','2014-01-02','Like many women, I misinterpreted the muted symptoms of ovarian cancer. By the time a CT was ordered, the cancer had progressed to a stage that is treatable but not curable. I was furious at myself and upset with my doctor....'"
"'10','2014-01-02','Politics trumps evidence....'"
"'11','2014-01-02','Shell, which beat out more than a dozen bidders, will pay $3.8 billion in cash to the Spanish energy company and assume about $1.6 billion in leases related to ship charters....'"
"'12','2014-01-03','Western news media pick up an old report that for the South Korean press, it seems, was too sensational....'"
"'13','2014-01-03','The Writers Guild nominees include well-known names like David O. Russell, Woody Allen and Spike Jonze....'"
"'14','2014-01-04','WEISSMAN--Jerome J.,passed away at 97 on December 31, 2013, in Palm Beach Gardens, FL. Alumnus of Cornell '36 and Fordham Law '39. Jerry was a long-time member of the Regency Whist Club in Manhattan, an ardent bridge player. He was happily married...'"
"'15','2014-01-04','Economics humor. Really....'"
"'16','2014-01-04','Some animals appear to like sugar but have no response to artificial sweeteners....'"
"'17','2014-01-04','David Rockefeller made his mark in the world of finance and foreign affairs as chairman and chief executive of Chase Manhattan bank.'"
"'18','2014-01-05','WEISSMAN--Jerome J.,passed away at 97 on December 31, 2013, in Palm Beach Gardens, FL. Alumnus of Cornell '36 and Fordham Law '39. Jerry was a long-time member of the Regency Whist Club in Manhattan, an ardent bridge player. He was happily married...'"
"'19','2014-01-06','The treatments can cause severe burns and disfiguring injuries, and a rising percentage of lawsuits involve operators who are not physicians....'"
"'20','2014-01-06','Representative Jim Gerlach, Republican of Pennsylvania, announced he will not seek re-election, intensifying the fight for his suburban turf....'"
"'21','2014-01-06','A trial over how Detroit should end costly financial contracts with two big banks was suspended Monday after more than a foot of snow fell, paralyzing much of the city and closing the federal courthouse there....'"
"'22','2014-01-06','The French actress wore Prada and Miu Miu to accept a nomination for the EE Rising Star Awards today in London....'"
"'23','2014-01-06','Looking into the small-business crystal ball for 2014....'"
"'24','2014-01-06','A headache, neck pain or dizziness, seemingly innocuous, may be signs of a vertebral artery dissection, a leading cause of stroke in young adults....'"
"'25','2014-01-07','Comments by Alan Mulally, the chief of Ford, are the most definitive sign yet that he is out of the running for the Microsoft job, though the prospects of such a change had dimmed in recent weeks....'"
"'26','2014-01-07','Goldman Sachs is shaking up its technology, media and telecommunications investment banking group, according to internal memos....'"
"'27','2014-01-07','JPMorgan Chase could have dug deeper despite an obligation to monitor accounts for suspicious activity, writes Peter J. Henning. But the victims of the fraud will be getting some repayment after prosecutors got creative, he says....'"
"'28','2014-01-07','Guest blogger Ellie Feinglass looks what is standing in the way of victory in the fight against AIDS....'"
"'29','2014-01-07','Chelsea Opera, a small Manhattan opera company, has appointed Samuel McCoy as its new music director and principal conductor....'"
"'30','2014-01-07','Stranded Amtrak and airline passengers document their travel ordeals on social media....'"
"'31','2014-01-07','Detail on the nine systemic financial crises the United States has suffered since 1814, taken from a new paper about post-crisis recoveries....'"
"'32','2014-01-07','Representative Jeb Hensarling is soon expected to propose legislation that could open up a huge loophole in the Volcker Rule....'"
"'33','2014-01-07','Business bankruptcies fall, how four businesses use YouTube creatively, and Zappos gets rid of managers....'"
"'34','2014-01-07','The continuing rise of a middle class in countries like India and Indonesia will be a main engine for sales growth, as those middle class consumers upgrade their cellphones and buy new tablets, according to a report from Gartner....'"
"'35','2014-01-08','The judge raised concerns that he might have to call in a fresh group of candidates on Thursday, postponing opening statements by a day....'"
"'36','2014-01-08','The show, which is inspired by the late rapper but is not a biographical treatment of his life, is scheduled to open on June 19....'"
"'37','2014-01-08','As smartphone speakers stay small, electronic-makers hope to offer wirelessly connected speakers....'"
"'38','2014-01-08','Hard lessons were learned by living through two huge bubbles, stagnating wages and an economy suffering from chronic fatigue syndrome....'"
"'39','2014-01-08','Tens of thousands of garment workers have returned to work, ending a two-week pay dispute after the authorities used deadly force to quell a strike and thwart a protest seeking a redo of a July election. A union and the garment factory association estimated that 65 percent to 70 percent of workers had returned to factories by Tuesday. About 350,000 had gone on strike, joining an opposition party in protesting the election, which they contend was stolen by the party of Prime Minister Hun Sen. Over the weekend, the government broke up the protest and banned all public gatherings.'"
"'40','2014-01-09','The New York State attorney general, Eric T. Schneiderman, said he planned to investigate brokerage firms that might have provided early market-moving information to preferred clients....'"
"'41','2014-01-09','The South by Southwest film festival announces its opening-night film, written, directed by and starring Jon Favreau....'"
"'42','2014-01-09','In March, Apple and Samsung Electronics are scheduled to go to trial again to fight over smartphone patents. But after discussing settlement opportunities earlier this week, the companies have agreed to meet with a mediator....'"
"'43','2014-01-09','A smart bracelet without a screen, speaker or stylus is exactly what this gadget lover wants....'"
"'44','2014-01-09','A budget surplus. The hottest e-commerce businesses. Selling American products in China....'"
"'45','2014-01-09','Judi Henderson-Townsend has been selling, renting and recycling mannequins for nearly 15 years. This year, she hopes to achieve an elusive goal, cracking a million dollars in revenue....'"
"'46','2014-01-09','The chief financial officer, Richard Meddings, will leave Standard Chartered as the bank combines its wholesale and consumer businesses....'"
"'47','2014-01-09','Would you want to try one of the cricket bars described in the article?...'"
"'48','2014-01-09','This word has appeared in 153 New York Times articles in the past year....'"
"'49','2014-01-10','Gov. Earl Ray Tomblin urged affected residents to avoid using tap water after a chemical spill in West Virginia.'"
"'50','2014-01-10','The musician says the film lacks the optimism that she recalls from the folk scene....'"
"'51','2014-01-10','Super Bowl commercials are ineffective. Tough questions for job candidates. Why YouTube videos fail....'"
"'52','2014-01-10','Mr. Price has led the company since 1968, producing more than 200 shows and sending 19 of them to Broadway....'"
"'53','2014-01-10','Two missile-launch crew members at Malmstrom Air Force Base have been implicated in an illegal narcotics operation, and their access to classified information has been suspended, a Defense Department official said Thursday. The two were members of the 341st Missile Wing at the base. News of the investigation came as Defense Secretary Chuck Hagel was visiting a sister missile base in Wyoming to deliver a message about the importance of the United States nuclear weapons mission, which has been troubled by morale problems.'"
"'54','2014-01-11','BISSO--Anna, 94, wife of the late Sidney Kerner and David Bisso. Beloved mother of Margaret (Donald) and Amy (David). Stepmother of Michael (Margery) and Susan (Stephen). Adored grandmother of Evan (Kaitlin) and Jessica. Anna was an exhibited mixe...'"
"'55','2014-01-11','Gene Simmons and Paul Stanley talk shop....'"
"'56','2014-01-11','The columnist George Will recently took aim at tax breaks for environmentally friendly cars. Other kinds of cars get them, too....'"
"'57','2014-01-11','David Rockefeller made his mark in the world of finance and foreign affairs as chairman and chief executive of Chase Manhattan bank.'"
"'58','2014-01-12','STOCK--Cooper Dean. On January 10, 2014 Cooper Dean Stock, beloved son of Dana Lerner and Dr. Richard Stock, was tragically killed in a vehicular accident near his home on the Upper West Side of Manhattan. He was just nine years old. Cooper was a ...'"
"'59','2014-01-12','PATTERSON--Remington Perrigo, 87 on January 7, 2014 in Sleepy Hollow, NY. Beloved husband of the late Duane Lloyd Patterson, father of Burns Patterson and Sarah Cherry. Brother of the late Robert Burns Patterson. Grandfather to Emma, Isabel, Jack,...'"
"'60','2014-01-12','BISSO--Anna, 94, wife of the late Sidney Kerner and David Bisso. Beloved mother of Margaret (Donald) and Amy (David). Stepmother of Michael (Margery) and Susan (Stephen). Adored grandmother of Evan (Kaitlin) and Jessica. Anna was an exhibited mixe...'"
"'61','2014-01-12','Highlights of mutual fund performance....'"
"'62','2014-01-12','Up Next in Video'"
"'63','2014-01-12','Scenes from the Milan Fashion Week photo diary of Filippo Mutani....'"
"'64','2014-01-12','When bad people happen to good ideas....'"
"'65','2014-01-13','STOCK--Cooper Dean, We are devastated by the loss of Cooper, a unique 9 year old boy. He was both funny and profound, often in the same sentence. His curiosity knew no bounds. Our loves goes out to his amazing parents, Dana and Richard, and his bi...'"
"'66','2014-01-13','STOCK--Cooper Dean. On January 10, 2014 Cooper Dean Stock, beloved son of Dana Lerner and Dr. Richard Stock, was tragically killed in a vehicular accident near his home on the Upper West Side of Manhattan. He was just nine years old. Cooper was a ...'"
"'67','2014-01-13','An inspector appointed by a federal judge to make sure that Apple complies with antitrust laws has drawn strong objections from the company, which says he is intruding on operations....'"
"'68','2014-01-13','The E.U. plans a last-ditch effort to reach agreement on one of the biggest issues highlighted by the financial crisis: how to rein in trading of derivatives and other complex instruments....'"
"'69','2014-01-13','This is not the usual start-up acquisition: The founders had money, recognition and momentum. What they needed was a like-minded giant with some muscle....'"
"'70','2014-01-13','Also on the Minute, rising sea levels and a new owner for Jim Beam....'"
"'71','2014-01-13','The Swiss bank, which has a major presence on Wall Street, issued new guidelines to discourage analysts and associates from working in the office on Saturdays....'"
"'72','2014-01-13','How to tell your start-up story. How a bowling alley in New Jersey dealt with a competitor. And what you can learn from the big e-commerce sites....'"
"'73','2014-01-13','A tiny Hudson River environmental group sends money it received from Chevron to a group helping Ecuadorian indigenous groups in challenges against big oil....'"
"'74','2014-01-13','To draw young buyers and increase its market share in India, Apple has offered promotions like monthly payments and trade-ins....'"
"'75','2014-01-14','A West Virginia chemical spill reveals a host of regulatory gaps....'"
"'76','2014-01-14','To avoid handing over personal information, some readers said they feign deafness. Others provide a fake email address belonging to their dog or Representative Paul D. Ryan of Wisconsin....'"
"'77','2014-01-14','Eminence Capital, which owns a 4.9 percent stake in Jos. A. Bank, plans to add even more pressure on the menswear retailer by nominating two directors for its board....'"
"'78','2014-01-14','Private companies are waiting longer to get paid. And how to send a professional thank-you note....'"
"'79','2014-01-14','John P. Havens, who resigned as chief operating officer of Citigroup in 2012 when Vikram S. Pandit was ousted as chief executive, has found a new home at the hedge fund business that was spun out of the bank....'"
"'80','2014-01-15','Thinking through the liberal Catholic response to Pope Francis....'"
"'81','2014-01-15','Ideas for teaching about the West Virginia chemical spill, either by focusing on West Virginia alone, or widening the lens to include other industrial spills, inquiries into the water supply or regulation in general....'"
"'82','2014-01-15','There may be a billion people on Facebook, says Jeff Gibbard, but no business needs to reach a billion people....'"
"'83','2014-01-15','It is notable that the board of General Motors is reinstating the dividend before sorting out new pay levels for its top executives, Antony Currie writes for Reuters Breakingviews....'"
"'84','2014-01-15','When shots for flu and pneumococcal disease were given together, children were more likely to develop a fever within a day....'"
"'85','2014-01-15','In the years since the financial crisis, hedge funds managed by women performed better than a broader index reflecting the performance of the industry, a report found....'"
"'86','2014-01-15','Fresh coverage of the lack of radiation risk in California from the Fukushima disaster....'"
"'87','2014-01-15','Small-business optimism rises. How to assess the health of your business. A reason to use Google Plus....'"
"'88','2014-01-15','Wall Street firms are making a show of re-evaluating the grueling hours endured by their junior employees as a younger generation increasingly wants meaningful work and the flexibility afforded by technology....'"
"'89','2014-01-15','Deutsche Bank has suspended several traders in New York amid investigations into potential manipulation of the foreign exchange market, according to a person briefed on the matter....'"
"'90','2014-01-15','Articles and multimedia in this series explore how the surge of poaching in Africa both feeds off and fuels instability on the continent, and in other places like Asia....'"
"'91','2014-01-16','IBM is planning to spend $1.2 billion this year on increasing the number and quality of computing centers it has worldwide, partly to keep pace with the competition....'"
"'92','2014-01-16','My dog is always ready to move on and look for something new. I can relate....'"
"'93','2014-01-16','Apple and Samsung Electronics, the two technology companies that make almost all the profit in the smartphone market, have grown even stronger in the United States....'"
"'94','2014-01-16','The actor, who was nominated alongside his co-star, Julie Delpy, and director, Richard Linklater, says he kinda, sorta understands the reasoning....'"
"'95','2014-01-16','A new chief of the S.B.A. Federal contracts going to private companies plunge. What business owners wish they had known when they started....'"
"'96','2014-01-16','I daydreamed that my book would end up in the White House library. But its real path was humbler, and more meaningful....'"
"'97','2014-01-16','The sale, conducted as a private placement, helps resolve questions about how the government would dispose of its Ally stake....'"
"'98','2014-01-16','Anonymous reviews are protected by the First Amendment. But if they are anonymous, how can they be determined to be fake?...'"
"'99','2014-01-16','Investors seeking higher yields are increasingly turning to riskier sectors like real estate and hedge funds, BlackRock found in a survey of 100 institutions released on Thursday....'"
"'100','2014-01-16','Discarded consumer electronics are clogging landfills, fast-becoming a worldwide environmental calamity. One woman in Tulsa, Okla., is trying to make a dent....'"
"'101','2014-01-16','The Communist Party has barred the advancement of wayward cadres in its ranks....'"
"'102','2014-01-16','The National Labor Relations Board, in a sweeping complaint filed on Wednesday, said that Walmart illegally disciplined and fired employees after strikes and protests for better pay.

The complaint listed violations of federal law in 14 states involving more than 60 workers and 34 stores. It said Walmart fired 19 employees for taking part in strikes and demonstrations against the company. Other employees were given verbal warnings or faced other disciplinary action. In some cases, according to the complaint, the company spied on employees.

The complaint said that twice on national television, as well as in statements in stores in California and Texas, the company unlawfully threatened employees with reprisals if they took part in strikes or protests. Some of those protests took place around Black Friday, the big shopping day that follows Thanksgiving, in 2012 and others the next year.

A union-backed group called Our Walmart had organized protests at about 1,000 Walmart stores in 46 states. Despite the threats, the protests drew thousands of employees seeking higher wages.

More than 60 supervisors and one corporate officer were named in the complaint.

Walmart said the employees were not fired for participating in an outside group. It said most of the firings were for breaking attendance policies.'"
"'103','2014-01-17','The two sides of David Steinberg....'"
"'104','2014-01-17','Michael Sippey, the vice president of product at Twitter, announced that he would step down from his position at the company....'"
"'105','2014-01-17','Mr. Masur, the former music director of the New York Philharmonic, was hospitalized for anemia, and a conducting seminar at the Manhattan School of Music was postponed until next year....'"
"'106','2014-01-17','There is no public debate about the budgets, and no opportunity for outside groups or experts to weigh in....'"
"'107','2014-01-17','Fifty ways to get customers. Hershey plans to print chocolate. And the dark side of the truffle trade....'"
"'108','2014-01-17','Instead of the round-the-block lines that have greeted Apple product introductions in China and other countries in the past, only about a dozen customers showed up to buy iPhones at the opening of a store in Beijing on Friday....'"
"'109','2014-01-17','The Tampa Bay Rays signed David Price, the 2012 American League Cy Young Award winner, to a one-year, $14 million year deal on Thursday, the biggest single-season salary in team history. Price, 28, has been the subject of trade speculation after going 10-8 with a 3.33 earned run average last year while earning $10 million. He is eligible for free agency after the 2015 season, and the Rays probably cannot match what Price could earn on the open market.'"
"'110','2014-01-17','WASHINGTON, Jan 16 (Reuters) - Japan-based Koito Manufacturing Co Ltd has agreed to plead guilty to two counts of conspiring to fix auto parts prices and will pay $56.6 million in criminal fines, the U.S. Justice Department said on Thursday.

Koito and other unnamed companies conspired to push up the prices of lighting fixtures and lamp ballasts used to make headlights, tail lights, brake lights and turn signals. The parts were sold to automakers in the United States and elsewhere, the department said in a statement.

Koito has also pledged to cooperate with the department's ongoing probe.

Law enforcement authorities in the United States and elsewhere have brought charges related to price fixing of more than 30 types of car parts, including seat belts, radiators, windshield wipers, air-conditioning systems, power window motors and power steering components.

Including Koito, 24 companies have pleaded guilty or agreed to plead guilty in connection with the U.S. probe. Twenty-six executives have been charged.'"
"'111','2014-01-18','A December 1955 article in The New York Times on the opening of the Tappan Zee bridge....'"
"'112','2014-01-20','Perhaps unsurprisingly, people caring for abusive parents are more likely to have symptoms of depression, a new study finds....'"
"'113','2014-01-20','Of the 87 banks, asset managers and insurance companies surveyed, 69 percent said they felt more optimistic about the business environment, the highest level since 1989....'"
"'114','2014-01-20','In a letter to a Hong Kong newspaper columnist, former Prime Minister Wen Jiabao of China said he had a clean conscience about his time in office....'"
"'115','2014-01-20','Our contributing writer explains what happens when online bullies get bullied themselves....'"
"'116','2014-01-21','Apple is expected to announce record iPhone sales for the last quarter of 2013, according to analyst estimates....'"
"'117','2014-01-21','A rough calculation suggests breaking up Dow Chemical could increase its value, so investors reacted favorably to a suggestion that the company split off its petrochemicals business, writes Kevin Allison in Reuters Breakingviews....'"
"'118','2014-01-21','The government in Thailand imposed emergency rule over protests, and law enforcement authorities circulated images of a man alleged to be behind a recent grenade attack....'"
"'119','2014-01-21','A chemistry teacher reminds students and the rest of us that natural foods are made of chemicals, too....'"
"'120','2014-01-21','UniCredit, the large Italian bank, is the first to take advantage of the funds from the Mariner Investment Group, which will help European banks and other financial institutions free up capital....'"
"'121','2014-01-21','Apple won a small victory in its attempt to oust a court-appointed monitor. The court ruling sets the stage for more legal battles to come....'"
"'122','2014-01-21','Daniel Loeb took a stake of about $1.3 billion in Dow Chemical, which has pre-empted activist ambushes by getting ahead of them....'"
"'123','2014-01-21','At least seven citizens are due to stand trial for participating in the New Citizens Movement and other protest groups....'"
"'124','2014-01-22','A plant that turns chicken fat into truck fuel burned to the ground after explosions created a fire that was too hot for firefighters to touch....'"
"'125','2014-01-22','A deal for the unit could be announced on Thursday, and would represent the successful completion of a deal that almost got done last year....'"
"'126','2014-01-22','Verizon Communications on Wednesday published a so-called transparency report describing when and why it receives requests for customer data, like phone records or emails, from law enforcement and government agencies....'"
"'127','2014-01-22','Wells Fargo said on Wednesday that it sold the rights to service 184,000 mortgages to Ocwen Financial Corporation, a rapidly expanding company known for its expertise in dealing with subprime borrowers....'"
"'128','2014-01-22','Because of the drought in California, trail rides and hiking are now being offered at Yosemite National Park....'"
"'129','2014-01-22','Private equity investors in Santander Consumer USA, the American auto-lending arm of the Spanish banking giant Grupo Santander, plan to sell about 75 million shares at $24 each, which would raise $1.8 billion....'"
"'130','2014-01-22','More small businesses are using software to adjust prices as demand rises and falls....'"
"'131','2014-01-22','Marijuana ads have been banned by Google and Facebook. The limits of shipping insurance. Is 2014 the year of free hardware?...'"
"'132','2014-01-22','At a panel looking at Africa in 2015, several speakers argued that opening and supporting more foreign investment would naturally trickle down to the populace....'"
"'133','2014-01-22','The Finnish gaming company rode Angry Birds to international success. Next up: the dream of interacting with one billion customers....'"
"'134','2014-01-22','Scores of supporters of Xu Zhiyong flocked to a Beijing courthouse and demonstrated noisily in front of foreign reporters....'"
"'135','2014-01-23','The mutual fund giant is one of only a couple shareholders that have stakes in both Time Warner Cable and Charter....'"
"'136','2014-01-23','Admission to the memorial at the World Trade Center will remain free, and families of victims will not be charged admission, the museum foundation said....'"
"'137','2014-01-23','In a letter to investors, Brevan Howard told investors it was sorry for its 2.6 percent return....'"
"'138','2014-01-23','Their company makes an online shopping tool that notifies users when a product they want to buy has gone on sale....'"
"'139','2014-01-23','Hours after Police Commissioner William J. Bratton joined Twitter he still was not following a single account. Here we offer up a few suggestions....'"
