"'128','2013-04-12','The chief executive, Robert Greifeld, earned a bonus of $1.35 million last year, down from a 2011 bonus of $3.59 million. But his total compensation rose to $8.9 million from $7.6 million....'"
"'129','2013-04-12','Chelsea stumbled into the semifinals of the Europa League despite losing to Rubin Kazan, and Basel also advanced by beating Tottenham in a penalty shootout. Chelsea, the reigning European champion, lost by 3-2 in Moscow but progressed, 5-4, on aggregate.

Tom Huddlestone and Emmanuel Adebayor failed with spot kicks as Basel won the shootout, 4-1, after a 2-2 draw after 120 minutes. The American Clint Dempsey scored both goals for Tottenham.

Fenerbahce and Benfica were the other teams to advance after holding on for 1-1 draws at Lazio and Newcastle.'"
"'130','2013-04-12','Federal prosecutors in Los Angeles and securities regulators brought insider trading charges against a former top KPMG executive.'"
"'131','2013-04-12','AUGUSTA, Ga. &#x2014; Minutes after his four-under par 68 made him the clubhouse leader, David Lynn said his runner-up finish at last year&#x2019;s P.G.A. Championship helped him avoid any nervousness in his first Masters on Thursday.&#xa;   &#xa;...'"
"'132','2013-04-13','Inflation is sticky, it seems....'"
"'133','2013-04-13','Each Champions League semifinal will pit a German club against a Spanish one: Bayern Munich and Barcelona will fight for the right to play the winner of Dortmund versus Real Madrid. The final is in London on May 25. In the second-tier Europa League, Chelsea will play Basel of Switzerland, and Fenerbahce of Turkey will play Benfica of Portugal.'"
"'134','2013-04-13','Pictures From the Week in Business'"
"'135','2013-04-13','Secretary of State John Kerry warned North Korea not to test-fire its Musudan missile and said the nation would lose if a conflict broke out....'"
"'136','2013-04-13','Wall Street knew the craze wouldn&#x2019;t last.&#xa;   &#xa;The nation&#x2019;s biggest banks, capitalizing on government efforts to bolster the housing market, have raked in handsome mortgage profits of late. On Friday, that started to change....'"
"'137','2013-04-13','WASHINGTON &#x2014; Organizing for Action, the grass-roots group that grew out of President Obama&#x2019;s campaign machine, raised just shy of $4.9 million in the first quarter of 2013, according to an e-mail to the group&#x2019;s supporters.&#xa...'"
"'138','2013-04-13','The Old Globe Theater in San Diego will open its 2013-14 season with &#x201C;The Last Goodbye,&#x201D; a  long-in-development adaptation of &#x201C;Romeo and Juliet&#x201D;  set to the music of  Jeff Buckley .&#xa;   &#xa;Conceived and adapted by ...'"
"'139','2013-04-14','Adam Scott of Australia won his first green jacket on the second playoff hole at the Masters. Scott and Angel Cabrera each birdied on the 18th hole of the final round to compete in a sudden-death playoff....'"
"'140','2013-04-14','An indulgent and elegant apartment on the 42nd floor of the Trump International Hotel and Tower, which was reconfigured to a two-bedroom, two-and-a-half-bath aerie from the original four bedrooms and six baths by the designer Jeffrey Bilhuber, sol...'"
"'141','2013-04-15','Dear Diary:&#xa;   &#xa;While waiting on the business class boarding line at J.F.K., I spied parents with their 3-month-old daughter....'"
"'142','2013-04-15','The proposal to restructure debt is the opening move in what many say could be a long and contentious battle between the company and its largest creditors....'"
"'143','2013-04-15','Gold prices tumbled 9 percent on Monday, the sharpest drop in 30 years, as stocks and other commodities also felt the impact of a disappointing report on Chinese growth....'"
"'144','2013-04-15','More black and Hispanic male high school students than their white counterparts said they had carried a gun at least once in the previous month, a federal study found....'"
"'145','2013-04-15','A weekly capsule of travel news curated by our writers and editors....'"
"'146','2013-04-15','Doctors often prescribe potentially harmful drugs to older patients, and the problem is particularly acute in the South, a new study shows....'"
"'147','2013-04-15','A declining deficit? A global recession? Why some small businesses are hungry to hire. Do you expect to buy PCs this year?...'"
"'148','2013-04-15','Ford and General Motors announced that they would jointly develop a new generation of 9- and 10-speed automatic transmissions....'"
"'149','2013-04-15','Many of the hedge fund leaders who had giant paydays last year earned their riches by posting big returns. But even weak results can produce lavish take-home pay....'"
"'150','2013-04-15','A number of hedge-fund leaders had mega paydays last year by posting big returns on their investments....'"
"'151','2013-04-16','Energy Future Holdings, the Texas energy giant that was taken private in 2007 in a record-breaking $45 billion buyout, disclosed Monday a potential bankruptcy plan to its creditors.&#xa;   &#xa;The proposal to restructure about $32 billion in debt...'"
"'152','2013-04-16','9:02 p.m. | Updated &#xa;&#xa;   &#xa;Gold prices tumbled 9 percent on Monday, the sharpest drop in 30 years, heightening fears that investors&#x2019; faith in the safe haven has been shattered....'"
"'153','2013-04-16','Alcohol consumption is known to increase the risk for breast cancer. But a new study suggests that moderate drinking has little effect on survival after diagnosis, and may reduce deaths from cardiovascular disease.&#xa;   &#xa;Researchers,  writin...'"
"'154','2013-04-16','LILLIN--Marion Elizabeth (Brambora), 86, passed suddenly on April 12. Happily married for 59 years to Charles, who preceded her, she leaves her two sons, Daniel and Ethan, and the best grandchildren ever, James, Jack and Haley. Besides her brother...'"
"'155','2013-04-16','A judge conditionally approved a settlement between the hedge fund and securities regulators that allows the firm to pay a $602 million fine without admitting guilt....'"
"'156','2013-04-16','NBCUniversal, the new Premier League rights holder in English and Spanish in the U.S., will carry across its TV and digital properties all 380 league matches in the 2013-14 season....'"
"'157','2013-04-16','Google is recruiting developers to build apps for its Internet-connected glasses, but it is being unusually restrictive as it slowly introduces the new technology to a wary public....'"
"'158','2013-04-16','The Times's Pam Belluck reports on a new study about the use of music therapy for premature infants.'"
"'159','2013-04-16','The season will also include new work from Suzan-Lori Parks, Mike Daisey and Elevator Repair Service....'"
"'160','2013-04-16','Tara Siegel Bernard of the Your Money team wants to come to your home and help you sort out your financial life. If you think you have a compelling case, nominate yourself in the comments section....'"
"'161','2013-04-16','Net income in the first quarter was $632 million as investors put $39.4 billion of new money into BlackRock products, with most of that going into stock-related investments....'"
"'162','2013-04-16','Prize money at the French Open will rise for both singles champions and players who lose in some of the early rounds. Roland Garros organizers said that the overall total for the tournament would grow to $28.7 million, from $24.6 million, with the winners receiving $1.96 million compared with $1.64 million in 2012.'"
"'163','2013-04-16','Up to 2.4 million credit and debit cards used by customers at Schnucks grocery stores in four states may have been compromised over a three-month period, the suburban St. Louis supermarket chain said Monday. Many customers have reported fraudulent charges, some in the thousands of dollars. The chain contacted the police and the F.B.I. after learning of the fraud and hired a private investigation firm. It was determined that the breach dated to December.'"
"'164','2013-04-17','SAN FRANCISCO &#x2014; The allure of the iPhone was not its brushed metal or shiny touch screen, but the apps that turned it into anything from a flute to a flashlight. Now, Google hopes that apps will do the same thing for Glass, its Internet-con...'"
"'165','2013-04-17','Philip Norman , a prolific biographer whose&#xA0; &#x201C;Shout! The Beatles in Their Generation&#x201D; is considered by many to be among the most absorbing and comprehensive biographies of the group, and whose  &#x201C;John Lennon: The Life&#x20...'"
"'166','2013-04-17','When the  sixth season of &#x201C;Mad Men&#x201D;  opened last week on AMC (see video below), it was December 1967 in New York City, and the fictional Henry Francis had landed a post as a top-level aide in the very real Mayor John V. Lindsay&#x201...'"
"'167','2013-04-17','LILLIN--Marion Elizabeth (Brambora), 86, passed suddenly on April 12. Happily married for 59 years to Charles, who preceded her, she leaves her two sons, Daniel and Ethan, and the best grandchildren ever, James, Jack and Haley. Besides her brother...'"
"'168','2013-04-17','Stu Ockman sets his bar high. Really, really high....'"
"'169','2013-04-17','The Costa Rican federation has wants to play its World Cup qualifier against the United States at Estadio Saprissa in September....'"
"'170','2013-04-17','Amaryllis Knight opens ALTAI, a new retail store and online platform for her consultancy and furniture studio in Los Angeles....'"
"'171','2013-04-17','Starting today, The Daily Dog-Ear will appear weekdays on The 6th Floor, directing you to things we find notable, interesting, surprising, provocative or otherwise dog-ear-able....'"
"'172','2013-04-17','What do you do to mitigate the risk?...'"
"'173','2013-04-17','The forgotten story of the Mississippi River Squadron at Vicksburg....'"
"'174','2013-04-17','If you missed the tax deadline and can provide a reason, the I.R.S. may waive penalties. But the reason had better be good....'"
"'175','2013-04-17','After a five-year restoration, the Louxor, a neo-Egyptian movie palace from the 1920s, is reopening in Paris....'"
"'176','2013-04-17','Facing an opening Arctic Ocean, nations opt to mange any new fishing effort cooperatively....'"
"'177','2013-04-17','The bank, whose shares are up nearly 40 percent over the past 12 months, reported first-quarter earnings of 20 cents a share, well short of analyst expectations of 23 cents a share....'"
"'178','2013-04-17','No matter how you finance your business, it makes sense to think about how you are going to get out before you decide to get in....'"
"'179','2013-04-17','Officials said they were still at the start of an inquiry on the attack at the Boston Marathon that killed three people and hurt more than 170, using what were likely kitchen pressure cookers set up to shoot shrapnel....'"
"'180','2013-04-18','8:06 p.m. | Updated &#xa;&#xa;   &#xa; Bank of America  reported first-quarter earnings on Wednesday that fell well short of Wall Street&#x2019;s expectations but that were substantially higher than in the period a year earlier....'"
"'181','2013-04-18','The price of gold has been falling....'"
"'182','2013-04-18','So far this year, banks have issued $33.5 billion in new commercial mortgage-backed securites, one of the structured financial products that stood at the center of the financial crisis. The mortgages within those securities are getting riskier.'"
"'183','2013-04-18','The Consumer Financial Protection Bureau has recommended ways to sort out the various credentials used by financial advisers who claim to have expertise in helping older people....'"
"'184','2013-04-18','The R.N.C. has come out strongly against Common Core education standards, placing Republicans in conflict with the Business Roundtable....'"
"'185','2013-04-18','Race organizers have once again rejected appeals to cancel the Bahrain Grand Prix, an event demonstrators plan to use to highlight continuing repression in the Arabian Gulf kingdom....'"
"'186','2013-04-18','Two years after the 16-hour mandate was established for doctors in training, studies on the outcomes are being published, and the results reveal one thing: Maybe we should have thought a little harder about the arithmetic....'"
"'187','2013-04-18','The graduate student who was killed was one of the hundreds of thousands of Chinese who have come to the United States to be educated at its universities....'"
"'188','2013-04-19','Excel, PowerPoint, Word and Outlook have played more than just cameo roles in the dark side of capitalism, the author contends....'"
"'189','2013-04-19','Honda reported a sticky brake-shift interlock, and Nissan a faulty brake caliper casting in recalls affecting more than 220,000 vehicles....'"
"'190','2013-04-19','Why should any new rules favor money market funds that invest in government debt over those buying corporate debt?...'"
"'191','2013-04-19','Shares of Apple traded for more than $700 last year, but they have tumbled and analysts are trying to understand why, Nick Wingfield and Nathaniel Popper write in The New York Times....'"
"'192','2013-04-19','Credit: Gretchen Ertl for The New York Times'"
"'193','2013-04-20','The  Bronx High School of Science  has produced more scientific leaders than many countries, including eight Nobel Prize winners in physics and chemistry.&#xa;   &#xa;But when New York City&#x2019;s premier science magnet school decided to honor i...'"
"'194','2013-04-20','BARST--Dr. Robyn. The congregation of Westchester Reform Temple mourns the death of its devoted member and extends sympathy to her bereaved family. Lisa Messinger, President Jonathan E. Blake, Rabbi Jill Abramson, Cantor...'"
"'195','2013-04-20','BARST--Robyn, 62, of Scarsdale. Survived by her loving husband Samuel of 32 years; was the adoring mother of Nomi (David) Berenson, Lindsey (Jason) Gumer and grandson Tobias Berenson; her sister Lynn Hofstra and mother Ruth. Professor Emeritus at ...'"
"'196','2013-04-20','Family of missing Indian American student horrified to see his name falsely connected with Boston attacks....'"
"'197','2013-04-20','Pictures From the Week in Business'"
"'198','2013-04-20','Mississippi has become the third state to sue BP over the 2010 Gulf of Mexico oil spill. State Attorney General Jim Hood said on Friday that the state had filed suits in federal and state court. Mr. Hood said he wanted to settle, but he said BP refused to negotiate. A spokeswoman for BP did not immediately respond to a request for comment. Louisiana and Alabama sued BP earlier and are participating in a federal trial in New Orleans to determine the liability of BP and its contractors. Mississippi had not been participating because it had not sued.'"
"'199','2013-04-21','Members of the audience called her a &#x201C;liar,&#x201D; an opponent relentlessly attacked her, and the moderator at one point had to beg the scornful crowd to let her speak.&#xa;   &#xa;On Saturday, a forum of five Democratic mayoral candidates...'"
"'200','2013-04-21','Ford Motor and General Motors announced on Monday that they would jointly develop new transmissions with 9 speeds for front-wheel-drive vehicles and 10 speeds for rear-drive cars and trucks. The new transmissions, with more forward gear ratios tha...'"
"'201','2013-04-21','MCCAUSLAND--Robert G.,passed April 13. Loving husband to Marilyn; his daughter, two sons, two step-daughters and six grandchildren. Born in Philadelphia's main line in 1928; graduated Gettysburg College, Naval Intelligence School and flew USN as a...'"
"'202','2013-04-21','BARST--Robyn. Your grace, courage and dignity inspired us. Our lives will never be the same without you. Eternal love, Debra & Andy...'"
"'203','2013-04-21','BARST--Robyn, 62, of Scarsdale. Survived by her loving husband Samuel of 32 years; was the adoring mother of Nomi (David) Berenson, Lindsey (Jason) Gumer and grandson Tobias Berenson; her sister Lynn Hofstra and mother Ruth. Professor Emeritus at ...'"
"'204','2013-04-21','Surveys conducted when this debate was last in the news found that a small majority of Americans favored informing terrorism suspects of their Miranda rights....'"
"'205','2013-04-22','The Brooklyn side of the first installment of  TransCultural Express: American and Russian Arts Today , a three-year collaboration between  the Brooklyn Academy of Music  and the Mikhail Prokhorov Fund will include screenings of contemporary Russi...'"
"'206','2013-04-22','As president of Microsoft&#x2019;s server and tools division, a $19 billion-a-year business devoted to databases, servers and other software products, Satya Nadella has a predictable cast of competitors to worry about. There is Oracle, VMware, SAP...'"
"'207','2013-04-22','Many Questions, Few Answers on U.S. Claims of Iran Violations'"
"'208','2013-04-22','Premiere of new video by Superhumanoids....'"
"'209','2013-04-22','As owners, we often try throwing as much as we can against the wall to see what sticks. This is unlikely to work when it comes to search for capital....'"
"'210','2013-04-22','Internet Explorer has options for removing unwanted third-party toolbars and other add-ons from the browser window....'"
"'211','2013-04-22','Apple, gold and cupcakes all tumble. The strangest travel start-up is revealed. The health care overhaul is labeled a huge train wreck. And do you consider yourself a good boss?...'"
"'212','2013-04-22','In the midst of the national struggle for civil rights, James Karales, born into an immigrant Greek family in Ohio, turned his camera on the individuals fighting for rights and respect....'"
"'213','2013-04-23','He browsed the books like a giant looking for something to read. Some were small enough to fit into a fold of his hand. Many of the books were illegibly small, and he didn&#x2019;t know what they were all about. But reading them was never the poin...'"
"'214','2013-04-23','Marvin Tolkin was 83 when he decided that the unexamined life wasn&#x2019;t worth living. Until then, it had never occurred to him that there might be emotional &#x201C;issues&#x201D; he wanted to explore with a counselor.&#xa;   &#xa;&#x201C;I do...'"
"'215','2013-04-23','High levels of cortisol &#x2014; the so-called stress hormone &#x2014; have been associated with cardiovascular disease in some studies, but not in others. This may be because measuring cortisol in blood or saliva at one point in time may pick up ...'"
"'216','2013-04-23','7:35 p.m. | Updated  Standard  Poor&#x2019;s, accused of inflating its ratings to win business during the boom in mortgage investments, urged a judge on Monday to dismiss the federal government&#x2019;s civil case against it, saying the Justice De...'"
"'217','2013-04-23','The new Broadway musical &#x201C;Matilda,&#x201D; which arrived from London this spring with exceedingly high expectations &#x2013; and opened April 11 to some of the  best reviews  of the season &#x2013; joined the million-dollar club of top-sell...'"
"'218','2013-04-23','Despite the attention-grabbing numbers, the iPad maker could quickly replace the withdrawal from its cash hoard, which now totals $145 billion....'"
"'219','2013-04-23','Apple iPhone 4 owners began receiving $15 checks in the mail Tuesday as a result of a class action settled by the company last year....'"
"'220','2013-04-23','The Twitter account for The Associated Press was hacked on Tuesday and erroneously sent out a tweet saying there had been explosions at the White House, injuring President Obama....'"
"'221','2013-04-23','Coverage and live analysis of the first leg of the Barcelona-Bayern Munich Champions League semifinal....'"
"'222','2013-04-23','A.T.M. fees are generally highest in areas of little competition, like airports or amusement parks....'"
"'223','2013-04-23','Brian Hare, an associate professor at Duke University, has created a new method to research dog behavior, using the Internet and citizen science.'"
"'224','2013-04-23','The Blackstone Group will buy Strategic Partners, a private equity business owned by Credit Suisse that specializes in buying stakes in funds from other investors. The unit has $9 billion of assets under management....'"
"'225','2013-04-23','The sharp slide in the price of gold has led to much hand-wringing but should cause little surprise....'"
"'226','2013-04-23','Many Chinese netizens were unimpressed by a state report criticizing the U.S. human rights situation, which focused on gun violence, among other things....'"
"'227','2013-04-23','The Atlantic Coast Conference presidents have agreed for the league to retain media rights for a university that leaves the conference. The A.C.C. said each of the current and future universities has signed the deal, which is effective immediately. The grant of rights would appear to make the league more stable by essentially locking all 15 universities into the A.C.C. through the length of a TV deal, including the new arrivals Pittsburgh, Syracuse, Notre Dame and Louisville.'"
"'228','2013-04-24','Hackers hijacked the Twitter account for The Associated Press on Tuesday and sent out an erroneous message reporting explosions at the White House that injured President Obama.&#xa;   &#xa;Within minutes, Jay Carney, Mr. Obama&#x2019;s press secre...'"
"'229','2013-04-24','Henry A. Prunier taught Vo Nguyen Giap, the Vietnamese general who withstood the armies of France and the United States, how to throw a grenade.&#xa;   &#xa;The lesson came in July 1945, after Mr. Prunier and six other Americans had parachuted int...'"
"'230','2013-04-24','Adding your personal touch to the Microsoft Office Ribbon can make it easier to find your favorite commands....'"
"'231','2013-04-24','What did I know, and how did I know it?...'"
"'232','2013-04-24','The bank reported first-quarter earnings of $1.4 billion, a large increase from the period a year earlier when it booked large charges on its own debt....'"
"'233','2013-04-25','LONDON &#x2014; As European policy makers push financial institutions to cut back on their risky trading activity, some of the region&#x2019;s largest banks are becoming more reliant on their investment banking operations to bolster performance.&#...'"
"'234','2013-04-25','If you&#x2019;re not sure that you need a tablet, $200 is a lot to spend just to find out. But  Ematic  has reduced the risk with the Genesis Prime, a 7-inch Android tablet computer that lists for  $80 .&#xa;   &#xa;You get quite a lot at that pri...'"
"'235','2013-04-25','BB Seguridade, the biggest insurance company in Latin America, raised $5.74 billion late Thursday in the largest initial public offering in the world so far this year....'"
"'236','2013-04-25','Multiple videos posted online by Syrian citizen journalists claim to show the aftermath of chemical attacks in Ateibeh, a town outside Damascus....'"
"'237','2013-04-25','The first round of the N.F.L. draft was a wild ride: three offensive tackles and three pass-rushers in the first six picks;  two guards in the top 10 for the first time in N.F.L.; and only one quarterback selected....'"
"'238','2013-04-25','Under pressure from a populist campaign, the Swiss government has moved to curb migrant numbers from the European Union. The debate in Switzerland has echoed a growing anti-immigration mood elsewhere in the Continent....'"
"'239','2013-04-25','Senators John McCain and Charles E. Schumer, who are leading a push for bipartisan immigration legislation, said Thursday that they were aiming to win 70 votes in the Senate and hoped to gain the backing of a majority of senators in both parties....'"
"'240','2013-04-25','Getting the Reinhart-Rogoff story wrong....'"
"'241','2013-04-25','A military jury has decided that an Air Force instructor should be jailed for six months and reduced one rank for his role in a sex scandal at a South Texas base. The jury at Keesler Air Force Base in Biloxi convicted Tech. Sgt. Bobby D. Bass of 31 charges on Tuesday. He was a basic training instructor in 2009 at Lackland Air Force Base, where the episodes occurred. Sergeant Bass had faced up to 33 years in prison. The 31 charges included cruelty, assault and abuse. More than 30 Lackland instructors have been investigated in the military sex scandal.'"
"'242','2013-04-26','Zynga &#x2019;s latest quarterly earnings report, released on Wednesday, came in the typical format and was accompanied with the usual financial tables investors expect.&#xa;   &#xa;But the social gaming company that counts FarmVille among its gam...'"
"'243','2013-04-26','&#x201C;Collapse&#x201D; is quite a bold title for a play that proves so trite. Built on unbelievable situations and uninspired jokes, the script holds enough humor to sustain a sitcom. But as  this comedy  stretches toward an hour and a half, the...'"
"'244','2013-04-26','Robert Earl Holding, a Western entrepreneur who made his first fortune in the 1950s running a 24-hour service station in an otherwise desolate stretch of Wyoming and became a billionaire whose assets included  oil  refineries and ski slopes, among...'"
"'245','2013-04-26','BARSEL--Jan. The Board of Governors and the Members of Glen Oaks Club express our deepest sorrow at the passing of Jan, wife of our esteemed member, Ely, and extend our heartfelt sympathy to her family. Board of Governors Michael Mann President...'"
"'246','2013-04-26','Mark Zuckerberg, co-founder of the social network, exercised options worth more than $2 billion after its public offering, according to a company filing, and sold about half the shares to pay taxes....'"
"'247','2013-04-26','A new study found that by tracking certain search terms in Google Trends, researchers could predict whether the Dow Jones industrial average would rise or fall the following week....'"
"'248','2013-04-26','Chevrolet announced today that the 2014 Corvette Stingray starts at just under $52,000....'"
"'249','2013-04-26','The Smith-Ninth Street station, elevated more than 80 feet above Gowanus, Brooklyn, had been shuttered for nearly two years....'"
