"Date","Direction","Headline"
"2007-05-20","0"," Dissecting the Preakness"," ‘Fellow Travelers’"," Clinton Accepts Aid From a Divisive Figure"," Illegal Migrants Dissect Details of Senate Deal"," Ghosts Wail as Cambodians Plunder Killing Field Graves"," Virginia Puts Higher Price on Best Seats in the Stadium"," Spread the Wealth of Spousal Rights"," The Online Broker, as Your Financial Supermarket"," The Bull Market That’s Missing Something"," Stocks Cheap? Private Equity Thinks So"," Correction: Girth and Nudity, a Pictorial Mission"," Debating How to Finance Land Preservation"," Jennifer Wu, Harold Zernike"," Emily Sheehy, Reed Carey"," Jessica Rodriguez and Emile Lisboa"," Emily Larned, Christian Ruggiero"," Stores Damaged by Storm Slow to Reopen Doors"," Conductor, Dismissed After a Stroke, Sues Ridgefield Symphony"," Visa Denials Mean Unfinished Business"," ‘Doors Open’"," A Childhood Issue? Ask a Librarian"," Correction: Moyduh, He Watched: Commissioner Turns Critic"," Anime Dreams, Transformed Into Nightmares"," Or No Conspiracy?"," Conspiracy?"," Oil Price ‘Gouging’: A Phantom Menace?"," The Remix; Trend Spotting | Extreme Makeovers"," A Childhood Issue? Ask a Librarian"," The Remix; HIGH-LOW | RIVIERA RESTAURANTS"," Paid Notice: Deaths   COYLE, ELIZABETH MCCONNELL"," The Remix; Blazing Saddles"," Dissecting the Preakness"," The Remix; Sail of the Century"," The Remix; On the Q.T.: Grant Tatcher"," A Childhood Issue? Ask a Librarian"," A Childhood Issue? Ask a Librarian"," The Remix; Bohos in Paradise"," FARM-FRESH PRODUCTS"," The Remix; The New New List"," The Remix; It's all about . . ."," Jessica Rodriguez, Emile Lisboa"
"2007-05-21","0"," Telling Bloopers: Oops! I Didn't Mean for You to Find Out This Way"," McCain's Choice Words for Romney"," McCain's Way With Words, Still Intact"," EMI Accepts $4.7 Billion Bid From Terra Firma"," Merrill Lynch Takes Hedge Fund Stake"," Germany Calls for Voluntary Hedge Fund Rules"," For Hedge Funds, Treasure Ahoy"," M&A Extends Markets' Bull Run"," Sneaker Brands Seen as Ripe for Buyouts"," Hedge Funds to Manage Part of Illinois Teachers' Pension"," Confident Spurs Show Jazz What It Is Missing"," Liberty Rains 3-Pointers on the Sky in Its Opener"," Italy Bests U.S. in America’s Cup Semifinals"," Zipf’s Law, or the Considerable Value of Being Top Dog, as Applied to Branding"," UniCredit to Buy Capitalia for $29.5 Billion in Stock"," Pfizer’s Head of Research Is Departing"," Much Ado About Apple’s iPhone"," Verizon Consolidates Agencies and Adds Wireless Assignments"," Eye-Opener: A Blind Man’s Rare Opportunity to See"," Much Ado About Apple's iPhone"," TODAY IN BUSINESS"
"2007-05-22","0"," Cooler Climate for NIMBYs?"," CBS Buys Wallstrip, Going Long on Finance Humor"," The Meaning of 'Democrat' in Montana"," 2008: Immigration Draws Out McCain"," Unimpeachable Bravery"," In Acxiom Deal, It's Hedge Fund vs. Hedge Fund"," Paul Weiss Adds to Investment Funds Group"," Chevron Plans Offering of Dynegy Stake"," A New Twist in Merrill's Hedge Fund Deal?"," Missouri: Bill Protects Executioners’ Anonymity"," Heart Attack Risk Seen in Drug for Diabetes"," Man Charged in Animal Cruelty"," Commissioner Leaves for Port Job"," Body Found in Search for Missing Boat"," Knicks Expected to Miss a Shot at Oden or Durant"," Audit Finds Subway Track Work Safety Violations"," $4.7 Billion Private Equity Buyout Wins Support at EMI"," McCain Counters Romney With a Three-Way Riposte"," Group Offers a Simple Fix for Alternative Minimum Tax"," General Electric to Sell Plastics Division"," An Energetic Pianistic Program With Wine as Accompaniment"," EMI Accepts $4.7 Billion Buyout Offer"," Patterns: Treatment of Depression May Lead to Longer Life"," Outcomes: Alcohol Is Tied to Lower Risk of One Type of Kidney Cancer"," Figuring the Next Field for the Mayor"," Executive on a Mission: Saving the Planet"," America’s Admissions System"," TODAY IN BUSINESS"," Alcohol Is Tied to Lower Risk Of One Type of Kidney Cancer"," World Briefing | New York: Trenton: Commissioner Leaves For Port Job"," Treatment of Depression May Lead to Longer Life"," A Balcony View of Strife in Tripoli  "
"2007-05-23","0"," Apple iPhone Commercial"," Microsoft: We Don't Need Yahoo"," The Color of Dissent"," Worth a Lot, but Are Hedge Funds Worth It?"," Chinese Bookstore Chain Prices I.P.O. Amid Strong Demand"," Hedge Fund Executive Leaves Merrill Lynch"," Intel to Form a Flash-Memory Venture"," The Meaning of 'I'll Be Back'"," Former Chief of EMI Said to Prepare Rival Bid"," Hedge Fund Suit Tests Use of 'Big Boy' Letters"," Onex to Unload More of Spirit in Offering"," British Police Seek 3 Missing Terrorist Suspects"," Nominee to Head Consumer Agency Withdraws"," 12 Guilty in Serbian Premier’s Death"," Afghanistan: Canadian Premier Pays Surprise Visit"," Worth a Lot, but Are Hedge Funds Worth It?"," A Frustrated Pettitte Stews About His Missed Chances"," Hedge Fund Figure Leaves Merrill Lynch"," Furious Street Battles Remind Lebanon of Its Past"," Antimissile Test Comes Amid Financing Debate"," California Wants Strict Auto Emission Rules"," Search Continues Off Jersey Shore for Missing Fisherman"," Intel to Form a Flash Memory Venture With a Swiss Company"," Veteran-Claim Court Faces Highest Caseload in Its History"," Russian Is Accused of Poisoning Ex-K.G.B. Agent"," Giuliani Above the Fray as McCain and Romney Skirmish"," Gay and Dissident Bishops Excluded From ’08 Meeting"," 3 Global Financial Institutions’ Roles Questioned"," CBS Buying Wallstrip, a Web Finance Site"," Food Safety Joins Issues at U.S.-China Talks"," Recipe: The Best Spinach Dip With Chipotle and Lime"," American Express or Visas?"," World Business Briefing | Americas: Canada: Nortel Settles Accounting Fraud Investigation"," TODAY IN BUSINESS"," World Business Briefing | Asia: India: Viacom Forms Joint Media Venture"
"2007-05-24","0"," The Biggest Hedge Funds? Investment Banks"," A Redefining Moment for McDonald's"," S.E.C. Revises Its Standards for Corporate Audits"," Coca-Cola Keeps Quiet on Rumors of Water Deal"," Rival Bids for EMI Unlikely, Reports Say"," Nasdaq Plans Market for VC's"," 8-Year Sentence in Coca-Cola Secrets Case"," Oil Industry Says Biofuel Push May Keep Gas Prices High"," Recent Openings"," Congress Passes 1st Minimum Wage Boost in a Decade"," Financial Services Firm Settles With S.E.C."," China Talks Don’t Resolve Major Issues"," Leading Russian Official Dismisses U.S. Treaty and Missile Shield"," Bush Says Iraq Pullout Would Leave U.S. at Risk"," Years Ago, Agency Was Warned of a Drug’s Risks"," Body Found in Iraq May Be  That of Missing G.I."," Fannie Lee Chaney, 84, Mother of Slain Civil Rights Worker, Is Dead"," Getting a Chance to Fill Up Before the Price Goes Up"," Microsoft Asks, Why Buy Yahoo?"," Carbon Dioxide Emissions Down"," Weather Delays Missile Test"," S.E.C. Revises Its Standards for Corporate Audits"," Emirates Team New Zealand Gains Final"," Ex-Secretary Gets 8-Year Term in Coca-Cola Secrets Case"," U.S.-China Trade Talks Open With Food Safety an Issue"," World Business Briefing | Americas: Canada: Alcoa Stands By Bid"," World Business Briefing | Europe: Limits on Roaming Charges"," TODAY IN BUSINESS"," National Briefing | Washington: Alaska Weather Delays Missile Test"," World Business Briefing | Americas: Canada: Cerberus Plans Bell Bid"," Arts, Briefly; Linkin Park Opens Big"," National Briefing | Science And Health: Carbon Dioxide Emissions Down"
"2007-05-25","1"," Stroke, an Animation"," Deciding Whether a Window Shade Is Open or Closed"," An Opening Gambit With an Odd Acronym"," Goldman Alum Keeps the Hedge in Hedge Fund"," McCain Gives Obama 'Flak'"," Coca-Cola Pulls Out the Stops for Glaceau Deal"," McCain on Clinton, Obama War Votes"," Nasdaq in $3.7 Billion Deal for Sweden's OMX"," Sallie Mae Documents Add to Questions About Stock Sale"," Sharper Image Jumps on Buyout Speculation"," Stock Picks From Hedge-Fund Stars"," Fifield Is Still Interested in EMI, Even If Corvus Isn't"," In a Crowded Anime Dreamscape, a Mysterious Pixie"," Despite Gas Prices, Drivers Are Hitting the Road"," Coca-Cola Is Said to Buy Vitaminwater"," Japan: Consumer Prices Slow"," Albany: Interim SUNY Chancellor Nominee"," Surf City: Beaches Reopened"," Recall Is Issued for Frozen Fish"," Investigation Is Said to Open on Dow Chemical "," Documents From Sallie Mae Add to Questions About Timing of $18 Million Stock Sale"," Animal Rights Advocates Claim Success Over Plan to Shoot Kangaroos"," U.S. Opens a Sheltered Path to Asylum for Some Iraqis"," Home Sales Climb, but Prices Plummet"," Custom Stamps as a Status Symbol"," Support Riders in Tour Admit Taking EPO"," Openness Sought in British Terror Trials"," Spain Voting Seen as Test for Premier and His Rival"," Risky Bets on Winning Tax Fights"," Congress Passes Increase in the Minimum Wage"," Correction: A Renaissance of Charm in a Hub of the Surfing World"," Mission for Memorial Day: Always Remember"," Risky Bets On Winning Tax Fights"," Metro Briefing | New York: Albany: Interim SUNY Chancellor Nominee"," Metro Briefing | New Jersey: Surf City: Beaches Reopened"," World Business Briefing | Europe: Netherlands: Russia Wins A Yukos Round"," TODAY IN BUSINESS"
"2007-05-26","0"," Open days"," Traffic Agents Talk About the Prospect of New Ticket-Writing Powers"," North Korea: Short-Range Missiles Fired"," California: After Just 25 Days, Freeway Reopens"," More Visas for Translators"," Existing Home Sales and Prices Fall in April"," An Eye-Opening Flight That Might Knock You Out"," Breaking the Silence on Finance"," Nasdaq Agrees to Buy OMX, Operator of 7 Stock Exchanges in Europe"," Dissecting the Game, Skill by Skill"," Missile Defense Test Is Halted After the Target Rocket Fails"," The High Price of Creating Free Ads"," Nasdaq to Buy Operator of Nordic Exchanges"," Coca-Cola Agrees to Buy Vitaminwater"," Arts, Briefly; Paying the Price"," World Briefing | Asia: North Korea: Short-Range Missiles Fired"," Nasdaq Agrees to Buy OMX, Operator of 7 Stock Exchanges in Europe"," Searching for Missing Soldiers in Iraq  "," Dissecting The Game, Skill by Skill"
"2007-05-27","0"," ‘Animal, Vegetable, Miracle’"," Russian Police Suppress Gay Rights Rally"," Elite Colleges Open New Door to Low-Income Youths"," An Asterisk Is Very Real, Even When It’s Not"," Coke Struggles to Keep Up With Nimble Rivals"," Stocks Fall in a Week of Cloudy Economic News"," Parking, Pollution and the Pricing Zone; TriBeCa Tennis Court: Open to All Players (4 Letters)"," Sure, Inflation Is Tame, but Don’t Forget Other Risks"," Apple’s Lesson for Sony’s Stores: Just Connect"," The Curtains, the Dog, the Remark"," Record Price for a Ferrari: $9.3 Million"," Melissa Kujawski, Andrew Rosen"," Kimberly Kissam, David Lucchino"," Alissa Schecter, Aaron Wright"," Sonali Madia and Nimesh Patel"," The Alchemist’s Moment: The Reclusive Mr. Polke"," ‘Doors Open’"," The Dogged Approach"," Benchmark and Timetable"," Working Out the Kinks, for a Price"," A Pause to Refresh a Weary Dogmatist"," Many Toppings for Lots of Dogs"," Creeping Equality, a Bit of Fraternity and a Slick of Asterisks at Indy"," A Disservice"," The Oil Price Trajectory"," A BREAK FROM BUSINESS"," A Disciplined Business"," On Behalf of Beta Males"," DataBank; Stocks Fall in a Week of Cloudy Economic News"," TriBeCa Tennis Court: Open to All Players"," Paid Notice: Memorials   GRIFFING, MELISSA"," BEHIND THE WHEEL/2007 Nissan Altima; The Pace Picks Up As Act 4 Begins"
"2007-05-28","0"," Davydenko Takes First Round in French Open"," Scientists Explore Genetic Risk of Breast Cancer"," Perth Amboy: Gunman’s Death Ruled Suicide"," A Twosome Reminiscent of the Stockton-Malone Era"," Officers and Counterprotesters Disrupt Gay Rights Rally in Russia"," Honoring an Avant-Garde Eminence of the Saxophone"," African Energy Celebrated Ebulliently and Symbolically"," OMG! Cute Boys, Kissing Tips and Lots of Pics, as Magazines Find a Niche"," Steps Toward Reducing Risk "," The Abortion Issue: Who Decides? (5 Letters)"," The Abortion Issue: Who Decides?"," Steps Toward Reducing Risk: Controlling Blood Pressure, Learning the Warning Signs and Acting Immediately"," TODAY IN BUSINESS"
"2007-05-29","1"," U.S. Attorney Charges Pakistani Banker with Insider Trading"," Housing Price Rebound?"," Are Warner and Cerberus Planning a Suprise Attack on EMI?"," Morgan Stanley Analyst Defects to Hedge Fund"," Hedge Fund Manager's Comments Irk Macquarie"," South Korea Examines Credit Suisse Transaction"," Former Citigroup Executives to Launch Asia Hedge Fund"," Calpers Backs Shareholder Rights Bill at UnitedHealth"," JPMorgan Back on Board in Nasdaq's Latest Exchange Deal"," UK house price growth slows"," The Risks Associated With Valve Replacement"," Roddick and Blake Crash Out of French Open"," Andy Roddick Crashes Out of French Open"," Lens Solution Recall Is Blow to Company’s Stock"," Rise in Metal and Mining Shares Bolsters Foreign Markets"," Kremlin Aim of Monopoly Threatens BP Gas Venture"," Kazakhstan Issues Warrant for President&#8217;s Son-in-Law"," Uranium Windfall Opens Choices for the Energy Dept."," Genome Researchers Find New Indicators of Breast Cancer Risk"," Moral Rights or the Outraged Heir: Real-Life Drama at House of Molière"," Responses: In Study of Men, Lots of Coffee Appears to Lower Risk of Gout"," At Risk: Where Smokers Congregate Outside Bars, a Cloud Hovers"," Effective, Yes, but Is It Safe? A Drug’s Risks"," Effective, Yes, But Is It Safe? A Drug's Risks"
"2007-05-30","1"," Trump on Why Miss USA Fell"," Dogfighting in Russia"," Lebanon's Missing Curriculum"," Adventures in 'Love' and Advertising"," Missile Attacks in Lebanon"," The U.N. Condemns Missile Tests"," Hedge Fund Signals Support for Clear Channel Deal"," More Pain at Goldman's Flagship Hedge Fund"," British Want Their Hedge Fund Access"," Are Online Ad Firms Overpriced?"," I.B.M. Borrows $11.5 Billion to Buy Back Stock"," China Triples Tax on Stock Trades"," Kyrgyzstan: Doctors Confirm Poisoning of Premier"," Russia to Issue Visas to Georgians"," Russia Hails Test of a New Missile It Says Can Pierce Defense Shields"," Prosecutors Accuse Banker of Fraud and Conspiracy"," Parren Mitchell, 85, Congressman and Rights Leader, Dies"," In a Switch, China Triples the Tax on Stock Trades"," Boeing Sells 15 Dreamliners to Russian Airline"," New Jersey Public Advocate Seeks Stronger Eminent Domain Protections for Property Owners"," I.B.M. Borrows $11.5 Billion to Buy Back Stock"," With Financial Tactic, Corzine Would Keep Turnpike Public, Toll Increases and All"," Should British Academics, or Rock Bands, Boycott Israel?"," Indians Protest Use of ‘Katonah’ for Martha Stewart Product Line"," Gretchen Wyler, 75, Actress and Advocate for Animals, Dies"," The Bonds Paradox: Headphones, Head Games"," U.S. Raising Visa Fees 66% on Average, to Advocates’ Dismay"," How We’re Animalistic — in Good Ways and Bad"," World Briefing | Europe: Russia To Issue Visas To Georgians"," Paid Notice: Deaths   DESSISSO, ALBERT"," TODAY IN BUSINESS"," Arts, Briefly; Few Care to Look At 'Miss Universe'"," Paid Notice: Deaths   GALAMBOS, PETER"," TODAY IN BUSINESS"
"2007-05-31","0"," Much Ado About Microsoft's Surface Computer"," Much Ado About Microsoft's Surface Computer"," Northwest Airlines Exits Bankruptcy Protection"," Spain Files Suit Against Hedge Funds' Treaure Hunter"," Appeals Court Sides With Overstock in Gradient Suit"," Hedge Funds: With More Money Comes More Post-Nups"," Maker of a Well-Known but Risky Drug to Sell Shares"," Barclays Settles Insider Trading Charges"," Small Business Not as Usual"," Tax Increase Batters Chinese Stocks"," Bush Calls for Global Goal for Cutting Emissions"," For Jobs and Gates, a Night to Reminisce"," Missouri: Ruling on Sex Offender Law"," Manhattan: City to Open Asthma Center"," Near Misses Allowed Man With Tuberculosis to Fly"," Comedy Business Turns to the Web"," Oral Dissents Give Ginsburg a New Voice on Court"," 3 Claims Dismissed Against McDonald’s"," Bush’s Nominee Has New Agenda for Bank"," Small Business Not as Usual"," Rice Clashes With Russian on Kosovo and Missiles"," Loitering Arrest of Panhandler Is Dismissed as Unlawful"," Coca-Cola and PepsiCo Agree to Curb Animal Tests"," British Academics’ Union Endorses Israel Boycott"," Protect an iPod and Tame Its Unruly Cord at the Same Time"," W.H.O. Seeks More AIDS Tests in Nations at Epidemic’s Center"," Pepsi and Coke Agree to Stop Financing Research That Uses Animals"," Tax Increase Batters Chinese Stocks, but There’s Little Wider Damage"," Manufacturer of Risky Drug to Sell Shares"," Copyrights That No One Knows About Don’t Help Anyone"," From Nike, Beat-Up Chic"," A Voice for Small Business"," Concussions Tied to Depression in Ex-N.F.L. Players"," Metro Briefing | New York: Manhattan: City To Open Asthma Center"," Paid Notice: Deaths   CUTLER, EVELYN, (NEE GURLITZ)"," TODAY IN BUSINESS"," Study of Ex-N.F.L. Players Ties Concussion to Depression Risk"," Inviting the Animals In"," Oral Dissents Give Ginsburg A New Voice"," Arts, Briefly; Joyce Theater Awards Commissions"
