"Date","Direction","Headline"
"2006-11-01","0"," S.E.C. Said to Consider Action on Hedge Fund's Short Sales"," British Brokerage's Stock Soars in First Day of Trading"," Nymex to Issue 600 Million Shares in I.P.O."," Deutsche's 3Q Profits Rise, No Thanks to Investment Banking"," EMI's Bandier May Jump to Warner, Report Says"," A Surgeon on a Special Mission Deep in the Heart of Vietnam"," To Boldly Go Where the iPod Has Gone Before"," CVS to Buy Caremark in All-Stock Deal"," Defending Champion Heat Loses Opener to Bulls by 42"," For North Korean Resort, Symbol of Engagement, Nuclear Test’s Fallout Is Financial"," Turkey: Academic, 92, Tried Over Head Scarf ‘Insult’"," Rights Advocate Wins a Retrial, a Rarity in the Chinese Courts"," Pfizer Drug Dealt Blow in Testing"," Earnings Jump 33% at Procter & Gamble"," Morgan Stanley in Deal for Hedge Fund Manager"," Noonan Glad to Be Back After Missing World Cup"," Hevesi’s Lawyers Take On State Ethics Commission"," New Czars of Conspicuous Consumption"," Agent Charged in Smuggling of Cubans"," KBR Sets Offering Price"," A Basement Full of Video Games, With Something Missing"," The Foley Scandal and the Risks of Righteous Politicking"," TODAY IN BUSINESS"," World Business Briefing | Asia: India: Central Bank Raises Rate To Control Inflation"
"2006-11-02","0"," What to Do in Copenhagen"," Where to Eat in Copenhagen"," Where to Stay in Copenhagen"," McCain for ... Callaghan?"," Recent Openings"," A Sneak Peek at the New iPod Shuffle"," RiskMetrics Takes ISS for $553 Million, Report Says"," Credit Suisse Profits Slip But Shares Rise"," Toronto Exchange Falls on News of Trust Tax"," Letter to Cramer: An Apple-Sirius Merger?"," Schering C.E.O. Wonders at Price of Drug Deals"," Morgan Takes a Stake in Yet Another Hedge Fund"," Tribune Quietly Opens Door to Sale of Individual Assets"," China Opens Summit for African Leaders"," Iranian Military Tests Ballistic Missiles"," Cambodia: U.S. Policeman Kills Himself in Jail"," Northern Ireland: $95 Billion ‘Peace Dividend’"," Latin Grammys Finally Arrive in Mambo’s Hometown"," Before Opening Loss, Celtics and Their Fans Pay Tribute to Auerbach"," Local Issues Mirror National Ones, but the Special Effects Occasionally Stand Alone"," Tribune Quietly Opens Door to Sale of Individual Assets"," Iran Is Offering Bounty to Agents Who Can Entice Western Tourists"," Microsoft Vista Event"," Toronto Exchange Falls on News of Trust Tax"," Immigrant Workers’ Rights Violated, A.C.L.U. Charges"," Big Prices, Big Risks at Fall Art Auctions"," A Pollock Is Sold, Possibly for a Record Price"," Paid Notice: Deaths   GURIN, GEORGE"," TODAY IN BUSINESS"," Picture With the President? Priceless."," World Briefing | Asia: Cambodia: U.S. Policeman Kills Himself In Jail"," A Pollock Is Sold, Possibly for a Record Price"," World Briefing | Asia: Cambodia: U.S. Policeman Kills Himself In Jail"," Paid Notice: Deaths   VAN STOCKUM, HILDA"," The Bacchanal Of Downtown Clubs, Translated as Home"
"2006-11-03","0"," Ad Analysis: The Hevesi Apology"," Missouri Is Where It's At"," Missouri Senate"," Missouri Senate"," Missouri Senate"," Missouri Senate"," Editorial Tutorial: Missouri and Tennessee"," Cash Flow Keeps Private Equity at the Media Trough"," A Sneak Peek at the New iPod Shuffle"," Boeing Executive May Migrate to Ford"," Seattle Trio to Launch Hedge Fund"," Hedge Fund I.P.O. Breaks Record"," Nationwide Puts Hedge Fund on the Block"," Fearing Slow Holiday Sales, Wal-Mart Cuts Prices"," U.S. Intelligence Chief Visits Baghdad"," Louisiana: Council Approves Watchdog Office"," Court Orders Changes to Medical Admissions Test"," L.I. Hospital Is Issued 17 Violations by the State"," Congress Tells Auditor in Iraq to Close Office"," Father of Missing U.S. Soldier Says Son Just Made a Mistake in Quest to Find His Calling"," Mission: Rescue Operation"," Bush Shores Up His Base as Democrats Spot Opening"," Selig Sees a Billion Reasons to Open a Season in China"," Mussina, Not Wright, Figures in Yanks’ Pitching Plans"," Russian Gas Company Plans Steep Price Increase for Georgia"," Thoroughbred Racing Association Files for Bankruptcy Protection; Tracks Stay Open"," Forecast Lifts Corn Prices"," Trenton: Verizon Seeks to Offer Cable Service"," Manhattan: Labor Figures Show Increase in Jobs"," Credit Suisse&#8217;s Stock Trading Lags Its Deals; Profit Is Off"," Judge Bars Defense Witness in Libby Case"," Animal Intelligence (1 Letter)"," Insulting Our Troops, and Our Intelligence"," World Business Briefing | Asia: India: Outsourcing Company's Net Soars"," Paid Notice: Deaths   GURIN, GEORGE"," Animal Intelligence"," Selig Sees a Billion Reasons To Open a Season in China"," TODAY IN BUSINESS"," Metro Briefing | New York: Manhattan: Labor Figures Show Increase In Jobs"," Mussina, Not Wright, Figures in Yanks' Pitching Plans"
"2006-11-04","0"," A Comptroller in Limbo"," Redskins’ Moss to Miss a Game"," G.O.P. Turns to the Economy as Campaign Issue"," Warrant Is Issued for Haitian Police Chief"," For U.S. and Top Iraqi, Animosity Is Mutual"," Dismissals at Apollo Over Stock Options"," Morgan Stanley Criticizes Stock Structure of Times Co."," Turn by Yankee Pitcher’s Plane Posed Stalling Risk, Report Says"," High Risk Cuts Champions’ Careers Short"," Where Cars Are King and Gasoline Costs a Mere 12 Cents a Gallon"," Hilda van Stockum, 98, Author and Illustrator of Children’s Books, Dies"," In Missouri, a Final Rush to Find Votes in Senate Race"," Supreme Court to Revisit Federal Sentencing Issues"," 7 U.S. Troops Die in Iraq; U.S. Intelligence Chief Visits"," Fees Are Price of Running New York"," Leonard P. Pepkowitz, 91, a Chemist in Atomic Energy, Dies"," Candidates Crisscross New York in a Push to Pick Up a Few More Votes"," Rolling the Health Dice; New Consumer-Directed Plans Reduce Premiums But Carry Higher Annual Deductibles"
"2006-11-05","0"," Always Academicize: My Response to the Responses"," ‘The Real Animal House’"," Copenhagen in 36 Hours"," Pastor Dismissed for ‘Sexually Immoral Conduct’"," Detainees&#8217; Access to Lawyers Is Security Risk, C.I.A. Says"," Jane Hodgson, 91, Supporter of Abortion Rights, Is Dead"," Asterisks for the Political Rulebook"," Stocks Lose Ground as Hopes for Rate Cut Fade"," A Business Where Customers Grow Along With Sales"," Could You Call Them ‘Business Climbers’?"," Shacking Up"," Anne McCaughey, Roger Sommerfield"," The Price of Climate Change"," The Mother Load"," Course Overload"," Contagion"," The Share-Price-to-Campaign-Contribution Ratio"," All Housing Markets Are Local, Except When They’re Not"," Admissions"," A Building With a Mission"," 36 Hours in Copenhagen"," The Remix; Go West"," The Remix; Now Appearing | Cocoa Powder"," The Remix; West Eats East"," The Remix; Ear Candy"," The Remix; Now Pairing | Start The Presses!"," The Remix; Food For Art's Sake"," BOHEMIAN TAOS"," The Remix; Prêt-À-Manger"," The Remix; Stealth Technology"," The Remix; It's all about ..."," The Remix; Pulpit of the Palate"," Paid Notice: Deaths   VAN STOCKUM, HILDA"," Figures Show Sharp Drop in Home Sales"," Nickels and Dimes"," On Nassau Ballot, an Open-Space Bond Issue"
"2006-11-06","1"," The Numbers Game That the Auditors Missed"," Overstock's Woes"," The Issue of the Count"," Dismissals at Apollo Over Stock Options"," Morgan Stanley Criticizes Stock Structure of Times Co."," Kohlberg Kravis and Goldman Sachs Fork Over $5 Billion for Linde Unit"," Morgan Stanley and Visa Settle Suit, Report Says"," R.B.C. in Liquidity Breach, Canada's Dealers Group Says"," After Merck's Big Deal, All Eyes Turn to Alnylam"," Tokyo Exchange in Talks With L.S.E., Report Says"," Vivendi's Talks With Kohlberg Fuel Breakup Speculation"," When Even a Miss Is Profitable"," Microsoft Moves Into Video Download Fray"," Church Tries to Cope After Minister’s Dismissal"," National Issues, Led by Iraq, Dominate Final Appeals in Congressional Campaigns"," As Drug Prices Climb, Democrats Find Fault With Medicare Plan"," Do the Rights of the Disabled Extend to the Blind on the Web?"," Insert Product Here: Plenty of Space to Sell on HD DVDs"," In French Advertising, a Ruthless Hunt for Talent"," THE 2006 CAMPAIGN: Economy; Receding Gas Prices Quiet a Major Issue"," TODAY IN BUSINESS"," National Issues, Led by Iraq, Dominate Final Appeals In Congressional Campaigns"," Stock Offerings This Week"," Paid Notice: Deaths   NISSEN, ANTON"," Paid Notice: Deaths   GURIN, GEORGE J."," THE 2006 CAMPAIGN: Social Issues; A Race for Every Vote (Left to Cast, That Is)"
"2006-11-07","1"," Joe vs. Symbolism"," Revolving Door: Credit Suisse, Jones Day, Piper Jaffray"," After a Loss, the Chief of Overstock Reassesses"," Cerberus's Aozora Prices at Low End in I.P.O."," British Hedge Fund Prepares for I.P.O."," Andarko Unloads Gulf of Mexico Properties"," YouTube, Time's Invention of the Year, Is in Talks With Verizon, Report Says"," National Issues Outweigh Local Ones Among Voters"," U.S. Audit Faults Grants for Reading in New York"," Incumbent Hits the Trail, With a Dog"," Morgan Stanley and Visa Settle Dispute"," Sports Briefing: Figure Skating, Auto Racing, Colleges and Golf"," Cost of Taking Fuel to Iraq Is Questioned in New Audit"," Microsoft Xbox to Join the Battle for Video Downloading"," Iran Would Share Missiles"," China to Pass U.S. in 2009 in Emissions"," A Fiery Warning Against Taking Risks"," Many Relatives of Slain Man Grieve and Miss His Support"," After a Loss, the Chief of Overstock Reassesses"," Comcast Is Said to Agree to Carry Fox&#8217;s Planned Business News Channel"," A Quintet by Mozart the Inimitable (Sigh)"," Keeping a Girl Breathing Becomes Her Family’s Mission"," The Neediest Cases; Keeping a Girl Breathing Becomes Her Family's Mission"," World Business Briefing | Europe: Britain: Ryanair's Profit Increases 24%"," TODAY IN BUSINESS"," A Fiery Warning Against Taking Risks"," World Business Briefing | Asia: India: Foreign Investments Approved"," World Business Briefing | Asia: India: Mcdonald's Is Expanding"
"2006-11-08","1"," AOL Picks Up Financial-Content Firm"," Kate Spade: an Overpriced Accessory?"," How Hedge Funds Are Remaking Hollywood"," Dean Foods Finds Stock Option Errors"," Merck Disputing a $5.5 Billion Tax Bill"," Nortel Networks Announces Reverse Stock Split"," Is Morgan's Mack Too Late to the Hedge Fund Party?"," L.S.E. May Turn the Tables on Nasdaq"," Financial Power Shift in Washington"," Inside the Business of Gossip, Chasing Stars and Cashing In"," Missouri: McCaskill Defeats Talent"," Virginia Dead Even; Tennessee Goes G.O.P.; Missouri, Montana Still Out"," McCaskill Claims Narrow Win in Missouri"," Cézanne Brings the Top Price at Auction"," The Impetus for Changes: Voters Display Frustrations and Dissatisfactions"," Russia: Rights Group Can Work Again"," China: Sparring Over European Trade Issues"," Actress Was Killed in Hanging Meant as Cover-Up, Officials Say"," A Report by the World’s Largest Auditors Urges Relaxed Standards for Liability"," Disney Will Open a Video Game Studio"," Nortel Networks Announces Reverse Stock Split"," Vivendi Says Sales Missed Estimates in Quarter"," Heard the One About Mississippi? It’s Fighting Back"," Israel Declares End to Gaza Mission, but Firing Continues"," A Missed Chance in Iraq (1 Letter)"," High-End Director at Low-End Swap Meet"," Traveling on Business, Learning Gibberish"," Bombing Germany Into Submission, and the Toll It Took"," World Briefing | Europe: Russia: Rights Group Can Work Again"," Paid Notice: Deaths   FLEMING, MARY ELIZABETH (BETTY)"," World Business Briefing | Europe: Russia: BP Licenses to Two Fields Are Challenged"," TODAY IN BUSINESS"," A Missed Chance in Iraq"," Paid Notice: Deaths  BARBET, D'ASSIGNIES, DENYSE"
"2006-11-09","0"," Hedge Fund Managers May Know It Is Getting Late"," Virginia Opens Door for Democrats"," The Case of the Missing Analysts"," Borders' Stock Surges as Investor Reveals Stake"," Keefe Bruyette Prices I.P.O., Raises $143 Million"," Temasek Offloads Remaining Hopson Stake"," Sinopec Investors Not Happy with Stock Increase"," More Stock-Option Backdating Woes at UnitedHealth"," S.E.C. Sues Hedge Fund Manager"," Hochschild Shines in 1 Billion Pound Opening"," J.P. Morgan, Morgan Stanley Near Resolution on Derivatives Trading"," Australian Government Opens Up Telstra Share Sale"," Intel Gets Green Light to Invest up to $1 Billion in Vietnam"," L.S.E. Shares Fly on Word of Another Nasdaq Bid"," Microsoft Strikes Deal for Music"," 3M in Three-Way Deal to Sell Drug Business"," Fortress Opens the Gates to Landmark Hedge-Fund I.P.O."," U.S. Trade Deficit Narrows as Energy Prices Drop"," Business or Personal? Sheffield Says It&#8217;s Both"," Thorny Issue Faces Spitzer in Day-After Pleasantries"," Johnson & Johnson Drug Inquiry"," Microsoft Strikes Deal for Music"," Iowa State’s Mccarney Resigns"," Hedge Fund Is Planning Public Offering"," F.B.I. Opens Office"," Owner and Dog Undone Over a Fence Unseen"," More Premium-Service Sales Help Narrow Cablevision Loss"," Michigan Rejects Affirmative Action, and Backers Sue"," S.E.C. Accuses Hedge Fund Manager of Deceiving Investors"," Lieberman, Seniority Sure, Has No Plans to Join G.O.P."," Premier Says Preparations for Elections in Ivory Coast Are Back On"," Accountants Say Mrs. Astor’s Son Misstated Gains on Painting Sale"," S.E.C. Is Seeking to Help Small Companies on Audits"," McCain Quits Post at College for the Deaf"," Beijing Sets a ‘One Dog’ Policy to Combat Rabies"," Turks’ Bid to Join Europe Stalls on Cyprus and Rights, Official Warns"," In Late 19th-Century Paris, the Names That Are Emboldened"," Trying Out the Zune: IPod It’s Not"," TODAY IN BUSINESS"," Lieberman, Seniority Sure, Has No Plans to Join G.O.P."," World Briefing | Australia: F.B.I. Opens Office"," Paid Notice: Deaths   MCCABE, TIMOTHY JOHN, SR."
"2006-11-10","1"," Charlie Rangel Picks on Mississippi"," N.Y.S.E. Open to Borsa Italiana Talks, Thain Says"," Former Enron Executive Seeks $250 Million for Energy Hedge Fund"," Cox: Hedge Funds, Regulators under the Microscope"," Fortis Acquires Stake in Hedge Fund Manager Cadogan"," Q & A: Passenger Rights Under E.U. Rules When a Flight Is Delayed"," New Zealand Accuses Visa, MasterCard of Price Fixing"," Nissan Looks to Pick Up Orphaned U.S. Plants"," Bergstein Eyes Canada's Motion Picture Distribution"," Sarbanes-Oxley Opens Up V.C. Niche"," Recent Openings"," A Dog, and the Rhythms of Everyday Life on the Steppes"," France: New Long-Range Missile Fired"," Boeing Is Awarded Air Force Contract"," Brands Produce Their Own Shows"," New Jersey Unveils a Proposal for Easing Property Taxes"," With Power Set to Be Split, Wiretaps Re-emerge as Issue"," Choice for Intelligence Panel Poses Early Test for Pelosi"," Newark: Mixed Utility Prices"," American Strike in January Missed Al Qaeda&#8217;s No. 2 by a Few Hours"," Aeroflot Misses Deadline to Buy Boeing Jets"," Figure Skater Is New Envoy of Good Will Overseas"," 3M to Sell Drug Business for $2 Billion in 3 Deals"," ‘Underdog’ Yankees of 1996 Gather to Share Stories "," Ellen Willis, 64, Journalist and Feminist, Dies"," Call It a Concert, but Keep Your Eyes Wide Open"," ‘Borat’ Is Not Approved for Distribution in Russia"," Paid Notice: Memorials   REMINE, SHIELDS"," Art in Review; Art20 -- The International Art Fair 1900 to Contemporary"," Paid Notice: Deaths   MCCABE, TIMOTHY JOHN, SR."," What Do You Get if You Write a Play a Day? A Lot of Premieres"," TODAY IN BUSINESS"," Film in Review; The Cave of the Yellow Dog"," World Briefing | Europe: France: New Long-Range Missile Fired"
"2006-11-11","0"," Commissioner's Report: Bye, Bye, Bye"," New Look Suits St. John&#8217;s in Opening Win"," Walsh Says He Has Leukemia"," Hedge Funds Could Face New Limits"," Absentee Ballot Carries Big Price"," Two Businesses in a Briny Battle Over Guss’s, the Pride of the Picklers"," PlayStation 3 on Rescue Mission"," McCain Plans a Committee to Study ’08"," Star Scorer’s Composure Is a Product of Pedigree"," Giants&#8217; Injuries Create Job Openings"," Southwest Stockpiles Talent and Lays Claim as the Best"," Under Heavy Police Guard, Gay Rights Advocates Rally in Jerusalem"," Mississippians Rise Up Over Rangel’s Comment"," A Plan to Rein in Dogs Troubles Owners"," Are High Credit Ratings Just a Thing of the Past?"," The Paradoxes of Businesses as Do-Gooders"," A Royal Emirati Whose Career Fuels Young Women’s Dreams"," McCain Plans A Committee To Study '08"
"2006-11-12","0"," Brazil Reaches Semifinals"," U.N. Meets With Junta and Dissident"," U.S. Offers Reward for Help in Finding Missing Soldier"," A Chase Where Winning Means Next to Nothing"," Voice of Depression: Styron’s Struggle and Hope (1 Letter)"," Keeping Your Enemies Close"," Endorsements by Third Parties; Barrier Bike Lanes Are Dangerous; On Top of the World in Riverside Park; Smiles Above, Grimaces Below; Downtown, Still Bohemian (5 Letters)"," From a Small Loan, a Jewelry Business Grows"," The Business of Negotiating for More College Aid"," Mary McCann, Timothy Leahy"," Emily Blair, Tyler Hinckley"," Weighing the Benefits of Wind Power; Devoted to Music for a Lifetime; Endorsements by Third Parties; Addressing Grief Through Writing (7 Letters)"," ‘The Great Risk Shift’"," Passenger Rights Under E.U. Rules When a Flight Is Delayed"," Paid Notice: Deaths   BEMIS, JOHN RICHARDSON"," Endorsements By Third Parties"," A Plan to Rein In Dogs Troubles Owners"," Endorsements By Third Parties"," Open-Space Proposals Win Voter Approval"," Paid Notice: Deaths  MCCRYSTAL, DOROTHEA M. (DEE)"," Voice of Depression: Styron's Struggle and Hope"," Animal Shelter Deal Benefits Both Sides"," Downtown, Still Bohemian"," 'The Great Risk Shift'"
"2006-11-13","1"," Pataki: 'I Am a Free Agent'"," G.E. and Hitachi to Merge Nuclear Businesses"," This Week's Issues in Congress"," Illumina to Buy Genetic Analysis Firm for $600 Million"," A Hedge Fund With High Returns and High-Reaching Goals"," Activist Hedge Funds May Not Be Doing Firms Any Favors"," Swiss Banks Cut Ties With Cuba"," CB Richard Ellis to Finance Purchase Through Bank Loans"," Emirates' Dana Gas Buys Canada's Centurion"," Suzuki Swaps Solo for Duo"," In Race for Majority Leader, Pelosi Risks Early Setback"," Robert B. McCurry, Auto Executive, Dies at 83"," G.E. and Hitachi to Merge Nuclear Businesses"," Little Falls: Boater Is Missing"," Administration Opposes Democrats’ Plan for Negotiating Medicare Drug Prices"," Robert Fennell, Broadway Press Agent, Dies at 48"," Emirates Company in Canadian Deal"," Microsoft Counting on a Twist to Make Zune Shine in Shadow of iPod"," Candles, Jeans, Lipsticks: Products With Ulterior Motives"," A Hedge Fund With High Returns and High-Reaching Goals"," The Emotional Path From Puppy to Guide Dog"," Big Givers Turn to Poorly Financed Community Colleges"," Cooling Off the Hot Issues"," How to Stuff a Stocking for a Soldier"," Equity Issues This Week"," TODAY IN BUSINESS"," Big Givers Turn to Poorly Financed Community Colleges"," Robert Fennell, 48, Broadway Press Agent"
"2006-11-14","1"," Memo: Valleywag Gets Down to Business"," Life Is Complicated at South Plaquemines"," Case of the Missing Analysts: Solved?"," An Error of Commission in Iraq"," 'In the Heights' Sets Opening Date"," Apple Poaches I.B.M.'s Top Lawyer"," Hedge Funds and Wall Street Are Warned to Be Vigilant"," Marshall Wace Plans World's Largest Hedge Fund I.P.O."," Cisco Systems Taps into Greenfield Networks"," American Express Close to Anchoring Harbor Deal, Report Says"," Europe Seeks to Impose Airline Emission Controls"," Wholesale Prices Match Biggest Decline on Record"," World Business Briefing: Asia and Europe"," Bush Says He’s Open to Change in Iraq, but ..."," Iraqi Premier and U.S. General Discuss Syria and Iran"," Lawmakers Seek to Continue Iraq Reconstruction Watchdog"," Lowering Medicare Drug Prices"," Backing Murtha Is Risky for Next House Speaker"," Hedge Funds and Wall St. Are Warned to Be Vigilant on Misdeeds"," Loading an Airliner Is Rocket Science"," In Call for More Troops, McCain Places His Bet on Iraq"," Catholic Bishops Take Up Contraception and Gay Issue"," Heart Risk Seen in Older Marathoners"," Robert B. McCurry, 83, Auto Executive, Dies"," Educator Seen as Favorite to Succeed Palestinian Premier"," Microsoft Aims to Improve Its ‘Works Well With Others’ Score"," Apple Hires I.B.M.’s General Counsel"," Fertility: Iron Supplements May Reduce Risk of Infertility"," Spiders, Peppers and a Pathway to Pain"," Fish Oil Linked to Lower Alzheimer’s Risk"," Focusing on the Issue of Aging, and Growing Into the Job"," World Business Briefing | Europe: Italy: Chief Resigns From Benetton"," Paid Notice: Deaths   WEISS, BELLA"," Giants Battle Injury Epidemic  "," World Business Briefing | Asia: India: G.E. Forecasts Strong Growth"," In Call for More Troops, McCain Places His Bet on Iraq"," Educator Seen as Favorite to Succeed Palestinian Premier"," Bush, After Talk With Iraq Panel, Says He's Open to Change, but"," TODAY IN BUSINESS"
"2006-11-15","1"," McCain Inches Forward: 2008 Is Like Today"," P Is for Price, M Is for Mystery"," Reynolds Tamps Down Speculation"," Tracing the Rise of a Legal Maven in Buyouts"," A Dissenting View"," Airline Stocks Soar After Delta Gets Offer"," Financial Analyst Charged With Theft"," Rules for Small Businesses Will Recertify Their Sizes"," Vonage Shareholders Agree to Delay Move to Sell Stock"," Investment Banks Team Up to Take on Europe's Exchanges"," Study Suggests Anemia Drug May Raise Risk of Heart Problems"," Blake Advances to Semifinals in Tennis Masters Cup"," Newark: Openings in Seton Hall Trial Delayed"," Manhattan: Rise Urged for Age Limit in Bars"," Manhattan: No Trace of Missing Goya"," Israel: El Al Cancels Option for Boeing Jets"," Cheney Asks for Dismissal of Case"," Massachusetts: Juror Dismissed"," Pennsylvania: Slot Machine Parlor Opens"," Financial Analyst Charged With Theft"," A New Push to Raise Cap on H-1B Visa"," Prices Fell Sharply in October"," Rules for Small Businesses Will Recertify Their Sizes"," Europe Seeks New Controls on Emissions From Airliners"," Rights Group Cites Backlog of Complaints About Police"," Leading Makers Agree to Put Limits on Junk Food Advertising Directed at Children"," Planes to Use Apple iPods"," Mets Retain Father Figure and Ignore Father Time"," Auto Chiefs and Bush Diverge on Key Issue"," U.S. Official Presses China to Punish Piracy"," Voters Back Limits on Eminent Domain"," Figuring the Tax Benefits of Renting"," Recipe: Honey Apple Pie With Thyme"," Mets Retain Father Figure and Ignore Father Time"," TODAY IN BUSINESS"," Metro Briefing | New York: Manhattan: No Trace Of Missing Goya"
"2006-11-16","1"," McCain Explores Fallout in Search of '08"," Intel Infight in the House"," Hedge Fund Financing: You Like?"," Blogtalk: Transitional Analysis"," For Hedge Funds, a Dearth of Talent, Not Profits"," Dismissal of KB Home C.E.O. Might Invite Heightened Scrutiny"," EMI Says It May Not Play Nice With YouTube"," Europe Warns Microsoft Over Compliance"," S.E.C. Comes Out Clean in Government Audit"," South Korea Issues Arrest Warrants for Lone Star Executives"," Pfizer Buys Biotech Embrex"," Murdoch and Malone Near Deal for Asset Swap"," Recent Openings"," Mets Add Outfielder at the Right Price"," Consumer Prices Fall for Second Straight Month"," Prices Soar and Records Fall at Sale of Postwar Paintings"," Lawmakers Introduce 98 Proposals to Cut New Jersey Property Taxes"," General Warns of Risks in Iraq if G.I.'s Are Cut"," Nike Pops Up in SoHo, Sells $250 Sneakers, and Leaves"," Heart Risk Seen in Drug for Anemia"," Step 1 in Starting a Small Business: Hire a Lawyer"," Microsoft Will Join in Free Wi-Fi Effort"," Quality Issues Force a Delay for a New Ford"," Merck Is Winner in a Vioxx Lawsuit"," Europe Warns Microsoft Over Compliance"," A Digital S.L.R. That Gives Hints on What an F-Stop Means"," Behold: McCartney as Classical Composer"," Milton Friedman, Free Markets Theorist, Dies at 94"," Another Magnolia Blossom at Risk"," The New Urban Frontier: A Brooklyn Store Opens an Outpost in Manhattan"," TODAY IN BUSINESS"
