"Date","Direction","Headline"
"2006-05-01","0"," Murder in the Kissel Family"," Comverse Executives Step Down Amid Stock Options Inquiry"," Boeing to Acquire Aircraft Maintenance Company Aviall"," Broker Pleads Guilty in Milberg Weiss Case"," Davidson Carves Niche in Investment Banking"," Harry's, Symbol of the Age of Gecko, Serves Again"," Barclays Capital Develops U.S. Leveraged Finance Business"," Alcatel and Lucent Say Technology Not at Risk"," Bolivia Nationalizes Natural Gas Industry "," Western Europe Opens Doors to East"," New Microsoft Browser Raises Google's Hackles"," Serbia Misses a Deadline Set for a Fugitive"," Sports Briefing: Agent Says McNair Trade Is Near"," Alcatel and Lucent Say Technology Not at Risk"," A Deal of Missed Bidding and Missed Opportunities"," Changing Conditions Mean Creation and Re-Creation"," Audra McDonald's Degree of Difficulty: Challenging to Scary"," Debate on Global Warming Helps Produce a Brisk Seller"," Gas Prices: Do Something Real (8 Letters)"," Changing Young Lives With the ABC's of Business"," Sheffield May Miss Games Against Red Sox"," Gas Prices: Do Something Real"," Plan to Race Stock Cars Frays Tempers At S.I. Meeting"," Changing Conditions Mean Creation and Re-Creation"," Gas Prices: Do Something Real"," Debate on Global Warming Helps Produce a Brisk Seller"," New Microsoft Browser Raises Google's Hackles"," BUSINESS DIGEST"," Gas Prices: Do Something Real"," Gas Prices: Do Something Real"," Stock Offerings This Week"," Sheffield May Miss Games Against Red Sox"," Op-Art; OPEN"," Gas Prices: Do Something Real"," Changing Young Lives With the ABC's of Business"," Gas Prices: Do Something Real"," Gas Prices: Do Something Real"," Bridge; A Deal of Missed Bidding And Missed Opportunities"," Gas Prices: Do Something Real"
"2006-05-02","1"," EMI Close to Bid for Warner Music, CNBC's Faber Reports"," CA's Proxy Feud: a New Opening for Activists?"," DreamWorks Animation May Sell Shares Soon, Analyst Says"," Sago Mine Hearing Opens"," Bank of America Swaps Assets for Stake in Brazil's Itau"," Unilever Sells Two Hair-Care Brands in U.S."," The Real Deal Disses the Rice"," Prosecutor Zeroes In on Ex-Enron Chief's Finances"," Credit Suisse First-Quarter Profits Jump"," Breakthrough for Prosecutors in Milberg Weiss Case"," Microsoft and Google Set to Wage Arms Race"," Fuel Prices Weigh on Sysco’s Profit"," Congress Set to Drop Fuel PriceRebate Plan"," As Gas Prices Rise, Detroit Sales Decline"," Sago Mine Hearing Opens With Questions"," Italian Premier Quits After Defying Vote"," Russians Pause to Consider Meaning of May Holidays"," Intel to Offer Its Own Plan for Global Internet Access"," Republicans Drop a Tax Plan After Businesses Protest"," Phantom Constituents Behind Bars"," Prosecutor Zeroes In on Ex-Enron Chief's Finances"," Microsoft and Google Set to Wage Arms Race"," Conservation Group Finds Polar Bears and Hippos at Risk"," Finances of Social Security and Medicare Deteriorate"," Times Promotes Advertising Executive"," Boeing Will Buy Parts Maker"," Turmoil in Asia Doesn't Dent Investors' Enthusiasm for Its Markets"," Germans, Already Mad, Try to Get Even Over Gas Prices"," Judge Bars Subsidy Cuts in Adopting Foster Children"," Opening on Broadway Soon, a New Look for TKTS and Father Duffy Square"," Nostalgic 'Drowsy Chaperone' Opens on Broadway"," Their Rights, Exercised Civilly"," Adoption and Depression"," Paid Notice: Deaths  ZABRISKIE, HORTENSE"," TODAY IN BUSINESS"," Adoption and Depression"," One Draft Guru Outshines ESPN"
"2006-05-03","0"," For EMI and Warner Music, Many Expect a Deal This Time"," MasterCard Sets Price Range for I.P.O."," Nasdaq Raises Stake in London Exchange"," Microsoft Settles California Antitrust Suit"," UnitedHealth Executive Apologizes Over Stock Options"," Apple Wins the Day in iTunes Pricing"," Overstock Raises Much-Needed Cash in Share Sale"," Euronext Dumps L.S.E. Bid After Nasdaq Takes Stake"," Warner Music Rejects EMI's $4.2 Billion Takeover Bid"," A Driver Vanishes With Pricey Artwork"," EMI Holds New Talks for Rival"," An Unqualified Judicial Nominee"," Suozzi Unveils Plan to Cut Property Tax and Aid Schools"," Daly Is an Open Book in Discussing His Gambling Habit"," Draft Report Outlines Plans for Pandemic"," Profit Declines 73% at Animation Studio"," Apology Issued on Stock Options"," Apple Extends Deal for 99¢ Downloads"," 	  Profit Falls as Sales Rise at Verizon"," Battle of Endorsements in Attorney General's Race"," Differing Treatment of Religious Slurs Raises an Old Issue"," Cambodian Ginger Fry"," For Food Lovers, a Renaissance"," Microsoft Teams Up With Hollywood to Offer Original Web Shows"," All Quiet Since the Hurricane, Preservation Hall Reopens"," Credit Suisse Profit Rose 36% in Quarter"," St. Paul Travelers Raises '06 Forecast"," Metro Briefing | New York: Brooklyn: Food Stamps For Greenmarkets"," Cambodian Ginger Fry"," Draft Report Said to Give Official Plan For Pandemic"," Metro Briefing | New York: Manhattan: F.B.I. Agent Killed In Motorcycle Crash"," World Briefing | Asia: Kyrgyzstan: Threat To Dissolve Parliament"," TODAY IN BUSINESS"," AS GAS PRICES RISE, SALES OF S.U.V.'S DROP"
"2006-05-04","1"," Takeover Speculation Lifts Shares of InterContinental Hotels"," A Different Kind of Internet Stock"," Remembering Louis Rukeyser, Dog Show Judge"," Want to Buy a Hedge Fund? You're Not Alone"," Chiefs of L.S.E. and Nasdaq to Meet, Telegraph Reports"," European Regulators Fine Chemical Companies for Cartel"," Germany to Heighten Scrutiny of Hedge Funds"," Businessman Pleads Guilty to Bribing a Representative"," MB Financial Buys First Oak Brook"," Is Warner Music Taking The Lead In Its Dance With EMI?"," Slide Show: Recent Openings"," Yahoo Stake for Microsoft?"," Truckload of Missing Art Found in Trailer Park"," Productivity Increases in First Quarter"," In Aftermath of Plane Crash, Grief and Speculation Abound"," Nasdaq Raises Its Stake in London Stock Exchange"," Step 1 in Bolivian Takeover: Audit of Foreign Companies"," Warner Music Turns Down Takeover Offer From EMI"," Businessman Pleads Guilty to Bribing a Representative"," Opening Private Equity's Door, at Least a Crack, to Public Investors"," Pardon Unlikely for Civil Rights Advocate"," Scandal Adds to French Premier's Political Ills"," Sizing Up Paper in Microsoft Word"," A Big Voice Inaugurates a Smallish Concert Hall"," A New Size for Denim: Extra Tight"," In Open-Toe Season, a Pedicure Is More Than Clip and Polish"," Controversy and the Commissioner Followed Aaron, Too"," World Business Briefing | Australia: Central Bank Raises Interest Rate"," Metro Briefing | New York: Manhattan: Five Charged In Extortion Conspiracy"," World Business Briefing | Europe: Bleach Makers Are Fined"," TODAY IN BUSINESS"," A Luxury Hotel Opens in Budapest, But Will Poets Return to the Cafe?"," Warner Music Turns Down Takeover Offer From EMI"
"2006-05-05","1"," Microsoft and Google Square Off"," The Bernanke Bombshell: How Bartiromo Moved Markets"," Small Colleges Pile Into Hedge Funds"," Warner Music's Earnings Could Drive EMI Bid Higher"," Mission Improbable: Tom Cruise, Writer"," N.Y.S.E. Shareholders Sell $1.54 Billion in Stock"," U.K. Hedge Fund Trader Parts Ways With GLG"," Reuters and C.M.E. Team Up to Create Exchange"," Imperial Sugar Stock Goes Sour, as Lehman Mulls Stake Sale"," Bally Goes Deutsche for Stapled Finance"," Should Intel Hang Up the Phone?"," Microsoft Makes Massive Run at Ad Market"," Swinging Is Back in 'Kiss Me Again'"," Going to Extremes and Getting Personal in 'Mission: Impossible III'"," Exchange Shareholders Sell $1.54 Billion in Stock"," Tyco Says Copper Prices Will Hold Down Year's Profit"," That Missing Vaccine Capacity"," Asian Finance Ministers Seek Common Currency"," Small-Screen Hollywood Production Creates a Stir"," Britain Takes NATO Command as Afghanistan Mission Grows"," Figure in Brooklyn Waterfront Deal Fights a Troubled Past"," Analysis of Tax Bill Finds More Benefits for the Rich"," Conflicting Loyalties as Republicans Confront High Gas Prices"," Johnson Aims to Bolster Its Sluggish Drug Business"," Microsoft to Put More Money Into MSN"," Aid Group Reports Financial Lapses in Tsunami Relief"," Shares Gain as Oil Prices Decline Further"," Productivity and Wages Showed Gains in Quarter"," Judge Issues Arrest Warrant for Missing Homeless Stalker"," Margin Calls Forced Lay to Sell Stock, Witness Says"," Court Nominee Will Receive a New Hearing"," Science and Race Issues Clash in Cassandra Medley's 'Relativity'"," A Literary Archaeologist Digs for Missing Treasures"," Cheney Rebukes Russia on Rights"," The Meaning of Cozy"," A Cruise for Glue and Scissors"," As Energy Prices Rise, It's All Downhill for Democracy"," Art in Review; 'I Never Meant to Hurt You'"," World Briefing | Europe: Russia Bars Georgian Mineral Water"," TODAY IN BUSINESS"," LIVING HERE | Mountain Cabins; The Meaning of Cozy"
"2006-05-06","0"," Bar Association Rates Nominee to Federal Court 'Not Qualified'"," Sabres and Mighty Ducks Take Openers"," For Capitol Police, a Narrow Mission and Limited Tools"," Financial Plan: Don't Graduate Without One"," A Memorial Amiss"," U.S. Defends Rights Record Before U.N. Panel in Geneva"," Federal Recipe for Gasoline Helped Drive Up the Price"," Big Builder of Luxury Homes Says Business Is Off 29%"," Palestinian Asks Israeli Premier to Begin Talks"," Criminal and Abuse Reviews Begin for Student Exchange Hosts"," Denny's Stock Options (1 Letter)","  In a Crucial Tournament Deal, an Opportunity Just Missed"," Denny's Stock Options"," Paid Notice: Deaths   WEISS, WILLIAM L."," Metro Briefing | New York: Albany: More Endorsements For Republican"," World Briefing | Americas: Canada: Margaret Trudeau Reveals Struggle With Depression"," Palestinian Asks Israeli Premier To Begin Talks"," BUSINESS BRIEFS"
"2006-05-07","0"," Labor Dissidents Planning for Blair's Succession"," Cabinet Moves Fail to Satisfy the Dissidents in Blair's Party"," Border Arrests Rise as U.S. Debates Immigration Issue"," The Intelligence Business"," Gypsies Gain a Legal Tool in Rights Fight"," Boeing Bets the House on Its 787 Dreamliner"," Melissa Gerling and Robert Burch"," Preventing Eminent Disasters"," Wooden Dogs May Fake the Geese Out"," Michael Giacchino's Mission: Make the Old Music New"," The Mystery of the Stock Price and the Strike Price"," Why Prices at the Pump May Have Little Bite"," A Good Summer Expected In the R.V. Rental Business"," Tokyo Bars With Standing Room Only"," The Sick Seatmate: What's Your Risk?"," Foreign Exchange"," Five 'Don't Miss' Exhibitions This Summer"," If Train Riders' Heads Rest Easier, Here's Why"," The Remix; Spotted | It Happened Near Monterrey"," Surcharge Included In Price of Ferry Ticket"," Paid Notice: Deaths   TIFFANY, ROBERT MCCLELLAN"," The Remix; Food Ways | Eat Where You Live"," The Remix; Try This at Home"," The Remix; It's All About"," The Remix; Stick a Fork in It"," The Remix; Shell Shacks"," QUICK BITES/South Hackensack; Subs With the Minimum Oven-to-Mouth Time"," The Sick Seatmate: What's Your Risk?"," LIPA Asks State Agency To Review Surcharges"," The Remix; Turning Tables | Hangar-7"," The Remix; Breakfast And Bed"
"2006-05-08","1"," Vonage Opens I.P.O. to Customers"," Seeing Hedge Funds Everywhere"," Scenes From the Bamboozle"," The Mystery of the Stock Price and the Strike Price"," London Hedge Funds Top U.S. Counterparts in Fund-Raising Dinner"," Stock Case Puts Icahn Back in the Spotlight"," Court Favors Apple Computer in Logo Suit Against The Beatles"," Businesses Call For Justice Department To Restrain Prosecutors"," British Equity Group to Buy Publisher of Used Car Price Guides"," Northstar Debuts Above Target Price"," London Stockbroker Heads to Market"," N.Y.S.E. Expected to Open Talks With Euronext, Report Says"," Blair Again Dismisses Calls for an Early Departure"," Puerto Rico's Fiscal Woes Lead to Protests and Fears of Worsening Financial Fallout"," Conspiracy and Reality (1 Letter)"," America's 'Near Poor' Are Increasingly at Economic Risk, Experts Say"," Cheney Lauds 3 Premiers for Efforts to Join NATO"," In Newark, Booker Mayoral Campaign Takes on Air of Coronation"," New 'Mission' Opens Weaker Than Expected"," Stock Offerings This Week"," Apple Wins Trademark Case With Beatles"," With 4th and 5th Starters Missing, It's a Numbers Game"," CRITICS' CHOICE: NEW CD's; Lamenting The Losses Of a Girl And a Dog"," Sports of The Times; With 4th and 5th Starters Missing, It's a Numbers Game"," Stock Offerings This Week"," Conspiracy and Reality"," TODAY IN BUSINESS"
"2006-05-09","1"," Kisses from Booker and the Dulcet Tones of Rice"," Hedge Funds With Ticker Symbols"," Conspiracy Theories: Body Armor for the Bush Administration"," Merrill Hires Middle East Markets Specialist"," New PlayStation's Price Point"," Merck to Acquire Biotechnology Company for $400 Million"," Apple's Top Legal Eagle Flies the Nest"," Investment Bank Avondale Opens Atlanta Office"," UBS Private Banker Jumps to Credit Suisse"," Lehman Shores Up Asian Finance Team"," Thomas Weisel First-Quarter Profits Up on Investment Banking"," Verizon Takes Stake in Online Gamer"," U.S. Hedge Fund Takes Stake in Indian Auction House"," Big Gap in Verizon's Bid for Wireless Stake, Report Says"," Investors Question Price Tag for BlackRock"," Hedge Funds as Organized Crime?"," Price of Gold Surges to New Height"," Apple Versus Apple"," Game Maker to Put Product on Big Screen"," British Judge Allows Apple to Keep Logo on iTunes"," Bar Panel Downgrades Bush Nominee for Judiciary"," Special-Effects Pioneer Files for Bankruptcy"," Ex-Aide With Abramoff Ties Pleads Guilty to Conspiracy"," Hawaii: Gasoline Price Caps End"," Sports Briefing: Golf, Tennis, Cycling, Hockey and Sports Business"," Deal by Lab Equipment Makers Priced at $10.6 Billion in Stock"," The Bamboozle Draws Them by the Thousands for an Emo Jamboree"," The High Price Tag on the 9/11 Memorial (4 Letters)"," Bostridge and Andsnes Pan Through the Bits and Pieces That Schubert Left Behind"," Sorting Out Pills to Reduce Breast Cancer Risk"," At Risk: High-Traffic Areas Tied to Children's Asthma Risk"," Killings in Iraq Spawn Search for Missing Funds"," Paid Notice: Deaths   STOCK, GEORGE EDWARD"," TODAY IN BUSINESS"," The High Price Tag On the 9/11 Memorial"," The High Price Tag On the 9/11 Memorial"," The High Price Tag On the 9/11 Memorial"," The High Price Tag On the 9/11 Memorial"," World Business Briefing | Americas: Canada: Shell Canada Bids for Calgary Oil Producer"
"2006-05-10","1"," From Corzine to Booker: A Transition Guru Speaks"," What's Worse Than One Angry Hedge Fund?"," Energy Issues Complicate an Already Messy World"," Nasdaq's London Creep Continues"," N.Y.S.E. and Nasdaq Gobble Each Other's Market Share"," After Doing Its Homework, a College Puts Its Money Into Hedge Funds"," Overstock 'Celebrates' S.E.C. Subpoena"," Credit Suisse Forks Over $90 Million in Enron Settlement"," Leap Readies Stock Sale"," Bank of China Aims for $9.8 Billion IPO"," Merck Buys Two Research Companies for $500 million"," Vodafone Shareholder Agrees Verizon Lowballed Bid"," Saudis Plan Middle East Financial Center"," Can Microsoft Fight Threats With Deals?"," Bush Says Iranian's Letter Misses the Point"," Merck Buys Two Research Companies for $500 million"," On a Fault Line, a Divide Opens Between a Newspaper Editor and His Predecessor"," Protesters Object to McCain as New School Commencement Speaker"," Strong Earnings Boost Fluor Corporation Stock"," Microsoft and Google Grapple for Supremacy"," India and China Drive Up Emissions Rates"," New U.N. Rights Group Includes Six Nations With Poor Records"," Britain: Animal Rights Activists Threaten Investors"," Lawrence Lader, Champion of Abortion Rights, Is Dead at 86"," After Doing Its Homework, a College Puts Its Money Into Hedge Funds"," Saudis Plan Middle East Financial Center"," Missouri: 12 Boys Accused of Assault"," Underdog Candidate Hopes His Passion Catches On"," Laborites: Their Own Worst Enemies"," Third Party Rights (1 Letter)"," Cedar Lake Contemporary Ballet Offers One Tool to Convey Many Meanings"," Third Party Rights"," World Briefing | Asia: India And China Drive Up Emissions Rates"," Metro Briefing | New York: Manhattan: Buildings Department Audit"," POLL GIVES BUSH WORST MARKS YET ON MAJOR ISSUES"," TODAY IN BUSINESS"," World Briefing | Europe: Britain: Animal Rights Activists Threaten Investors"
"2006-05-11","0"," New Arrest in Insider Trading Case"," Lucent Explains: 'Acquired' Sometimes Means 'Merged'"," Walter Fields on the Litmus Test of Civil Rights"," Craig McCaw's Clearwire Aims for Nasdaq Listing"," Slide Show: Recent Openings"," UnitedHealth's Stock Option Troubles Deepen"," Microsoft’s Sinking UMPC Ship"," A Missile Crisis in Slow Motion"," Reports FaultIntelligence forLondon Blasts"," Regulators Open to Ideas for Fine Tuning Sarbanes-Oxley"," Judge Leaves Appeals Court for Boeing"," Hedge Fund Barington Takes a Slice of  Steakhouse"," Overstock.com Drops Plan for Share Sale"," Credit Suisse to Add 900 to Singapore Office, Reports Says"," Verizon Considering Sale of Local Lines"," What Has the Nasdaq Really Bought With the L.S.E. Stake?"," Owens Corning Clears Bankruptcy Roadblock"," Slide Show: Beyond Minimalism"," Stocks Fall on Fears of Inflation"," 	  Owens Corning to Pay Billions in Plan to Exit Bankruptcy"," Detroit Grapples With a New Era: The Not-So-Big 3"," Extradition Set in Hacking"," Gas Prices Unlikely to Drop Soon, Energy Official Says"," From Albany, a Move to Cut Gasoline Taxes"," Observatory Reopens in Fall"," Hepatitis Risk for East Asians in New York"," Bush Says Iran Leader's Letter Fails to Address Nuclear Issue"," Nasdaq Raises Stake in London Exchange"," Cost and Safety Put Memorial's Striking Vision at Risk"," Judicial Nominee Rated Unqualified"," Judge Leaves Appeals Court for Boeing"," Israel Is Open to European Plan for Aid to Palestinians"," Houses and Gardens Open Up, Greeting Spring (and Visitors)"," Does Iran's Letter Open a Door? (3 Letters)"," Sounds of Two Hemispheres From China National Symphony"," A Good Walk, Downloaded and Analyzed"," Judge Leaves Appeals Court For Boeing"," TODAY IN BUSINESS"," Does Iran's Letter Open a Door?"," Israel Is Open to European Plan for Aid to Palestinians"," Does Iran's Letter Open a Door?"," Houses and Gardens Open Up, Greeting Spring (and Visitors)"," Does Iran's Letter Open a Door?"," For Summer, Light Often Means White"
"2006-05-12","0"," Microsoft Pressed to Make Mammoth Buyback"," C.I.A. Nominee Defends N.S.A. Programs"," Second Thoughts on NYSE's Share Sale"," Phone Records Scandal: 'Blawggers' Debate the Legal Issues"," Canadian Regulator Accuses Imax Exec of Insider Trading"," Departure of Apple's General Counsel Remains a Mystery"," The Triumphs, and Obsession, of New Hedge Fund Managers"," Willis Stein Unloads Media Distributor"," Reliance Stock Jumps 70 Percent on Debut"," Fairfax Financial to Overstock's Rescue"," Televisa Said to Line Up Team for Univision Bid"," Possible Verizon Deal for Phone Lines Stirs Up Vodafone Talk"," Pfizer Consumer Auction Dominated by European Suitors"," New Spin on Insider Trading"," Yahoo Chief: No Sale to Microsoft"," Antidotes for $4 Gasoline"," 'Negadon: The Monster From Mars' Headlines a Triple Bill of Anime"," Bringing the Soul Into Minimalism: Eva Hesse"," Energy Prices Affecting Consumers, Reports Show"," New Fears of Security Risks in Electronic Voting Systems"," Antidepressant May Raise Suicide Risk"," Arrest of Grand Juror Is Latest Twist in Insider Trading Case"," Career C.I.A. Figure Is at Eye of Scandal"," No Added Risk Seen From Ending Vioxx Use"," China Stock Market Up 50% in a Year"," The Triumphs, and Obsession, of New Hedge Fund Managers"," TODAY IN BUSINESS"," Paid Notice: Deaths   WEISS, JEAN (NEE CHANKIN)"
"2006-05-13","0"," Midcentury Modern McCobbs"," Buyers Don't Let High Prices Get in the Way"," Gas Prices and Rate Worries Rattle Consumer Confidence"," U.S. Says Microsoft Browser Is No Threat to Competition"," Televisa to Enter Bidding for the Spanish-Language Broadcaster Univision"," Gasoline Pipeline Explodes in Nigeria, Killing About 200"," Fire Marshals Bring in Dog to Sniff for Arson"," Promotions for Times Advertising Executives"," 50 Years of Open-Minded Interviews"," Former Kissel Driver Loses New Job"," Democrats See an Opening to Debate Security Issues"," Two Premieres for Chris Elam and His Misnomer Dance Theater"," Vet Bills and the Priceless Pet: What's a Practical Owner to Do?"," Paid Notice: Deaths   WEISS, JEAN (NEE CHANKIN)"," BUSINESS BRIEFS"
"2006-05-14","0"," Puerto Rico's Governor Approves Bailout, Ending Impasse"," At Falwell's University, McCain Defends Iraq War"," Attention Shoppers: Low Prices on Shots in Clinic"," Nepal's Rebels Seek Talks With Premier"," Grocers Seek Twice-Monthly Food Stamp Distributions"," Once-Tall Figure in the Rugged World of Texas Politics Is Back in the Saddle"," From TV Role in 'Dobie Gillis' to Rights Fight in Legislature"," A Vision of Pale Beauty Carries Risks for Asia's Women"," Intelligence Design"," Foreign Stocks and the Allure of Double-Digit Growth"," In a Resurgent Neighborhood, the Word Is 'Nimby'"," Stocks Slide, Ending Dow's Five-Week Advance"," Intelligent Design and Evolution (4 Letters)"," Wagging the Dog, and a Finger"," Property Taxes and 'Home Rule' (3 Letters)"," Normajean Pratico and Kenneth Swiss"," Supermarkets on Steroids for the One-Stop Shopper"," Anne Douthat and Carl Reiss"," Cedar Lake Company, Financed by Nancy Laurie, Looks for Success in Dance"," Forget the Time, Agent Bauer. What Year Is It?"," Family Business"," Momnipotence"," Who Let the Dogs In?"," Paid Notice: Memorials   WEXLER, MELISSA ANN"," Paid Notice: Deaths   PINCISS, BARRY"," Intelligence Turf: A Guide"," Intelligent Design And Evolution"," Intelligent Design And Evolution"," Intelligent Design And Evolution"," Health Chief Dismissed; Bailout Concerns Cited"," Intelligent Design And Evolution"," ANTIDOTES FOR $4 GASOLINE"," Verizon and Town Agree on Cable TV Pact"," Property Taxes And 'Home Rule'"," Paid Notice: Deaths   WEISS, JEAN (NEE CHANKIN)"
"2006-05-15","1"," Hedge Funds Love Buybacks, But Do They Work?"," John McCain's Apology"," Justice Department Extends Microsoft's Antitrust Oversight"," S.E.C. Opens Investigation into Brooks Automation"," MD Beauty Makes Up to PE Backers with Dividend"," In Emerging Markets, Private Equity and Hedge Funds Find Respite from Each Other"," Companies Eschew U.S. Listings for Foreign Markets"," Saudi Exchange Appoints Regulator"," Coming to Japan's Small Screen: Financial Experts"," Boeing to Pay $615 Million to Settle Investigations"," Hedge Fund Takes Dim View of Exelon's $16.5 Billion Purchase"," EMI May Raise Warner Music Bid"," Televisa to Enter Bidding for the Spanish-Language Broadcaster Univision"," Report Revives Talk of Verizon Wireless Stake Sale"," Life in a Financial Neverland"," Bausch Issues Worldwide Recall of Contact Lens Cleaner"," After Mets' Loss, Missed Opportunities Rankle Randolph"," After Surviving Hurricane and Being Mauled by Dog, Pony Is Still Standing"," René Préval Is Inaugurated as President in Uneasy Haiti"," Blair Weighs Move to Limit Courts' Power in Rights Laws"," France Debates Downloads, With Teenager as Top Expert"," Photo May Shift Old Spat From Academia to Court"," Stock Offerings This Week"," McDonald's Revival (1 Letter)"," Stock Offerings This Week"," For MasterCard, Variation On 'Priceless' Campaign"," Arts, Briefly; Missing 'Ghost' Haunts CBS"," Arts, Briefly; 'Mission' Scuttles 'Poseidon' Challenge"," McDonald's Revival"," TODAY IN BUSINESS"
"2006-05-16","0"," Nasdaq's Credit Takes a Hit Over London Moves"," Furry Mammals, Angry Hedge Funds"," In Lyons, Animal Rights Activist Gets Six Months"," Dissent in Memorial Foundation"," Microsoft Likes Its Acquisitions Fresh"," Caterpillar Buys Railcar Maker in $1 Billion Deal"," Slide Show: Tony Nominees"," Commissioner Is Giving Up Seat at S.E.C."," Milberg Weiss Walks the Razor's Edge as Indictments Loom"," Bear Stearns' Analysis Peeves N.Y.S.E."," In Bid for Univision, a New Consortium Threatens Televisa's Position, Reports Says"," Photographs: Challenging Slopes Have Extreme Risks"," Fed Chairman on Hedge Funds"," Verizon Denies It Gave N.S.A. Local Phone Records"," Deal With U.S. Would Let Boeing Avoid Prosecution"," Wie Advances in Open Qualifier"," Syria: Prominent Dissident Arrested"," New Electrical System Has Tram Working, but Not Yet Open"," Target's First-Quarter Profit Rose 12% but Missed Estimate"," Commissioner Is Giving Up Seat at S.E.C."," Dow Rises After Commodity Prices Fall"," Patent Holder Sues Apple Over iPod Software"," IRA Swaps Could Cost U.S. Billions in Tax Revenue"," Texas School Finance Plan Goes to Governor"," 'Da Vinci Code': The Mystery of the Missing Screenings"," In Surveillance, Risks and Gains (4 Letters)"," Paris's Jewel-like Orangerie, Home to Monet's Waterlilies, Reopens, Polished and Renovated"," On the Runway: Spacewear Meant to Dazzle, Even in Zero Gravity"," Risk: For Men, Low Estrogen Level Puts Hips in Peril"," The Claim: Flying Increases the Risk of a Miscarriage"," The Hot Potato of Business Etiquette"," In Surveillance, Risks and Gains"," TODAY IN BUSINESS"," In Surveillance, Risks and Gains"," In Surveillance, Risks and Gains"," In Surveillance, Risks and Gains"," World Briefing | Middle East: Syria: Prominent Dissident Arrested"
