"Date","Direction","Headline"
"2012-09-01","0"," U.S. Open: Day 6"," Troubled Times for Plaquemines Parish"," Salty Dog"," The U.S. Open Chronicles: A Loss, but It's Cool"," Woodford on Monetary Policy (Sort of Wonkish)"," Jets Trim Roster as Season Opener Nears"," Weapons Plant Security Issues Are Described in U.S. Audit"," Commodities Prices Rise Broadly for a Monthly Gain"," Risky and Getting Riskier"," The Week’s Business News in Pictures"," Catfish Farmers Fight Fish Glut and High Feed Prices"," Overpriced Real Estate? Well, Maybe It’s Art"," Merkel’s China Trip Focuses on Economy, Not Rights"," Chinese Dissident, Jailed on Evidence Provided by Yahoo, Is Freed"," Tokyo Court Hands Win to Samsung Over Apple"," Paid Notice: Deaths  BORISS, FLORENCE E"," On New York's Walkways, a Mission to Set Unused Ideas Free"
"2012-09-02","0"," U.S. Open: Day 7"," Ryan Admits Misstating Marathon Time"," What Would a President Romney Mean for the Arab Spring? For Europe?"," Campaign References to Afghanistan Are Missing In Action"," Sima Gandhi, Richard Gurley"," Emily Harrison, Bryan Subach"," Amy Wolper, Jeffrey Price"," Peter Shelton, Architect Who Made Luxury Minimal, Dies at 67"," Inquiry on Tax Strategy Adds to Scrutiny of Finance Firms"," Don’t Shy Away From Growth Stocks"," Clear Goals Matter More Than Mission"," In Russia, Opening Inquiries and Settling Scores"," Tracking a Subtle Scent, a Dog May Help Save the Whales"," Mrs. Clinton’s Asia Mission"," Syrian Rebels Say They Have Seized an Air Defense Post and Its Missiles"," Looking for Meaning in the Detritus of Hurricane Katrina"," The 8.19.12 Issue"," The Merger of Academia and Art House"," Ever Loyal, Stocking Up for School"," Downsizing the Jumbo Loan"," Prying Open a Cold Case"," Meanwhile, In the City"," Rainy Days at the Open"," Paid Notice: Deaths  MCCARTHY, COLLEEN"," Happy Birthday, Parks. Now Open Your Web Site."," Paid Notice: Memorials  WEISS, DORIS T"," Paid Notice: Memorials  WEISS, DORIS T"," Paid Notice: Deaths  BORISS, FLORENCE E"
"2012-09-03","0"," U.S. Open: Day 8"," Citibank Hid Firm's Financial Troubles, Ex-Partner at Dewey & LeBoeuf Says "," With First-Round Open Juniors Victory, Less Teasing by the Other Kids"," Relief for Severe Asthma, at a High Price "," Ryan Adds Some Loaded Examples to Question of 'Better Off?'"," On Labor Day, Obama Talks Up Auto Bailout in Ohio"," Abortions Linked to Risk of Preterm Birth"," Really? Some Plants Can Filter Airborne Chemicals","  Rivals Jostle Before Apple Announces New iPhone"," E.U. Trade Commissioner Is Getting a Raw Deal"," Bartoli Blitzes Kvitova for Spot in First Open Quarterfinal"," In Mumbai, Open Spaces Are Rare, and Rarely Open "," Success at Open Bodes Well for Britons’ Chances at Wimbledon"," Arctic Paradox"," Rivals Jostle Before Apple Announces New iPhone"," Apple Deems Drone Strike App Inappropriate"
"2012-09-04","0"," U.S. Open Replay: Day 9"," One-Man Mambo"," Digital Style Start-Ups Get Nimble at New York Fashion Week"," With Lax Regulation, a Risky Industry Flourishes Offshore"," What's at Issue in the Private Equity Tax Inquiry"," U.S. Open Food of the Day: Pulled Pork"," Solving the Ocean Methane Paradox "," U.S. Open: Competitive Tennis, Anyone?"," In UBS Convictions, Parallels to the Libor Investigation"," Hackers Claim to Have 12 Million Apple Device Records"," Accounts and People of Note in the Advertising Industry"," Apple Confirms Sept. 12 Event"," Dick Clark Productions Sold to Guggenheim Partners"," U.S. Open Weather Nemesis Returns"," Microsoft Moves Further Into the Cloud"," After a Year, Business Group Members Discuss Their Progress"," Business Day Live: How Plan to Help a City Pay Pensions Backfired"," A Lack of Diversity in Advertising"," Obama's Speech Will Be Outdoors, Unless Safety Is an Issue, Aides Say"," Dick Clark Productions Sold to Guggenheim Partners"," This Week in Small Business: An Elevator on the Moon"," Before Opener for Giants, a Look Back at Their Run "," Nomura Reshuffles Investment Banking Unit"," U Visas Hit a Ceiling"," U.S. Open Is Drawing Record Crowds, but Fans Are Feeling the Squeeze"," Health Issue Leads Fish to Withdraw Before Federer Match"," Federal Trial Set to Open for Ex-Mayor of Detroit"," Moody’s Reduces Its Outlook for Europe’s Credit Rating"," Expectation of Stimulus Lifts European Markets"," Music From Matchbox Twenty, Animal Collective and Jason Lescalleet"," Risks for Travelers (1 Letter)"," Jordan’s King Cancels Fuel Price Rise in Face of Protest"," In Ruined Apartments, a Symbol of Ireland’s Fall"," States Sift for Libor Losses"," Really? The Claim: Some Plants Can Filter Airborne Chemicals."," Two Playwrights Receive Horton Foote Prize"," Citi Hid Dewey's Finances, Ex-Partner at Firm Says"," Vital Signs | Patterns: Abortions Linked to Risk of Preterm Birth"," Relief for Severe Asthma, at a High Price"
"2012-09-05","1"," U.S. Open Replay: Day 10"," For U.S. Open Grounds Crew, an Arsenal to Combat Wet Courts"," Two Amsterdam Museums to Reopen After Major Renovations"," Study Finds Increased Risks for N.F.L. Players"," Four-Bedroom Villa Near a Forest Outside Copenhagen"," Ryan Says Prayer in Schools Is a State Issue"," Excerpt: ‘Animal Practice’"," Highlights and Analysis: Cowboys 24, Giants 17"," For Blue Dog PAC, Cash but Few Candidates"," Apple Denies Giving F.B.I. Device Information"," Regulators Clarify Timing of New Derivatives Rules"," U.S. Open Food of the Day: Fish Tacos"," Are Your Employees Really More Productive Working at Home?"," Newspaper Publisher Journal Register Files for Bankruptcy and Plans for a Sale"," McDonald's Vegetarian Restaurants: Latest in Long, Tough Battle to Woo India"," Business Day Live: Bin Laden Book Release Moved Up"," Surprise! More Rain at the Open"," Pruning Hedge Fund Regulation Without Cultivating Better Rules"," Why the Minimum Wage Doesn't Explain Stagnant Wages","  New Yorker Festival to Include 'Cloud Atlas' Premiere "," At the Democratic Convention, an Emphasis on Social Issues"," Microsoft and Nokia Unveil New Lumia Phones"," Still No New Pynchon Photo, but Here's Emily Dickinson"," Wednesday Reading: When Restaurant Prices Vary by Reservation Time"," Daily Report: Facebook Tries to Lift Stock Price"," 3M and Avery Dennison 'Committed' to Deal Despite Antitrust Issue"," Medicare Part D Premiums Holding Steady"," Banks Face Suits as States Weigh Libor Losses"," Michelle Obama Tops Opening Night for Democrats"," Former Mayor Koch Is Hospitalized for Anemia"," Banks Face Suits as States Weigh Libor Losses"," If This Brooklyn Kingmaker Is Asking, Saying No Is Risky Option"," Ryan Carries Load While Romney Readies for Debates"," Experts Issue a Warning as Food Prices Shoot Up"," Smarck Michel, Former Haitian Premier, Dies at 75"," Connecticut Looks to Airport as a Business Draw"," Weight-Loss Leaders Back Bloomberg Soda Plan"," New Bars Shy Away From Serving It Neat"," Mean Streets? Not With Free Ice Cream"," Europe Opens Inquiry Into Gazprom Trade Practices"," Restaurants Opening in Early September"," British Premier Reshuffles Cabinet, Promoting Official Linked to Murdoch Case"," Gas Prices Rise, but So Do Auto Sales"," Hackers Post ID Numbers for Apple Devices, Claiming They Are From F.B.I."," With Lax Regulation, a Risky Industry Flourishes Offshore"," Paid Notice: Deaths  MCCORMACK, BERNARD"
"2012-09-06","1"," U.S. Open Replay: Day 11"," Foreign Policy Issues and Voters"," Visas-for-Dollars Program a Boon to Hotel Developers"," Mets Get Permission for 9/11 Hats"," Video: Is Women's Tennis Boring? Not at the Open "," Today's Scuttlebot:  iPhone 5 Video and Apple TV Delay"," U.S. Open: Women's Semifinals Preview"," Smorgasburg Spreads to Dumbo"," All of Their Business | Bernadette Corporation at Artists Space"," Excerpt: 'Emily Owens M.D.'"," Bill Clinton Draws More Viewers Than N.F.L. Opener"," Theater Talkback: Finding Inspiration in Improvisation"," U.S. Open Food of the Day: Burrata"," No Federer, No Nadal: The 2004 French Open"," Appeals Court Revives Insider Trading Case Against Obus"," The U.S. Open Chronicles: Summer in the City"," World's First Pizza Museum Opening in Philadelphia"," World Premiere by Craig Lucas Added to Atlantic Theater Company Season"," Business Day Live: Fashion's Seismic Shift"," 'Big Fish' Musical to Open in Chicago"," Are the Big Banks Keeping Their Commitment to Small Businesses?"," Agent Orange Victims Get Scientology Treatment"," Missouri: Bishop Will Face Judge, Not Jury "," Leak Prompts Netanyahu to Cancel Security Cabinet Meeting on Iran Issue"," $1 Pizza Slice Is Back After a Sidewalk Showdown Ends Two Parlors’ Price War"," Open Teams at Second World Mind Sports Games"," Running a Business With Staff Scattered Around the World"," Europe to Investigate Chinese Exports of Solar Panels"," Key Figure in Scandal That Felled Bo Xilai Is Charged"," A Jovial Dylan Celebrates Reopening of Capitol Theater"," Study Finds Risk of Brain Disease for N.F.L. Players"," Journal Register Files for Bankruptcy for a Second Time"," The Business Side"," Paid Notice: Deaths  DAVIDSON, ALEXANDRIA ""ALIX,"" NEE WEISS"," Emily Dickinson: A Second Look"," 'Cloud Atlas' Premiere At New Yorker Festival"
"2012-09-07","1"," Violence, Dissected"," U.S. Open Replay: Day 12"," Black Voter in a Blue Dog District"," U.S. Open Food of the Day: Niman Ranch B.L.T."," Singer Gets His Van Back, but Pays a Price"," Williams and Azarenka Will Play in Open Final"," Jobs Numbers Prompt Obama to Account for Anemic Recovery"," Sorting Out the Collapse of Reforms for Money Market Funds"," Freezing Brisket"," What Citizenship Means "," Two Cuts of Brisket"," Police Seeking Man Who Abused Dog in Elevator"," Business Day Live: Hiring Slows in August, Adding to Pressure on Fed and Obama"," Friday Reading: How to Add Missing Titles to iTunes Tracks"," The Breakfast Meeting: New Amazon Devices, and Apple's Plans for Digital Radio"," Men's Fashion Issue | Stars Aligned at Cannes"," Audiobook Publisher Issues 120-Disc Version of Proust "," Carlyle Buys Power Plants From Goldman Sachs"," Daily Report: Apple Plans a Move Into Streaming Music"," Q&A: Adding Missing Titles to iTunes Tracks"," Visa's Ads to Highlight an 'Epic' N.F.L. Season"," How Not to Pitch Your Business in Social Media"," Gene Sperling on Economic Issues"," Defending Champion (Remember Him?) Reaches Semifinals"," Apple Plans Web Radio Challenge to Pandora"," Plan to End Bankruptcy in Rhode Island City Gains Approval"," Chemical Safety Policy"," In Opposite Dugout, Reminders of Showalter’s Past"," Web Businessman Sentenced for Threats"," With Their Food Scarce From Drought, More Animals Try Dining in Town"," United Arab Emirates: New Charges for American"," Collaborative and Solo, With a Certain Feminist Bent"," Generations United for Improvisation, Refined but Violent"," Putin Says Missile Deal Is More Likely With Obama"," A Theme Change on Opening Night"," Buoyed by European Commitment to Buy Debt, Markets Soar to a Four-Year High"," O.E.C.D. Warns of Recession in Germany"," Arborio and Red Rice Risotto With Baby Broccoli and Red Peppers"," 'Big Fish' Musical To Open in Chicago"," Visas-for-Dollars Program a Boon to Hotel Developers"," A Decade-Old Insider Trading Case Is Revived"," Amsterdam Museums Preparing to Reopen"
"2012-09-08","0"," U.S. Open Replay: Day 13"," Photos of The Moment | Prabal Gurung"," Prabal Gurung: Calm Before the Storm "," Prabal Gurung: Spring 2013 RTW"," Highlights and Analysis: Second Weekend"," Murray Reaches Final; Second Semifinal Is Suspended"," Rodriguez Finds His Old Stroke, Which Yankees Have Been Missing"," A Walmart for Chinatown Stirs a Fight in Los Angeles"," Building Ties by Opening Up"," The Week’s Business News in Pictures"," Natural Gas Claims on Cyprus: Two Views"," Influence of Money Market Funds Ended Overhaul"," As PC Sales Turn Down, Intel Trims Its Outlook"," Family Property Means Managing for a Legacy"," Dozens of Migrants Said to Be Missing From Boat Near Italian Coast"," Ad Run Canceled: Akin's Finances in Question"," Legal News: Lenient Sentence Is Urged For Insider Trading Witness"," Pitchfork Issues Apology Over Rapper Interview"
"2012-09-09","0"," U.S. Open Replay: Day 14"," Lawmakers Push to Increase White House Oversight of Financial Regulators"," Documentary Takes a Business View of Street Drug Trade"," Williams Beats Azarenka for U.S. Open Title"," Teaching the F.A.A. That Dogs Don't Buckle Up"," Backstage Beauty Report | Prabal Gurung"," Emily Kennedy, Joshua Kempf"," Rebecca Wolf, Gennadyi Gurman"," Aleesha Nissen, Stephen Ast"," Yanks Miss a Chance to Distance Themselves"," In School Finance Tangle, Wealth Doesn’t Necessarily Mean More"," Violence, Dissected"," Wider Warning After 3rd Yosemite Hantavirus Death"," His First Rule of Business: Don’t Hope"," Defying Parents, Some Pakistani Women Risk All to Marry Whom They Choose"," The Issues? Yawn."," India and Pakistan Sign Visa Agreement, Easing Travel"," Dispute Over Costs Delays Opening of 9/11 Museum"," Russia and Japan in Agreement on Natural Gas Deal"," Lowercase Minimalists"," The 8.26.12 Issue"," Opening a Door"," ‘Ken Price Sculpture: A Retrospective’"," Business and Pleasure"," Paid Notice: Deaths  DEMIRJIAN, M"," Paid Notice: Deaths  WEISSMAN, JACK L"," Paid Notice: Deaths  DAVIDSON, ALEXANDRIA ""ALIX,"" NEE WEISS"," Paid Notice: Memorials  WEXLER, MELISSA ANN"
"2012-09-10","0"," Plot Twist in the A.I.G. Bailout:  It Actually Worked"," Treasury's A.I.G. Stock Sale Is Priced at $32.50"," HarperCollins Reaches New Agreements With Amazon and Others on E-Book Prices"," The Time I Played for a Championship at the 1977 U.S. Open"," Man Arrested in Abuse of Dog in Elevator"," A Crop Dividend: Restored Bird Habitat in New Jersey "," Highlights and Analysis: Andy Murray Wins U.S. Open"," Accounts and People of Note in the Advertising Industry"," Big Step in Selling A.I.G. Stake, but Other Bailouts Remain"," Business Day Live: Debt Collectors Cashing In on Student Loans"," Apple as the Last Hope for Growth in Business PCs"," Amazon and Apple's Giant Markups on Flash Storage"," India and Pakistan Sign Visa Agreement, Easing Travel"," Q&A: Shutting Down a Missing Kindle"," This Week in Small Business: Best Facebook Pages"," Records Missing on Afghan Army Fuel Costs"," News From the Advertising Industry"," Frayed Man of Action With a Head for Figures"," A Business View of Drug Dealing"," Teaching the F.A.A. Dogs Don't Buckle Up"," Lawmakers Push to Increase White House Oversight of Financial Regulators"
"2012-09-11","1"," Obama Plans Wisconsin Advertising, Signaling the State Is Now in Play"," Abused East Harlem Dog Getting Care at Animal Shelter"," Absence of Asterisks"," For Paton, Bankruptcy for Journal Register Is 'Embarrassing' but Necessary "," Too Much Protection for Derivatives in Bankruptcy"," Business Day Live: In Standoff, Latest Sign of Unions Under Siege"," Daily Report: Chinese Plant Faces New Labor Issue on iPhones"," Warhol Has Your Mac Products Covered"," The Risks of Hosting a Successful Olympics"," Georgia: Suit Dismissed Over Submarine Training"," Munnu Kasliwal, a Favorite Jeweler of Connoisseurs, Dies at 54"," Missteps and Surprises Turn Battle for the Senate Into a Guessing Game"," After Loss in Opener, Giants Seek Redemption"," Nominees Leave Congressional Candidates to Stump Alone"," Cuomo Is Open to ‘Tweaks’ in Ethics Panel"," For Some, Moving On From 9/11 Means Scaling Back"," China Contractor Again Faces Labor Issue on iPhones"," New York Is Lagging as Seas and Risks Rise, Critics Warn"," Professor’s Dismissal Upheld by Colorado Supreme Court"," Greece Wrestles With Cuts to Unlock Bailout Funds"," Company Says It, Not F.B.I., Was Hacking Victim"," Issues Linger as Afghans Take Control of a Prison"," Plot Twist In a Bailout: It Worked"," Teixeira, Sidelined Again, Will Miss Up to Two Weeks"," Missteps and Surprises Turn Battle for the Senate Into a Guessing Game"," Nominees Leave Congressional Candidates to Stump Alone"
"2012-09-12","1"," Clinton Sticks to Domestic Issues While Campaigning for Obama "," In 2013, Mets Open at Home and Host All-Star Game"," Lang College Offers Academic Credit for Taking a Gap Year"," Fuel for Debate: Examining the Natural Gas Fracking Controversy"," Damage to the American Mission in Benghazi, Libya"," Ask Us Your Questions About Apple's Announcements"," Nissan Previews Terra Fuel-Cell Concept Ahead of Paris Motor Show"," British Banker Barred Over Role in Financial Crisis"," Updates From the Apple iPhone 5 Event"," Business Day Live: Robots in All Walks of Life"," The Patent Clues to the Apple iPhone Beyond '5'  "," Dealers Peer Into Chrysler Product Pipeline"," Munnu Kasliwal, a Favorite Jeweler of Connoisseurs, Dies at 54"," Questions Surround Agents Absent From Steroids Report"," France: Former Premier Is Questioned in Fraud Case"," Dissecting Romney’s Vietnam Stance at Stanford"," Aurora’s Aftermath"," Hoping to Lure Riders With Scenic Commutes"," Players in Bounty Case to Meet Commissioner"," Marc Jacobs Gets the Meaning of It All"," Met Museum Considers Opening on Mondays"," Spouse’s Consent Is Required to Change Retirement Account Beneficiary"," Late Arrival to British Open Has Good Excuse"," At Humboldt State, Revved Up for Success"," Health Care Premiums Rise Slightly"," U.S. Missile Defense Strategy Is Flawed, Expert Panel Finds"," Invite Brisket’s More-Tender Brother for the Holidays"," City's Health Boards Have Ruled on Livestock and Tattoos. Up Next: Soda."," Facebook's Chief Concedes Disappointment Over Stock"
"2012-09-13","1"," Microsoft Finds PCs That Ship Pre-Infected"," Why the iPhone 5 on Verizon and Sprint Won't Juggle Calls and Data"," Riding High on 'Hatfield and McCoys,' A&E Gives Dubuc a New Deal"," Met Opera Concerts Set For Le Poisson Rouge"," SFJazz Names Artists to Open Its Permanent Home"," Defending 'Conscience,' Restricting Rights"," 4 Years After Lehman's Demise, Regulators Debate Overhaul"," Britain's National Theater To Open New York Office "," Reaction to Libya Attack Could Color Poll Analysis, and Vice Versa"," A Red Tide Epidemic?"," Business Day Live | Casting Controversy"," Another Murder on the Resource Frontier - This Time a Journalist in Cambodia"," Soros's Wisdom and Markets' Ignorance"," Business Day Live: Food Fight"," Taking the Preferences Out of Preferred Stock"," Answers to Your Questions About Apple's iPhone 5"," At Apple Event, With Secrets Spilled, No Surprises"," Cambodia's Most Unwanted"," Dole in Talks to Sell 2 Businesses to Itochu of Japan"," Missteps Don&#8217;t Become Stumbles"," Labor Fight Poses Risks to Coalition for Obama"," Business Trip as Schiano Returns to New Jersey"," Design Thrills Apple’s Partners, but Will Cost Users"," A Ban on Flavored Tobacco Products"," Fashion Week Street Style Is Often a Billboard for Brands"," Open Season on Politicians at ‘SNL’"," Apple Unveils an iPhone That Is Lighter and More Powerful"," The Charm of the Underdog"," In Victory for Merkel, German Court Ruling Favors European Bailout Fund"," Warhol Foundation Provides Graphics for Product Covers"," Design Thrills Apple's Partners, but Will Cost Users"," Paid Notice: Deaths  WEISSBERG, NORMAN"," Book by Former Banker Promises Peek Inside Goldman Sachs"
"2012-09-14","1"," Battle Renewed Between Sabathia and Price"," Reviewing the Nissan Altima and Honda Accord"," The Price of Politics (Shorter Bai Edition)"," Wrapping Up TimesOpen: Sockets and Streams"," New Animated Series Make Inroads in Ratings"," A Reminder of the Perils of Retirement Planning"," Speaking at Values Voter Summit, Ryan Says Obama Creates 'Straw-Man' Issues","  Hot Dogs and Hamburgers? During Fashion Week? How Déclassé!"," Lamborghini Recalls 1,500 Gallardos for Fire Hazard"," New York Stock Exchange Settles Case Over Early Data Access"," Business Day Live: Bailout's Success Is No Guarantee of Votes"," India Opens Door to Foreign Investment"," A Tax Tactic That's Open to Question"," Q&A: Undoing AutoFormats in Microsoft Word"," The Early Word: In It for the Duration"," Missouri: Documents Turned Over in Priest’s Abuse Case"," Despite Virus, Visitors Trek to Yosemite, if a Bit Warily"," For Slain Contractor, a Life of Risks Overseas"," Though Not Yet Open, a Huge Mine Is Transforming Mongolia’s Landscape"," A Tax Tactic That’s Open to Question"," Diplomats Pulled 2 Ways, Between High Walls and Open Doors"," Board Votes to Regulate Circumcision, Citing Risks"," 15-Year-Old Trails by Two at Women’s British Open"," Prices Surged for Producers in August"," Yogurt Berry Parfait With Steel-Cut Oats"," To Overcome Depression, Go to Kindergarten"," Britain's National Theater Opens New York Office"," Met Opera Concerts Set For Le Poisson Rouge"
"2012-09-15","0"," Highlights and Analysis: Third Saturday of College Football"," Small Business Health Insurance: Costs Still Going Up"," Peter Lougheed, Ex-Premier of Alberta, Dies at 84"," U.S. Trails Spain in Davis Cup"," Walmart Opts Out of New York Mall After Facing Labor Opposition"," The Week’s Business News in Pictures"," New Novel of Harlem Renaissance Is Found"," Slovenia Encounters Debt Trouble and May Need Bailout"," Spain Sweeps United States in Singles for 2-0 Davis Cup Lead"," China Sets Trial Date for Figure in Scandal"," Musical to Open Public Lab Series"," Paid Notice: Deaths  FLEMING, RICHARD ELLIOT"
"2012-09-16","0"," Code Red Explains Its Mission"," Ron Paul on Money Market Funds"," Emily Cleveland, Angus Smith"," Corliss Williams, Amani Olu"," Marissa Capineri, Derrick Shallcross"," Sadler Reminds Texas Who He Was"," Harvard Wins Opener, but Scandal Spoils Mood"," Bryans Keep U.S. in Davis Cup Series"," Sometimes, a Candidate Is Meant to Look Plastic"," European Bank Overhaul Meets Opposition From Finance Ministers"," In Dueling Ads, Candidates Seek to Politicize Issues of China and Manufacturing"," A Wide-Open Field, and the Nascar Chase Is On"," A Comedian and a Cardinal Open Up on Spirituality"," A Concert Finder for the Open-Minded"," The First Issue in Any Massage"," Making It Exclusive: Signing With an Agent"," Rescue Dogs"," The 9.2.12 Issue"," Melissa Leo Is a Fighter"," Life After Bankruptcy"," Education Is The Issue"," Sometimes, A Candidate Is Meant to Look Plastic"," Paid Notice: Deaths  BEEMISH, FRANKLYN R."
"2012-09-17","0"," For Maimed Veterans, Animal Tissue Offers Hope of Repair"," Despite Lack of Surprises, Apple Sells 2 Million New iPhones"," Walkabout &ndash; 9/17: Travelers to the Middle East Ponder Plans, and Students Go Abroad"," Accounts and People of Note in the Advertising Industry"," Business Day Live: Protesting Austerity Measures in Europe"," On Our Radar: Nuclear Plants and Flood Risks"," This Week in Small Business: GoDaddy Goes Dark"," Week 2 Quick Hits: The Cam Newton Combo"," Ferrer Wins as Spain Ousts U.S. in Davis Cup"," Eva Figes, Author and Feminist, Dies at 80"," Human Muscle, Regrown on Animal Scaffolding"," Somalia President Is Inaugurated Four Days After Assassination Attempt"," News From the Advertising Industry"," For Open Winner, It Only Looks Easy"," Human Muscle, Regrown on Animal Scaffolding"," SFJazz Names Artists To Open Its Home"
"2012-09-18","1"," Behind Goldman Sachs's Success Is a Focus on Survival"," Open Agenda | P! in Chinatown "," BrisketTown to Open in Williamsburg"," Uploading Trouble: Teaching About the Video that Roiled the Muslim World "," With Hollywood Hire, Microsoft Bolsters Entertainment Efforts"," Tip Sheet | 8 Things Admissions Officers Wish You Knew About Applying to College"," For a Student Veteran, Graduation Is the Next Mission"," Business Day Live: Ford and Canadian Workers in Tentative Deal"," Providence Equity's Nelson and Netflix's Hastings Join the Giving Pledge"," A Business Owner Expects the Worst From Health Insurance Overhaul"," A Start-Up Figures Out Photoshop Abuses"," Dole Food to Sell 2 Businesses to Itochu for $1.7 Billion"," Financial Strains Said to Threaten Stability of Palestinian Authority"," Drive or Fly? Depends on Your Tolerance for Risk"," Flying With Animals, Smiles All Around"," Long Wait and Worry for a Visitor to Yosemite"," In &#8216;Obesity Paradox,&#8217; Thinner May Mean Sicker"," At Democratic Residence, Wallets Open for G.O.P."," U.S. Accord With Japan Over Missile Defense Draws Criticism in China"
"2012-09-19","1"," A Closer Look at 'Redistribution'"," Stark, Minimalist and Beckett All Over"," Can't Figure Out the Playoff System? Neither Can the Players"," Trulia Prices I.P.O. at $17 a Share, Above Expected Range"," Netflix Picks Up New Ricky Gervais Series 'Derek'"," The 'Redistribution' of Wealth"," The Missing Two Minutes in the Romney Video? Everyone Has a Theory"," Dave Matthews Band's Latest Opens at No. 1"," Samsung Takes More Swipes at Apple in Latest Ad"," Business Day Live: Rising Tower Emerges as a Billionaires' Haven"," Syria's Dark Horses, With Lathes: Makeshift Arms Production in Aleppo Governorate, Part I"," Emancipation's Price"," U.S. Gets Favorable Davis Cup Draw"," Google Updates Android Maps App as Apple Moves On"," American Airlines Notifies Thousands of a Layoff Risk"," The Meaning of the China-Japan Island Dispute"," Opinion Report: Freeloaders"," Guidance Office | Ask Princeton's Dean About College Admissions"," Syria Orders Schools to Open, but Classes Give Way to War"," Samsung-Apple Fight Moves to Marketing"," Olympic Gold Medalist Gardner Files for Bankruptcy"," Oil and FedEx’s Forecast Weigh Down Markets"," As Uncertainty About Bailout Lingers, Spain Sells $6 Billion in Short-Term Debt"," A Southern Spot on a Mission"," Pear-Apple Butter With Cardamom"
