"Date","Direction","Headline"
"2006-09-01","1"," 'Mean-Spirited, Personal...'"," Hedge Fund Hegemony: London Versus New York"," Debating Open-Source Software at the U.N."," Apple and Sun? No, Not, Never, Bloggers Say"," PayPal Founder's Hedge Fund Fires Back"," Hedge Fund May Boost McDonald's Stake"," Photo Studio for Wal-Mart Lands in Bankruptcy"," HBOS Group Sells McCarthy & Stone Stake to Rival Bidder Tchenguiz"," D.O.J. Files Extension of Microsoft Settlement"," Plan at Intel May Include Many Layoffs"," Ciena Goes In for Stock Split"," U.S. Reports Successful Test of Missile Interceptor"," Russia Gets Tougher on Illegal Downloading"," Rehearsals End as Giants Look to Opening Night"," California: Emissions Bill Is Passed"," In Latest Push, Bush Cites Risk in Quitting Iraq"," Cambodia: Push to Criminalize Adultery"," Triumphant Serena Williams Savors Her Role as an Underdog"," Plan at Intel May Include Many Layoffs"," Manhattan: Tram to Reopen Today"," Unadilla: Flood-Damaged Highway Reopens"," Cute and Furry, Some Say. A Beaten Dog, a Court Finds."," Mel A. Sachs, 60, Trial Lawyer With a Flamboyant Streak, Dies"," Elite Riders Come to Defense of Their Sport"," New York Health Officials Issue Guide to 9/11 Illnesses"," AIDS Money Suddenly at Risk"," Village Voice Dismisses 8, Including Senior Arts Editors"," The Business of Movies (1 Letter)"," The Business of Movies"," TODAY IN BUSINESS"
"2006-09-02","0"," Commissioner's Report"," Bud's Best Open Moments, and the Billie"," Cambodia: Adultery Law Passed"," MySpace Will Open Digital Music Store"," Guidelines for Selecting Seminarians"," Missile Defense System Intercepts Rocket in Test"," A Swoon in Autumn, With Asterisks"," Rush Testing Is Under Way for Microsoft’s New System"," Zabriskie Wins Time Trial, With Help"," 2 U.S. Reports Seek to Counter Conspiracy Theories About 9/11"," Clarification Issued on Stem Cell Work"," Japan&#8217;s Likely Next Premier in Hawkish Stand"," McDonald’s Says Investor Plans to Buy Stake for Hedge Funds"," Professor-Turned-Pope Leads a Seminar on Evolution"," 10 Brands to Freshen, Plus Linens"," Some Things Old, but a Whole Lot of Premieres"," National Briefing | Religion: Guidelines For Selecting Seminarians"," TODAY IN BUSINESS"
"2006-09-03","0"," Iraq Reports Capture of Senior Al Qaeda Figure"," Wild-Card Race in N.L. Remains Wide Open"," Top Riders Get Little Team Support"," Annan Arrives in Iran for Talks on Nuclear Issue and Lebanon"," Tech and Retail Stocks Lead a Late-Week Rally"," Productivity and the Paycheck (6 Letters)"," When Hailing a Cab Means Waving a Bonus"," Want to Be in Show Business? Here’s a Start"," The S.E.C. and Insider Trading (1 Lettera"," Is a Recession Ahead? A Bond Buyer’s Debate"," Why the Tide Hasn’t Turned Toward Growth Stocks"," New Breed of Lawyer Gives Every Dog His Day in Court"," A Taxing Issue"," Bliss Woolmington, Patrick Bernal"," Listening to Beck, My Chemical Romance, the Pack and ‘Radiodread’"," Dangerous Bliss"," A Series of Opening Doors"," Race Wasn’t an Issue to Him, Which Was an Issue to Me"," Paid Notice: Memorials   WEISS, DORIS TROTZKY"," This Is No Street Corner Hot Dog"," Some Things Old, but a Whole Lot of Premieres"," Productivity and the Paycheck"," The S.E.C. And Insider Trading"," THE (PRAIRIE) DOG HOUSE"
"2006-09-04","0"," Dana's View: Don't Buy Our Stock. It Costs Too Much."," University Enjoys a Renaissance After 90’s Strife"," One Last Kiss From Agassi, and It’s Over"," French Interior Minister Is Gathering Support in Race for Premier"," Gyorgy Faludy, 95, Hungarian Poet and Figure in Resistance, Dies"," Stock Offerings This Week"," TODAY IN BUSINESS"
"2006-09-05","1"," Ford C.E.O. Cedes Post to Boeing Executive"," AP's Analysis. Discuss."," Premier Foods Considers a $3.2 Billion Bid for United Biscuits"," Contemplating a Microsoft-Yahoo Merger"," Slide Show: The New Bohemians"," Don't Risk It"," U.S. Opposes Dana's Bankruptcy Bonus Plan"," Jets Rookie Opens Doors With Hard Play"," 76ers May Fetch Record Price"," U.K. Hedge Funds in Merger Talks"," Nasdaq Mulls Hostile Bid for London Exchange, Report Says"," As Schools Open, New Powers for Some Principals"," Putin Makes Business Deals With an Old Ally in South Africa"," Africa’s Business Reform Praised by World Bank"," Many 9/11 Workers Have Lung Issues, Report Says"," Viacom C.E.O. Ousted as Stock Price Falls"," McClellan Resigns as Medicare Chief"," Political Season Opens With Focus on Security"," Seminoles Survive Clash of Stingy Defenses"," Tropical Depression Strengthens in Atlantic"," Colombia: Rebels Seek Hostage Swap"," Drug Piracy: A Wave of Counterfeit Medicines Washes Over Russia"," An Afghan Symbol for Change, Then Failure"," U.S. Opposes Bankruptcy Bonus Plan"," World Business Briefing"," Oil and Gasoline Futures Fall as the Summer Season Ends"," Barlow Figures a Way to Learn from Martin"," Europe, Asia and Latin Markets Reach 3-Month Highs"," Within Its Walls, Club Med Opens a First-Class Preserve"," A Lone Man&#8217;s Stunt Raises Broader Issues"," Judge Sets Aside Airbus Request to Disqualify Boeing Lawyers"," Cardiologists Question the Risks in Using Drug-Coated Stents"," One Route Seems Closed, So Lawyers Try Different Lawsuit in Stock-Option Scandal"," Exercise: Brisk Walk Can Counter Effect of Fatty Meals"," On These Mean Streets, Going a Little Travis Bickle"," Risks of Smallpox Vaccine Vary by Virus Used as Base"," Dogs May Laugh, but Only Cats Get the Joke"," Cause and Effect: Dogs on Notice in Asthmatic Households"," Prevention: Daily Aspirin Use May Decrease Prostate Risks"," A Daily Aspirin May Decrease Prostate Risks"," Risks of Smallpox Vaccine Vary by Virus Used as Base"," TODAY IN BUSINESS"," Paid Notice: Deaths   WEISSMAN, ESTHER"," Giants Hope That New Will Mean Improved"
"2006-09-06","0"," Sara Lee Sheds Its Underwear Business"," Openness Runs in This Family"," Is Intel a Warning Sign?"," Goldman Sachs Director Selected as Treasury Undersecretary"," Mauresmo Rolls Into Semis"," Stock Fraudster Pays the Ultimate Price: a SoHo Loft"," Report Estimates the Costs of a Stock Options Scandal"," Former Icahn Lawyer to Open Fund With Asian Approach"," An Offer to Buy MacDermid, a Chemicals Maker"," The Risk-Free Pleasures of $10 Bottles"," Davis Cup Rivals Are Making Deep Runs Through the Draw"," Inquiry Arranged by Merck Finds No Misconduct in Its Handling of Vioxx"," U.S. Air Force Officer Missing in Kyrgyzstan"," Franchitti to Miss I.R.L. Finale"," As Rival Quits Race, Cuomo Business Link Is Topic of Questions"," Report Estimates the Costs of a Stock Options Scandal"," Brooklyn: McCall Endorses Clarke"," Mortgages Grow Riskier, and Investors Are Attracted"," In Africa, a More Business-Friendly Approach"," Intel to Cut Work Force by 10,500"," Bush Chooses Transportation Nominee"," Home Prices Fall in Nearly One-Fourth of Metropolitan Regions"," Tribute Center, an ‘Interim Destination’ Sept. 11 Memorial, Is Readied for Opening"," News of Chevron’s Oil Reserve Lifts Shares"," The Behavior of Dogs (and Homo Sapiens) (4 Letters)"," A Look Back: Last Year’s Hits and Misses"," Opening This September: Tropical, Turkish and Texan"," TODAY IN BUSINESS"," The Behavior of Dogs (and Homo Sapiens)"," Davis Cup Rivals Are Making Deep Runs Through the Draw"," Paid Notice: Deaths   MCCAULEY, JOHN"," At the Open, Enough Already  "," The First Day of School Means No Mom  "
"2006-09-07","0"," Navratilova Still In the Open"," Euphemisms and Crimes at Hewlett-Packard"," Monza's reminder of the past"," Big Hedge Funds, Getting Bigger"," For Merrill Analysts, Euronext Question Weighs on NYSE"," Out of Boeing's Cabin and Behind the Wheel at Ford"," Delphi Stockholders Lay $26 Billion of Blame at G.M.'s Door"," Bankruptcy Judge Clears Bid Procedures for Tower Records Auction"," Intel and Motorola Pour More Money into Clearwire"," InterNap to Return to Nasdaq"," Nasdaq Is Planning to Start an Options Exchange in 2007"," Washington: Parks Nominee Named"," Brooklyn: Man Sentenced in iPod Killing"," A Board in Need of an Emily Post"," Davenport Exits Open, Perhaps for Final Time"," Jawn Sandifer, Civil Rights Lawyer, Dies at 92"," Opening Up the Club"," Nasdaq Is Planning to Start an Options Exchange in 2007"," U.S. Air Force Major Missing in Kyrgyzstan"," Merck Inquiry Backs Conduct Over Vioxx"," Apple Updates iMac Desktop Computers"," Equal-Opportunity Offender Plays Anti-Semitism for Laughs"," The Cradle Didn’t Come With an iPod Dock? Here’s a Solution"," Couric’s Opening Night Lifts Ratings for CBS"," Nail Polish Makers Yield on Disputed Chemical"," The Bag That Aced the U.S. Open"," Time to Take Stock After a Season in the Sun"," TENNIS: U.S. OPEN"," Skin Deep; Time to Take Stock After a Season in the Sun"," TODAY IN BUSINESS"
"2006-09-08","1"," Commissioner's Report"," Treasury Official Gives Up Hedge Fund-Related Payments"," Q & A : How to Find (and Guarantee) the Best Rooms at the Best Price"," Nasdaq Looks to Expand, But Not Too Quickly"," French Telecom Prepares $4.45 Billion Stock Float"," U.S. Court Order Puts Black in Tricky Financial Situation"," Bankruptcy Overseer Had Busy Tenure, Even in Good Times"," Niveus Gets Cash Injection From Intel"," New Role for Rubin: Policy Guru"," EADS Dismisses Criticism of Airbus"," Hedge Funds Hound Stork"," NEC Is Set to Sell Packard Bell to a California Businessman"," F.B.I. Agents Question Accuracy of 9/11 Series"," Senate Panel Releases Report on Iraq Intelligence"," Same Magic for Steelers in Opening Victory"," World Business Briefing"," After Years Behind Bars, Now a Life on the Run"," Texas: Border Agent Pleads Guilty"," Microsoft Warns Europeans New System Could Be Delayed"," New Service From Amazon Offers Downloadable Films"," NEC Is Set to Sell Packard Bell to a California Businessman"," Amid Talk of Three Impressive Buildings, Silence on One Important Issue"," Arrest of Second Major Online Gambling Figure Is a First for State Officials"," At the Pentagon, a Shared Symbol of Security for the Next Time Darkness Falls"," It’s a Simple Scarf, but Its Meaning Is Much More Than Faith"," Housing Outlook Darkens, Pulling Share Prices Down"," New Role for Rubin: Policy Guru"," In the Defense of Basic Rights, an Official Led a City’s Defiance"," Bankruptcy Overseer Had Busy Tenure, Even in Good Times"," Corzine Offers Proposal to Bolster Business Climate"," An Age of Tainted Admissions and Too Much Homework"," Pluto, Paradoxically, Joins ‘The Planets’"," Blair to Give Up Post as Premier Within One Year"," Apple Festivals: Crisp and Fresh From the Tree"," TODAY IN BUSINESS"," Paid Notice: Deaths   PRICE, NORMAN"," At the Pentagon, a Shared Symbol of Security for the Next Time Darkness Falls"
"2006-09-09","0"," Match-Tracking: Sharapova Wins U.S. Open Women's Title"," Qualifying as symbolism"," Federer Wins U.S. Open"," Semifinal Predictions"," Saudi Arabia: Not Dog People, or Cat People Either"," Junior in the Semifinals Overcame Leg Injuries"," With Little Authority, African Union Force Struggles With Its Mission in Darfur"," U.S. Bars Iranian Bank&#8217;s Access to System"," An Evening of Premieres and Praise"," 2 Dissidents Appear to Have Won Heinz Seats"," Loneliness and Passion in Mississippi"," Paid Notice: Deaths   WEISS, HARRY"," Paid Notice: Deaths   PRICE, NORMAN"
"2006-09-10","0"," Match-Tracking: Third Open for Federer"," Sharapova Wins Open Final"," Opening Shows"," McCain and Dole Stand Up"," By Any Means Necessary"," 'Going on a Mission'"," Michigan’s Big Property Tax Cut, and the Lessons It Has for New Jersey"," Iraqi Premier Will Visit Iran to &#8216;Enhance&#8217; Ties"," Seeking to Attract Top Prospects, Employers Brush Up on Brands"," Battle Lines in Treating Depression"," Worry Over Housing Market Offsets Oil Price Cut"," A Few Bad Apples, and Everybody’s Sauce"," Is 8 Enough? Transmissions Meet the Need for Speeds"," Melissa Boasberg, Eric Schvimmer"," Lori Marino and Megan McCarroll"," Alisa Miller, Jason Artemiuk"," Tim Bunner, Jonathan Vipond III"," Transmissions 101: How to Get in Gear"," 2007 Nissan Versa: Another David Wielding a Slingshot"," The Mean Dahlia"," Murray Hill’s Growing Housing Stock"," Putting Whole Teeming Cities on the Drawing Board"," The Demise of Childhood: Growing Up in Suburbia’s Dark Shadows"," Stock Tips From Spam Aren’t Just Silly. They’re Costly."," How to Find (and Guarantee) the Best Rooms at the Best Price"," Dubai: Adventures in the Emirates"," Price Check; What You Get For $750,000 In . . ."," Alisa Miller, Jason Artemiuk"," New Bohemians"," Allow Dissenting Opinion"," Remember the Role Of a Real Estate Agent"," Lori Marino, Megan McCarroll"," Paid Notice: Memorials   WEXLER, MELISSA ANN"," Loneliness and Passion in Mississippi"," On a Mission to See Clinton But Lacking $1,000"
"2006-09-11","1"," For Hedge Funds, Style Is Just a Suggestion"," JOSEPH E. MALONEY: A Nurse’s New Mission"," NEILIE ANNE CASEY: A Life With More Meaning"," Nasdaq in Talks With OMX Exchange, Report Says"," Pinnacle Financial Completes $20 Million Offering"," Chicago Exchange Plans to Go Public, Despite Legal Tussle"," Citigroup Names Head of Hedge Fund Unit"," The Microsoft-Yahoo Pipe Dream"," Study Links Rising Ocean Temperatures to Emissions"," OPEC Holds Production Steady"," Manhattan: Police Commissioner Honored"," In Role Reversal, Ex-F.B.I. Agents Align Themselves With Defendant"," Montenegro Premier Appears to Win Vote"," China Puts Stricter Limits on Distribution of Foreign News"," Opening Shows Snub Conventional Wisdom"," At OPEC, Some Worry as Oil Prices Start Falling"," Citigroup Names Head of Hedge Fund Unit"," How Will Apple’s Marketing Maestro Marry the Computer and the Home TV?"," Stock Offerings This Week"," A Kenyan Town’s Offer of Aid Pays Dividends for Its Youth"," Stock Offerings This Week"," Montenegro Premier Appears to Win Vote"," TODAY IN BUSINESS"
"2006-09-12","1"," Football Fumble in Missouri"," Meanwhile, in Connecticut..."," Pricewaterhouse Returns to U.S. Restructuring Business"," FTI to Buy Financial Public-Relations Firm"," Televisa Still Covets Univision"," A Review of Intel Widens in Europe"," Dismissal Recommended for Bristol Chief"," Freescale Considers Rival Bids, as Debt Risk Triples"," Banc of America Sells Stake in Prime Brokerage Business"," Intel Sells Optical Manufacturing Unit to Cortina"," Barr's Revised Pliva Bid Brings Questions of Price to the Forefront"," Vioxx’s Heart Risks Were Unique, Studies Suggest"," Surcharge for High-Income Medicare Recipients"," Apple Previews Device Linking Computer to TV"," A Review of Intel Widens in Europe"," Japan: Oil Pushes Up Wholesale Prices"," Germany: Airline Settles Price Suit"," Harvard Ends Early Admission"," United States Open Becomes Memorable for Its Victories and Farewells"," Chevron Could Avoid Huge Royalties on New Field"," France: Trial Opens for Chirac Allies"," Site Previously for Students Will Be Opened to Others"," Dell Delays Financial Filing as Accounting Inquiry Grows"," Dismissal Recommended for Bristol Chief"," California Opens Inquiry on Breaches of Computers"," Chicago Mayor Vetoes Big-Store Minimum Wage"," Televisa Still Covets Univision"," Would You Like Fries With That Monopoly Game?"," Sale of Businesses Hurts Campbell Soup’s Profit"," OPEC Production to Remain Unchanged"," A Most Prolific Composer Opens His Book of Angels"," The Artist Who Made a Tougher Aunt Jemima Hasn’t Softened With Age"," A Celebrity Among Ungulates May Soon Be Dismissed as a Poseur"," Consequences: 	Long Hours Put Medical Interns at Risk"," Help With Your Business, Often Free, on the Web"," It’s Business as Usual, and Politics as Unusual"," Long Hours Put Medical Interns at Risk"," Paid Notice: Deaths   WEISSBARD, SAMUEL H."," Arts, Briefly; Issues Big and Small"," World Briefing | Europe: France: Trial Opens For Chirac Allies"," TODAY IN BUSINESS"
"2006-09-13","1"," Sun, Sand and Lots of Hedge Funds"," Tellabs Stock Jumps as Analyst Sees Takeover Potential"," A Better Way to Improve College Admissions"," Primary Analysis"," Business Software Executive Quits Microsoft"," Plan for Vista Draws Warning to Microsoft From Europe"," Panel of Executives and Academics to Consider Regulation and Competitiveness"," Hedge Fund Manager Says Holdings Are 'Trade Secrets'"," HealthSouth Figure Is Sentenced Again"," Hedge Fund Bets on Burst of Housing Bubble"," Speculation Mounts on Electrolux Takeover"," Aer Lingus I.P.O. Priced to Go"," Cuomo and Pirro Open Attorney General Campaign"," California Highway Partially Reopens After Fire"," Seeming Defeat for Incumbent From Queens"," Missouri: Judge Voids Execution Procedure"," Apple Plans to Inhabit Living Room"," In the Debate on Security, Perhaps a Misstep or Two"," HealthSouth Figure Is Sentenced Again"," Modern Ways Open India’s Doors to Diabetes"," Discounts and Gas Prices Raise Kroger’s Sales"," Harvard’s End to Early Admissions Intrigues Others"," Dean Agrees to Finance Some Programs for Turnout"," Deal Reported Near on Rights of Suspects in Terror Cases"," Animal Rights Advocates Given Prison Terms"," Government Sets Higher Medicare Rates and New Surcharge"," Executive Quits Microsoft"," Arkady I. Volsky, 74, Founder of Russian Business Lobby, Dies"," Even Safety Czar Thinks British Are Too Risk-Averse"," Eliminating Early Admissions"," Plan for Vista Draws Warning to Microsoft From Europe"," Panel of Executives and Academics to Consider Regulation and Competitiveness"," Optimism on Energy Prices Drives Shares Sharply Higher"," Studies Find Higher Rates of Heart Risk With Vioxx"," Cupcakes and Tartlets Cavort With Croissants"," Recipe: Grilled Chicken With Chipotle Sauce"," Farm Animals Are at Center of Town Divide"," Salami for the Connoisseur"," TODAY IN BUSINESS"," Deal Reported Near on Rights Of Suspects In Terror Cases"," Dean Agrees To Finance Some Programs For Turnout"," Cupcakes and Tartlets Cavort With Croissants"
"2006-09-14","0"," Movie Minutes: 'The Last Kiss'"," Powell Breaks With Bush on Torture Issues"," Recent Openings"," In Stock-Loan Inquiry, One Family Looms Large"," Premier Drops Bid for United Biscuits"," Apple's Smaller iPods"," V.C.s Throw Dogster a $1 Million Bone"," Britain Hopes to Limit Changes at Exchange"," Toronto Exchange Reportedly Picks Up a Bond Broker"," Liberating Miss Alma, a Heroine at Last"," Astronauts Start Up New Solar Panel Plant"," Microsoft Raises Dividend"," Yankees Win, but Lidle&#8217;s Postseason Pitch Misses"," World Business Briefing"," Prosecutors Say 4 Men Took Up a Trade Behind Bars: Extortion"," Mars Expands ‘Health’ Line With Milk Chocolate Bars"," Chicago Minimum Wage Ordinance Fails"," Microsoft Fixing Hole in Media Software"," New Product by Nintendo for Holidays"," Commission Is Set to Discuss a Possible Increase in Taxi Fares"," Giants&#8217; Defense Opens Season to Mixed Reviews"," Britain Hopes to Limit Changes at Exchange"," New at Apple: Smaller iPods, Bigger Ideas"," Free Your Inner Disney With a Video Editing Tool That Can Animate Your Home Movies"," ‘Those Were the Days,’ the Punk Remix"," The French Art of Living, Back in Business in Paris"," Mambo and Hip-Hop: Two Bronx Sounds, One Sense of Dignity"," Ivy Halls and Open Arms"," Swiss Home of Cyclist Ullrich Is Raided"," Ends Without Means"," Ann Richards, Flamboyant Texas Governor, Dies at 73"," Yankees Win, but Lidle's Postseason Pitch Misses"," Paid Notice: Deaths  MCCARTNEY, DOROTHY A."," Arts, Briefly; 'Apple Tree' Is Headed For Studio 54"," TODAY IN BUSINESS"
"2006-09-15","1"," Commissioner's report"," Weekend Reading: Taming the American Stock Exchange"," When Hollywood Meets High Finance"," A Decline in Industrial Production"," Air America Denies Bankruptcy Rumors"," Slaying of Banker Throws Spotlight on Russia's Financial Community"," Murdoch Said to Be in Talks With Liberty on Stock Swap"," Hedge Funds Flirt With Heresy: Going Public"," Action Figure"," Murdoch Said to Be in Talks With Liberty on Stock Swap"," Refco Figure Arrested in France"," Missouri: Voter ID Law Is Struck Down"," Nevada: Wiccan Symbol Allowed on Memorial"," Ukraine: New Premier Puts Off Trying to Join NATO"," Democrats Open Purse Strings for a 2nd Upstate House Race"," Los Angeles Times Editor Openly Defies Owner’s Call for Job Cuts"," Top 2 Executives at Times Co. Will Forgo Stock Compensation"," Music Player From Microsoft Offers Wireless Song-Sharing"," Retail Sales Slow Their Rise; Wall St. Awaits Price Report"," Hedge Funds Flirt With Heresy: Going Public"," Writing May Be Oldest in Western Hemisphere"," This Way to Your Half-Price Seats"," Losing Money by Buying Stock Back"," World Briefing | Europe: Ukraine: New Premier Puts Off Trying To Join NATO"," TODAY IN BUSINESS"," World Business Briefing | Americas: Brazil: Petrobras Protests Bolivian Measures"," Paid Notice: Deaths   BRESCIANI, MARYE (NEE MCCARTHY)"
"2006-09-16","0"," Westbrook Misses Practice"," Brands in Recall"," Bush Says G.O.P. Rebels Are Putting Nation at Risk"," Price Index Moderated in August"," In a Shift, Annan to Fill Out a U.N. Form Disclosing His Finances"," Mystery Deepens in Case of Missing Colorado Marine"," A Milk War Over More Than Price"," Palestinian Intelligence Official Is Killed"," Financial Leaders Gather, a Bit Tensely"," Paying the Price When Companies Stumble"," It’s America Against Europe for the Inaugural Buffett Cup"," A One-Woman Campaign to Tell Dogs Where to Go"," As Trends Come and Go, a Swiss Tradition Endures"," Survivor Gently Adds Voices to Cambodia’s Dark Tale"," TODAY IN BUSINESS"," Bush Says G.O.P. Rebels Are Putting Nation at Risk"
"2006-09-17","0"," ‘The Mission Song’"," ‘Coronado’"," John Lithgow and Jeffrey Tambor"," U.S. Asks Finance Chiefs to Limit Iran&#8217;s Access to Banks"," In San Francisco, a Plague of Stickers Opens a New Front in the Graffiti War"," Sliding Quarterbacks Sometimes Risk Injury"," Who Bears the Risk?"," Ending Early Admissions: Guess Who Wins?"," In Russia, Business-Class Killings"," Lower Oil Prices Push Key Stock Indexes Higher"," Drug Can Prevent Diabetes in Many at High Risk, Study Suggests"," Tools of Running a Business, at Tag-Sale Prices"," A Video Business Model Ready to Move Beyond Beta"," The Good News About Oil Prices Is the Bad News"," Legacy Admissions (1 Letter)"," The Remix: 28 Easy Pieces"," American Brandstand"," The Remix: Hooked on Classics"," Emily Pryor, Cam Winton"," Page Sargisson, Peter Robbins"," Erin McCann, Joseph Lenehan"," Lynn Farrell, Michael McCarthy"," Fed-Up Riders Push for Train Station Cleanup"," Even Security Cameras Pose a Legal Risk"," The Academic Blues"," Global Gun Rights?"," Applying for Early Admission (Very Early)"," Feminist Literature"," A Fable, Adapted From Aesop"," After a Face-Lift, a Design Museum Reopens in Paris"," Give My Regards to Beaujolais: Wine Bars in New York"," Ethiopia Opens Its Doors, Slowly"," Paros, Greece, Is a Jam-Packed Island That’s an Open Secret"," A Short Course in College Finance"," Is Chemistry Destiny?"," The Remix; Read My Hips"," The Remix; Proportion Control"," THE PRICE OF SUCCESS"," Fed-Up Riders Push For Train Station Cleanup"," A One-Woman Campaign To Tell Dogs Where to Go"," A One-Woman Campaign To Tell Dogs Where to Go"," The Remix; How To Put On The Ritz | Evening Accessories"," The Remix; 28 Easy Pieces"," The Remix; Inside The Beltway | Take It Up A Notch"," The Remix; Hooked on Classics"," The Remix; It's All About ... Vampires"," The Remix; Bedroom to Boardroom"," Fed-Up Riders Push For Train Station Cleanup"," The Remix; Battle of the Boxer Shorts | All Blows Below The Belt"," A One-Woman Campaign To Tell Dogs Where to Go"," Fed-Up Riders Push For Train Station Cleanup"," Legacy Admissions"," The Remix; Japanese, If You Please"," Enjoying the Open Spaces"," The Remix; Snow Serving | A Den Of Iniquity"," A One-Woman Campaign To Tell Dogs Where to Go"," Action Figure"," Underdog Love"," Even Security Cameras Pose a Legal Risk"," Feminist Literature"," Paid Notice: Deaths   BRESCIANI, MARYE (NEE MCCARTHY)"," As Trends Come and Go, A Swiss Tradition Endures"
"2006-09-18","0"," Missouri Senate"," Televisa Abandons Quest for Univision"," Sterling Financial Acquires Northern Empire for $335 Million"," Hedge Fund Amaranth Said to Report Big Loss"," Great American to Open Bidding in Tower Auction"," U.S. Asks Finance Chiefs to Limit Iran's Access to Banks"," Dreier Acquires Boutique Bankruptcy Firm"," EMC Looks to Buy Network Intelligence, Report Says"," Hummingbird Shareholders OK Open Text Deal"," Speculation Over Airline Mergers Resurfaces"," Motorola Tipped to Win Symbol Auction"," Pitting Their Idealism Against Show Business"," Business Travel Factoids"," Institutions Hinder Female Academics, Panel Says"," Astronauts Rush to Clean Up Chemical"," Baghdatis Wins China Open"," Bid to Stockpile Bioterror Drugs Stymied by Setbacks"," Manhattan: Advertising Campaign Aims to Laud Detectives"," Israeli Visa Policy Traps Thousands of Palestinians in a Legal Quandary"," McCain, in New Hampshire, Gets an Earful From the Right"," Business and Islam: Allies Against Anarchy in Somalia"," French Newspaper of the Far Left Faces Financial Ruin"," It’s Dogster, for When Family Pets Network"," Nickelodeon Web Site Is Seeking Loyalty of a Parent Generation"," Interior’s Ethics Issues (1 Letter)"," Blogs About Business Travel Begin to Feel the Power"," Business Tools, Small and Smart"," Drink Lots of Fluids, and Save Time for a Frisking"," In Europe, Cheap Flights Come at a Price"," Metro Briefing | New York: Manhattan: Advertising Campaign Aims To Laud Detectives"," TODAY IN BUSINESS"," Interior's Ethics Issues"
