"Date","Direction","Headline"
"2009-09-17","0"," The Danger of Livestock Waste"," California Investigates Credit Rating Agencies"," Farmers' Market Opens Near White House"," 'Lost Symbol' Also a Big Hit on Kindle, But How Big?"," Verizon Boss Hangs Up on Landline Phone Business"," The Fallout of a Reversal on Missile Defense"," Finding Meaning in Arctic Ice"," Gates Addresses Missile Defense Changes"," Marriott's Renaissance Brand Gets a Makeover"," 2009 Emmy Award Nominees and Winners"," Obama Reconfigures Missile Shield Plan"," Madoff Beach House Is Sold at a Premium"," White House Fact Sheet on Missile Program"," Obama and Gates on Missile Defense"," Business Booming at Drip-Irrigation Company"," AMR Gets $2.9 Billion in New Liquidity"," Irish Bank Stocks Rise as Plan for Bad Loans Emerges"," The Recession on Film, as Comedy and Satire"," Lloyd's of London Insurers Pull Hedge Fund Investments"," In Blow to Verizon, Nortel Gets Approval for Avaya Deal"," Special Section: Taking a Chance on Risk, Again"," Sun-Times Union Rejects Pay Cuts, Putting Deal at Risk"," A Watchdog on Pakistan's Media"," Citing Risks, U.S. Seeks New Rules for Niche Banks"," Rating Up for Open Final"," Taking a Chance on Risk, Again"," Hedge Funds Challenged Over Fees"," To Reduce Hedge Fund Risk, Let Everyone In"," Health Reform’s Missing Ingredient"," Exploitation of Farm Workers and Farm Animals"," Shock Rallies to Win in Playoff Opener"," Visas and Speech"," Citing Risks, U.S. Seeks New Rules for Niche Banks"," Cuomo Is Said to Issue Subpoenas in Merrill Case"," DNA Profiles of Many Felons Are Missing in Wisconsin"," St. Joseph, Superagent in Real Estate"," Maine: Fishing Grounds Reopened"," Environmental Group Reveals Toxic Chemicals in a Range of Consumer Items"," Jets Still Paying Price for Favre and Mangini"," To Reduce Hedge Fund Risk, Let Everyone In"," Hedge Funds Challenged Over Fees"," Taking a Chance on Risk, Again"," August Wilson Center Prepares for Opening"," Yankees Will Hold the Line on Ticket Prices for 2010"," Pakistan Rights Groups Seek Answers on Christian’s Death"," Consumer Prices Rise on Energy Costs"," Chemicals With Risks"," Barclays Sells $12.3 Billion of Illiquid Assets"
"2009-09-18","1"," What 'Socialism' Means to the Masses"," Microsoft Chases Unknown Scammers Through the Courts"," The New Gurus"," Obama Says Race Is 'Not the Overriding Issue Here'"," Great Recession Takes Great Toll on Value of Brand Names"," S.E.C. Sees More Disclosure by Hedge Funds"," Google Says Apple Flatly Rejected Voice App for iPhone"," Free Energy Audits in Maplewood"," A Long Island Bouillabaisse"," Analysts See Bigger Profits at Goldman Sachs"," Nissan Recalls 26,000 Altimas and Maximas"," The Early Word: Missile Shield Fallout"," Ithaca's Pioneers of Dog Waste Composting"," Financier's Lawyer Calls Suicide Speculation 'Offensive'"," Hedge Fund Liquidations Decline"," As Stocks Keep Rallying, I.P.O.'s Return"," New S.E.C. Rules Take Aim At Credit Rating Agencies"," After an 11-Month High, Markets Take a Breather"," Swiss Bankers Back a Broad Withholding of Taxes"," Colts’ Gonzalez May Miss Two Months"," In His Book, Fritz Peterson Discusses Pranks, Teammates and Swapping Wives"," New Missile Shield Strategy Scales Back Reagan’s Vision"," Mob Figure Is Sentenced to Life for Four Killings"," Indiana Pulls Away From Washington in W.N.B.A. Playoff Opener"," Indictment Issued and Plea Entered in Property Sale Cited in Trump Lawsuit"," Missile Sense"," Scathing Report on Border Security Is Issued"," Florida: A.C.L.U. Suit Dismissed"," Despite Their Prices, Gourmet Teas Thrive as Global Economy Sags"," Obama’s Remarks on Missile Defense Strategy"," Stir-Fried Tofu and Peppers"," After an 11-Month High, Markets Take a Breather"," White House Scraps Bush’s Approach to Missile Shield"," OBAMA RESHAPES A MISSILE SHIELD TO BLUNT TEHRAN"," Open Season on Lawsuits"
"2009-09-19","0"," This Catwalk Isn’t Meant for Cats, or for Walking"," Chargers’ Tomlinson to Miss Showdown With Ravens"," Recession Drives Women Back to the Work Force"," A Rite of Hazing, Now Out in the Open"," Free Speech Battle Arises From Dog Fighting Videos"," Health Insurance? Here’s a Paradox"," Vivian Girls in the Hype Cycle: Anointed, Dismissed, Overworked"," The Bailout Bill Comes Due, Vexing Agencies"," Dissonances, Drones and Striations of Feedback"," Russia’s Reaction on Missile Plan Leaves Iran Issue Hanging"," Loving Your Stock Only When It’s High"," Taking Care of Parents Also Means Taking Care of Finances"," Stocks Renew Their Rally on Wall Street"," NATO Proposes Link With Russia’s Missile Defense"," Goldman Sachs Sells Holdings In Sanyo"
"2009-09-20","0"," After Disney-Marvel Deal, Cartoonist's Heirs Seek to Reclaim Rights"," Seminoles Dim Brigham Young’s Dreams of B.C.S."," U.S. Agents Arrest Father and Son in Terror Inquiry"," The Financial Turmoil, One Year Later"," Chinese Women Remind the World of Their Prowess"," Calculations of War: Which Risk Is Reasonable?"," A Better Missile Defense for a Safer Europe"," Beauty Products Lose Some Appeal During Recession"," Facts and the Financial Crisis"," The Twists and Turns of Missile Defense"," The Financial Crisis and America’s Casino Culture"," The Recession Is Over — for Now"," Emily Harris, Matthew Mauney"," Danielle Robinson and Dwayne McClary"," Treated Like Dogs? Yes, and Very Well"," Poof! How Home Loans Transform"," Wealthy Town Cools on Super-Jumbo Homes"," Artists in Academia: Endangering the Teachers"," A Fondness for Concealment"," The Future of Global Finance"," An Island Frozen in Time and Price"," The Friends Who Hold the Enemies Closer"," Season Openers"," A Player Turns Punts Into a Risky Decision"," Paid Notice: Deaths  STOCKLY, JOHN G"," Treated Like Dogs? Yes, and Very Well"," Dissecting The Ups And Downs Of Week 1"
"2009-09-21","0"," A Day for Speechifying as Finance Panel Takes Up Bill"," The Judge Unloads on the Lawyers"," Bank of America Misses Congressional Deadline"," An Island Frozen in Time and Price"," Takeover Premiums Take Flight"," What's an Affordable Premium for You?"," The Vanishing M.T.A. Station Agent"," Netflix Awards $1 Million Prize and Starts a New Contest"," Taking Stock of New York for 'Climate Week'"," Missing a Daily Ritual in Michigan"," For Newspaper Advertising, a Slower Decline"," General Offers Grim View of Afghan Mission"," E.P.A. Report Suggests Waste Reduction and Recycling Reduces CO2 Emissions"," Money Gets Tight for Europe's Small and Medium Businesses"," N.J. Governor Criticized Over Hedge Fund Investment"," Microsoft to Let Shareholders Vote on Executive Pay"," Disney Faces Rights Issues Over Marvel"," Swiss Secure Cup Spot"," Jets Open Thread: Game Ball to Ryan"," Small Business and Health"," Mississippi’s Failure"," Ravens Leave Chargers an Opening, but Lewis Fills It"," Perceiving the Risk of Stock Picking"," Disney Faces Rights Issues Over Marvel"," A Good Risk in a Pair Event Proves Costly in Teams Play"," Paid Notice: Deaths  WAGREICH, ZIPORA K."," Verizon Moving From Landlines"
"2009-09-22","1"," Sundance Developing ‘Little Miss Sunshine,’ ‘Like Water for Chocolate’ Musicals"," In Debut Week, ‘Lost Symbol’ Sells More Than 2 Million Copies"," Which Factors Will Mean the Most in October?"," In Health Care Premiums, Who Gets a Subsidy?"," National Academic Standards: The First Test"," A Reminder to Keep Politics Out of Grants"," Utility Leaves Chamber Over Climate Issue"," Shell Beans and Potato Ragout With Swiss Chard"," California E.V. Corridor Is Open for Business"," The Estate Tax: A New Conspiracy Theory"," Baucus Proposes New Limits on Insurance Premiums"," Sotomayor Gets Opening Toss at Yankee Stadium"," Group Warns of Global Road-Death 'Epidemic'"," U.N. Climate Conference Opens"," 'Tax Hike on Dogs'"," In Debut Week, 'Lost Symbol' Sells More Than 2 Million Copies"," Media Bailout: All Obama, All the Time?"," Bullish Signs From the Hedge Fund Crowd?"," Today in Business Travel"," A123 Raises I.P.O. Price Range"," Investors Poured $19 Billion Into Hedge Funds in August"," AMR Plans to Raise $500 Million in Stock and Debt Sale"," Vicis Capital Bars Withdrawals After Losses"," A $1 Million Bargain for Netflix, and Maybe a Model for Others"," Stocks Retreat From Recent Gains as Investors Cash in Profits"," European Union Lays Out Its Evidence Against Intel"," Emissions of CO2 Set for Best Drop in 40 Years"," Colts Rally Four Times and Spoil Dolphins’ Home Opener"," The Rights of Corporations"," States Can Sue Utilities Over Emissions"," A $1 Million Research Bargain for Netflix, and Maybe a Model for Others"," Refitted to Bury Emissions, Plant Draws Attention"," Trial Opens With 2 Views of Slashing Recounted"," France: Villepin Trial Opens"," For a President in the Big Apple, a Heart-Shaped Potato"," With Low Prices, Hyundai Builds Market Share"," Census Data Show Recession-Driven Changes"," Reopened Museum Tells Chinese-American Stories"," The Claim: Lack of Sleep Increases the Risk of Catching a Cold."," Stocks Retreat From Their Recent Gains as Investors Cash in Profits"," Paid Notice: Deaths  BIENSTOCK, FREDDY"," Paid Notice: Deaths  BIENSTOCK, FREDERICK"," Europe Says E-Mail Shows Antitrust Violations by Intel"
"2009-09-23","0"," Employee Tied to Perot Systems Is Charged With Insider Trading"," What to Watch Wednesday: Top Chef, Stegner and More Premieres"," Kiss and Abba Nominated for Rock Hall of Fame"," Brandeis Committee Recommends Keeping Its Art Museum Open"," Art Awards | And the Nominees Are. ..."," Apple Gets Green Light to Block Palm From iTunes"," Of Forest Management and Carbon Markets"," Divisions in House on Financial Regulation"," Tuck Misses Practice With Injury"," White House Pares Its Financial Reform Plan"," 'Unanimous Republican Opposition'"," Travelers' Fee Can Help Fight Diseases"," Court Decision Deals Blow to Carbon Prices"," Areva Said to Receive 3 Bids on Transmission Unit"," U.S. Seeks Global Consensus for Financial Reforms"," Hedge Funds Look to Policy Experts to Decode Washington"," S.E.C. Warns Swaps May Evade White House Reform"," Stocks Resume Rally; Dollar at Year's Low"," Large Dogs in Public Housing Are Now Endangered Species"," Travelers’ Fee Can Help Fight Diseases"," Best Buy and Verizon Jump Into E-Reader Fray"," U.N. Sets an Example by Offsetting Its Carbon Emissions"," Yahoo’s New Campaign Emphasizes User Preferences"," ConAgra Sales Fall, Depressing Stock"," Big Polluters Told to Report Emissions"," For Opening Night at the Metropolitan, a New Sound: Booing"," ‘The Lost Symbol’ Finds Two Million Buyers"," U.S. Hopes for Global Accord on Financial Reforms"," China Bars Foreigners From Making Visits to Tibet"," Chief Financial Officer to Lead N.C.A.A. for Now"," Stocks Resume Rally; Dollar at Year’s Low"," Coconut Barley Pilaf With Corn, Chicken and Cashews"," Paid Notice: Deaths  BIENSTOCK, FREDDY"," Paid Notice: Deaths  HASKINS, EVELYN EMILY (FENRICH)"," Paid Notice: Deaths  BIENSTOCK, FREDDY"
"2009-09-24","0"," A Notoriously Daunting Financial Aid Form Gets a Makeover"," ‘Mad Men’ and Dr Pepper"," On Behalf of Senator Wyden's Bill to Give Open Access to Insurance Exchanges"," Marathon Tech Review: FM Radio Comes to the iPod"," Obama May Head to Copenhagen, After All"," California Gubernatorial Hopeful Vows to Reverse  Emissions Rules"," G.O.P. Lawmakers Press for McChrystal to Appear"," Congress Speaks: Animating APIs"," Safety Agency Won't Recall Prius for Headlight Issue"," Web Site for Dog Lovers Has Had Its Day, Creator Decides"," BrightSource Expands Land Deal in Nevada"," Is Relying on Public-Private Plan Risky?"," Jigsaw's Business Model Is Built on Crowdsourcing"," Should a College Applicant 'Friend' an Admissions Officer?"," Giants' Phillips Misses Practice"," Private Medicare Plans Are at Center of Senate Finance Fight"," Summer Houses: More Sales, Lower Prices"," Carbon Traders Issue Warning After Ruling"," Stampede to Business School Eases"," Siemens Sells Airfield Business to Private Equity Firm"," TARP Watchdog Doubts All Funds Will Be Repaid"," Hedge Fund Fees Remain Intact, Report Finds"," Former Executive at Hedge Fund Gets Prison Time for Theft"," Microsoft Quashes Electronic Arts Deal Chatter"," Fed May Borrow From Money Market Funds, Report Says"," Swiss to Exit Bank Secrecy List, O.E.C.D. Says"," London Stock Exchange Cuts 12% of Staff"," Greenberg Wants Dismissal of Suit"," Freddy Bienstock, Who Published Elvis Presley Hits, Dies at 86"," Too Many Veterans’ Disability Claims Take Too Long to Process, Audit Finds"," Illinois: Chicago-Area Day Care Center Was Site of Dog Fighting, Police Say"," Greenberg Wants Dismissal of Suit"," Chevron Moves Fight With Ecuador to Arbitration"," Green and De Blasio Focus on Attacks and Endorsements in Public Advocate Debate"," Prisoners’ Rights"," Canadian Judge Dismisses Polygamy Charges"," Even the Smallest Nonprofit Groups Tried Their Hands at High Finance"," Nonprofits Paying Price for Gamble on Finances"," N.B.A. and Players Swap Ideas Ahead of Negotiations"," Conran Hears You on Its Prices"," A Clip-and-Save Renaissance"," Keep Art Museum Open, Brandeis Panel Says"," Business Perks (Must Be Laid Off)"," Oil Industry Sets a Brisk Pace of New Discoveries"," Britain’s Top Financial Regulator Takes On Banks"," A Plan to Add Supermarkets to Poor Areas, With Healthy Results"," White House Pares Its Financial Reform Plan"," All That's Missing Is Camouflage"
"2009-09-25","0"," Volcker Warns Obama Plan Leaves Opening for Bailouts"," Los Angeles Art Museum Says Its Financial Picture Is Looking Up"," The Last of the Fizz Businesses"," Group of 20 Agrees on Far Tighter Financial Rules"," Intel Inside? Try Intel Everywhere"," Will Amazon Open the Kindle to Developers?"," Canora and Grieco Leave Insieme, Will Open Second Terroir"," Boogie Down Productions at MoMA"," Cross-Cultural Hot Dogs"," Quote Unquote | Open Fire!"," State Department Issues Travel Alert for Germany"," U.S. Issues Travel Alert in Germany"," Hot Dog Diplomacy"," A First Look at Adobe Elements and Premiere"," Now Online | T's Fall Travel Issue"," More Businesses Disclosing Carbon Profiles"," New S.E.C. Rule Increases Risk of Insider Trading"," Walking the Dog to Draw Attention to a Cause"," U.S. to Audit Loans by Offshore Funds"," Boutiques Grab M&A Market Share From Big Firms"," Bankruptcy Judge Approves Sale of the Cubs"," A Banner Week for New Stock Sales"," First Listings on Shenzhen Board Priced at High End"," Japan Seems Reluctant as Airline Seeks a Bailout"," Bankruptcy Judge Gives O.K. to Sale of the Cubs"," House Votes to Block Increase in Medicare Part B Premiums"," The Rights of Cyclists"," Meanwhile, Next Door, It’s Team Obama for Corzine"," Japan Appears Reluctant as Airline Seeks a Bailout"," Kirk Heads to Senate With Brief, Crucial Mission"," U.S. Assures Fretful Britons: It’s Much Ado About Nothing"," New S.E.C. Rule Heightens Risk of Insider Trading"," Prepping for Opening Night (and Life)"," $35 Billion Tanker Contract Opens"," Volcker Says Obama Plan Leaves Opening for Bailouts"," U2 in the Round, Fun With a Mission"," Paid Notice: Deaths  GURWIN, JOSEPH"," Paid Notice: Deaths  ALHADEFF, NISSIM"," Paid Notice: Deaths  GURWIN, JOSEPH"," Paid Notice: Deaths  GURWIN, JOSEPH"," Paid Notice: Deaths  GURWIN, JOSEPH"," Paid Notice: Deaths  GURWIN, JOSEPH"," Paid Notice: Deaths  ALHADEFF, NISSIM"," Paid Notice: Deaths  GURWIN, JOSEPH"," Paid Notice: Deaths  GURWIN, JOSEPH"," Paid Notice: Deaths  GURWIN, JOSEPH"," Paid Notice: Deaths  GURWIN, JOSEPH"," Paid Notice: Deaths  GURWIN, JOSEPH"," Paid Notice: Deaths  GURWIN, JOSEPH"," Paid Notice: Deaths  GURWIN, JOSEPH"," Paid Notice: Deaths  GURWIN, JOSEPH"," Red Bulls Set Opener For Arena"," A Loyal Soldier Heads to the Senate With a Brief but Crucial Mission"," Myanmar: Dissident Endorses U.S. Shift"
"2009-09-26","0"," Switzerland: Tensions Rise as Libya Holds 2 Swiss Men"," Myanmar: Dissident Offers to Work With Junta"," G.I. Bill Checks Will Be Issued"," Mississippi: No Jail for Ex-Mayor"," Medium-Range Missiles"," Animal Rights and Speech"," With Gallinari, Knicks Open Camp Focusing on What Can Go Right"," Two Misses by Woods Throw Tour Championship Field a Lifeline"," High-Priced Seats"," Once a ‘Bad Boy,’ Detroit Shock’s Rick Mahorn Becomes a Father Figure"," Jack Gets Bragging Rights in Computer Battle"," Unilever to Buy Businesses From Sara Lee"," From Obama, G-20’s Mission as Tim Sees It"," Before Game on Sunday, Bragging Rights on Saturday"," Detroit Mayor’s Tough Love Poses Risks in Election"," Trial Opens in Chechen Leader’s Slander Suit"," New Jersey Businessman, a UBS Client, Pleads Guilty to Tax Evasion"," Paid Notice: Deaths  GURWIN, JOSEPH"," Paid Notice: Deaths  GURWIN, JOSEPH"," Paid Notice: Deaths  GURWIN, JOSEPH"," Paid Notice: Deaths  GURWIN, JOSEPH"," Paid Notice: Deaths  GURWIN, JOSEPH"," Paid Notice: Deaths  GURWIN, JOSEPH"," Paid Notice: Deaths  GURWIN, JOSEPH"," Paid Notice: Deaths  ALHADEFF, NISSIM"," Paid Notice: Deaths  GURWIN, JOSEPH"," From Obama, G-20's Mission As Tim Sees It"," F.D.A. Approves a Drug Maker's First Product"," Stress Tests In Europe Show Risk Of Big Loss"," Paid Notice: Deaths  GURWIN, JOSEPH"," Paid Notice: Deaths  GURWIN, JOSEPH"
"2009-09-27","0"," Small Business and the Economic Crisis"," Premiums, Penalties and Political Costs"," Immigrant Firings Raise Issues"," Germany Blanks U.S. in U-20 World Cup Opener"," The Hatfields and McCoys of Counterterrorism"," Joseph Gurwin, Textile Manufacturer and Philanthropist, Dies at 89"," Election Commission Decisions Deadlocking on Party Lines"," U.S. Job Seekers Exceed Openings by Record Ratio"," Learning in Business by Following the Heart"," Enter the Recession’s Waiting Room"," Looking at the Future of Artificial Intelligence"," Ranting and Scheming in a Seedy Junk Shop"," In the City, Highly Productive Drug Mills"," Nissan’s Van Contender Awaits an O.K."," Double Agents"," Paid Notice: Deaths  GURWIN, JOSEPH"," Insurance Mandate: The Legal Issues"," Paid Notice: Deaths  GURWIN, JOSEPH"," Renaissance Is Under Way For Marriott's Renaissance"," Paid Notice: Deaths  GURWIN, JOSEPH"," Paid Notice: Deaths  GURWIN, JOSEPH"," Paid Notice: Deaths  GURWIN, JOSEPH"," Paid Notice: Deaths  GURWIN, JOSEPH"," Paid Notice: Deaths  GURWIN, JOSEPH"," Paid Notice: Deaths  GURWIN, JOSEPH"," Paid Notice: Deaths  GURWIN, JOSEPH"," Paid Notice: Deaths  GURWIN, JOSEPH"," Paid Notice: Deaths  GURWIN, JOSEPH"," Paid Notice: Deaths  GURWIN, JOSEPH"," Paid Notice: Deaths  GURWIN, JOSEPH"
"2009-09-28","1"," Julianne Nicholson Cast in Playwrights Horizon’s ‘This’"," Apple Rehires a Developer of Its Newton Tablet"," Apple Rehires a Developer of Its Newton Tablet"," Executive Tied to A.I.G.'s Demise Returns to U.S."," Star Tribune Emerges From Bankruptcy"," UBS Names Heads of Investment Banking"," Bankruptcy Tourism"," Please Curb Your Invisible Dog"," Apple App Store Crosses Another Threshold"," Iran Test-Fires More Missiles"," Giants Open Thread: 'Bucs Got Seal-Clubbed'"," Ask About Exploring New York City With Your Dog"," Health Care Reform Is a Woman's Issue"," Johnson & Johnson Invests $444 Million in Crucell"," Sprint Banks on WiMax to Win Back Market Share"," Asian Markets Leave Memories of Lehman Behind"," Citi Sues Morgan Stanley Over Credit Default Swap"," Jets Open Thread: Defense Is 2 for 2 in Save Situations"," Did Canadian Banks Miss Their Chance?"," Bill Clinton Echoes 'Right-Wing Conspiracy' Theme"," Small-Business Owners Are Coping, and Feeling Grateful for the Bright Spots"," Many Investors Still Avoid Risks of Iraq"," Honduras Bars Diplomats as Political Crisis Grows"," Canadian Banks Missed a Chance"," Sprint Banks on WiMax to Win Back Market Share"," Born to Love the Boss, Academic Style"," Small Business Owners Are Coping, And Feeling Grateful for the Bright Spots"," Paid Notice: Deaths  GURWIN, JOSEPH"," Paid Notice: Deaths  GURWIN, JOSEPH"," Premiums, Penalties And Political Costs"," Paid Notice: Deaths  GURWIN, JOSEPH"
"2009-09-29","0"," Suit Over Winnie the Pooh Royalties Is Dismissed"," Hugh Dancy Is Wedded to ‘The Pride’ for MCC Theater"," Microsoft Releases Free Antivirus Software"," One Blogger's Guess Leads BBC to Ask British Prime Minister About Depression"," Garden State: Unfinished Business"," Craigslist's Missed Connections as Art"," Court Dismisses Rather Suit Against CBS"," Scorecard | Missoni Wins!"," At Risk: Calling Queen Latifah"," New All-Business-Class Flight to London"," Ireland Expands Transmission Capacity"," Google's Much-Anticipated Wave Opens Up a Bit"," After Cancer, Ambushed by Depression"," Today in Business Travel"," Live Blogging: Senate Finance Committee Debate on Public Option"," Small-Business Green Shoots?"," Taxing Banks to Pay for, and Prevent, Future Bailouts"," BNP Paribas to Raise $6.27 Billion to Repay Bailout"," UBS Might Sell Paine Webber If Price Was Right"," Taiwan Opens Door to Mainland Chip Takeovers"," Pallotta to Invest in New Hedge Fund"," An Uptick in New Hedge Funds"," Guantánamo Deadline May Be Missed"," British Airways Will Fly Business-Only to New York"," Darrell Hammond Missing From ‘SNL’"," Probiotics: Looking Underneath the Yogurt Label"," In China Quake Analysis, Insight Into Devastation"," Risks: Diabetes Tied to Heart Rhythm in Women"," Health Care Overhaul and Mandatory Coverage Stir States’ Rights Claims"," President Obama Will Go to Copenhagen to Lobby I.O.C."," Iran Test-Fires Missiles That Put Israel in Range"," Paid Notice: Deaths  GURWIN, JOSEPH"," Paid Notice: Deaths  MCCABE, FRANK J."," Paid Notice: Deaths  GURWIN, JOSEPH"
"2009-09-30","0"," Lawsuit Over Indie Film ‘Precious’ Is Dismissed"," Live Album Planned From McCartney’s Citi Field Shows"," Surprise! Zuckerman Wants BusinessWeek, Too"," Surprise! Mort Zuckerman Wants BusinessWeek, Too"," E.P.A. Rule Draws Fire From Large Emitters"," Endive, Apple and Walnut Salad"," No Visiting Rights for Hospital Trauma Patients"," Two New Docks for iPods"," Senate Finance Committee Rejects Effort to Tighten Abortion Restrictions"," Toyota Seeks Solution to Floor-Mat Issue"," Now Opening | An Imeldific Show"," CIT Plans for Exchange Offer and Potential Bankrucpty"," My So-Called Business Plan (Enter Laughing)"," Small Business and Health Care"," Answers About Exploring New York With Your Dog"," The Times Plans Local Editions in Chicago and Other Markets"," Going to Extremism"," Financial Ignorance and Arrogance"," Evaluating Pesticide Risk"," Russian Hedge Funder Finally Leaves the Plaza"," Chevron Picks Veteran to Succeed O'Reilly"," Walt Disney Family Museum"," Nike Resigns From Chamber Board1000 2009-09-30 Crème de la Cannes Reopens1001 2009-09-30 'I Miss Our Old President'1002 2009-09-30 Will Health Care Reform Encourage Small Businesses to Drop Health Coverage?1003 2009-09-30 Apple Expands Environmental Disclosures1004 2009-09-30 CQ Editor Who Questioned Firings Gets Answer On Pink Slip1005 2009-09-30 I.M.F. Calls for Overhaul of Financial System1006 2009-09-30 Does unconventional monetary policy solve the zero bound problem?1007 2009-09-30 Efficient Computers in Cambodian Schools1008 2009-09-30 Benchmark Taps MySQL Founder for Job1009 2009-09-30 Pfizer Gets Approval From China and Australia for Wyeth Deal1010 2009-09-30 Microsoft C.E.O. Takes Pay Cut After Rough Year1011 2009-09-30 Hedge Funds Bet on Sugar1012 2009-09-30 Less Regulation, Better Credit Ratings?1013 2009-09-30 Signs of Life in Financial Reform1014 2009-09-30 Less Regulation, Better Credit Ratings?1015 2009-09-30 Phoenix Outguns Indiana in W.N.B.A. Finals Opener1016 2009-09-30 California: Murder Charge Against Soldier Dismissed1017 2009-09-30 He Ain’t There on Business, Baby, He’s Only There for Fun1018 2009-09-30 Criticism Is Mounting Over Flood Premiums1019 2009-09-30 Pakistan: Missile Attacks Reportedly Kill 13 Insurgents1020 2009-09-30 In Harsh Reports on S.E.C.’s Fraud Failures, a Watchdog Urges Sweeping Changes1021 2009-09-30 Iran: Swiss Visit 3 Detained American Hikers1022 2009-09-30 ‘Winnie-The-Pooh’ Suit Is Dismissed1023 2009-09-30 Rather’s CBS Suit Dismissed1024 2009-09-30 Dementia Risk Seen in Players in N.F.L. Study1025 2009-09-30 From McChrystal’s Mouth to Obama’s Ear1026 2009-09-30 Suspect Pleads Not Guilty in Bomb-Conspiracy Case1027 2009-09-30 U.S. Home Prices Continue to Improve, Index Shows1028 2009-09-30 Iran Defends ‘Rights’ to Run Its Newly Declared Plant1029 2009-09-30 Paid Notice: Deaths  RENCHARD, ALICE ""DOLLY"" (NEE FLEMING)1030 2009-09-30 Paid Notice: Deaths  BLIND, REBECCA MCCOY1031 2009-09-30 Elder of Burmese Opposition Grapples With Election Dissonance1032 2009-09-30 Paid Notice: Deaths  SCHNEEWEISS, SAMUEL1033 2009-09-30 Paid Notice: Deaths  SCHNEEWEISS, SAM1034 2009-09-30 Stocking Up for One Chinese Holiday and Two Worlds"
