"Date","Direction","Headline"
"2009-09-01","0"," Rise in Oscar Nominees Brings New Voting Rules"," Small-Business Group Forges an Alliance for Health Care Reform"," 2010 Ticket Prices Are Hurting Giants-Jets Sales in 2009"," Freedom Communications Files for Bankruptcy"," From Wii to Hideaway, Beijing's New Breed of Bars"," Oudin, Punctuating Effort With Emotion, Wins Opener"," At Risk: The Week of Magical Thinking"," U.S. Open: Day 2"," Words for the Opening of School"," Business-Linked Group Assails Growing Debt"," Should Apple Help Save Leopards?"," Huckabee Issues Appeal for Dole's Debt"," Stating Your Mission in No Uncertain Terms"," The Demi-Ashton Ratio"," Cerberus Dismisses Talk of Fund Defaults"," The Enigmatic Kuznetsova Notches Opening-Round Win"," Liu to Add Teachers' Union to List of Endorsements"," In Case You Missed It . . ."," Courtside at the U.S. Open"," Should Entrepreneurs Minimize Credit Card Debt?"," Today in Business Travel"," Rise in Oscar Nominees Brings New Voting Rules"," Barneys Reportedly Considers Debt Swap"," Economic Recovery or Ski-Jump Recession?"," In Asia, Dangerous Derivatives Said to Return"," Bankruptcy Judge Backs Grupo Mexico Bid for Asarco"," Sparx to Open Global Macro Fund to Investors"," Chevron Offers Evidence of Bribery in Ecuador Suit"," Korea's KB Financial Raises $914 Million in Offering"," Chris Connor, Jazz Singer Whose Voice Embodied a Wistful Cool, Dies at 81"," Volume Turned Up at U.S. Open, Larcher de Brito Wins"," Business Travelers Give Up Amenities to Cut Costs"," The N.H.L. Players Union Dismisses Its Director"," Women’s Rights in Italy"," Louisiana: Former Lawmaker Files for Bankruptcy"," Chevron Offers Evidence of Bribery Scheme in Ecuador Lawsuit"," Justice Department to Recharge Civil Rights Enforcement"," Constitutional Rights Outlined for Montanans"," Procter & Gamble Will Sponsor U.S. Olympic Team"," Russian Premier Calls Nazi-Soviet Pact Immoral"," Finding a Scapegoat When Epidemics Strike"," Kaboom! More ‘Rambo’ and ‘Bad Boys’ Movies"," Business Activity Increases More Than Expected"," A Chicago Production Lures the Wary With a Money-Back Guarantee"," Overseer of Dreamliner Will Retire From Boeing"," Federer and Clijsters Showing Familiar Form at the Open"," Risks: Disparities Found in Heart-Related Deaths"," Price Declines in Europe Seen to Be Moderating"," Like Other Markets, U.S. Follows Shanghai Lower"," Three Genes Determine the Nature of a Dog’s Coat"
"2009-09-02","0"," Afghan Intelligence Officer Killed"," CVB Financial Buys Back Treasury Stake"," Q. and A.: When iPhoto Meets Picasa"," Small Businesses in Iowa Celebrate Democrat's Support for 'Public Option'"," India Sees Tripled CO2 Emissions by 2031"," U.S. Open: Day 3"," S.E.C. Watchdog Releases Madoff Report"," Is Gardening Worth It, Financially?"," Credit Suisse Investment Chief Treated for Cancer"," U.S. Open Cup: D.C. United vs. Seattle"," Swiss Bank Said to Tell Clients to Sell U.S. Assets"," Report Finds Windfall in Bank Executives' Stock Options"," Finance Jobs Hint at Recovery in Asia"," Car Bomb Rocks Athens Stock Exchange"," Credit Suisse Eyes Private Banks, No Word on ING"," Cross Creek Invests in Film Production"," FbFund's Wildfire Builds Brands Contests on Facebook"," Reviving Civil Rights"," Postseason Ticket Prices Evading Comparison"," Wright Rejoins Mets After Missing 15 Games"," Another Fave Hot Dog"," Lawsuit Filed by Principal Fired From Arabic School Is Dismissed"," Back at Open, Dent and Sharapova Win"," Turkey: Border With Armenia Will Open to Trade"," OTB Is in Financial Trouble, but It’s Ready to Roll"," Call to Jury Duty Strikes Fear of Financial Ruin"," On Fifth Avenue, by Way of London, Le Caprice"," Opening Later"," Opening in September"," Freedom Communications Files for Bankruptcy Protection"," Rise in Oscar Nominees Brings Voting Change"," Ambitions and Prices to Suit the Moment"," The Outlook Is Murky for Media Advertising"," A Stillness in the City: The Raw Grace of Noguchi’s Nimble Constructions"," North Korea Opens Border; Again Calls for U.S. Treaty"," In Asia, Financial Sector Jobs Lead Rebound in Employment"," Investors Lose Appetite for Financial Shares"," On Fifth Avenue, by Way of London, Le Caprice"
"2009-09-03","1"," It’s Official: Imus Show to Begin on Fox Business in October"," Record Labels Say Student Is Still Encouraging Illegal Downloads"," In TV Market Share, Does Size Matter?"," Local Locals: Kili and the Dogs"," U.S. Open Day 4: Sept. 3"," Now Opening | Opening Ceremony in Tokyo"," Quanta Strikes $350 Million Deal for Price Gregory"," Stocking Up on Swine Flu Goods"," It's Official: Imus Show to Begin on Fox Business in October"," Finance Gone Wild"," HSBC Banker Sees Opportunity With Hedge Funds"," Exchange Seeks to Link Start-ups and Cash"," Pfizer Pays $2.3 Billion to Settle Marketing Case"," Canada Firm Nabs Sunoco's Heating-Oil Business"," A Reluctance to Retire Means Fewer Openings"," High Stakes for Merck in Litigation on Fosamax"," Greece: Premier Calls for Elections, Seeking ‘a Fresh Public Mandate’"," Oregon Wants ‘Dog Friendly’ to Be Less So"," Customers Angered as iPhones Overload AT&T"," Tackling Business Stress in Trying Times"," Her Eyes Wide Open, Her Feet on the Ground"," The Basics of Starting a Business"," All Is Well With Nadal in Return at U.S. Open"," Digging Deep for an Upset at the Open"," Pfizer Pays $2.3 Billion to Settle Marketing Case"," Deputy Chief of Intelligence Is Slain in Afghanistan"," Bomb Damages Athens Stock Market"," Paid Notice: Deaths  BUCHANAN, HARRY WINTERS III"," Despite Global Recession, A Polish City Is Thriving"
"2009-09-04","1"," Erika Dissipates, New Easterly Wave Developing"," U.S. Open: Day 5"," For the Emir Who Has Everything: Shake Shack"," Comparing This Recession to Previous Ones: Job Losses"," Unregulated Tenants Have Limited Rights"," Analysis: Women's Matches on Friday"," Reader Response: Would Hospital Price Controls Cause Care Shortages?"," Rentals Abound in Hedge Fund Hub"," Letting Children Take Risks"," BOC Suisse Says Funds Approved in Switzerland"," Ending Hospital Price Discrimination Against the Uninsured"," A Year Later, Hedge Funds in Two Camps"," Dismissed but Not Discouraged"," Credit Suisse Said to Eye Mesirow Financial"," Oil India I.P.O. Said to Be Fairly Priced"," Archipelago Learning to Seek Nasdaq Listing"," New Jersey Wins 1,600 Financial Jobs"," South Carolina Wins Opener"," Emboldened by ’08 Race to Roil Waters at Home"," Greek Premier, Dogged by Many Troubles, Takes Risk With Snap Elections"," Inquiry Stokes Unease Over Trading Firms That Shape Markets"," Downloads Continue, Record Labels Say"," Financials Rise, Helping to End 4 Losing Days for S.&P. 500"," Meeting Of The Underdogs?"," Fox Business Network To Simulcast Imus Show"
"2009-09-05","0"," Pac-10's New Commissioner Gets Involved"," Soderling Ends Querrey's Run at the Open"," TV Alert: Tennis Channel to Pick Up Tonight's Open Coverage"," U.S. Open: Day 6"," Knicks’ Long-Term Plans for 2010 Foil Free-Agent Signings"," Setting Priorities in Civil Rights Enforcement"," Italy: Premier Scolds Press"," White House to Open Visitor Logs to Public"," Under Pressure, Ecuadorean Judge Steps Aside in Suit Against Chevron"," Why College Costs Rise, Even in a Recession"," Dent Supplies Excitement on Orderly Day at Open"," The Alchemy of the U.S. Open Schedule"
"2009-09-06","0"," A Dream Interrupted at Boeing"," Buchanan Gets a Taste of Different Sides of the Open"," U.S. Open: Day 7"," Stephanie Liss and Marc Otten"," What Oklahoma's Loss Means"," UConn Opens With a Win Over Ohio"," Former Agent Faces Charges in Drug Case"," 1965 Civil Rights Killing Still Inching Its Way Toward Trial"," The Recession Behind Bars"," A Young French Quartet Is on the March at the Open"," The Wait for Financial Reform"," A Dream Interrupted at Boeing"," Stephanie Liss, Marc Otten"," Alyson Megur and Nicholas Stamos"," Lilia Gerberg and Matthew McCaffree"," Pen Strokes and Gag Lines, a Stimulus Package for All"," New Flood Rules, With a Price Tag"," The River’s Meaning to Indians, Before and After Hudson"," Uploading the Avant-Garde"," Composer Finds a Muse in the Mississippi"," Paid Notice: Deaths  NISSIM, HENRI"," By All Means, Take It Personally"," Paid Notice: Memorials  WEXLER, MELISSA ANN"," Dismissal Clears Way for Clemens to Appeal"
"2009-09-07","0"," The Confusing Diagnosis of Osteopenia"," U.S. Open: Day 8"," Second Week of the U.S. Open"," Volunteers Find Muck and Meaning in Service"," Housing and Civil Rights"," Pettersen Cruises to Victory at Canadian Open"," Like Apple, TV Explores Must-Have Applications"," Intel and Qualcomm Eye Each Other’s Terrain"," Natural Gas Hits a Roadblock in New Energy Bill"," A Minimalist Incarnation of the Stomp"," North Korea Opens Dam Flow, Sweeping Away 6 in the South"," Paid Notice: Deaths  NISSIM, HENRI"," Like Apple, TV Explores Must-Have Applications"," Natural Gas Hits a Roadblock in the Energy Bill"
"2009-09-08","1"," Lincoln Center Theater Will Present a New A.R. Gurney Play"," From the Doghouse to the Board Room"," Hedge Funds Gain for Sixth Straight Month"," U.S. Open: Day 9"," The Mind, Body and Guts of the U.S. Open"," Dog Bites Book"," Ono To Reopen as a Japanese Pub Named After a Racoon-like Dog"," The Morning Skate: Hockey's Neglected Officiating Issue"," A.I.G.'s Stock Falls After Rating Cut"," Butterfinger Hopes Funny Again Means Money"," Guidance Office: Submit Your Questions to Harvard's Dean of Admissions"," A Strike Doesn't Mean the Race Is Off"," Missing the Nuance"," Today in Business Travel"," Kraft Shares Drop as U.S. Markets Open"," What to Watch on Tuesday at the Open"," Swiss Deal With I.R.S. May Hide Some Tax Cheats"," Swiss Ease Bank Secrecy in Treaty With Britain"," Film Financer Seeks to Raise Up to $1 Billion"," Kraft's Bid for Cadbury Propels European Stocks"," Abu Dhabi Fund Bids for Chartered Semiconductor"," Rights in the Workplace"," Mississippi: Driver Killed as Prisoner Van Crashes"," Crack Found in Bay Bridge Postpones Its Reopening"," At Rutgers, It’s a Not-So-Grand Opening"," Abu Dhabi to Purchase Chartered Semiconductor"," Google Tackles Fears on Rights in Book Deal"," In Turbulent Air, Flight Attendants Face Risk"," Chevron Offers Evidence in Ecuador Bribery Case"," Swiss Deal With I.R.S. May Hide Some Tax Cheats"," Russia: Appeal Reopens Murder Case"," Seeing Women’s Rights as a Key to Countries’ Progress"," Study Finds Risk to Some Birds Nesting Near Oil Fields in Alaska"," In School Speech Obama Avoids Political Issues"," Japan’s Next Premier Vows to Cut Emissions Sharply"," In Taming Dogs, Humans May Have Sought a Meal"," Kraft’s Bid for Cadbury Propels European Stocks"," Swiss Ease Bank Secrecy in New Treaty With Britain"," Week 2 Begins at Open With Men Holding Form"," The Bankruptcy Toll"," PREVENTION: Habits May Lower Risk of Breast Cancer"
"2009-09-09","1"," Planning Commission Votes for a Shorter Skyscraper Next to MoMA"," The TV Calendar: Premieres for New and Returning Shows"," U.S. Open: Day 10"," Tavern on the Green Files for Bankruptcy"," Bloggingheads: Health Reform Paradox"," K.H.L. Opener to Be Shown Live on League Web Site [UPDATED]"," ‘Inside of a Dog: What Dogs See, Smell, and Know’"," App of the Week: A Swiss Army Knife for the iPhone"," Oudin Discovers Price of Celebrity"," Listen to Arguments in a Key Campaign Finance Case"," Not Your Average Gallery, or Opening"," No Chest Bumps: Bryan Brothers Lose in Semifinals"," Port Authority Nominee Out in Wake of Cuomo Inquiry"," Match Analysis: Nadal Wore Down Monfils"," Recap of Apple’s Event"," Live-Blogging Apple's Music Event"," Apple Polishes the iPod Lineup"," Apple Polishes the iPod Lineup"," Green Diplomacy on Display at U.S. Mission"," A 'Nuclear Renaissance' Stumbles Forward"," The TV Calendar: Premieres for New and Returning Shows"," Hutchison Whampoa Raises $3 Billion in Bond Issue"," What to Watch on Wednesday at the Open"," Jim Zorn as a Coach: Where Did the Risk-Taker Go?"," Previewing Apple's Musical Mystery Show"," NYSE Euronext to Sell Stakes in Amex Options Unit"," Beijing Bank Regulator to Increase Risk Controls"," Delaware to Open N.F.L. Lottery"," Stockton Chooses Thomas"," Match Analysis: Serena at the Top of Her Game"," Ole Miss Players Battle Flu Symptoms"," Historic Issue on Peary's North Pole Feat"," Sylvia Schur, Food Editor and Developer of Cran-Apple, Dies at 92"," Russia: Moscow Denies Reports on Missing Cargo Ship"," Driver Texting Now an Issue in the Back Seat"," Recession Batters Britain’s Smaller Private Schools"," Lincoln Center Bound: New A. R. Gurney Play"," Clijsters to Face Serena Williams in Semifinals"," Bay Area Bridge Reopens a Day Early After Repairs"," A Summer of Work Opens Medical Students' Eyes"," Clijsters to Face Serena Williams in the Semifinals"," Bay Area Bridge Reopens A Day Early After Repairs"," Bay Area Bridge Reopens a Day Early After Repairs"
"2009-09-10","1"," Missing for Five Days, Glasvegas Lead Singer Resurfaces"," Toronto Film Festival Goes International for Opening"," From the Garden to Broadway: Woodstock Musical in the Works"," Bloomberg L.P. Shows Interest in BusinessWeek"," Au Contraire: Stossel Moves to Fox Business"," For Two Health Care Systems, a Priceless Presidential Testimonial"," At the Open, Double Faults for Style"," Chamber of Commerce and Car Dealers Fight California Emissions Rules"," Geithner Defends Bailout "," Get Out: Singing, Open Mic and Art"," After Open, Oudin Makes a TV Run"," Open Season on Idaho Wolves "," Keeping R.&D. Sacrosanct, Even in Recession"," Ex-Morgan Stanley Banker Convicted of Insider Trading"," Bailouts Are Shrinking, Geithner Says"," Apple's New Nano: Now The World's Smallest Camcorder"," Flushing Fashion | U.S. Open Upsets and Surprises"," Sprint Puts a Twist, and a Higher Price, on More Free Minutes"," Apple’s New Nano: Now The World’s Smallest Camcorder"," Match Analysis: Wozniacki's Winning Approach"," Q & A: Christopher Clarey From the Open"," Monopoly, and Other Real Estate Fantasies"," What Was Missing in Obama's Speech"," What to Watch on Thursday at the Open"," Titans at Steelers: Opener Is a Throwback"," In Dutch Finance Minister, a Voice for the Little Guy"," Cablevision Prices $900 Million Notes Offering"," Stars to Scale Prices"," When Success Means Shifting Gears"," Coinstar Sells Gumball and Video Game Business"," AIDS Activists Issue Grades to Drug Companies"," The Business of Voting Machines"," For OPEC, Current Oil Price Is Just Right"," Wisconsin: Suspect’s DNA Sample Had Been Missing"," Study Spells Out Spread of Brain Illness in Animals"," Brad Paisley Leads Country Music Nominees"," Federer and Djokovic Stay Course for Semifinal Showdown"," McDonald’s Sales Rise 2.2%, but Miss Analysts’ Targets"," Buyers of Huge Manhattan Complex Face Default Risk"," How Oudin's Open Run Compares"," Bryans Ousted In the Semifinals"
"2009-09-11","0"," Microsoft Portable Keyboard Cuts Down on Heft, Logic"," Minnesota Governor Retreats From States' Rights Argument"," A Year of Financial Turmoil"," Illegal Immigrants Could Not Buy Insurance on New 'Exchange,' White House Says"," U.S. Open Semifinals and Finals Rescheduled"," Stalk Exchange | A Twitter Directory"," Is Starting a Business Brave, Smart, Stupid or Nuts?"," Limited Rights for Co-op Tenant"," Now Online | T's Men's Fashion Issue"," Taking Stock of Morgan Stanley's New Chief"," Small Businesses That Produce Goods Have Shed More Jobs"," In Break With Tradition, British Film Opens Toronto Film Festival"," A Battle Over California Emissions Rules"," Justice to Review Microsoft-Yahoo Deal Further"," Buffett-Backed BYD to List on Shenzhen Exchange"," Cautiously, Small Investors Edge Back Into Stocks"," Lawmaker Slams Bank of America on Bailout Exit"," Western Brands May Be a Step Too Far for China"," Justice Dept. to Review Microsoft-Yahoo Deal Further"," U.S. Stocks Rise After Jobs Report"," Weisel Taps Bankers for V.C. and P.E. Businesses"," U.S. Open: Day 11"," In N.F.L. Opener, Steelers Win but Suffer a Big Hit"," Oudin Finds Success at U.S. Open Brings Scrutiny Also"," Mets’ Parnell Keeps Auditioning, and Struggling"," The Court and Campaign Finance"," Limo Drivers at U.S. Open Are Running on Empty"," Israel: Dispute Over Premier’s Absence"," Attempting a Stimulus Package for Clothing Retailers"," John Stossel Leaving ABC for Fox Business"," Cautiously, Small Investors Edge Back Into Stocks"," Friendly Rivals Square Off in Women’s Semifinals"," An Animated Look at Latin America"," Del Potro Defeats Cilic to Reach Semifinals"," Woodstock the Musical"," Procter & Gamble Predicts Sales Will Recover in Fall"," Giants Prepare for Redskins Tackle’s Mean Game"," Seaside Resort of a Certain Age Enjoys an Eclectic Renaissance"," Geithner Says Bailout Programs Are Shrinking"," Ex-Morgan Stanley Banker Convicted of Insider Trading"," U.S. Stocks Rise After Jobs Report"
"2009-09-12","0"," After Long Wait, Wozniacki Works Quickly in Semifinal Win"," Women's Semifinals Under Way"," How the Giants of Finance Shrank, Then Grew, Under the Financial Crisis"," U.S. Open: Day 13"," Saturday at the U.S. Open"," Gerhart Friedlander, Nuclear Chemist, Dies at 93"," Harrington Takes Risks, Thinking Only of the Rewards"," Men’s Final Moved to Monday in Revised U.S. Open Schedule"," U.S. Upgrades Colombia’s Human Rights Score"," Vaccine Supply May Miss Swine Flu Peak"," Jury Deadlock Ends a Trial Over Merck’s Bone Drug"," Lehman Had to Die So Global Finance Could Live"," For a Bounced Check in Dubai, the Penalty Can Be Years Behind Bars"," Environmental Groups Spar Over Certifications of Wood and Paper Products"," Torture Case Against Iraq Contractors Is Dismissed"," Around the World, Stock Markets Fell and Rose, Together"," Caster Semenya Withdraws From Competition Amid Speculation"," Iran’s Supreme Leader Issues New Warning"," Minnesota Governor's Issue"," WHAT IS AN EXCHANGE?"
"2009-09-13","0"," U.S. Open: Day 14"," Intel Is Said to Plot an Executive Overhaul"," Clijsters Wins the United States Open"," Heisman Watch: Tebow and McCoy Are Early Favorites"," Serena Fined for Semifinal Outburst"," The Jets and Sanchez Win Opener, 24-7 (Live Updates)"," Startling End to Semifinal Between Champions"," A Look at Sunday's Matches at the U.S. Open"," Architectural Limbo in Chelsea"," Buchanan Reaches Boys Final"," The Rights of Gay Employees"," Alaska Suit on Judges Is Dismissed"," The Recession’s Racial Divide"," U.S. Revokes Official Visas in Honduras"," Washington, Too, Joins States Divided Over Rights for Gay Couples"," Venezuela Says It Will Buy Russian Missiles"," Flaw in Free Markets: Humans"," Erin Gustafson, David Curtiss"," ‘An Epidemic of Capital Destruction’"," Seeking to Woo the Insured, Obama Cites Risk of Losing Coverage"," Business Moves Home"," Letter: Downside of Pack Animals"," Jun Takahashi | Undercover Agent"," Open the Storeroom: Let’s Put on a Show"," Risks and Retreats"," An Overdog to Root For"," 2009: Thyme-Meringue Cookies With Boozy Apple"," Apples of Her Eye"," Without Health Care, and Just a Hamburger From Financial Ruin"," Paid Notice: Deaths  PINTEL, MORTON"," All the Giants of Finance Fell. 7 Stayed Down."
"2009-09-14","1"," Around the World, Stock Markets Fell and Rose, Together"," Flaw in Free Markets: Humans"," Lehman Had to Die So Global Finance Could Live"," As Obama Goes to Wall St., Bailouts Still in Focus"," Baucus Bill Would Bar Illegal Immigrants From Insurance Exchanges"," Del Potro Stuns Federer to Win Open"," Be the Journalist: Police (and Other) Business"," Key Arguments in Philadelphia Newspapers Bankruptcy Are Postponed"," U.S. Open Champions"," Finally, a Business That Is Too Busy"," Estimate on Senate Finance Draft Dips Under $880 Billion"," Times Site Was Victim of a Malicious Ad Swap"," A New Resource for Travelers"," Intuit to Buy Personal Finance Site Mint.com"," Monday's News Of Hockey, 9/14/09: Isles Open Exhibition Season"," Verizon Explains Coal Rally Sponsorship"," BusinessWeek, on the Block and Ailing"," NEC, Casio and Hitachi to Merge Handset Businesses"," 'An Epidemic of Capital Destruction'"," Ad Shift Throws Blogs a Business Lifeline"," Giants Open Thread: The Return of Umenyiora"," Intel Is Said to Plot an Executive Overhaul"," The Great Pre-9/15 Stock Seers"," Ex-Macquarie Team Starts Helix Hedge Fund"," J&J in Talks to Reduce Price of Elan Deal, Reports Say"," Jets Open Thread: Win, 24-7 (as in All Day Every Day)"," Clijsters Wins U.S. Open Women’s Title"," Paes and Dlouhy Take U.S. Open Doubles Title"," Turning to Premium Credit Cards"," Reforming the Financial System"," U.S. Is Finding Its Role in Business Hard to Unwind"," Police Seeking Missing Yale Student Find Body"," BusinessWeek, on the Block and Ailing"," Ad Shift Throws Blogs a Business Lifeline"," In Shanghai, Police Detain Former Worker at Coca-Cola"," Subway Riders Are Greeted by a Blast of Sol LeWitt Color"
"2009-09-15","1"," Harry Potter Theme Park to Open This Spring"," McCann Is Taking Aim at Bank of America in Court"," JPMorgan in No Hurry to Raise Dividend"," Facebook Says Its Finances Are Looking Up"," 'Young Sex Symbols' Gather at City Hall"," At Risk: The Wedding's Over"," Explaining the 'Exchange': A Primer"," Video: Bernanke on the End of the Recession"," New iPod Nano Fulfills Its Mission, Mostly"," Leno's 10 O'Clock Premiere"," 18 Million Watched Leno Premiere"," Details of Proposed 20 Percent Business Week Layoffs"," Harry Potter Theme Park to Open in Spring"," My Life as a Dog"," The News of Hockey, 09/15/09: Isles Lose; Rangers Open Preseason Tonight"," Insurance Premiums Still Rising Faster Than Inflation and Wages"," Today in Business Travel"," Dubai Fund Struggles With Debt Load"," D.E. Shaw to Open in Dubai"," J&J and Elan Cut Deal Price to Resolve Biogen Dispute"," Stocks React Coolly to Obama's Speech"," Beagle-Smoking Issues"," U.S. Open Men’s Final"," Opening Victory Was Nice; Now Comes First Real Test for Jets"," Ravens’ Foxworth Is Building Home Museum to the Civil Rights Movement"," A Five-Set Reward for the Young and the Weary at the U.S. Open"," New U.N. Agency for Women’s Rights"," Del Potro Stops Federer in Five Sets and Wins Open"," Rights Group Assailed for Analyst’s Nazi Collection"," Turkish Premier Defends Fine on Media Company"," A New Meaning for Cutting Classes"," A Mailbox Overloaded on Politics"," Home Depot Agrees to Sell Martha Stewart Brands"," The Day I Tried to Board With a Gasoline Can"," Inspiration From Bjork, ‘The Alchemist’ and the Sea"," A Dubai Investment Arm Struggles With Debt Load"," Intuit Buys Mint, a Web-Based Finance Competitor"," Sickle-Cell Anemia: Vaccines in Wealthy Countries May Save Lives of Children in Africa, Study Suggests"," Mission Possible: Entertaining Chamber Music"," When a Parent’s ‘I Love You’ Means ‘Do as I Say’"," Risks: Breast Cancer Drugs Bear Health Cautions"," Text of Obama’s Speech on Financial Reform"
"2009-09-16","1"," Bragging Rights for Beatles, Jay-Z on Album Charts"," August Wilson Center Prepares for Opening"," Dan Brown’s ‘Lost Symbol’ Sells 1 Million Copies in the First Day"," Stir-Fried Shrimp With Snow Peas and Red Peppers"," The Writer Opens a Door"," U.S. and U.K. Seek to Monitor Hedge Funds"," Barclays to Sell $12.3 Billion in Illiquid Assets"," For Those Who Missed Jay's Second Show..."," College Corner: Time for Financial Aid"," Dan Brown's 'Lost Symbol' Sells 1 Million Copies in the First Day"," Yankees Announce New Ticket Prices for 2010"," 'Recession Is Probably Over'"," Carlyle and Taiwan Mobile in $1 Billion Swap"," U.S. Rebuffing Big Banks' Push to Exit Bailout"," Fed Chief Says Recession Is 'Very Likely Over'"," Intel Says Europe Erred in Levying $1.4 Billion Fine"," Vacancies Raise Risks and Lower Value for Landlords"," Ex-SocGen Bankers Start Hedge Fund"," Bernanke Speaks, and Markets Inch Higher"," Facebook Says Its Finances Are Looking Up"," Olympian to Miss Championships"," Inquiry Looks Into E-Mail Missing From Boston City Hall"," Pettitte to Miss a Start Because of Achy Shoulder"," Vacancies Raise Risks and Lower Value for Landlords"," For Rosh Hashana, Apple Cake to Call Your Own"," Wages Grow for Those With Jobs, New Figures Show"," Iran Arrests Children of Dissident Clerics"," New Standard Links Mileage and Gas Emissions"," Fed Chief Says Recession Is ‘Very Likely Over’"," Bernanke Speaks, and Markets Inch Higher"," Intel Says Europe Erred in Levying $1.4 Billion Fine"," Insurance Premiums Rising"
