"Date","Direction","Headline"
"2008-09-17","0"," The Candidates on the A.I.G. Bailout"," Google Chief Defends Yahoo Advertising Deal"," Google and General Electric Team Up on Energy Initiatives"," Liquidity trap"," Groups Increase Pressure Over Abortion Rights"," A Democratic Baroness Endorses McCain-Palin Ticket"," How Big are the Risks for Oil Majors Like BP and Shell that Exploit Tar Sands?"," Can Owners Lower the Cost of Condos in a Building Without Offering a Lower Price to Those That Are Sold?"," McCain Daughter's Book Becomes a Best Seller"," On the Financial Crisis: It's Not Just Weak Oversight"," On the Financial Crisis: There Are Bigger Issues"," Expanded Brooklyn Children's Museum Opens"," Endorsements of the Rich and Famous"," The Candidates on the A.I.G. Bailout"," Kickball Feuds, Panda Dancing and Frisbee Prices"," Debate Commission, MySpace Open New Site"," Distressed Investor Sees Possibility of Depression"," Arctic Ice Retreat Misses Last Year's Mark"," European Markets Edge Higher; Asian Rally Fizzles"," After Bailouts, It's Time to Play Offense"," Biotech Offering Will Test Unsettled Markets"," A.I.G.'s $85 Billion Government Bailout"," Cambodia: U.S. Pledges Funds to Khmer Rouge Tribunal"," Italy: Indictment Hearing Opens in Killing of British Student"," Texas: Plane Carrying Federal Officials Is Missing"," North Korea Said to Have Tested Missile Engine"," Missing Teacher Is Found, Alive, Floating in New York Bay"," Head of Conflicts Board Opposes Disclosing Finances"," Asian Markets Rally Early, Then Lose Steam"," Mozzarella, an Unlikely Star, Opens in Midtown"," County Interested in Price of Specials"," On the East Side, Cambodian Two Ways"," Mr. McCain and the Economy"," McCain Laboring to Hit Right Note on the Economy"," Abortion Issue Again Dividing Catholic Votes"," Lawsuit Is Filed to Halt Alaska Dismissal Inquiry"," Risky Real Estate Deals Helped Doom Lehman"," Money Market Fund Says Customers Could Lose Money"," India Grapples With How to Convert Its Farmland Into Factories"," Despite Death Threats, McCartney Plans to Play"," Gasoline Prices Rise, but at a Slower Pace"," Rangel to Stay On as Ways and Means Chairman"," Energy Led Consumer Prices Down in August"," Japan Banking Stocks Suffer Biggest Drop Since 1987"," Study Disputes McCain Figures"
"2008-09-18","1"," McCain Says S.E.C. Chairman Should Be Fired"," The Finance Crisis"," McCain's Position on Spain"," McCain Reveals Dog Tags of Dead Soldier"," Brooklyn Children's Museum Reopens"," Brooklyn Children's Museum Reopens"," And if There Had Been No Bailouts . . ."," Ethics Seminar"," Are Bank Runs a Risk?"," We Are the Dog"," Obama: Is McCain Goldwater or Kucinich?"," Podcast: Rosenberg Case Open and Shut?"," Behind Russia's Crash: Foreign Investors and Oil Prices"," Zune + iPod: A Love Story"," McCain's Curious Comments"," Zune + iPod: A Love Story"," More on Closing the Markets (or Not)"," Will Government Bailouts Lead to Inflation?"," ""Markets Correct Themselves"": Another Take"," Amazon Enters the File-Shipping Business"," Other Stops: Quick-Change McCain"," Does ""Bailout"" = ""Nationalization""? Part 2"," McCain Says S.E.C. Chairman Should Be Fired"," Watchdog Groups Call for Ethics Overhaul"," Should We Temporarily Close the Markets?"," Hedge Fund Closures, By the Numbers"," A.I.G.'s Building, After the Bailout"," Sneak Peek | T's Fall Travel Issue"," Can Markets Correct Themselves?"," Minnesota Bridge Reopens a Year After Collapse"," Does ""Bailout"" = ""Nationalization""?"," '60 Minutes' to Give Hour to McCain, Obama"," A.I.G.'s Building, After the Bailout"," Regulators Change Rules to Soothe Markets"," Hedge Funds Batten Down the Hatches"," A Dark Mood Among Hedge Funds in London"," Hedge Funds May Fund New Disclosure Rules Unpalatable"," Investors Flee Russian Markets"," Abroad, Bailout Is Seen as a Free Market Detour"," Stocks Slump as Investors Run to Safety"," Asia Stocks Take an Early Hit"," Helping New Technologies Grow Into Businesses, the San Diego Way"," European Roundup: Every K.H.L. Scorer Rumored to Be Dissatisfied"," Challenge to McCain’s Eligibility Is Dismissed"," Asia Stocks Take an Early Hit"," House Votes to Expand D.C. Gun Rights"," House Widens Gun Rights in District"," Rules Near for Animals’ Engineering"," McCain, on the Economy"," The McCain of the Week"," In Virginia, Large Voting Blocs for McCain and for Obama"," Panel Calls for Consolidation and Minimum Standards for Judges in Town Courts"," Money Market Funds Enter a World of Risk"," Order to Tuck In Dreadlocks Leads to Civil Rights Lawsuit"," A House Marked by 9 Years of Local Financial Change Now Falls Into British Hands"," Playoffs Open With Parker Chasing a Triple Crown"," New York Times to Add Business Column"," Echoing the Campaign of a Rival, Microsoft Aims to Redefine ‘I’m a PC’"," Solid Computing, for a Price"," McCain Seen as Less Likely to Bring Change, Poll Finds"," A Dark Mood Among Hedge Funds in London"," Helping New Technologies Grow Into Businesses, the San Diego Way"," Abroad, Bailout Is Seen as a Free Market Detour"," New York Times to Add Business Column"," In Washington, Financial Furor Is a First-Rate Chance to Assess Blame"," Pakistanis Say 5 Are Killed by U.S. Missiles in Tribal Area"," Berkeley Approves City-Backed Loans for Solar Panels"," Financial Crisis Enters New Phase"," TODAY IN BUSINESS"
"2008-09-19","1"," McCain on banking and health"," Why Sergey Brin May Have Disclosed His Risk for Parkinson's"," Emmys: Venture Capital Rolls Out the Red Carpet for Joan and Melissa Rivers"," Venezuela Expels U.S. Rights Group"," McCain in Captivity"," Paulson Outlines Financial Rescue"," Shoring Up Money Markets"," Shoring Up Money Markets"," Seeking Financial Advice at the Library"," Now Online | T's Fall Travel Issue"," Alexander McCall Smith's No. 1 Online Novel"," Emmys: Reality TV Goes From Strike Issue to Award Show Star"," Hey, Microsoft Fans: What Would Your Vista Ad Be?"," Abolish the Credit Rating Agencies!"," Mississippi's Governor Gives In"," Putting a Price Tag on a Government Bailout"," McCain Fires at Obama Over Economy"," Financial Stocks Soar Amid Bailout Hopes"," Make It a Rolls-Royce Recession"," Make It a Rolls-Royce Recession"," Brooklyn Children's Museum Reopens"," Bailout Nation"," Treasury to Backstop Money Market Funds"," Big Bailout Plan Is Discussed in Washington"," For Candidates, Finance Crisis Is Posing on-the-Fly Tests"," The 'Retard' Renaissance"," S.E.C. Halts Short Sales of Financial Stocks"," Russia Will Buy Stocks to Combat Market Slide"," House Backs Oil Speculation Bill"," Asian Stocks Rise on Hopes of U.S. Action"," Mississippi: Rearranging the Ballot"," Minnesota: Rebuilt Bridge Opens"," Albany Watchdog Groups Urge New Ethics Monitors"," Panel Proposes Broad Changes in Federal Financial Aid for College"," Chicago Unveils Multifaceted Plan to Curb Emissions of Heat-Trapping Gases"," Obama Attacks McCain in a Bid to Attract Hispanic Voters"," House Backs Oil Speculation Bill"," Liberty Runs Out to Early Lead and Tops Sun in Playoff Opener"," Agreement With Iraq Over Troops Is at Risk"," For Rivals, Finance Crisis Is Posing on-the-Fly Tests"," Vast Bailout by U.S. Proposed in Bid to Stem Financial Crisis"," Veteran-Rookie Pairing Will Open for the U.S."," Folgers Markets a New Coffee to Cost-Cutting Home Brewers"," Lawsuit Against Grisham Dismissed"," The Financial Crisis: A Range of Voices"," Minimalism at 50, Depending on How You Look at It"," Report Accuses Chávez of Abusing Rights"," Theater Ticket Service Opens in Times Square"," At Fund-Raiser, No Financial Crisis"," Oracle Shrugs Off Turmoil in the Financial Markets"," Bush Emerges After Days of Financial Crisis"," A Woman Dreams of Opening a Bookstore, and Defying the Trends"," To Avoid Risk and Diversify, Sovereign Funds Move on From Banks"," Russia Will Buy Stocks to Combat Market Slide"," McCain Seen as Less Likely to Bring Change, Poll Finds"," Privately Owned Fisheries May Help Shore Up Stocks"," The New McCain: More Aggressive and Scripted on the Campaign Trail"," Crude Oil Prices Rise Amid Dwindling Inventories"," China Says More Milk Products Show Signs of Being Tainted"," Fed Offers $180 Billion for Ailing Money Markets"," Ex-Dog Biscuit Factory Is Among New Landmarks"," Venezuela: Report Faults Chávez On Human Rights"," TODAY IN BUSINESS"," McCain's Position on Spain"," U.S. Bailout Plan Lifts Asia Stocks"
"2008-09-20","0"," Moscow Tries to Stir Up Crimean Tatars"," The Emmys: In the Category of 'Cheapest Reality Show That Pays the Network's Bills,' the Nominees Are..."," Candidates React Carefully to Bailout"," Other Stops: The Man Behind the Mean Campaigns"," McCain Breaks His Record in August, Raising More Than $47 Million"," Early Word: Finance and the Campaign"," A Dissent on Cindy McCain's Outfit"," Respond to Today's Column: The Alpha Dogs Bark"," García, Westwood Missing From Lineup"," Costly Financial Rescue Could Narrow Economic Options Later"," The Alpha Dogs Bark"," Pope Seeks Greater Role for Catholics in Europe on Policy Issues"," France Worries About Financial Shock Wave From Across Atlantic"," Hard Truths About the Bailout"," Speculation on North Korean Leader Thrives in Factual Vacuum"," City Issues Controversial New Rules Regulating Cranes at Construction Sites"," McCain’s Camp Tests Fund-Raising Limits"," McCain Tries to Link Obama to Financial Crisis"," In Land of Captivity, Interest in McCain Is Mixed"," U.S. Stock Markets Have Lost Less Than Most Other Nations’"," Meanwhile, the Other No. 2 Keeps On Punching"," In Japan, Financial Crisis Is Just a Ripple"," Finger-Pointing in Financial Crisis Is Directed at Bush"," Minimizing Your Own Exposure to Risks"," Issues Women Care About"," Stimulus Ignites Russian Markets"," Venezuela Expels 2 After Human Rights Report"," Dissidents Win Screen Actors Guild Vote"," Dow Rises 370 Points as U.S. Plans Financial Rescue Package"," Treasury to Guarantee Money Market Funds"," S.E.C. Temporarily Blocks Short Sales of Financial Stocks"," Markets Soar, but New Rules Upset Traders"
"2008-09-21","0"," Interview With McCain on the Financial Crisis"," Interview With Obama on the Financial Crisis"," Palin to Meet With Kissinger, Colombian President"," Obama: No Blank Check on Bailout"," Thinking the bailout through"," Authorization for the use of financial force"," Correction: The Poetry of Scissors and Glue"," Intellectual Moves: A Wallace Sampler"," The Wall Street Bailout Plan, Explained"," Weekley Arrives on the Scene and Finds That García Is Missing"," Hyman Golden, Co-Founder of Snapple, Dies at 85"," For Depression Generation, an Unwelcome Trip Back in Time"," 7 Years Later, 9/11 Hijackers’ Remains Are in Limbo"," Understanding the Price-Earnings Ratio"," Promoting a Vision of Tourist Bliss in Baghdad’s Dusty Rubble"," A Disability Epidemic Among a Railroad’s Retirees"," For Rays, New Success but the Same Old Issues"," Fumbles Are Dogging a Cardinals Rookie"," Roundup: With Doubles Win, U.S. Stays Alive in Davis Cup"," Number of Americans in Premier League Falls"," Obama Criticizes McCain on Social Security"," A Question About Bailouts"," Pact on Debates Will Let McCain and Obama Spar"," A Bailout Plan, but Will It All Work?"," A Professor and a Banker Bury Old Dogma on Markets"," Text of Draft Proposal for Bailout Plan"," Swiss Bliss"," Margaret Geisst, Ralph Baker"," Italian, Busy, Pricey"," For Young Financiers, Risk Hits Home"," Songs Open Doors to the Inner Sanctum"," For Him, Reggae Is the Family Business"," The Camera-Friendly, Perfectly Pixelated, Easily Downloadable Celebrity Academic"," The Securities and Exchange Commiseration"," Apples, Pies and Mazes"," Fuzzy Renaissance"," The College Issue"," Artist in Denim, Back at Work"," Paid Notice: Deaths   REISSMAN, DOROTHY ''TUDDY''"
"2008-09-22","0"," The Ad Campaign: Obama's Chicago, in McCain's Eyes"," The Ad Campaign: Banking Deregulation and McCain's Health Plan"," Nader: Drawing Votes - From McCain"," McCain Steps Up Attacks on Obama"," Obama Urges Caution on Bailout Front"," Poll Reveals Unanimity on Economic Point"," The Sweetest Peppers, Fresh From the Farm"," Brand Is Familiar, but the Product Is New"," McCain Expresses Concerns About Bailout Plan"," A Memento From the Financial Crisis"," Statement by President Bush on the Financial Bill"," A Better Bailout"," McCain Floats Cuomo as Possible S.E.C. Chairman"," Microsoft Migrates From Servers to Supercomputers"," JetBlue Terminal at J.F.K. Reopens After Evacuation"," Short-Selling Ban Expands to Other Markets"," The Early Word: Candidates on the Bailout"," As Treasury Chief Rallies Support, Democrats Set Bailout Conditions"," Congress Faces Major Issues in Final Week"," Nomura Said to Have Reached a Deal for Lehman's Asia Business"," Foreign Banks Hope Bailout Will Be Global"," 2 Candidates Back Bailout, With Caveats"," How Three Economists View a Financial Rescue Plan"," For Banks, Bailout; For Young People, Credit Advice"," In Newest Crisis, Hedge Funds Face Chaos"," Hedge Funds Said to Plan Lawsuit Against U.K Regulator"," KfW Executives Could Face Charges in Lehman Swap Deal"," Russian Billionaire Bolsters Renaissance"," High-Performing Hedge Fund Manager Closes Shop"," 'The Feminine Mystique' Reconsidered"," In-Hock Stock Shock"," Ceremony Minded Its Own Business, Not the World’s"," The $700 Billion Bailout"," Palin Will Meet With Kissinger and Foreign Leaders"," Loan Titans Paid McCain Adviser Nearly $2 Million"," At School of Finance, a Building Block Takes a Tumble"," Young and Arab in Land of Mosques and Bars"," Barack Obama, John McCain and the Language of Race"," 2 Candidates Urge Greater Oversight in Bailout Plan"," Missed Kick Saves Broncos, and Made One Lifts Jaguars"," Democrats Set Terms as Bailout Debate Begins"," After Ousting U.S., Spain Will Face Argentina in Davis Cup Final"," For Banks, Bailout; For Young People, Advice About Credit"," Float Like a Bird and Sting Like a Missile"," In Newest Crisis, Hedge Funds Face Chaos"," How Three Economists View a Financial Rescue Plan"," Foreign Banks Hope Bailout Will Be Global"," Abortion: One Issue or the Issue?"," In Scary Times, Advertising Firms Offer Messages of Strength"," Scholastic Cuts ‘Bratz’ Products for Book Clubs and Fairs"," TODAY IN BUSINESS"
"2008-09-23","0"," McCain Stands By Fiorina"," The Shocking Truth About Solar Panel Theft"," 'Radical Openness' on the Google Phone - at Least for Now"," Night Shift | Day Trader"," Economic Roundup: Analysts Discuss the Proposed Bailout"," Roasted Pepper and Tomato Salad"," What the Financial Crisis Says About the Candidates"," What the Proposed Bailout Means for the Deficit"," The Dogs of Law"," Obama Says Bailout Should Include 4 Conditions"," New Era for Ole Miss"," Where Are Home Prices Headed? (Or: What Are Those ""Bad"" Mortgages Treasury Wants to Buy Actually Worth?)"," McLaren Appeal Inadmissible"," 'Dancing' Leads a High-Rated Monday of Premieres"," McCain Praises Obama's Style, but Says He Will Prevail on Issues"," Other Stops: Who's In Charge of the Financial Crisis?"," The Financial Meltdown: Congress Gets a Sudden Taste for Oversight"," The War on Financial Terrorism?"," Affordable Housing Effort Reaches Halfway Point"," New Season: New Benchmarks for Success"," A Bailout Bill Takes Shape"," S.E.C. Chair: Regulate Credit-Default Swaps Now"," Open Market: A Reader Contest"," On Brookings's ""Brief Guide to Fixing Finance"""," A.C.C. Notebook: Seminoles' Soft Start Turns Rough"," Silicon Valley Barely Touched by Financial Crisis - So Far"," Possible Food Price Fixing"," Paulson on the Hill: Lawmakers' Opening Remarks"," Balance sheet baloney"," I Want Candy (at Lower Prices)"," 'Here's the Way a Bailout Works'"," What Are the Other Bailout Options? An Explainer"," Following the Bailout Hearing"," Oracle's Homegrown Push to Out-Collaborate Microsoft"," The Paradoxes of Arctic Energy"," A McCain Sampler"," Mayor Considers 7 Percent Property Tax Increase"," Short-Selling Ban Prompts Grumbling From Hedge Funds"," Experts See a Need for Punitive Action in Bailout"," Hedge Funds Try to Find Footing Amid Bailout Proposals"," Stocks Fall in Europe and Asia"," New York to Regulate Credit-Default Swaps"," Stopping a Financial Crisis, the Swedish Way"," Media Heavies Help Finance Trion World"," Carlyle May Open Its Wallet for Bailout Assets"," Bailout Talks Advance Amid Heated Debate"," Russian Tycoon to Buy Half of Russia's Renaissance Capital"," Some Lehman Units Reopen for Business"," With Bailout Picture Unclear, Markets Tumble"," McCain, More Critical of Bailout Plan, Faults Oversight"," Microsoft, H.P. and Nike Announce Buyback Plans for Shares"," A Bailout Above the Law"," Housing Experts Say Bailout Proposal May Do Little for Homeowners"," Trial of Alaska Senator Opens"," As the Giants of Wall Street Topple, Smaller, Nimbler Rivals Move In"," With Bailout Picture Unclear, Markets Tumble"," Last Two Big Investment Banks Reinvent Their Businesses"," McCain, More Critical of Bailout Plan, Faults Oversight"," Finale Had Too Much Familiar and Too Much Missing"," Risks for Zimbabwe Deal in Mbeki’s Resignation"," Experts See a Need for Punitive Action in Bailout"," Bailout Talks Advance, but Doubts Voiced in Congress"," Nike Leaves Elite Swimwearto Bigger Fish in the Market"," Would You Ask a Psychic for Stock Tips? More Often, Clients Do"," Microsoft, Hewlett-Packard and Nike Announce Buyback Plans for Shares"," McCain Camp Takes Issue With Times Coverage"," Missouri: Animal Park Owners Charged"," Trial Opens in Courthouse Killings"," New York to Regulate Credit Default Swaps"," Dog Owner Sent to Prison for Murder in ’01 Mauling"," Obama Carries Uneven Record as Debater to First Contest With McCain"," A Scrappy Fighter, McCain Honed His Debating Style in and Out of Politics"," Business Travelers Expect a Squeeze on Expenses"," In Fiscal Crisis, Mayor Considers Raising Property Tax 7 Percent"," So McCain Would Like Cuomo for the S.E.C.? New York Politicians Chew It Over"," Hookworm Infection Linked to Anemia Among Pregnant Women in Africa"," Hotel Bars Find a Market for Fancy Drinks"," Cycling in America Is One Big Exchange Program"," Idea for McCain Sketch Attributed to Franken"," Shell Opens an Office in Baghdad After a 36-Year Absence"," Stopping a Financial Crisis, the Swedish Way"," Crude Oil Prices Up More Than $16"," TODAY IN BUSINESS"," Stocks Fall as Rescue Plan Is Negotiated"," Campaign '08: The Debates: McCain's Style: A Fierce Rival"," Banking Deregulation and McCain's Health Plan"," Obama's Chicago, in McCain's Eyes"
