"Date","Direction","Headline"
"2006-03-20","0"," Avoid Bankruptcy.  Borrow More!"," SBS Fetches Big Premium in G.E. Takeover"," VeriSign Opens Wallet Again for Wireless Content"," Prudential Shares Surge on Hopes for a Higher Takeover Price"," London Exchange Shares Climb on Report of Renewed Talks With Euronext"," Florida's Freedom Bank Prices Offering"," Breaking With Policy, St. Paul Travelers Denies Merger Rumors"," Investment Bank McColl Garella Shuts Its Doors"," While AT&T Does Deals, Verizon Spends to Hone Its Networks"," Citizens Financial CEO Sees Salary Bonanza"," British Mergers Rife With Insider Trading"," While AT&T Does Deals, Verizon Spends to Hone Its Networks"," Merck to Enter a Venture for Pain Drugs"," T.V.A. Coal Emissions"," Metro Briefing | New York: Manhattan: Endorsements Made"," Grisly Discovery Reopens Old Wounds in Village in India"," Stock Offerings This Week"," A Seemingly Modest Fate for a Lofty Card"," Emirates Aided Kin of Palestinian Militants"," Metro Briefing | New York: Manhattan: Missing Boy Found"," BUSINESS DIGEST"," Andrew Sherratt, 59; Studied Animal Husbandry"," The Meaning of Life, or the Joys and Challenges of Life With Chopsticks"," The Speculation Won't Stop, But All Is Quiet With Cuba"," Microsoft Takes On Craigslist in the Battle for Classified Ads"," Zurich American Agrees to Settlement in Price-Fixing Suit"," Zurich American Agrees to Settlement in Price-Fixing Suit"
"2006-03-21","0"," Overstock.com Father-Son Team Says There's No Feud"," Infuriated Softbank Chief Is Said to Have Issued Vodafone an Ultimatum"," American Express Sells Brazil Operations to Bradesco"," Tim Hortons Lifts Price Range for I.P.O."," Pension Funds' Stakes in Hedge Funds Sparks Political Outcry in Massachusetts"," Forget the Share Price, What About the Parking?"," Branson Said to Be Looking at Bally Chain to Build Up  Fitness Business"," Microsoft to Buy Maker of Remote Sensors"," Jefferson-Pilot Merges With Lincoln Financial"," Following Icahn's Lead, Hedge Fund Buys Lexar Stake and Opposes Match"," Nissan Sells Nissan Diesel Stake to Volvo"," Pfizer Is Poised to Add Another $10 Billion to Its Coffers"," Writer Depicts Scientists Risking Glory for Truth and Truth for Glory"," F.B.I. Agent Testifies Superiors Didn't Pursue Moussaoui Case"," Microsoft Develops Version Of Internet Software Tools"," Talk Therapists Cite Major Strides in Fending Off Depression Among the Elderly"," Cuba's Dance Through Classic Ends in Manager's Missteps"," BUSINESS DIGEST"," Richard K. Root, 68, Educator And Epidemiologist, Is Dead"," Metro Briefing | New York: Manhattan: New Consumer Affairs Commissioner"," World Business Briefing | Americas: Canada: Sears Holdings Persists in Sears Canada Offer"," Business Prepares for the Possibility of Avian Flu in the United States"," New Business Blooms in Iraq: Terror Insurance"," Google Offers Search Service On Finance"," For Matsui, the Game Is Serious Business"," Israel Briefly Reopens a Gaza Crossing to Send In Food"," Now This Is What World Series Is Supposed to Mean"," Andersen's Dismissal Is Upheld"," National Briefing | South: Tennessee: Protest For Disabled Rights"
"2006-03-22","1"," Secret Commission Rebates"," Nextest Systems Prices Its I.P.O."," L-3 Buys Two Firms to Bolster Security Systems Business"," Challenge to iPod Restrictions Advances in French Legislature"," Accused Hedge Fund Manager Fears NFL Clients"," British Credit Rating Firm Is Said to Have Rebuffed Buyout Suitors"," Swiss Private Bank Lets Foreign Directors into the Club"," Lucent Wins Bankruptcy Auction for Riverstone"," AT&T Chief Says Merger Will Not Create Monopoly in Internet Access"," Korea's Largest Lender Set to Take Stake in Korea Exchange Bank"," Researchers Find New Details on Transmission of Avian Flu"," Flaw Seen in Genetic Test for Breast Cancer Risk"," Superior Says He Didn't See Agent's Report on Moussaoui"," Where Have All The Supermarkets Gone?"," A 3rd Rise in Core Wholesale Prices Spurs Concern Over Inflation"," Chertoff Seeks a Chemical Security Law, Within Limits"," Arts, Briefly; Julianne Moore to Star in David Hare Broadway Premiere"," Army Dog Handler Is Convicted In Detainee Abuse at Abu Ghraib"," Seminary Students"," BUSINESS DIGEST"," The Critics Missed the Cheers Heard Around the World"," Microsoft To Delay New System"," Pataki Bars His Appointees From Raising Funds"," For a Reasonably Priced Red, a Budget Cut of Beef. Keep the Change."," Running Away From the Pack In Japan; A Gamble on L.C.D. TV's Meant Survival for Sharp"," French Premier Considers Easing Job Law"
"2006-03-23","0"," Delphi Shareholders Get a Voice Thanks to an Activist Hedge Fund"," When Dissent Goes AWOL"," American Stock Exchange Ponders I.P.O."," Business Meetings in a Strip Club?"," Seeking to Mollify Europe, Microsoft Offers to Assist Rivals"," Financial Chief Quits Freddie Mac"," 3 Samsung Executives  to Plead Guilty in  Price-Fixing Case"," Survey: Hedge Fund Investment to Grow 28% in 2006"," Schering Prepares for Battle With Merck of Germany"," Koomkin Pays $7.2 Billion for Korea Exchange Bank Stake"," Studies Suggest Avian Flu Pandemic Isn't Imminent"," Different Drug Often Works in Depression, Study Finds"," Parents Held In Murder Of Girl, 4, Long Missing"," Microsoft Offers To Assist Rivals"," 3 to Plead Guilty in Samsung Price-Fixing Case"," Paul Bunyan, Modern-Day Sex Symbol"," Labor Protests Put French Premier in a Bind"," So You Think You Can Just Adopt a Dog?"," BUSINESS DIGEST"," Roberts Dissent Reveals Strain Beneath Court's Placid Surface"
"2006-03-24","1"," Merger of Equals? Credit Rating Firms Beg to Differ"," Openings: PIXAR at the MoMA"," As Tim Hortons' I.P.O. Soars, Wendy's Stock Sags"," Merck Drops Schering Bid After Bayer Rides In"," Talks for Lucent May Signal End for 90's Symbol"," Suez Wants End to Speculation on Bid"," Tekelec Gets Delisting Notice"," Schonfeld Group Moves Into Hedge Fund Game"," Mobsters Charged in Penny Stock Scheme"," British Watchdog to Loosen Hedge Fund Rules"," Sad Money? Cramer's Stock-Picking Prowess In Question"," Paid Notice: Deaths   PRICE, DR. STEPHEN S., ED.D."," Basque Nationalists See an Opening for Autonomy"," A U.S. Advisory About Travel In Italy Becomes A Political Issue"," Hewlett-Packard Adds McCann to Agency Roster"," Talks for Lucent May Signal End For 90's Symbol"," BUSINESS DIGEST"," Stoudemire Is Brilliant, and Suns' Hopes Are Brighter"," Waiting on Deck in the Lineup for Rights"
"2006-03-25","0"," Tackling the Animal-to-Human Link in Illness"," Red Cross Fires 2 Managers In New Orleans Amid Audit"," As Indian Premier Calls for Treaty, Pakistan Says Kashmir Is the Key"," As Parents Age, Baby Boomers And Business Struggle to Cope"," A Merger Means a Payout for Lucent Chief"," BUSINESS BRIEFS"," Out of the Doghouse Into the Grand Tier At the Opera House"," Does a Seal Do a Dog Paddle?  "," Johnson Is on Target, but Posada Is Questionable for Opener"," Social Workers at Risk"," Google Finance: A Portal Play?"," Health Experts Meet in Atlanta to Tackle the Deadly Animal-to-Human Link in Illness"," A Video Game With Death on Its Beta"," Time to Stall a Bush Nominee"
"2006-03-26","0"," League Switchers Are Risky for the Red Sox"," True or False: A Hedge Fund Plotted to Hurt A Drug Maker?"," Woods Rehabilitation At an Unwanted Price"," After Katrina, Taking On 'Big Dogs'"," LIVING IN/SoHo; Cast-Iron Buildings, Gold-Plated Price Tags"," Mental Health Therapists Face Financial Stress as Fees Stagnate"," Retired F.B.I. Agent Is Accused of Helping in Mafia Murders"," In Dubai, an Outcry From Asians for Workplace Rights"," Woods Rehabilitation At an Unwanted Price"," Kiss Me, I'm Illegal"," An Open Case"," Sports of The Times; When They Say 'Athletes,' What Do They Really Mean?"," At Risk: Chapter 12: Follow the Money"," Avian Flu Is Already a World Pandemic"," Plan Is Floated to Open Choice of Premier to Iraqi Parliament"," IN THE REGION/Long Island; When the Asking Price Is $55 Million"," From School Auditorium to Capitol Records"," STREET LEVEL/West Chelsea; In Club Land, 'Neighbors' Doesn't Mean Nearby"," From One Commissioner to Another"," Jews in France Feel Sting as Anti-Semitism Surges Among Children of Immigrants"," On the Ethanol Bandwagon, Big Names and Big Risks"," Nena O'Neill, 82, an Author Of 'Open Marriage,' Is Dead"," Woods Rehabilitation At an Unwanted Price"," Cellphones in Flight? This Means War!"," The Case of the Missing Golf and Other Mysteries"
"2006-03-27","0"," Buy Seven For the Price of One"," Angular Apples"," Goldman Sachs  in Two European Deals"," For a 3d Time, Two Apples Meet in Court"," Zurich Financial May Pay  $100 Million to Settle Investigations in U.S."," True or False: A Hedge Fund Plotted to Hurt a Drug Maker?"," Zucker Looking to Unload About 80 Hudson Bay Stores"," Brazilian Police Arrest Credit Suisse Bankers"," Goldman Sachs Plays Catch-Up With Fund of Funds"," Online Exchange Reels In Investments"," How Serious Is the Risk of Avian Flu? "," Australian Stock Exchange Buys Sydney Futures"," On the Ethanol Bandwagon, Big Names and Big Risks"," Windows Is So Slow, But Why?; Sheer Size Is Causing Delays for Microsoft"," BUSINESS DIGEST"," For a 3rd Time, Two Apples Meet in Court"," Stock Offerings This Week"
"2006-03-28","0"," After Flip-Flop, Cablevision Moves Toward $3 Billion Dividend"," Apple C.E.O. Jobs Pays His Taxes - With Apple Stock"," A Plea for Openness from Political Bloggers"," Mentor Unloads Urology Unit"," New Breed of Trading Networks Threatens Exchange Giants"," Arch Rock Anchored by Intel Funds"," Moscow to Hear Yukos Bankruptcy Suit"," Bank of America Unit Prices Offering"," Lucent Talks Raise Issue of Security"," KKR Ready to Put Sealy IPO to Bed"," McClatchy Sale Attracts Would-Be Press Barons"," Will This Man Regulate Hedge Funds?"," Weeks After Killing It, NASA Resurrects Mission to Visit Asteroids"," Making a Ferret Sneeze for Hints to the Transmission of Bird Flu"," On the Front: A Pandemic Is Worrisome but 'Unlikely'"," With Every Epidemic, Tough Choices"," BUSINESS DIGEST"," How Serious Is the Risk?"," Making a Ferret Sneeze for Hints to the Transmission of Bird Flu"," As Prices Rise, Loyalty Follows the Lowest Fare"," Google, Once a Maverick in the Business World, Joins the Washington Lobbying Herd"," Lucent Talks Raise Issue Of Security"," World Briefing | United Nations: End Of The Line For U.N. Rights Commission"," Brazil's Finance Minister Quits Amid Continuing Political Scandal"," N.F.L. in No Hurry to Name Commissioner"," Preservationists Visit Hemingway's Cuba"
"2006-03-29","1"," Another Hedge Fund Goes Hollywood"," Lear to Swap Unit for Stake in Wilbur Ross Venture"," Bids Due for Pfizer's Consumer Unit; Will Colgate Bite?"," Moroccan Minimalism"," McClatchy Accepts Bids"," Intel Creates Brazilian Venture Fund"," Yukos Is Pushed Closer to Bankruptcy"," Intel Defends Business Practices in Europe"," Apple Computer Executive to Depart"," European Commission to Sanction Spain Over Blocked Bid"," Vienna Prosecutor Issues Arrest Warrants in Refco Affair"," Linden Lab Offers Toehold in Games Industry Without the Big Pricetag"," Yale Cuts Ties With Hedge Fund It Helped Found"," Wall Street C.E.O.'s: Their Money Is Where Their Stock Is"," Hedge Fund Hopes for a Higher Lexar Bid Fade"," Rumors of CBS Bid Lift Univision's Stock"," China Passes Japan in Foreign Exchange Reserves"," How Pink Slips Hurt More Than Workers"," After Dubai Uproar, Emirates Air Holds No Grudges"," Russian Company Moves Closer to Bankruptcy"," Paid Notice: Deaths   GREENHOUSE, AURORA DE LA LUZ FERNANDEZ Y MENENDEZ"," BUSINESS DIGEST"," Bush Opposes Iraq's Premier, Shiites Report"," Protection for Indian Patrimony That Leads to a Paradox"," G.M. Will Also Restate Results for Its Finance Unit"," Influence in Iraq Emerges as Key Issue as Arab Conference Opens"," Possible Opening for Unions In German Software Company"," Democrats Opening Assault On Bush Security Policies"
"2006-03-30","0"," London Exchange Is Looking Lonely"," David Pogue: Windows on an Intel Mac"," Asset Swap Considered in Bank of New York Deal"," Slide Show: Recent Openings"," Tim Hortons Underwriters Pick Up More Stock"," Judge Blocks Microsoft Request for Rivals' Documents"," Greater Clarity Needed for Financial Reports, House Told"," Mittal to Cut Arcelor Bid if Dividend Is Approved"," Germany's Infineon Said to Be Looking at a  Nasdaq Listing"," Verizon Broadband Decision Is Challenged"," Caterpillar to Purchase Finning Unit"," Who's Afraid of Microsoft? Not VC's"," British Court Hears Apple v. Apple"," Medical Financial Tool Provider Gets Funding"," Hedge Funds Reap Big Gains Betting on Mergers"," Pfizer's Big Sale Not a Sure Thing"," Nasdaq Pulls $4.2 Billion Bid For London Stock Exchange"," Russia Says Belarus Must Now Pay Market Price for Gas"," Scans Show Different Growth for Intelligent Brains"," Doubt Cast on Stockpile of a Vaccine for Bird Flu"," Beleaguered Premier Warns U.S. to Stop Interfering in Iraq's Politics"," BUSINESS DIGEST"," Justices Hear Arguments Over Whether Foreigners Have Reciprocal Rights in the U.S."," The Watchdog Awakes"," British Court Hears Apple v. Apple and 'Le Freak'"," Retired F.B.I. Agent Turns Himself In to Brooklyn D.A."," G.O.P. Risking Hispanic Votes On Immigration"," Jagr Dog-Ears Page in Record Book"," Concerns Voiced in Europe Over Microsoft's Next Windows"," Metro Briefing | New Jersey: Trenton: Fire Warning Issued For Dry Spring"," A Feminine Mystique All Her Own"
"2006-03-31","0"," Hedge Fund Pay Dirt: Who Earned The Most in 2005?"," London's Cold Shoulder Froze Nasdaq"," Accused Hedge Fund Manager Now Faces Criminal Charges"," Citigroup Sued by Australian Regulator for Insider Trading"," U.S. Asks European Union to Be Fair in Microsoft Case"," Shareholder Unloads China Life Shares"," Apple Defends Its Use of Logo on iTunes Store"," Heat-Technology Startup Hyperion Innovates for Dogs"," Panels Approve Bills About Ports Issues"," Boeing-Lockheed Rocket Merger Said to Be in the Works"," Swatting at the Hedge Fund 'Locusts'"," Guarding  Citadel: A Hedge Fund Story"," Colgate Said to Want Entire Pfizer Unit"," At Sept. 11 Trial, Tale of Missteps and Management"," College Admission Angst Finds a Forum on Web"," Russia Raises Price of Gas for an Ally, Belarus"," Lisa Kron's 'Well' Opens on Broadway, With Mom Keeping Watch"," U.S. Asks European Union To Be Fair in Microsoft Case"," Nasdaq Withdraws Offer for London Stock Exchange"," Ground Zero Still in Limbo As Talks Fail"," Paid Notice: Deaths   BUCHANAN, JEAN COOPER"," Film in Review; Marilyn Hotchkiss Ballroom Dancing and Charm School"," Arrow Points to the Jump Ball's Demise"," Chemical Plant Security"," House, on Party Lines, Passes College Finance Bill"," BUSINESS DIGEST"," For Hedge Funds, Life Just Got a Bit More Complicated"," F.B.I. Colleagues Help Ex-Agent Post Bail"," Pataki and Budget Chief Open Up on Legislators' Plan"
