"Date","Direction","Headline"
"2006-03-01","1"," Wachovia Hires Head of European Investment Banking"," Bank of China IPO May Raise $8 Billion in Hong Kong I.P.O."," Dave &#038; Buster&#8217;s Stockholders Approve Buyout"," Senior Refco Executive Says Clients Knew Risks"," Overstock to Restate Financial Results"," Ford Seen Snubbing Financial Firms in Plant Sale"," Bingham McCutchen Wraps Up Merger"," Shopping Data Provider Bags $19.3M Funding Round"," Synchronoss Technologies Files for IPO"," Vega, BBVA in Hedge Fund Joint Venture"," Targeting Intel, AMD&#8217;s Lawyers Call on Skype"," Regulators Approve Patch to Treat Depression"," Regulators Approve Patch to Treat Depression"," Lehman, Lightyear Joining Reinsurance Rush"," NYSE Seeks Regulation Alliance"," Enron Figures Tell How Results Were Manipulated"," Hedge Fund&#8217;s Money Is AWOL"," France Probes British Hedge Fund"," Microsoft Steps up EU Battle by Publishing Dispute File"," NASA to Cut Back Scientific Missions Because of Budget"," In Search of Profitability, JetBlue Increases Prices"," Computer Technology Opens a World of Work to Disabled People"," Storm's Missing: Lives Not Lost but Disconnected"," Rights and the U.N."," Apple Offers Hi-Fi System To Use iPod In the Home"," Smithsonian's Doors Open to a Hip-Hop Beat"," BUSINESS DIGEST"," Accused of Aiding Animals By Making Prey of People"," Paid Notice: Deaths   MCCORMICK, WILLIAM T."," Fewer Audits Of Oil Leases"
"2006-03-02","0"," Memory Makers Plead Guilty to Price Fixing"," Patent Ruling to Benefit Big Business"," Goldman on Sidelines as NYSE Sets Banking Team"," Overstock Chief Says S.E.C. Investigated Journalists on Its Own"," Dana&#8217;s Missed Payment Stokes Bankruptcy Fears"," Agents Provocateurs"," Analyst Unimpressed by Intrawest Move"," U.K. Hedge Fund Faces Deadline to Appeal Fine"," Chipotle IPO Spiced Up February"," Wall Street&#8217;s Spring Line-up: Taking Stock"," IXI Mobile Acquired in $42 Million Stock Deal"," Recent Openings"," Budget Cuts Back Much-Promoted NASA Missions"," Human Rights Director Urges Europe to Improve Oversight"," Emirate Wakes Up Famous. Thank You, America."," State Bars a Bronx Lawyer From Receiving Court Appointments"," Parts Supplier Says It Missed Bond Payments"," Paid Notice: Deaths  DOLNY, LIPSY, DENYSE"," BUSINESS DIGEST"," World Business Briefing | Asia: India: Morgan Buys Real Estate Stake"," U.S. Stockpiles Antiviral Drugs, but Democrats Call Pace Too Slow"," Apple Laptop Has Looks And Brains"," A New Season Arrives With a Paul Taylor Premiere"
"2006-03-03","0"," AK Steel Stock Surges After Report of Takeover Talks"," U.S. Opens Inquiry into Online Music Pricing"," Post-Google, Hambrecht&#8217;s OpenIPO Gains Traction"," Northstar Neuroscience Files for IPO"," U.K. Water Company to Sell Construction Business"," Xstrata Stirs Speculation of Falconbridge Bid"," Intel Invests in Small Cisco Rival"," Microsoft Accuses Europe of Colluding With Rivals"," Icahn Ends UAE Contract Pinned to Time Warner Stock"," Bell Globemedia May Stage IPO"," Judge Dismisses Shareholders&#8217; Putnam Suit"," Microsoft Accuses Europe Of Colluding With Rivals"," A New Visit to the State of Wedded Bliss"," A New Visit to the State of Wedded Bliss"," Pick-Your-Price Public Offerings"," A New Visit to the State of Wedded Bliss"," Six Animal Rights Advocates Are Convicted of Terrorism"," World Briefing | Americas: Haiti: New President's Inauguration Postponed"," Paid Notice: Deaths   REISS, JERRY"," Much Talk of a Nuclear Renaissance, but So Far Little Action"," Dissenting on Atomic Deal"," BUSINESS DIGEST"," ARCHIVIST URGES U.S. TO REOPEN CLASSIFIED FILES"," National Briefing | Midwest: Illinois: Commission Members Resign In Protest"," City Inmate Population Up; Brooklyn Jail May Reopen"," S.E.C. to Issue Guidelines On Subpoenas To Journalists"," Yellowing Paper, Stiffening Glue and the Sudden Demise of a Library"," A New Visit to the State of Wedded Bliss"," Paid Notice: Deaths  ABRAMS NEHEMIAH, ELAINE"," World Business Briefing | Asia: Singapore: Court Fines 3 China Aviation Officials"
"2006-03-04","0"," BUSINESS BRIEFS"," Dana, a Parts Supplier, Files For Bankruptcy Protection"," Another Bailout Is Sought For Nassau Health Agency"," U.S. Isolated in Opposing Plan for a New U.N. Rights Council"," 1,200 Sled Dogs, Too Little Snow"," Mixing Fact And Fiction To Open UpLarger Reality"," Intel Warns of Weaker Demand and Revises Forecast"," Even Those in the Semifinals Sometimes Can't Find the Path"," Cash Film's Missing Ingredient: Religion"," Noodle Prices Rise, Along With Chinese Tempers"," Teachings of a Missionary From the Old World"," Human Rights at the U.N."," A Load Of Manure"
"2006-03-05","0"," In the Alps, Wide-Open Slopes and Crowded Bars"," Allison Weiss, Chip Brady"," Chinese Premier Pledges Help for the Rural Poor, Playing Down Growth of Military Spending"," Style:  Agents Provocateurs"," Other Voices: Mulling the Meaning of Journalists' Discounts; Where Are the Roll Calls?"," The Obscure and Uncertain Semiotics of Fashion"," What Does It Mean to Be Educated?"," Oscar Gifts Taxable, I.R.S. Reminds Stars"," A Veteran of Dissent Screens the Films and Takes the Heat"," Dr. Who 2: Sexed-Up British Intelligence"," Other Voices: Mulling the Meaning of Journalists' Discounts; Where Are the Roll Calls?"," Conduct With All You've Got, Conk Out During Intermission"," Finding Historical Loops, and Opening Them"," Other Voices: Mulling the Meaning of Journalists' Discounts"," Other Voices: Mulling the Meaning of Journalists' Discounts; Where Are the Roll Calls?"," For Some Die-Hards, Spring Means the Season Is Just Warming Up"," From Pariah To Premier In Chechnya"," What Does It Mean to Be Educated?"," When the City Is Your Boss, Your Salary Is an Open Book"," At Risk: Chapter 9: Fatal Connections"," Black Shrouds and Black Markets"," In Bars Where a Woman Spent Her Final Hours, the Curious Mix With the Unaware"," U.S. Commander Meets With Iraqi Leaders on Impasse Over Premier"," WHY WE TRAVEL: DUBAI, UNITED ARAB EMIRATES"," DataBank: FEBRUARY 27-MARCH 3; Nasdaq Defies Its Peers and Climbs for the Week"," What Does It Mean to Be Educated?"," In New Haven, a Premiere Gets the Star Treatment"," Other Voices: Mulling the Meaning of Journalists' Discounts"," Other Voices: Mulling the Meaning of Journalists' Discounts"," Other Voices: Mulling the Meaning of Journalists' Discounts; Where Are the Roll Calls?"," What Does It Mean to Be Educated?"," Other Voices: Mulling the Meaning of Journalists' Discounts; Where Are the Roll Calls?"," Welcome To Limbo"," Other Voices: Mulling the Meaning of Journalists' Discounts; Where Are the Roll Calls?"," The Improvisational Extended Family"," What Does It Mean to Be Educated?"," Other Voices: Mulling the Meaning of Journalists' Discounts"," Other Voices: Mulling the Meaning of Journalists' Discounts; Where Are the Roll Calls?"," Travelers on the Road to Discovery, Fueled by the Imagination"," Other Voices: Mulling the Meaning of Journalists' Discounts; Where Are the Roll Calls?"
"2006-03-06","0"," Kohl&#8217;s Hands Off Credit Card Business to J.P. Morgan"," Freakonomics Guys Looking for Agents"," China&#8217;s ICBC Considers Four Banks for $10 Billion IPO"," Hedge Fund to Vote Against Chiron Merger"," As NYSE Finalizes Merger, It Looks for Acquisitions"," Toro Energy&#8217;s IPO 190 Percent Oversubscribed"," Barron&#8217;s Roundup: Shiny New Spinoffs, NYSE Overpriced?"," Bush's Foreign Policy: Sharansky Dissents"," Wynn Sells Macau Casino Rights Amid Development Frenzy"," Chinese Bloggers Grapple With the Profit Motive"," U.S. Open Will Use Replay To Review Disputed Calls"," Stock Offerings This Week"," In Parody Video, Writers Ridicule Placing Products"," BUSINESS DIGEST"," Drive Time Increasingly Means Talk Time"," Academic, Heal Thyself"," For Designers, an Image-Making Bonanza That Is Priceless"
"2006-03-07","1"," Analysis: Cisco Goes Far From Home for Latest Purchase"," Former SAC Managers to Start Hedge Fund"," LSI Puts Chip Business Up for Sale"," Ahold Fraud Trial Opens in Amsterdam"," HSBC Nears Completion of Investment Banking Build-Up"," Chinese Record Labels Seek IPO&#8217;s"," Credit Suisse Leads $17.5 Million Round for Copan Systems"," Macquarie Korea Fund Stock Debuts Amid Weak Demand"," AT&#038;T Move May Spur Verizon to Make a Deal of Its Own"," Is Antitrust No Longer the Issue?"," Dana Finance Chief Shifts to Consultant"," Ex-Trader on Philadelphia Exchange Wins Assault Suit"," Abortion Now a Wedge Issue for Dems?"," Risks Fall, Hopes Rise for Hearing Implants"," Rain Forest Gets Too Much Rain, and Animals Pay the Price"," Men's Health: Another Risk of Obesity: Dying in a Car Crash"," Is Antitrust No Longer The Issue?"," Metro Briefing | New York: Property Tax Rebates Offset Increases"," Worse Than Keeping a Mileage Log: An I.R.S. Audit"," Customers Will Miss Much More Than Shoes"," Learning to Love Overload"," Russia and West Split on Iran Nuclear Issue"," Small and Subtle Symbols In a Game That Recalls Shame"," BUSINESS DIGEST"," The Business of Government"," A Vivid Reminder"
"2006-03-08","1"," Big Board, Big Pop: NYSE Notches 25% First-Day Jump"," Real Estate Agent Excuse No. 43"," Analysis: Are VNU&#8217;s Shareholders Right to Object?"," With Exchange I.P.O.s, Who Needs Dot-Com Stocks?"," Google&#8217;s New Ticker Symbol: OOPS"," Continental Resources Files for IPO"," MGM Said to Make Movie Distribution Deals"," Dana&#8217;s Bankruptcy Rattles Industry, Gives Hope to Vultures"," PNC Financial Subsidiary to Open Minneapolis Office"," Resevoir Capital Invests in New Overseas Hedge Fund"," NFL, Regulators Desperately Seeking Hedge Fund Cash"," VNU Agrees to $9 Billion Sale; Is the Price Too Low?"," Mutual Insurance IPOS Mixed Bag, U.K. Report Says"," Mittal to Consider Change in Voting Rights After Steel Deal"," China National Building Material Takes Its IPO on the Road"," Microsoft to Buy Internet Software Firms"," U.S. Businesses Are Lining Up Behind Dubai"," UConn's Demise Was Exaggerated  "," Preschool Admissions: Take a Deep Breath"," Small-Scale Atomic Research By Iran Is Risky, Experts Say"," Preschool Admissions: Take a Deep Breath"," Palestinian Bailout"," U.S. Businesses Are Lining Up Behind Dubai"," Elite Troops Get Expanded Role On Intelligence"," BUSINESS DIGEST"," Cheney Warns of 'Consequences' for Iran on Nuclear Issue"," What's Missing From Hollywood? Office Space"," Metro Briefing | New York: Manhattan: Mayor Convenes Antipoverty Group"," Preschool Admissions: Take a Deep Breath"," MGM Said to Make Movie Distribution Deals"," Preschool Admissions: Take a Deep Breath"," Intel Announces a New Design for Chips"," Russia and West Split on Iran Nuclear Issue"," Shiites Threaten to Block Opening Session of Parliament"," Edelweiss, With a Dash of Oompah"
"2006-03-09","0"," Buy REIT; Load It Up With Debt; Repeat"," Hedge Fund Returns: Flat Again in February"," Oil Family&#8217;s Feud Lands in Bankruptcy Court (But Not For Long)"," Deconstructing the Hedge Fund for the Masses"," On eBay: NYSE I.P.O. Commemorative Bells"," Intel Invests in WiMAX Start-Up"," China National Building Materials Raises I.P.O. Price"," Hedge Funds Feeling Hot, Hot, Hot For Latin America"," Merger Talk Swirls Around Law Firm Pepper Hamilton"," Prudential Picks Up Allstate Variable Annuity Business"," Recent Openings"," Nissan Set To Relocate; A Sales Chief Will Retire"," Verizon's Best Next Move? Maybe It's No Move at All"," Justice Dept. Report Cites Intelligence-Rule Violations by F.B.I."," Circuits; Almost iPod, But in the End A Samsung"," Jewish Panel Delays a Vote On Gay Issues"," F.D.A. Panel Recommends M.S. Drug Despite Lethal Risk"," World Briefing | Europe: Serbia Opens Defense In Bosnia Genocide Case"," The Death of the Intelligence Panel"," Making Necessities Stylish And Getting a Higher Price"," Labels Halt Downloads To Increase CD Sales"," BUSINESS DIGEST"," For the City, Selling Snapple Becomes a Glass Half Empty"," U.S. Confirms Test of Missiles Was Conducted By North Korea"," Metro Briefing | New York: East Meadow: County Health Agency Starts Bailout Work"," Faulty Screening of Truck Drivers Puts Ports at Risk, New Report Finds"
"2006-03-10","1"," The Bubble in Housing Stocks"," Credit Suisse Spreads the Stock-Bonus Love"," Analysis: Was Nasdaq&#8217;s CEO Caught Bluffing?"," Update: Spurned by London, Nasdaq Stock Still Surges"," Nasdaq Is London Calling: L.S.E. Rebuffs $4 Billion Offer"," Where Were You on March 10, 2000?    The Nasdaq Was at 5,048."," Airlines Accused of Price-Fixing in Suit"," Entrepreneur Knocking on Door of London Exchange"," Investors Undaunted by Hedge Fund Meltdowns"," Televisa Group Takes Pole Position in Race for Univision"," Thain Expects to Play Active Role in Exchange Consolidation"," McClatchy Is Said to Lead in Knight Ridder Bidding"," Morgan Stanley Makes Leveraged Finance Hires"," Real-Estate Hedge Funds on the Radar"," Filofax, Symbol of the &#8217;80s, Sold to Private Equity Firm"," Volkswagen Sells European Rental Car Business for $1.5 Billion"," PacketFront Lands $27 Million Deal, Mulls IPO"," Game Over? Atari Receives Delisting Notice"," Small Gain for Eagle Test Systems IPO"," British Property Web Site Prices IPO"," Unloading on the Ports Deal"," Scenes From 'Pineapple Soup!'"," From Moon of Saturn, Signs of Water Stir Speculation on Life  "," Beyond Dogs: Wegman Unleashed"," Agent Says He Thought Moussaoui Knew About Plot"," Deal Helps Free Agents And Top Draft Picks"," McClatchy Is Said to Lead In Knight Ridder Bidding"," Amazon Considering Downloads"," State School Aid Distribution Harms L.I., Officials Contend"," Citing Collusion, New Jersey Sues Over School Site Price"," Why Snapple Deal Shrank"," Paid Notice: Deaths   GHRISKEY, H. WILLIAMSON"," Citing Collusion, New Jersey Sues Over School Site Price"," No Time to Be in the Chicken Business"," Film in Review; The Shaggy Dog"," University to Examine 2 Players' Admissions"," A New Dog Learns Some New Tricks"," BUSINESS DIGEST"," Film in Review; Shakespeare Behind Bars"," In Response, China Attacks U.S. Record On Rights"
"2006-03-11","0"," Open Doors Don't Invite Criminals"," London Rejects Bid By Nasdaq"," Symbol of Abu Ghraib Seeks to Spare Others His Nightmare"," Straw Poll Loses McCain, Its Star"," Arts, Briefly; Art Fair Opens Late"," Judge Issues Secret Ruling In Case of 2 At Mosque"," Microsoft Faulted on Response To Antitrust Ruling in Europe"," U.N. Delays Action on Rights Council Opposed by U.S."," U.S. Pushes for Broad Coalition as Iraqi Parliament Prepares to Open"," The Future of Natural Gas Pricing Could Be a Trans-Atlantic Tug of War"," BUSINESS BRIEFS"," New Hurdles For Premier As Election Nears in Italy"
"2006-03-12","0"," A Cancer Drug's Big Price Rise Disturbs Doctors and Patients"," The Remix; Seven Up (And Coming)"," This Navel's for You, Mr. Stravinsky, But the Trombonists May Leave Early"," Finding the Meaning of Life, Along With a 7% Return"," Chile Inaugurates First Woman to Serve as Its President"," Experts Say Medical Ventilators Are in Short Supply in Event of Bird Flu Pandemic"," Bush Is Business as Usual Despite Party Grumbles"," County School Districts Gird for First State Audits"," Town to Open Talks On Revitalization Plan"," The Remix; Now Serving | Hold The Tonic"," The Remix; Swimwear | Everyone Into The Pool"," The Remix; It's All About"," The Remix; Swimsuits"," The Remix; Scent of a Man"," Paid Notice: Deaths   MCCAULEY, HELEN T."," All Roads Lead To Goldman Sachs"," The Remix; The Inside Track"," The Remix; Spirit of '66"," The Remix; Got Game?"," STREETSCAPES/Depression-Era Buildings; Sister Buildings Show Their Age Quite Differently"," Caroline Wong, Brett McGurk"," The Remix; London Calling | The Man Show"," The Remix; Trend Spotting | Waistcoats"," The Remix; Patron Saint"," The Remix; Cad Cool"," Paid Notice: Deaths   GHRISKEY, H. WILLIAMSON"," The Remix; Now Kicking | African Football"," Exits&Entrances; What's My Line?"," At Risk: Chapter 10: The End of the Affair"," Met Music Director to Miss Rest of Season  "," Past Present; Secret Agent Man"," Just Wait for the Play About Microsoft"," Now Open: A Museum Of One Mind's Attic"," The Remix; Tracks | Pleasure-Cruising"," For Autism Programs, Revolving Issues"," Anonymous Source Is Not the Same as Open Source"," The Remix; Tracks | Pleasure-Cruising"," For Autism Programs, Revolving Issues"," Anonymous Source Is Not the Same as Open Source"
"2006-03-13","1"," Regional Bank Stocks Rise on Consolidation Hopes"," Touching a Nerve on Commissions"," McCain Is More Conservative Than You Think"," Update: No Pop for Paper Stocks After Knight Ridder Deal"," Mississippi's Vulnerable Children"," J.P. Morgan Bows Out of Nasdaq Bid"," A Nasdaq Bid For London May Spark European Mergers"," State-Run Indian Lender Plans IPO"," As L.S.E. and Nasdaq Resume Talks, Eyes Turn to NYSE"," Intel Is Expanding V.C. Arm"," On the Block: A Dozen Newspapers That McClatchy Will Divest"," Merck of Germany to Seek Control of Rival Drug Maker"," Knight Ridder Sold to McClatchy for $4.5 Billion"," Barron&#8217;s Roundup: Funds Get Frisky, Drunk on NYSE"," Stock Offerings This Week"," Merck of Germany Expected To Seek Control of Schering"," Car Bombs Kill 46 at Markets in Baghdad  "," Sometimes, Success at the Table Means Waiting for the Misstep"," Gilbert Y. Steiner, 81, Author And Theorist on Welfare Issues"," BUSINESS DIGEST"," Keppinger Keeps Hitting, But Support Is Still Missing"," Metro Briefing | New York: Manhattan: More Endorsements For Spitzer"
"2006-03-14","1"," Hedge Fund Nibbles at Mills Corporation"," Goldman Sachs Posts Big Profit as Investment Banking Booms"," Halliburton May Sell Some Pieces of KBR, But IPO Is Still On"," The Meaning of Big"," Hong Kong Semiconductor Maker Going Public"," Golden Eagle Prices High on Strong Demand"," Grupo Televisa Says It Has Yet to Decide on  Univision Bid"," NYSE Shareholders to Sell Stock"," Credit Suisse Builds Australian Property Team"," Bear Stearns Is Seen in $250 Million Mutual Fund Settlement"," London Stock Exchange Shareholders Ready for a Takeover"," Uncertain Future for 12 Papers That McClatchy Will Resell"," Safety: Baby Walkers Found to Be Safer but Still Risky"," BUSINESS DIGEST"," Leading New Jersey's Schools Has Its Price: High"," World Business Briefing | Americas: Canada: Bank to Increase Stake"," Keep 'Door Open' On Iran, Briton Says"," Paid Notice: Deaths   MCCAHAN, DR. JERMYN F."," The History of the Issue"," Spitzer as a Fighter For the Underdogs"," Road to Rebirth Diverges on a Mississippi Bridge"," Premier Says China Beset by Corruption and Rural Land Issues"," The Times to End Daily Stock Listings in April and Expand Data on Web Site"," McClatchy To Resell 12 Papers It's Buying"," China's Role Emerges as Major Issue for Southeast Asia"," A U.S. Takeover No Longer Appalls London's Exchange"," Web Magazine Raises Doubts Over a Symbol Of Abu Ghraib"," Colleges Open Minority Aid To All Comers"," World Briefing | United Nations: Rights Commission Suspends Session Over Deadlock"," Price of Midmajor Success Can Be Loss of a Coach"," World Briefing | Asia: Afghanistan: Canadian Premier Meets Troops"," Metro Briefing | New York: Manhattan: Property Tax Notices To Be Sent"
"2006-03-15","1"," As Former Apple Executives Seek Deals, Road Show Raises Questions"," Italian Stock Exchange Unveils New Rules"," A Troubling Finance Tool for Companies in Trouble"," Hedge Fund Hires Former Clinton Adviser"," S.E.C. Chief Calls for Re-Examination of Exchange Regulation"," Cairn Energy to Float on Mumbai Exchange"," Oil Executives: Mergers Aren&#8217;t to Blame for High Gas Prices"," British Watchdog Clears Deutsche Borse for London Bid"," Icahn Hedge Funds Take Aim at Micron-Lexar Deal"," Overstock.com Squeezes Short Sellers With Mysterious Stock Rise"," Hedge Fund Regulators Diverge: More Access or Tighter Oversight?"," Crisis at School Agency Reflects Missteps, Trenton Says"," BUSINESS DIGEST"," In Iran, a Chorus of Dissent Rises On Leadership's Nuclear Strategy"," Metro Briefing | New York: Albany: Lobbying Commission Chairman To Step Down"," Reservoir Dam Bursts in Hawaii; One Is Killed and 7 Are Missing"," A Troubling Finance Tool For Companies in Trouble"," Lawyer Thrust Into Spotlight After Misstep in Terror Case"," Few Riders, Much Vision In Connecticut Rail Plan"," Airbus, China and Quid Pro Quo; The Giant of Aviation Markets Seems Just the Place to Put a Factory"," U.S. to Vote No on a New U.N. Rights Council"," Paid Notice: Deaths   MEANEY, JOHN J."," Crisis at School Agency Reflects Missteps, Trenton Says"," Still Advertising to Gays, Ford Under Boycott Again"
"2006-03-16","1"," Meanwhile . . ."," Concern Over Price of Scripps' British Shopping Trip"," Hedge Fund Takes Aim at Delphi's Board"," Hedge Funds' Hoard Reaches $1.5 Trillion"," Brown-Forman Adds Chambord to Liquor Cabinet"," Engelhard Will Open Books to BASF"," Aleris Swallows Chunk of British Steel Business"," Princely Riches for Troubled Saudi Exchange"," Ukraine Blocks Steel Factory Privatization"," HIG Capital Gets Into the Hedge Fund Game"," Grasso Motion to Dismiss Claims Is Denied"," Big Name Buyout Firms to Open Their Wallets in India"," Ex-Morgan Stanley Execs Pandit and Haven to Open Hedge Fund"," Kiss Rocker Simmons Aiming His Love Gun at IPO"," First Atlantic Takes a Swing at Golfsmith IPO"," U.S. Overture to London Exchange Stirs Talk of a Merger by European Rivals"," A Complex and Modern Cultural Gumbo"," Recent Openings"," Portrait of Artist as Impresario, and Other Premieres"," U.S. Overture to London Exchange Stirs Talk of a Merger by European Rivals"," BUSINESS DIGEST"," As U.S. Dissents, U.N. Approves A New Council On Rights Abuse"," Charity Delays Tsunami Work as Audit Finds Irregularities"," Paid Notice: Deaths   BISSINGER, ELLIE"," Metro Briefing | New York: Brooklyn: Warehouse Opens After Anthrax"," Is Business Ready For a Flu Pandemic?"," Trailers, Vital After Hurricane, Now Pose Own Risks on Gulf"," Atlantic Tops Nominee List For Awards"," M.T.A. Dismisses (for Now) New Vote by Transit Workers"," Milosevic's Body Taken to Serbia; Funeral a Political Issue"," Color-Coordinated Cubans Head to the Semifinals"
"2006-03-17","1"," Bleak Open Houses"," In Case You Missed It"," Study of Alzheimer's Drug Revives Questions on Risk"," After Jagr Shoulders the Blame, Rangers Help Carry the Load"," Anne Braden, 81, Activist in Civil Rights and Other Causes"," Microsoft Reveals Plan to Take Business From I.B.M."," Verizon Seeks to Invade Cablevision Turf on L.I."," Students Flock to Seminaries, But Fewer See Pulpit in Future"," France Weighs Forcing iPods to Play Other Than iTunes"," World Business Briefing | Asia: India: Goldman To Start New Firm"," Orr's Résumé Is Left With Another Blemish"," National Briefing | Midwest: Missouri: Teacher In 'Crucible' Case Quits"," An Officer Seen as a Hero Faces a Year Behind Bars"," Art in Review; Jil Weinstock"," BUSINESS DIGEST"," Arts, Briefly; Microsoft in Deal With Epic Records"," Prices Rose Only 0.1% Last Month"
"2006-03-18","0"," Ex-Columbia Student Says Disputed Chemistry Research Is Sound"," Opening the Door on the Credit Report and Throwing Away the Lock"," The Price Of a Safe Landing"," Hedge Fund Chief Can't Get to Russia"," Personal Business:  The Allowance: It's Not Just About Money"," Agency Sees Little Risk From a Leak At Indian Point"," Paid Notice: Deaths   MCHUGH, CATHERINE (NEE MCCARTHY)"," Teenage Girl With Issues And Salinger"," Russia Effectively Closes a Political Opponent's Rights Group"," BUSINESS BRIEFS"," Brooklyn Officer's Shot Misses Suspect and Grazes Comrade"," Now G.M. Has Woes On Audits"," Cited as Symbol of Abu Ghraib, Man Admits He Is Not in Photo"," Human Rights Violators"
"2006-03-19","0"," Melissa Bender, Ryan Goodman"," Top Hamptons Rentals Go Fast, Agents Say"," ONE FOR THE PRICE OF TWO"," HEART RISKS FOR WOMEN AND BLACKS"," When a Co-op Refinances"," The Bigger the Better as Large Stocks Regain Favor"," Snapshots of the Suburbs' Housing Markets"," Paid Notice: Deaths   MEANY, JOHN"," The Chick-Lit Pandemic"," Jodi Segal, Seth Price"," The Remix; Fore Play"," The Real Estate Issue"," The Remix; Hideout Hideaway"," The Remix; Spring Corrections"," The Remix; A French Legacy | Beirut Bonbons"," A Private Golf Course And Eminent Domain"," The Remix; Charleston, S.C. | Off The Menu"," Spiritual Outreach: A Seminary on a Mission"," The Remix; Peel Me a Grape"," Snapshots of the Suburbs' Housing Markets"," A Price to Pay"," A Premiere for the State And for the New Conductor"," Splitting Up, Hollywood-Style, Means a Settlement and a Script"," Vacations, With a Relief Mission Included"," At Risk: Chapter 11: What's Lost Is Found"," HABITATS/Dumbo; A Pioneer Knows When to Move On"," The Remix; Auto Erotica"," The Remix; Pod Potatoes"," DataBank; Stocks Rally to Best Week Yet of '06"," Business Incubator Is Viewed As Crucial to North Amityville"," The Remix; Hot Denim | Detachability"," The Innocent Birth Of the Spring Bacchanal"," The Remix; The Art Hotel"," Fair Prices for Farmers: Simple Idea, Complex Reality"," A Private Golf Course And Eminent Domain"," The Remix; Weirding Out"," Radiation at Lab Gate Is No Risk, Tests Show"
