"Date","Direction","Headline"
"2007-10-23","1"," Weekly Wrap: Patriots' Bargains Bring Dividends"," Jerry Yang&#8217;s Musings on Opening Up Yahoo"," Women's Business Takes Stock of Politics"," How Apple Can Keep Its Value"," The Minimalist: Orange Confit"," Analysis: Harman's Off-Key Deal"," Clips: Syndicated Trump, Fires Delay Productions, Osmond Faints on 'Dancing'"," Deal-hunting through Berlin's Sunday markets"," Hearst Takes Stake in MediaNews in Newspaper Swap"," Nike Scores Umbro for $580 Million"," Delphi Irons Out Deal With Hedge Funds"," Dubai Exchange Nabs First North American Listing"," U.S. Considering Missile Defense Delay"," Talks Open to Cut Kennedy Traffic"," In Wide-Open Big East, Rutgers Still Has Chance"," Japan: Microsoft Cuts Price of Xbox 360"," An Arduous, Risky Mission"," Myanmar: Junta Agrees to Visit by U.N. Rights Official"," Israel: Hezbollah Turns Over 1986 Letter From Missing Airman"," Record Mac Sales Help Apple Earnings Climb 67% in Quarter"," Microsoft Is Yielding in European Antitrust Fight"," Iraqi Journalist Reported Missing After Driver’s Body Found"," Savior or Machiavelli, McCain Aide Carries On"," American Express Has Higher Profits"," Dell to Sell Computers and Other Products at Staples"," Earnings Reports Give Markets a Respite"," Keeping an Open Mind Allows Anyone to Wander in"," Redefining Business Casual"," Iraqi Radio Reporter Is Missing"," The Price of a War, Unpaid at Home"," Kyrgyzstan’s Leader Dissolves Parliament"," From Faithful Dogs and Difficult Fish, Insight Into Narcolepsy"," TODAY IN BUSINESS"
"2007-10-24","0"," With Reduced Emissions, Spitzer Foresees Lower Utility Bills"," Let's Not Forget Mapplets"," Microsoft Wins One in the War Against Google"," Good Food, at a Good Price, in London"," Obama Adds Openly Gay Minister to Concert"," Half-Priced Beers"," Microsoft to Pay $240 Million for Facebook Stake"," McCain Makes the Most of Debate One-Liner"," Analysis: The Dolan Discount"," Buying While the Business Burns"," In Facebook Race, Google Said to Be Hiking Price"," Venture-Backed XDx to Seek Nasdaq Listing"," Hedge Funds' Inflows Slow in 3rd Quarter"," XTO Spends $550 Million on Natural Gas Properties"," NYSE Euronext to Launch Carbon Trading Market"," Verizon Wireless Reaches Settlement on Internet Plan Marketing"," Hungarian Extremists Reflect Discontent, and Add to It"," Ileana Sonnabend, Art World Figure, Dies at 92"," Amgen Wins Patent Battle Over Roche’s Anemia Drug"," Mistrial Is Latest Terror Prosecution Misstep for U.S."," The Fifth Down: Patriots’ Bargains Bring Dividends"," Panel Pushes for Nominee to Denounce Technique"," Verizon Wireless Ends F.C.C. Fight"," Rally in Technology Companies and Drop in Oil Price Help Lift Major Markets"," Bush Stands by Plan for Missile Defenses "," Dutch Maker of Chemicals Reports Drop in Earnings"," Shuttle Starts a Mission to the Space Station"," Sales Are Strong for Glaxo’s Weight-Loss Product"," BP Settlements Seen on Safety and Price Cases"," A Premiere, a Fire Alarm and a Second Chance"," Diesel Engines May Not Purr, but They Please the Mileage Mavens"," With Katrina Fresh, Bush Moves Briskly"," Better Mileage? Lower Emissions? You Can Do It, Detroit"," Challenging Gasoline: Diesel, Ethanol, Hydrogen"," TODAY IN BUSINESS"," Paid Notice: Deaths   LABOUISSE, EVE"
"2007-10-25","0"," Jokes About a Hit-and-Miss Proposition"," Microsoft’s $30 Billion Vista Bump"," McCain's 'Secret Strategy Memo' on Giuliani"," Fox Orders Halt to McCain Ad"," More Goodies in Apple's New Operating System"," More Goodies in Apple’s New Operating System"," Romney Says He Is Open to Iran 'Bombardment'"," BEA Names Its Own Price"," London Hedge Fund Eyes British Soccer Club"," Brazilian Stock Exchange Raises $3.6 Billion"," Hedge Fund's Criticism Boosts Generali Shares"," Collins & Aikman's Bankruptcy Advisers to Cut Fees"," Lagardere Denies EADS Insider Trading"," Businesses and Blogs in Breast Cancer's Wake"," Lone Star's Del Frisco to Tap Public Markets"," Aryx Therapeutics Prices I.P.O."," A Battle Over Funding for Small Businesses"," Facebook to Wireless Companies: You Can Be Open, Too"," Apple Offers New Goodies in Leopard System"," Microsoft Earnings Send Stock Soaring"," Oil Price Surge Adds to Economic Jitters"," Collins Gives the Knicks a Reminder"," Open Cup Bidding Sought"," Microsoft Buys Stake in Facebook"," A Battle Over Venture Capital for Small Businesses"," Polishing Up the Apple in Applebee’s"," Boeing Net Up, but Outlook Is Curbed by Delays on 787"," A Top Republican Joins in Question for Nominee"," Promotions at Goldman a Record"," Eve Curie Labouisse,  Mother’s Biographer, Dies at 102"," A Risky Nomination"," Microsoft to Pay $240 Million for Stake in Facebook"," Kremlin Secures Price Controls on Food Items Before Elections"," Gay Rights Group Criticizes Obama"," McCain Reflects on P.O.W. Past, and Goes After Clinton"," TODAY IN BUSINESS"," Paid Notice: Deaths   LABOUISSE, EVE CURIE"
"2007-10-26","1"," Despite a Growing Need, Opening a Child Care Center Isn’t Easy"," This Land: Audition Day"," Fox Bars Candidates From Using Its Images"," Edwards Focuses on Workers' Issues"," The Lone Star Arrondissement"," Small Business Retirement Time Bomb Ticks On"," Stray Questions for: Elizabeth McCracken"," The Early Word: Clinton, McCain Anniversaries"," Taking Stock of Cognos' Potential Suitors"," Oracle Scoffs at BEA's Price, but for How Long?"," Germany Forces More Hedge Fund Disclosure"," Absolute Capital Reopens Fund"," India to Limit Foreign Investors to Cool Markets"," Hong Kong Exchange Sits Out the Dance, for Now"," Facebook&#8217;s Stock Options"," Attorney General  Nominee Faces New Resistance"," Oil Prices Continue to Rise"," Homes Still at Risk on 6th Day of Fires"," Dow Chemical’s Profit Falls 21.3%"," Italy: Beleaguered Premier Demands a Clear Show of Unity"," Supply Worries Push Oil Above $90; Stocks End Flat"," Warren Wins Opener"," Mexicans Miss Money From Relatives Up North"," Flush With New Millions, Underdog Vies to Compete"," Microsoft Reports Strong Gain on Sales of PC and Server Software"," For Former Newark Mayor, Arena’s Opening Is Tough to Savor"," High-Ranking Jail Officer Is Convicted of Conspiracy in Beating"," With Oracle in Pursuit, the Quarry Sets Its Price"," Hong Kong Exchange Sits Out the Dance, for Now"," India Seeks to Cool Stock Market With Limits on Foreign Investors"," City Wasted Millions on Bronx Golf Project, Audit Says"," Who’s Going to Take the Financial Weight?"," McCain Rebukes Giuliani on Waterboarding Remark"," Patriot Act Faulted in Denial of Visa for Muslim Scholar"," Paid Notice: Deaths  SCHLESSINGER, KAREN CORONATO MIELE"," Business Today"," Paid Notice: Deaths   NISS, ZELDA"," Paid Notice: Deaths   LABOUISSE, EVE CURIE"
"2007-10-27","0"," Apple Limits Sale of iPhones: Two Per Person and No Cash"," The Price of Any Departure Will Be at Least $159 Million"," Missouri: Jury Wants Death for Expectant Mother’s Killer"," Georgia Dismisses Top Scorer"," Denounce Waterboarding, Democrats Tell Nominee"," Can Anybody Tame New York’s Mean Streets?"," Putin Denounces U.S. Missile Shield "," Iranians Dismiss Sanctions From U.S."," Fires a Reminder: What Happened to Aaron Brooks?"
"2007-10-28","0"," Agent: Rodriguez to Opt Out of Yankee Contract"," Merrill Lynch Reported Ready to Dismiss Head"," Devils Open Their New Building but Fall Apart in Third Period"," New Jersey Civil Union Law Has Fallen Short in Its First Year, Commission Is Told"," Arthur Kornberg, Biochemist, Dies at 89"," Microsoft’s Slice of Facebook"," Comparing the Contrasting Styles of Freeney and Peppers"," Microsoft Leads the Market Higher"," Dogs, Kids or Hoopsters: Who Gets to Use a Park?; Look at Alternatives to Waste Disposal Plan; Bringing Down Maternal Death Rates; Be Wary of Making Hurtful Assumptions; The Many Varietiesof a Pastry Treat (8 Letters)"," Shedding Stock-Market Vertigo (but Still Making Some Money)"," Pledging Allegiance to the United States of Hedge Funds"," Chairlifts Are for Sissies"," Emily Manheim, Mark Whipple"," Emily Wilansky, Christopher D’Auria"," A Melee Highlights Issues of Downtown"," Animal Measures Draw Persistent Opposition"," No Irony, Please (and No Apples): Just Be Scary"," Shaky Service, and Hit-or-Miss Meals"," Of Trombones and Trumpets, of Drums and an Electric Jug"," Sun Never Sets on English Premier League"," When the Price Includes Tenants"," Paid Notice: Deaths   LIBRESCO, EMILE"
"2007-10-29","1"," A Hearing on Dumbo, and Several Landmark Votes"," Time for Supermarkets to Recycle Plastic Bags?"," The Gospel of Gay Rights"," The Prescription for Health Care: Open Software or Forklifts?"," NBC Universal Plays Catch-Up in International Markets"," Terra Firma Recuts EMI Deal, Report Says"," Oracle, I.B.M. Said to Have Bid for Business Objects"," Oil Price Up Again Ahead of Fed Meeting"," Risk-Taker’s Reign at Merrill Ends With Swift Fall"," India’s Peasants Protest for Land Rights"," Security Upgrades at Several Nuclear Sites Are Lagging, Auditors Find"," Financial News Web Site Remains Unruffled by Murdoch’s Foray on Its Turf"," ‘Miss Bad Media Karma’ Sings, Too"," Today in Business"," Paid Notice: Deaths   LIBRESCO, EMILE"
"2007-10-30","0"," Missed Opportunity on Airport Cats in 2004"," Big Apple Loves High Def"," The Price of Saying Goodbye"," Apple iPod Touch Advertisement"," As Bonuses Look Leaner, UBS Takes Stock"," How Not to Deal With A Failing Business"," Bear Stearns Issues More Pink Slips"," Somerset Buys 450 Park Ave. for Record Price"," Lerach Pleads Guilty to Conspiracy"," Iceland's Baugur Explores Joint Bid for Saks"," Zucker Dismisses NBC Sale Rumors"," Microsoft to Buy Global Care"," PetroChina Raises $8.9 Billion in Stock Offering"," Home Prices Are Down, and So Is Confidence"," PetroChina Raises $8.9 Billion in Stock Offering"," Looking at Dutch and Swiss Health Systems"," Xstrata Makes Offer Bids for Nickel Mine"," Thailand: Microsoft Acquires Health Care Assets"," Leading Class-Action Lawyer Pleads Guilty to Conspiracy"," NASA Extends Shuttle Mission to Work on Station"," Venezuela’s Gas Prices Remain Low, but the Political Costs May Be Rising"," N.B.A.’s Television Partners Get Expanded Digital Rights"," Cellphone Growth Strong at Verizon"," More Cuts at Bear Stearns as UBS Issues Warning"," Somalia Premier Quits as Colleagues Cheer"," Northwest Posts Solid Earnings in First Post-Bankruptcy Quarter"," An Animal’s Life"," Regimens: Low-Fat Diet May Lower Risk of Ovarian Cancer"," The Claim: Cayenne Peppers Can Cure Headaches"," Israeli Premier Says He Has Treatable Prostate Cancer"," TODAY IN BUSINESS"
"2007-10-31","1"," Spitzer, Clinton and the Meaning of Irony"," Slide Show: Historic Streets of Dumbo"," New McCain Ad: 'Guts'"," Facebook&#8217;s Rapid Stock Appreciation"," 'Dog' Suspended Over Alleged Remarks"," Apple MacBook"," When Animals Attack"," Spitzer, Clinton and the Meaning of Irony"," No Agent, No Editor, No Yanks"," Mission Accomplished, II"," Investor Sues Merrill Over Risk Exposure"," Are Hedge Fund Indexes the Answer?"," Nasdaq Said to Be Front-Runner for Philly Exchange"," Merrion Pharmaceuticals Cuts I.P.O. Price"," Applebee's Shareholders Say Yes to Ihop"," NASA Focuses on Solar Panel Repairs"," Britain: Credit Card Brands Sold"," Federal Court Extends Oversight of Microsoft Until January"," Cambodia: Leader Severs Ties With Gay Daughter"," Iowa: Dog Shoots Hunter"," Chinese Chemicals Flow Unchecked Onto World Drug Market"," Giuliani’s Prostate Cancer Figure Is Disputed"," Avon Products’ Earnings Soar 61%"," Securing Russian Nuclear Missiles? U.S. Is Set to Say ‘Done’"," Cancer Claim Is Dismissed Against Wyeth Hormone Drugs"," Oil Leaders Say Prices Are Not Their Fault"," Quarterly Profits Climb for Colgate and Procter & Gamble"," Senate Votes for Increase in Subsidy for Amtrak"," A Consumer’s Spot for Apple Grows Up"," Home Prices Are Down, and So Is Confidence"," Move West Could Be Risky for Torre"," Visa Data to Be Included on Driver’s Licenses Again"," TODAY IN BUSINESS"
