"Date","Direction","Headline"
"2012-09-20","1"," A Hit in the End Zone, a Price for a Lifetime"," Commander Who Pepper-Sprayed Protesters Is Sued Again"," The Attack on the American Mission in Benghazi, Libya"," Apple on Its iOS 6 Maps: Things Can Only Get Better"," Submit Your Questions to Princeton University's Dean of Admissions"," China Becomes an Issue in the U.S. Campaign"," MSNBC's Audience Grows, Seemingly Drawn by News of Romney's Troubles"," Today's Scuttlebot: Bad Apple Maps and Wi-Fi on Planes"," Reid Cancels Floor Votes in Senate After Brown Suggests He Might Miss Debate"," Pondering the Path To an Open Polar Sea"," Syria's Dark Horses, With Lathes: Makeshift Arms Production in Aleppo Governorate, Part II"," Business Day Live: Pension Funds at Center of Labor Crisis"," Pandora Keeps Growing, but Apple's Plans Add to the Uncertainty"," RIM Innovates and Then Waits as Apple Moves Ahead"," Your Worst Financial Mistake"," Daily Report: Apple Releases Its Mobile Maps, Glitches and All"," Peugeot in Talks to Sell Logistics Business"," Banks' Risky Ways"," Do You Really Expect Your Business to Get You Through Retirement?"," Egypt: New Intelligence Chief Helped to Broker Israeli’s Release"," Israel Wins Opener in World Baseball Classic Qualifiers"," Swiss Drug Giant Picks Manhattan for Research Site"," In a City Plagued by Violence, a Spike in Crime Opens Eyes Nationwide"," Belarus: Election Monitors Denied Visas"," Missouri: Damaged Lock Snarls Barge Traffic on Mississippi River"," Key Giants to Miss Panthers Game"," U.P.S. Bills Stores as Small-Business Solution"," Apple’s iPhone Update Leaves Out Google’s Maps"," USA Swimming Bars Coach"," A Tribe’s Epidemic of Child Sex Abuse, Minimized for Years"," A Reminder to Look(!) Both Ways"," Children and Minimalism, Coexisting"," Tentative Deal on E-Book Prices Is Reached in Europe"," 4-Year Deals for Unions at Verizon"," Couscous With Tomatoes, Cauliflower, Red Peppers and Olives"
"2012-09-21","0"," Poking Fun at Apple's New Maps"," Court Told of 'Risk Seeking' on UBS Desk"," Final Debate: McCain and Obama"," The Jesus Conspiracy"," Measuring the Achievements of Adults Who Don't Get Family Financial Help"," Business Day Live: A Manufacturing About-Face"," How to Fix a Glitch in Apple’s Passbook"," Art Tells of Upheavals as Louvre Opens a New Wing"," Joaqu&iacute;n Almunia on Europe's Tough Terms for Approving Universal-EMI Deal"," G.M. Recalls Chevy Malibus, Saturn Auras and Pontiac G6s for Rollaway Risk"," Ruling Opens Door for Lundqvist to Play in Sweden"," Notes on the Political Economy of Redistribution"," Bullfighting: Hallowed Tradition or Animal Torture? France Rules"," The Breakfast Meeting: Universal-EMI Deal Passes in Europe, and Relief at News Corp."," European Regulators Approve Universal’s Purchase of EMI"," A University's Mission: Preparing Mongolia for the Future"," Antipoverty Goals at Risk, U.N. Warns Donors"," Yum Brands Puts Focus on Hunger Relief"," A Family Pulled Into the Fray Over an Agent’s Death"," Europe Said to Be Close to Approval of EMI Deal"," Despite Risks, N.F.L. Leaves Helmet Choices in Players’ Hands"," Tedi Thurman Dies at 89; Radio’s Miss Monitor"," Taiwan Company Fined $500 Million for Price-Fixing"," Iran’s Top Atomic Official Says Nation Issued False Nuclear Data to Fool Spies"," When Jumbo Was Toast of the Town"," U.N. Presses Pakistan Over the Fate of Hundreds of Missing People"," Intangible Dividend of Antipoverty Effort: Happiness"," Markets Overcome Early Losses"," British Government Seeks to Suppress Dissident’s Alleged Spy Links"
"2012-09-22","0"," Emilio Pucci: Spring 2013 RTW"," Critics Press Cambodia to Fight Violence on its Forest Frontier"," In Malta, Immigrants Left in Limbo"," Underdogged"," In Times Sq., Reminders of an American Missing in Iran "," Highlights and Analysis: College Football Saturday"," The Official Attendance Can Become Empty of Meaning"," The Barriers to Openness"," India’s Premier Pleads for Support of His Plans in Televised Address"," The Week’s Business News in Pictures"," Russia: Dogs Poisoned in Moscow"," Congress’s Unpopular Watchdog"," Ex-Fannie Mae Chief Is Dismissed From Investors’ Suit"," Has Apple Peaked?"," U.S. Senate Race in Connecticut Devolves Into Attacks on Personal Finances"," New Plans for Velodrome Open Up More Space for Other Activities"," Disappointing Results at a Business Software Maker"," Colorado: Shooting Scene Will Reopen "," Blowing a Kiss Toward Asia"," India’s Premier Pleads for Support of His Plans in Televised Address"," Iranian Dissidents Convince U.S. to Drop Terror Label"," The Price Whistle-Blowers Pay for Secrets"," Japan’s Beleaguered Premier Wins Party Leadership Vote"," U.S. and European Regulators Approve Universal’s Purchase of EMI"," Lines at Apple Stores on iPhone 5’s First Day"
"2012-09-23","0"," Another E-Commerce Site Tests Advertising on TV"," Missoni: Spring 2013 RTW"," Disruptions: Will Apple Be the First to Break $1 Trillion?"," Mr. Mental Recession"," Jil Sander: Minimalism With a Kick"," Seminoles Stand Atop A.C.C. After Offense vs. Offense Duel"," Emily Chang and Alexander Rubens"," Emily Levine, Matthew Rascoff"," With Playoff Berth Secured, Liberty Unload on Shock"," U.S. League Is Loaded With Talent and Drama"," Ryan Criticizes Obama’s Cuba Policy and Explains His Shift on the Issue"," Anticipating the Next Pandemic"," When GPS Tracking Violates Privacy Rights"," Virginia Republican Adopts Cuts in Defense as His Issue"," The Fans Are Irrelevant in the Business of the N.H.L."," A Day for Dogs and Diners"," Cycling Around Luxembourg"," Luxembourg by Bike: 3 Days and 100 Miles"," The 9.9.12 Issue"," Mission Viejo"
"2012-09-24","0"," Are Financial Fair Play Rules Destined to Be Broken?"," Washington State, Women's Rights and Big Cities "," Today's Scuttlebot: iPhone 5 Thieves, and Business Tech Start-Ups"," Graphic: Mergers and Acquisitions, Top Financial and Legal Advisers"," Ethan Bronner Discusses the 'Core Issue' About Voting"," Small-Business Lessons From Harley-Davidson's Turnaround"," Early Menopause Is Linked to Heart Risk"," Year After Pepper-Spraying, Awaiting a New Cry: A Newborn's"," Accounts and People of Note in the Advertising Industry"," Photos of The Moment | Missoni"," Mean Joe, Meat Loaf and Moon Unit"," 'Ann,' Holland Taylor's Play About Ann Richards, Will Open on Broadway"," Gensler Calls for Overhaul of Libor"," Apple Sells Five Million New iPhones"," Business Day Live: Mobile Services and Cable TV Are Unexpected Allies"," Bumi Shares Tumble After Inquiry Into Financial Irregularities"," Daily Report: Apple's Feud With Google Is Now on the iPhone Screen"," This Week in Small Business: $931 Billion in Cash"," Part 1: Answers From Princeton's Dean of Admission"," Behind the Cover Story: John Jeremiah Sullivan on Cuba "," Tsonga Routs Seppi to Defend Moselle Open Title"," Uranium Substitute Is No Longer Needed, but Its Disposal May Pose Security Risk"," Covering the World of Business, Digital Only"," Apple’s Feud With Google Is Now Felt on iPhone"," Rationing Health Care to Control Costs"," Government Issues Order to Disband Libya Forces"," Seminoles See Dawn of New Glory Days"," News From the Advertising Industry"," Small Business Owners Share Their New Plans"
"2012-09-25","0"," An Electric Carmaker Struggles as Its Production Lags"," 'New Girl' Watch: A Season Premiere and a Balancing Act"," Today's Scuttlebot: Hacking Public Transit, and Twitter Rethinking Follower Counts"," Efterklang, Tonight at the Apple Store in SoHo"," Apple's Competitors Pile On With Map Critiques"," Japanese Look for Alternatives to Apple's Maps"," Why the Health Care Tax Credit Eludes Many Small Businesses"," A Deadline in the Missouri Senate Race"," A Hedge Fund's Complex Scheme May Cost It Millions"," Average A.T.M. Surcharge Reaches New High"," AT&T Introduces Security Products for ‘Bring-Your-Own’ Devices"," British Bankers Group May Give Up Control Over Libor"," First Night of the New Season Has NBC and CBS Swapping Places"," Russia Eases Limits on Visas for Americans"," Business Day Live: Law Firms Under Pressure"," Oil and Nature: A Landscape Reconfigured"," Charting the Success of Early Underdogs in the N.F.L."," Business Day Live: Ex-Regulator Has Harsh Words for Bankers and Geithner"," A Critical View of the Financial Crisis"," Comparing the Job Losses in Financial Crises"," No Thank-You Note, but Several Lawsuits for a Pepper-Spraying Inspector"," In West Bengal, Cashless Microfinance Opens Doors for Women     "," Part 2: Answers From Princeton's Dean of Admission"," UB Group Companies' Stock Up on Deal Talk"," Two Nets Take Stock of Future in Brooklyn"," Safer Flights, but Risk Lurks on the Runway"," Apple Maps Errors Send Japanese to Homegrown App"," Egypt: Extremists Sentenced"," Panel Reminds Doctors to Screen for Alcohol Misuse"," Verizon to Pay TiVo $250 Million Settlement"," Feathered Freeloaders at the Ant Parade"," Former Israeli Premier Gets Suspended Sentence"
"2012-09-26","0"," Nissan Aims to Improve Communication With Leaf Owners"," Gay Couple Sues Conservative Group, Saying It Stole Their Kiss"," Pogue: ‘Maps Most Embarrassing, Least Usable Apple Software’"," Column on Romney-Ryan Meant as Satire Is Taken as Fact"," Opening the Religious Tent to All"," McCaskill Hits Akin for 'Legitimate Rape' Comments in New Ad"," Vain Glorious | Organic Products for Your Pooch  "," Business Day Live: Violence Erupts as Greeks Strike to Protest Austerity"," Editor's Note: The Inspiration Issue"," Libor's New Masters"," Cambodia's Landless Class"," Part 3: Answers From Princeton's Dean of Admission"," California: Brown Signs Bills to Keep Parks Open"," Prosecutor Deals Blow to Stop-and-Frisk Tactic"," As Libya Presses Some Militias to Disband, Fighters Attack a Hotel in Tripoli"," In Romney-Obama ‘Redistribution’ Debate, a Gray Area"," MoMA Plans to Be Open Every Day"," Chinese Dissident Artist Says the Authorities Still Have His Passport"," U.N. Leader Opens General Assembly on Somber Note"," Home Prices Rise Again, This Time on the Low End"," Love Potion Opens Season at the Met"," Invitation to a Dialogue: An American Paradox"
"2012-09-27","1"," Answers From Princeton's Dean of Admission"," British Authorities to Announce Changes in Libor Oversight"," Loading Up and Heading Out"," Prudential to Acquire Life Business from Hartford"," Geithner Urges an Overhaul of Rules on Money Market Funds"," Part 4: Answers From Princeton's Dean of Admission"," Judge Dismisses Forgery Lawsuit Against Herb Allen"," When Non-Driving Factors Affect Auto Insurance Premiums"," Women Still Missing From Medicine's Top Ranks"," France and Britain Weigh the Price of Nuclear Deterrence"," How Rachel Carson Spurred Chemical Concerns by Highlighting Uncertainty"," Guidance Office | Ask a Financial Aid Expert About Scholarships"," Late Night Laughs and Conspiracy Theories"," As Jobless Figures Go Up, Officials Dispute the Data"," Visas for Scientists, With a Catch"," Losing Faith in Stop-and-Frisk"," Tennessee: Two Children Missing After Farmhouse Fire "," California: $1 Million Settlement in Pepper-Spraying"," Massachusetts: Chemist Admits Faking Drug Results "," Last Call for College Bars"," Russians Eagerly Participate in Medical Experiments, Despite Risks"," Spanish Ire, Symbolized by a Carrot"," In Further Opening, U.S. to Ease Ban on Imports From Myanmar"," Two Old Friends Prepare a Three-Part Premiere"," Markets Falter in Europe Amid Protests on Austerity"
"2012-09-28","0"," Opening Night in Brooklyn"," Apple's Plans for Internet Radio Run Up Against Big Music Publisher"," This Sunday: A Video Introduction to the Inspiration Issue"," Advertising Week Begins Monday, Focusing on Technology and Returning Veterans"," Video: Last Call for Peppers"," Ex-SAC Analyst Pleads Guilty in Insider Trading Conspiracy"," Roasting Peppers"," California Issues 10,000th Rebate for Zero-Emissions Incentive Program"," As Apple's Maps Stumbles, AOL's MapQuest Flourishes"," Universal Closes on EMI Deal, Becoming, by Far, Biggest of Remaining Big Three"," Photos of The Moment | Issey Miyake"," Rights During Wartime"," Lexus LF-CC: A Japanese Grille Opens in Paris"," Gay Center to Make Its Village Home More Open and Less Noisy"," A New and Improved Libor, Maybe"," Tim Cook Apologizes for Apple's Maps"," At the U.N., Agitation, Outrage and Business as Usual"," T-Mobile Sells Rights to Towers for $2.4 Billion"," British Regulator Unveils Libor Overhaul"," The Trouble With Fixing Libor"," Part 5: Answers From Princeton's Dean of Admission"," Redistribution of Wealth in America"," India, Home of the Nonviolent Protest, Embraces More Extreme Dissent"," China: Dissident Artist Rejects Fines"," Afghanistan: Joint Missions Rise Again"," Sun Top Liberty in Playoff Opener"," In Virginia, Nominees Reach Out to Military"," Ex-Worker Left I.R.S. for Job at Bank He Audited, Complaint Says"," Charges of Bias in Admission Test Policy at Eight Elite Public High Schools"," Nike Profit Falls 12% as Higher Costs Outweigh Strong Sales"," The Myth of Fixing the Libor"," Raising Frogs for Freedom, Prison Project Opens Doors"," Paintings Close to Home for an Italian Renaissance Master"," BlackBerry Maker Posts a Narrower Loss, and Stock Jumps in After-Hours Trading"," Sudan and South Sudan Sign Accord, but Several Issues Are Unresolved"," In Britain, Revised Figures Show a Smaller Economic Contraction"," Stocks Gain Despite Economic Data"," Europe to Seek Sanctions Against U.S. Over Boeing Subsidies"
"2012-09-29","0"," The Internet Is Apple’s Achilles’ Heel"," Highlights and Analysis: College Football Saturday"," Greek Premier Sees Hope, but Only if Europe Helps"," Federal Judge Dismisses Lawsuit Against Ex-Gov. Spitzer"," Apple Apologizes for Misstep on Maps"," Russian Parliament Bars Opposition Lawmaker From Speaking"," Cambodia Is Seeking 2nd Statue"," Gas Prices Cause Rise in Consumer Spending"," Massachusetts: Chemist Charged in Scandal That Closed Laboratory"," N.H.L. Negotiations Stick With Side Issues"," Radwanska and Petrova Reach Final at Pan Pacific Open"," That Loaded Gun in My Carry-On? Oh, I Forgot"," Carmakers Try to Figure Out the New Generation"," Spain Needs $76 Billion to Recapitalize Its Banks, Audit Finds"," Stocks Down for the Day but Up for the Quarter"," Merkel’s Ex-Finance Minister to Oppose Her"
"2012-09-30","0"," Aurora Victim Pushes Gun Issue With New Ad"," McIlroy Able to Look Back at Near Miss and Laugh"," Oracle: Big Business Has Big Data Woes"," McIlroy Nearly Misses Tee Time"," A Public Service Reminder: Simpson-Bowles Is Terrible"," Emily Cummings, Erik Nelson"," Emily duPont, Brendan Gotowka"," Alissa Ritter, Zachary Lupu"," Offense Carries Bulldogs After Their Defense Fails"," As Money Pours Down, It’s No Wonder That Stocks Are Up"," Lightening the Load for Manufacturers"," Ukraine Ex-Premier Airs Video"," Return of Referee Known for Big Arms Is Welcomed With Open Arms"," Faced With Strengthened Rivals in Atlantic Division, Celtics Load Up"," Soriano’s Renaissance Gives Cubs a Quandary"," Political and Class Issues Complicate a Colorado Land Dispute"," Hot-Button Issue: The ‘Hot’ Factor"," Beyond the 6-Speed: More Ratios for Automatic Transmissions"," Restaurant Report: Manfreds & Vin in Copenhagen"," The 9.16.12 Issue"," The Inspiration Issue"
