"Date","Direction","Headline"
"2006-11-17","1"," When Venture Firms and Hedge Funds Collide"," The Economist Asks: Are Hedge Funds Necessary?"," Taking Stock of Milton Friedman"," Nagging Cisco on Human Rights"," Red Hat Says No Thanks to Microsoft Offer"," Starting a Revolution in the Pay Structure for Hedge Fund Managers"," Spitzer Sues Hedge Funds Over Market-Timing"," KBR Stock Rises on First Day"," Hertz Prices Low, But Still Brings Home the Bacon"," Nymex I.P.O. Prices above Range"," Vodafone in No Rush to Sell Verizon Stake"," Head of Renault and Nissan Backs Away From Detroit"," Newark: Executives Admit Conspiracy"," Bronx: Stadium Objection Dismissed"," Pakistan: Medium-Range Missile Tested"," Corzine Questions if State Can Afford Legislature&#8217;s Plans for Property Tax Cuts"," Price Index Drops 0.5% a 2nd Time"," Ivy Football and Academics Strike an Uneasy Balance"," Head of Renault and Nissan Backs Away From Detroit"," High Price Tag Given to Open High Bridge"," Iraq Issues Warrant for Arrest of Sunni Cleric"," Korean Court Issues Warrants Against U.S. Fund Executives"," Right-of-Center Guru Goes Wide With the Gospel of Small Government"," Yum Brands Reshuffle"," With Markets Doubting OPEC Cut, Oil Is Lowest in a Year"," Starting a Revolution in the Pay Structure for Hedge Fund Managers"," Free Agents Seek Lucrative Baseball Off-Season "," As Oil and Gas Prices Fall, the Dow Hits Another Peak"," Jihadist Double Agent Writes of Derring-Do"," McCain Tells Conservatives G.O.P.&#8217;s Defeat Was Payback for Losing &#8216;Our Principles&#8217;"," Prices Soar and Records Tumble at Auction of Postwar Art"," Our Great Depression"," Dissecting the General’s Take on Iraq (6 Letters)"," Miss Havisham, Estella and Pip, the Microwaved Version"," World Briefing | Asia: Pakistan: Medium-Range Missile Tested"," Paid Notice: Deaths   MCCULLOH, DIANE JOAN (NEE TISHER)"," Paid Notice: Deaths   WEISSMAN, HAROLD"," TODAY IN BUSINESS"," Dissecting the General's Take on Iraq"," Free Agents Want Off-Season to Lead to More Free Spending"
"2006-11-18","0"," France: Royal Opens Quest for Presidency"," Judge&#8217;s Ruling Bars The Times From Using Sources&#8217; Information in Defense Against Suit"," City Approves ‘Carbon Tax’ in Effort to Reduce Gas Emissions"," 4 Hands Finding Unanimity on One or Two Keyboards"," Job and Jesus Combine to Find Meaning in Misery"," From Prom Dresses to Dog Treats — and a Chart to Guide You There"," National Briefing | Midwest: Missouri: Fire Ties Up Air Traffic"," World Briefing | Europe: France: Royal Opens Quest For Presidency"
"2006-11-19","0"," Old Business: The Game & The Question"," British Look Into Suspected Poisoning of Ex-K.G.B. Agent"," Kissinger Says Victory in Iraq Is Not Possible"," Nets’ Progress Hits Wall as Shots Miss the Mark"," Pregame Analysis, Punctuated by Screams"," A Cafe Opens to Serve a Mission to End the War"," Chemical Burns"," Newborns at a Renaissance"," He’s a Star, a Free Agent and, Rarer Yet, Only 26"," Colleen McCarthy and Daniel Turrentine"," When Being Medium Is No Mean Feat"," Fly Me to the Moon, and Let Me Profit on My Stocks"," Finding Bliss in Avalanche Country, British Columbia"," The Price of Climate Change"," New Jersey Weekend: Oh! The Places They Crowd -- Saturday; 11 a.m.: Sousa and Brisket"," The Remix; Paradise Regained"," The Remix; It's all about ..."," Paid Notice: Deaths   LISS, HENRY R., M.D."," The Remix: The Sophisticated Traveler; Dream Liner"," The Remix; What's a BRIC?"," New Jersey Weekend: Oh! The Places They Crowd -- Saturday; 5 p.m.: A Pint and a Barstool"," The Remix; TABLE TALK | ORGANIC CHEMISTRY"," The Remix; START-UP | RAD PADS"," Nets' Progress Hits Wall As Shots Miss the Mark"," The Remix; Tip-Off | Best Wurst"," The Remix; The New New List: Winter '06"," The Remix; All in the Family"," The Remix; TREND SPOTTING | SHANGHAI'S NEW SPIN"," When Being Medium Is No Mean Feat"," Colleen McCarthy, Daniel Turrentine"," The Remix; Shelf Life"
"2006-11-20","0"," Nasdaq Bids $5.1 Billion for London Exchange"," Little Miss Box Office"," Macao Casino Moving Ahead on Nasdaq I.P.O., Report Says"," Chevron Backs Off USA Petroleum Deal"," In Hollywood, Hedge Funds Fuel Moguls' Comebacks"," Iraq Reopens Diplomatic Relations With Syria"," Nasdaq Steps Up Bid to Buy London Exchange"," Bohemia, N.Y.: Man Killed in Highway Crash"," In City Symbolizing U.S. Defeat in Vietnam, Bush Stresses the Prosperous Present"," The Jets Take a Couple of Risks, and the Bears Make Them Pay"," 2 Rhodes Scholars Multiply a Family’s Bragging Rights"," O’Neal Has Knee Surgery and Could Miss 6 Weeks"," Mets&#8217; Free-Agent Pursuits Await a Decision by Glavine"," India, Too, Tests a Medium-Range Missile"," A Producer Hangs 10 in a Risky HBO Pilot"," Stock Offerings This Week"," Bohemians’ Rhapsody on a Rooftop"," An Open Letter To Coach Mangini: Use the P-Word"," An Open Letter To Coach Mangini: Use the P-Word"," TODAY IN BUSINESS"," Spurrier Denies Speculation"," Paid Notice: Deaths   LISS, HENRY R., M.D."
"2006-11-21","1"," Commissioner's Report: Playoffs?!"," Should Nasdaq Leave London Alone?"," Lazard and Insiders Prepare for Stock Sale"," On Wall St., a Fresh Wave of Real-Estate Speculation"," Alcatel Takes Microsoft to Court"," Ex-Financial Chief at Capital One to Pay $1.8 Million Fine"," Record Sale Price Lets Equity Office Say, 'I Told You So'"," Verizon Directories Spin-Off Debuts Strongly"," Swiss Banking Tax Hasn't Scared Away Investors"," British Media Watchdog Trains Eye on BSkyB's ITV Deal"," Lagardere Tackles Soccer Rights in Sportfive Deal"," In Nasdaq's Bid for L.S.E., It Now Comes Down to Shareholders"," Comparison of FreshDirect Prices to Other Stores"," U.N. Rights Chief Visits Southern Israel"," S.E.C. Opens Inquiry at Ford"," Mccoy Practices for Texas"," European Union Plans Dog and Cat Fur Ban"," Italy: Top Intelligence Chiefs Removed"," South Korea: Big Order for Boeing"," Missing From Internet: Avid Shoppers’ Sharp Elbows"," British Shun a New Offer by Nasdaq"," Flaws Seen in Markets for Utilities"," Ex-Financial Chief at Capital One to Pay Fine of $1.8 Million"," Nepalese Report Says King Committed Rights Abuses"," Record Sale Price Provides an ‘I Told You So’ Moment for Owner of Equity Office REIT"," Schiano Dismisses Talk of Possible Move to Miami"," Pelosi: Bad Missteps, or Grand Strategy? (4 Letters)"," Iraq Reopens Diplomatic Relations With Syria"," At Risk: Arthritis May Be Tied to Different Leg Lengths"," Yo, Rocky, or Rambo, Gonna Fly Now at 60"," In Study, Distance Running Is Tied to Skin Cancer Risk"," World Business Briefing | Asia: India: Strong Manufacturing Growth"," World Business Briefing | Europe: Britain: BSkyB Buys Stake in ITV"," Pelosi: Bad Missteps, Or Grand Strategy?"," TODAY IN BUSINESS"," World Briefing | Europe: Italy: Top Intelligence Chiefs Removed"
"2006-11-22","1"," An Open - or Shut? - Case"," Executive at Stock Unit Said to Leave Hedge Fund"," Microsoft-Novell Pact Is Already in Dispute"," Alesco Financial Prices I.P.O."," NYSE Group Agrees to Divide Board Equally With Euronext"," Air Travelers, Seeking Deals, Push Down Prices"," Rangers Find What They Were Missing"," Belgium: VW to Move Golf Production"," Asia’s Agenda: This Time, Terrorism Takes a Back Seat to Trade Issues"," Murdoch, Accustomed to Risks, Retreats From One"," Executive at Stock Unit Said to Leave Hedge Fund"," Comcast Buys Some Rights to Disney&#8217;s Programs"," Microsoft-Novell Pact Is Already in Dispute"," A Minimum for City Schools"," House Staff Member Cleared in Inquiry on Leak of Iraq Intelligence Estimate"," Exact Cause of Ex-K.G.B. Agent’s Illness Eludes Poison Experts"," Energy Leads Shares as Oil Prices Rise"," An Owner No More, Alpha Dog Prowls"," Delivering a Truckload of Miracles"," World Business Briefing | Asia: India: Infosys Plans a Big U.S. Offering"," TODAY IN BUSINESS"," Paid Notice: Memorials   PRICE, BARRY"
"2006-11-23","0"," Bayer to Sell Chemicals Unit to Advent and Carlyle for $1.5 Billion"," Change in Backcourt Chemistry Leads to Same Result for the Knicks"," Armed With Internet Bargains, Travelers Battle High Airfares"," BJ&#8217;s Wholesale Club Chief Resigns, Sparking Speculation of a Sale"," Buchanan: License Renewal Sought for Indian Point"," Idaho: City Workers Are Fired After a Slow Fast-Food Run on Zambonis"," Oxygen Monitor Fails to Help Doctors Detect Birth Risks"," City to Name Food Policy Official to Address Hunger Issues"," Russia Inaugurates Book Prize. It’s Big."," Israelis, Palestinians and the Land Issue (3 Letters)"," World Premieres, Sure, but Room for Older New Music Too"," A Bag Wears IPod Buttons on Its Strap"," Finding Help to Bear the Load as the Burdens of Diabetes Pile Up"," Israelis, Palestinians And the Land Issue"," TODAY IN BUSINESS"," Change in Backcourt Chemistry Leads to Same Result for the Knicks"," Chemical Plant Explodes, Leaving Neighbors Homeless  "
"2006-11-24","0"," Frugal Traveler: Bars and Clubs in New Orleans"," Audit Finds Massive Fraud in China’s Social Security Fund"," Day Laborers’ Rights"," Stolen Dinner Costs Mother Thanksgiving Behind Bars"," The Last Gravestone Business Standing"," Airline Opens a New Breach in the French Defenses"," 80 Years After Coronation, a Queen Returns to Macy’s"," A Smarter Computer to Pick Stocks"," World Business Briefings: Europe, Asia Americas"," What We Talk About When We Talk About Brands"," Microsoft Gives Europe Antitrust Documents"," Dallas Equity Firm Cancels Deal to Sell Stake in Korea Exchange Bank"," Specialized Centers to Treat Depression (2 Letters)"," Symbols of the Gilded Age, With a 21st-Century Luster"," Temptations of a Minister of Finance"," Dogs May Help Find Genes That Cause Cancer"," Letters: A National Park at Risk"," Specialized Centers To Treat Depression"," A National Park at Risk"," TODAY IN BUSINESS"," Paul McCarthy -- Between Beauty and the Beast"
"2006-11-25","0"," N.Y.U. Loses in Semifinals of N.C.A.A."," Minnesota: Search for Missing Brothers"," Confident Missouri State Shocks No. 7 Wisconsin"," All That’s Missing Is Mr. Whipple"," Willie Pep, 84, Dies; Champion Who Made Others Miss"," Missed Mortgage Payments Rise 20% in Third Quarter"," Palestinians and Israel Say They Are Open to Truce"," Next, a Lawsuit Futures Exchange?"," Why Property Taxes Are All Over the Charts"," Economics: The Invisible Hand of the Market"," Palestinians And Israel Say They Are Open to Truce"," Paid Notice: Deaths   STOCK, ELEANOR SCHWARZ"
"2006-11-26","0"," Awaiting Lengthy Lab Confirmation of Bird Flu Risks Treatment Delays, Studies Find"," For Public Officials, a Pocketbook Issue"," A Missing Link in a 2,950-Mile Chain"," Property Tax Relief? Maybe"," Annette Hamlin, Richard Deming Jr."," Emily Barton, Thomas Hopkins"," Melissa Edelman, Jason Sorkin"," Bakery’s ‘Open Hiring’ Offers Anyone a Chance"," Bringing a Political Trial to Animated Life"," As a Free Agent, Bonds Is Creating a Dilemma"," Copenhagen: The Hotel Fox"," Bakery's 'Open Hiring' Offers Anyone a Chance"," Bakery's 'Open Hiring' Offers Anyone a Chance"," Bakery's 'Open Hiring' Offers Anyone a Chance"," Why Property Taxes Are All Over the Charts"," Why Property Taxes Are All Over the Charts"," Why Property Taxes Are All Over the Charts"," Why Property Taxes Are All Over the Charts"," Budget Would Raise Property Taxes Nearly 4%"," Awaiting Lengthy Lab Confirmation of Bird Flu Risks Treatment Delays, Studies Find"," The Movie Issue"," Paid Notice: Deaths   STOCK, ELEANOR SCHWARZ"," STOCKS AND BOND"
"2006-11-27","0"," Goldman's Co-Head of Investment Banking to Leave"," Are Today's Stock Buybacks Tomorrow's Deals?"," Buyout Deals, Shrinking Premiums, Grumbling Investors"," A Portrait of McCain"," A Dude on a Mission"," Microsoft Gives Europe Antitrust Documents"," Next, a Lawsuit Futures Exchange?"," Lone Star Cancels Deal to Sell Stake in Korea Exchange Bank"," London Exchange to Cut Prices in Reply to Investment Banks"," Swisscom in Talks to buy Back Mobile Stake"," BJ's Wholesale Club Chief Resigns, Sparking Sale Speculation"," Hedge Fund Fever"," Vatican Plays Host for ‘Nativity Story’ Premiere "," Second Trial for Chinese Rights Advocate Ends in Acrimony"," Stocks Fall Sharply on Concerns About Slowdown"," Wal-Mart to Open Hundreds of Stores in India"," When Don&#8217;t Smoke Means Do"," Iraqi Premier Blames Politicians for Violence"," Search Is Called Off for Missing Brothers"," Rift Over Afghan Mission Looms for NATO"," With the Price of Copper Up, the Plumbing Can Go Missing"," Jay-Z in Brooklyn, Unblemished by False Modesty"," My Life as a Dog"," Schedule of Treasury Bills and Tax-Exempt Issues Is Set for Week"," Stock Offerings This Week"," Paid Notice: Deaths   STOCK, ELEANOR SCHWARZ"," TODAY IN BUSINESS"
"2006-11-28","1"," Pelosi to Hastings: No on Intelligence Chair"," Casino and Hedge Fund Said to Consider Harrah's Bid"," Pink Slips Become Common Prescription for Option Ills"," Coca-Cola Chief Denies Plans for Bottler Bid"," Milberg Weiss Trial Is Set for 2008"," NASD, NYSE Agree to Merge Regulatory Arms"," Vocal Dissent"," Delta to Allow Retired Pilots to Expand Bankruptcy Claim"," S.E.C. Sets Hearing for Monday to Consider New Hedge Fund Rules"," Yankees Spend $26 Million for Rights to Igawa"," Hertz Shares Fall Below I.P.O. Price"," EMI Says a Potential Buyer Has Made an Approach"," As Nasdaq Raises $5.9 Billion War Chest, Hopes of a Higher Offer Fade"," Get the Mean-ing"," Pfizer to Cut Its U.S. Sales Force by 20%"," Marbury vs. Thomas: Business, Not Personal"," Fire in Missouri Kills 10 at Home for Mentally Ill and Disabled"," Boeing Not Afraid to Say ‘Sold Out’"," Stocks Drop Steeply After a Bull Run"," Don&#8217;t Dismiss Pirro, Republicans Say"," Nasdaq Will Raise $5.9 Billion War Chest"," Israeli Premier Makes an Offer to Palestinians"," Justice Official Opens Spying Inquiry"," Banker to Leave Goldman Sachs"," Delta to Allow Retired Pilots to Expand Bankruptcy Claim"," Back on the Court, Cremins Has a New Bounce"," Lawyers Cite Obstruction in 2nd Trial for Chinese Rights Advocate"," An Epidemic No One Understands"," Public Colleges, Gone Semiprivate (3 Letters)"," The U.N. Rights Council (1 Letter)"," Outcomes: Circumcision May Reduce Risk of S.T.D.’s"," Don't Dismiss Pirro, Republicans Say"," Passing Shines, but Running Game Doesn't Carry Its Share of Load"," Nasdaq Will Raise $5.9 Billion War Chest"," TODAY IN BUSINESS"," The U.N. Rights Council"," Paid Notice: Deaths  HIRSCHFELD, ZIPORA"," World Business Briefing | Asia: South Korea: Arrest Sought in Bank Sale Inquiry"," Public Colleges, Gone Semiprivate"," Top Self-Financed Campaigns in 2006"
"2006-11-29","1"," Don't Mess With Austin's Music Moniker"," Nissan Blows Some Doors Off the Altima"," Trump's 'Fired' is Microsoft's 'Hired'"," Citadel Says Hedge Fund Earnings Rose Fivefold in 2006"," Mystery Bidder Woos EMI"," Equity Firm Officer to Succeed Financial Executives at Comcast"," Holiday Shopper: Loading Up the Sleigh, for a Pittance"," Minnesota: Fire Chief&#8217;s Dismissal Urged"," In Amman Enemies, and Allies, Await Bush"," Brooklyn: Judge Dismisses Suit Against Park Plans"," Equity Firm Officer to Succeed Financial Executives at Comcast"," In Utah, the Half-Life of Arena Naming Rights"," Business Chief Hedges, a Bit, on Running for Mayor"," New Chief at Pfizer Will Reduce Sales Force"," Albany Weighs Risks of Health Care Plan"," Supreme Court Weighs the Meaning of ‘Obvious’"," Ruling Lets Women Share Rights Custody Fight"," Billionaire Ally of Dead Spy Issues Statement"," EMI Says It Was Approached by a Suitor"," Pro-Peace Symbol Forces Win Battle in Colorado Town"," After Monday’s Fall, Markets Stand Firm"," Electricity Markets (1 Letter)"," In New Bidding, Price Is Right for the Yankees"," Recipe: The Stray Dog"," TODAY IN BUSINESS"," Electricity Markets"," In Utah, the Half-Life Of Arena Naming Rights"
"2006-11-30","0"," Boeing May Be Power Broker in Delta Bid"," A Swiss Mystery at Euro Disney"," Are Securities Rules Hurting U.S. Markets?"," Financial Firms Buy National Home Health"," Recent Openings"," Microsoft Unveils New Operating System"," Tokyo Financier Pleads Not Guilty to Insider Trading"," Hicksville: Two Dead at Plumbing Business"," El Salvador: $461 Million U.S. Antipoverty Grant"," In Queens, Closed Nursing Home Still Open to Controversy"," World Business Briefing: Europe, Americas and Asia"," Iraq’s Premier Abruptly Skips a Bush Session"," Police Commissioner Looks Ahead, and Back"," Ex-A.I.G. Chief Denies Report He Is Accumulating Times Stock"," Hedging on Hedge Funds"," More Doctors Turning to the Business of Beauty"," New Home and Issues for Civil Rights Project"," Use of Pfizer Drug in Children Is Backed"," Treatment of Anemia Questioned"," NASA Plans Night Launching for Next Mission of Shuttle"," Missouri: Student Dies in Fraternity House Fire"," Technology Marketers Go Touchy-Feely in Effort to Lure Customers to New Products"," Argentina Still in Hunt for Its First Davis Cup"," Manhattan: City Finances Called Flush but Fragile"," Health Care at a Premium"," Former Russian Premier Falls Ill; Poisoning Seen as Possible Cause"," Eminem and Lil Wayne, Rhyming With Friends"," Small Business Fighting Big Spam "," It Messages, It Downloads, It Even Makes Phone Calls"," A Simple, Compact System for Opening Up the Dead Zones That Block Cellphone Signals"," TODAY IN BUSINESS"," Breaking Up Open Spaces, With the Option to Change Your Mind"," Searching the Mountains on an Afghan Mission  "," World Briefing | Americas: El Salvador: $461 Million U.S. Antipoverty Grant"," World Business Briefing | Americas: Canada: Barrick Drops NovaGold Bid"," Loading Up the Sleigh, for a Pittance"
