"Date","Direction","Headline"
"2006-05-17","0"," The Human Side of a Microsoft Disaster"," Office Depot: Stocking Up?"," Pitney Bowes Sells Finance Business"," Hedge Funds and Hollywood: a Mixed Review"," Former Infinium C.E.O. Charged with Stock Manipulation"," Nike to Pay Licensee After Losing Arbitration"," Guardium Secures Funding from Cisco Systems"," Exchange I.P.O., Italian-Style?"," As Lawsuit Advances, Verizon Denies Turning Over Phone Data"," Washington in No Rush to Regulate Hedge Funds"," UBS Wins Bidding War for ABN Amro Trading Business, Reports Says"," As Exchanges Pair Up, Some Ask Why"," The Human Side of a Microsoft Disaster"," Paul McCartney and Second Wife Split"," Stocks Fall Sharply After Consumer Prices Jump"," Fed Chairman Sees Risks in Stiffer Hedge Fund Regulation"," Missing: Half of a One-Two Punch"," Caterpillar to Buy Supplier"," Colorfully, Some Students Protest McCain at Columbia Ceremony"," Afghan Lawmakers Review Court Nominees"," Chief Says Sun Plans to Offer Open-Source Version of Java"," Financial Reports Disclose Corzine's Continuing Largess"," An American Embassy in Tripoli"," Verizon Denies Turning Over Local Phone Data"," Lawsuit Is Dismissed on Trade Center Floor Slab"," Rush to Join Exchanges While Mirror Is Cloudy"," Barbaro's Owner Honed His Business Sense in Baseball"," New Nazi Files on Holocaust to Be Opened"," Shares Report Slight Losses in Reaction to Data on Prices"," L. Carrol, 83, Is Dead; Gave Nixons Dog Known as Checkers"," Wholesale Prices and Housing Data Cool Inflation Worry"," Dry-Cured Sausages: Kissed by Air, Never by Fire"," The Toughest Mission Yet for 'The Amazing Race'"," Deborah Voigt and Renée Fleming vs. the Ghosts of Met Divas Past"," World Business Briefing | Europe: Germany: Gas Company Plans Expansion"," Fairway Opens Its Brooklyn Doors"," The Darlings of Broadway: 2006 Nominees"," Metro Briefing | New York: Manhattan: Dissent In Memorial Foundation"," TODAY IN BUSINESS"
"2006-05-18","0"," Hedge Funds' Next Big Thing Is Everything"," Republican Blogs: 'Aloof' to 'Openly Hostile' on Immigration"," Shareholders Defy J.P. Morgan on Stock-Grant Resolution"," Fugitive Hedge Fund Manager Intercepted"," I.B.M. to Acquire Swiss Software Concern"," The Fever for Exotic Stocks"," Judge Extends Oversight of Microsoft"," S.E.C. Eases Audit Rules but Rejects Exemptions"," American Parent Prices Shares for New Issue"," Sprint Wireline Business Embarks on a New Life, Alone"," Burger King I.P.O. Prices at High End"," U.S. Subpoenas UnitedHealth on Stock Options"," Mellon Financial Buys Scottish Fund Manager"," A Tax Law May Help Pfizer Get Its Price for Consumer Unit"," Slide Show: Recent Openings"," Milberg Weiss Is Charged With Bribery and Fraud"," Europe Freezes Financial Assets of Belarus Officials"," Senate Panel Questions C.I.A. Nominee"," Stocks Fail to Recover From Big Sell-Off"," Business as Usual (Sort of) for Knicks"," U.S. Subpoenas UnitedHealth on Stock Options"," Burger King Announces Share Price for Public Offering"," S.E.C. Eases Audit Rules but Rejects Exemptions"," Judge Extends Oversight of Microsoft"," Inflation Rising, Markets Tumble"," Hotel Labor Issue Clouds Hartford's Redevelopment"," The Fever for Exotic Stocks"," Mississippi Judge Throws Out Conviction"," Tramway May Not Reopen Until the Fall"," Chic Hecht, 77, Former Senator and Businessman From Nevada, Is Dead"," Islamic Head Scarves at Issue in Killing of Judge in Turkey"," Mob Figure Is Convicted of Murder"," Missing Opera's Lost Generation of Stars at a Gala for Volpe"," Paul McCartney and Wife Say They Have Separated"," Look, Ma! No Hands, and No iPod"," A Mac in Black: Apple Introduces Its New Laptop Line"," Seeking 'Healthy' Look, Tanners Ignore Risks"," Wie Crams for U.S. Open Test"," Tramway May Not Reopen Until Fall, After Inspections"," Paid Notice: Memorials   LISS, ELLIOTT R."," Arts, Briefly; Chili Peppers' First No. 1"," TODAY IN BUSINESS"
"2006-05-19","1"," J.P. Morgan Hires Lehman Banker to Advise Hedge Funds"," Nasdaq Gains Blocking Stake in London Exchange"," Water Technology Concern Acquires a French Home Products Maker"," The Voters Who Like McCain"," Hedge Funds in Banks'  Clothing"," U.S. Accuses Abbott of Inflating Drug Prices"," Stock Option Subpoenas Issued"," Symantec Takes Microsoft to Court Over Trade Secrets"," BNP First-Quarter Profit Rises on Investment Banking Revenue"," A Senior Taliban Figure May Have Been Captured"," Trade Minister Presses Effort to Battle Extortion of Businesses"," Where Pitch Count Means Commercials"," Sales Miss Estimates at Barnes &#38; Noble"," Federal Judge Dismisses Lawsuit by Man Held in Terror Program"," Apple, a Success at Stores, Bets Big on Fifth Avenue"," Testy Exchange Precedes Vote on Ban of Same-Sex Marriage"," William Ginsberg, 75, Advocate for Preservation of Open Space, Dies"," Cink Opens With 64 to Lead Colonial"," Stock Option Subpoenas Issued"," Pataki Says He Is Likely to Back Effort to Reduce Gasoline Tax"," Israel Will Buy Supplies for Gaza Hospitals, Premier Says"," In a Southern Foray, Giuliani Helps a Friend but Skirts an Issue"," Nominee for No. 2 Fed Post"," U.S. Accuses Abbott of Inflating Drug Prices"," Iran's Secrecy Widens Gap in Nuclear Intelligence"," Nominee Says N.S.A. Stayed Within Law on Wiretaps"," 5 Bird Flu Deaths in Indonesia Not Linked to Human Exchange"," Oxford Seeks More Curbs on Protests to Aid Animals"," Vioxx Data Suggest Risks Started Earlier"," World Briefing | Europe: Vatican City: Pope Presses Catholic Rights"," Metro Briefing | New York: Bohemia: Endorsement Expected For Candidate"," TODAY IN BUSINESS"," Paid Notice: Deaths   MORRISSEY, THOMAS LEO"," World Business Briefing | Europe: France: Fuel Costs Hurt Air France's Income"," Art in Review; Ken Price"
"2006-05-20","0"," Palestinian Head of Intelligence Wounded in Explosion"," Senator Proposes Creating Board to Oversee College Admissions Tests"," Flaw in Microsoft Word Used in Computer Attack"," Admissions Officials Lament Practice of Signing On With More Than One College"," 3 More Companies Queried on Granting of Stock Options"," Graduates at New School Heckle Speech by McCain"," Battle for Euronext Heats Up; Nasdaq Gains Edge on London Exchange"," Automakers Drop Lawsuit on New York's Emissions Rule"," R. Bruce Merrifield, Who Won Nobel Prize in Chemistry, Dies at 84"," Bausch Says Report Helps Other Products"," The 24th Annual Young Playwrights Festival at Peter Jay Sharp Theater"," The C.I.A. Nominee Takes the Stand (2 Letters)"," It's Here; It's There; It's Spyware"," BUSINESS BRIEFS"," Palestinian Head of Intelligence Wounded in Explosion"," The C.I.A. Nominee Takes the Stand"," The C.I.A. Nominee Takes the Stand"
"2006-05-21","0"," NYSE Group Plans to Buy European Exchange"," Hundreds March for Immigration Rights"," Hundreds Are Still Missing After Typhoon"," Bjorn Shares Irish Open Lead"," Myanmar Dissident Healthy, U.N. Agent Says After Meeting"," Palestinian Intelligence Chief Is Badly Wounded in Bombing"," Herbert Doan, 83, Is Dead; Ran Dow Chemical Company"," Price Report Sends Stocks Into Reverse"," Gasoline Prices Got You Down? Do the Hybrid Math"," Emily Lehrer and B. J. Rimel"," Jennifer Nistad and Kevin McCooey"," As a Mount Kisco Center Closes, Other Opportunities Open"," Phoenix's Unresolved Daddy Thing, and Other X-Men Issues "," Promotional Intelligence"," Very Unimportant People"," One Reason to Care About Dividends"," 	  A High Price in Harlem"," Changing My Feminist Mind, One Man at a Time"," A Coronation in Greenwich"," Roof Bars: Drinking In the Skyline"," A Corner of Greenwich, but Without the Prices"," The Remix; It's all about ..."," The Remix; Like an Egyptian"," The Remix; Call It StoHo?"," A Missing Collaborator"," The Remix; Art | Below The Beltway"," The Remix; Hollywood and Divine"," The Remix; Pitch Perfect"," Governors Island, Now Open"," The Ticket; 10 Soon-to-be-sandy items that no back seat, bike basket or summer share should be without. Wet dog optional."," The Remix; Window Display"," Hundreds March for Immigration Rights"," The Remix; Coffee Down Under | Blame It On Roma"," The Broadway Paradox"," Paid Notice: Deaths   ARBEENY, EMILY"," The Remix; Pole Dancing"," The Remix; Venetian Class"
"2006-05-22","0"," Goldman Names Investment Banking Head in Europe"," Brokerage Stocks: What Goes Up..."," A Contrarian View on Mutual Fund Firm M&A"," Milberg Weiss's Unlikely Defender"," Milberg Weiss Fired by Ohio Attorney General"," Mitsubishi's DRAM Business Under Scrutiny"," Private Equity Versus Hedge Funds"," More Companies Show Uncanny Stock-Option Timing"," A Former Citigroup Trader Closing Down Hedge Fund"," Understanding Islamic Finance"," Lehman Tempted by Private Equity Business"," Stock-Option Investigation Expands"," Report on Gas Prices Finds No Collusion"," Big Board Bids for Exchanges Across Europe"," U.S. Is Proposing European Shield for Iran Missiles"," 5 Dead After Gunman Opens Fire in a Church in Louisiana"," For Carolina's Cole, Injury Is Open Wound"," Kuwait's Emir Calls Election, Citing 'Stability'"," NYSE Group Aims to Buy European Exchange"," Grand Themes, Conveyed in Movement and in Paint, in 'Cambodian Stories'"," MySpace Will Play Host to a Free Magazine Issue"," Stock Offerings This Week"," One Kiss and Too Many Errors to Count  "," Stock Offerings This Week"
"2006-05-23","0"," Pogue at the Apple Store Grand Opening"," Le Cirque's Opening Party"," McClatchy Reaches Deal for Philadelphia Newspapers"," EMI: We Still Want Warner Music"," Pogue at the Apple Store Grand Opening"," Kissinger to the Rescue?"," Missing Link Is Vonage's Latest I.P.O. Woe"," Lehman to Pay $400,000 Fine to NYSE Regulation"," Activision Buys Rights to Games Based on Mattel's Barbie"," Microsoft Rebuffed by Korean Regulator"," Guilty Plea in Case Related to Milberg Weiss"," Where Will The Stock Options Investigations End ?"," DLJ Merchant Banking Returns to the Waste Business"," Stock Exchanges: The Bidding War is On"," Hellmann to Become Big in Hedge Fund Assets"," American Express to Buy Back $10 Billion of its Own Shares"," Electronics Giant Philips Goes Into the Baby Business"," Goldman Sachs Raises U.K. Ports Bid to $4.5 Billion"," McClatchy Sells Philadelphia Newspapers"," A Sign of Renewal and a Reminder at Ground Zero"," Rights Group Faults U.S. for 'War Outsourcing'"," Sharp Drop in Stock Exchange Ignites Concern on Economy"," Big Board Bids for Exchanges Across Europe"," $44 Million Ferry Terminal Is to Open in Weehawken"," Violence Goes Unreported in Some Schools, Audit Says"," Former Political Enemies Join in Exile to Push for Change in Syrian Leadership"," Standard & Poor's Upgrades City's Credit Rating to Best Ever"," U.S. Expands Its Scrutiny of Stock Grants"," Campbell Raises Its Forecast as Soup Sales and Prices Rise"," Gas Prices Legitimate, Study Says"," Tanning and Health Risks (1 Letter)"," Heckling McCain at the New School (3 Letters)"," From the 'Dog Whisperer,' a Howl of Triumph"," New DVD's: A Box of DeMille"," American Symphony Orchestra Plays Works From Three Swiss Composers"," The Claim: Taking Selenium Lowers Risk of Heart Disease"," TODAY IN BUSINESS"," Tanning and Health Risks"," Heckling McCain At the New School"," Heckling McCain At the New School"," Heckling McCain At the New School"
"2006-05-24","1"," Apple Giveth and Apple Taketh Away"," Beverage Seller Hansen Natural Open to Acquisition, Chief Says"," With Links to Home Depot Board, Chief Saw Pay Soar as Stock Fell"," Senator to Put Boeing on the Grill"," File-Swapping Software Maker Sues eBay Over Online Phone Technology"," Hedge Fund Heavy Sees Grim Outlook for the Field"," Microsoft Spinoff Bags $10 Million"," Four Chinese Property Developers Enter the Stock Market"," CBS To Offload Some Radio Stations"," Hedge Fund Increasing Stake in Mills"," More Open Source Deals To Come"," Stock Exchanges: Who Can Go All The Way?"," Vonage Prices Its Shares At $17 Dollars A Piece"," Apple Giveth and Apple Taketh Away"," 'La Moustache': A French Mystery Plays With Notions of Conspiracy and Illusion"," Call to Open the Primary Ballot"," Uzbekistan: Opposition Figure Freed"," Luster of 7 World Trade Center Has Tattered Reminder of 9/11"," Vonage Prices Its Shares"," Dell to Open Stores in 2 Malls as Experiment"," Senate Panel Endorses C.I.A. Nominee"," One Team but Many Brands for Soccer Heroes"," Art Show Is Reopening in Brooklyn"," Euronext Turns Down Offer From German Exchange"," Rights Group Criticizes U.S. Over 'Outsourcing' in Iraq"," Microsoft Says New Windows Is on Schedule"," Shoes Are Made for Talking: Telling Your iPod About You"," Senator Plans Bill to Ban Fuel Price Gouging"," 	  Intel Details Broader Role in Indian PC's"," Farmers' Markets Go Beyond Green"," TODAY IN BUSINESS"
"2006-05-25","1"," McCain's New Pal, at Lunch"," Strong Debut for MasterCard Stock"," McCain's New Pal"," Finding a Cure for the Layoff Epidemic"," Yahoo and eBay Form Advertising Alliance"," UBS Bulks Up Futures Business With ABN Amro Deal"," Stock Option Inquiry at 4 More Concerns"," American Stock Exchange Sends Warning to Armor Maker"," Two Johnson & Johnson Start-Ups Merge"," Nestle Snacks On Australian Brands"," As Nasdaq Defends Pricetag, Hopes for L.S.E. Takeover Dim"," MasterCard I.P.O. Prices Shares Below Target Range"," Slide Show: Recent Openings"," Yahoo and eBay Form Advertising Alliance"," Enron Chiefs Guilty of Fraud and Conspiracy"," A Station With a One-of-a-Kind Campaign: All Snapple, All the Time"," F.B.I. Missed Many 'Red Flags' on Key Informer, Review Finds"," Key Mayoral Campaign Aide Is Named a City Commissioner"," Parents Making Use of TV Despite Risks"," At Trial of an Ex-White House Aide, an Admission and a Denial"," Shares Rise for First Time This Week as Oil Price Falls"," Stock Option Inquiry at 4 More Concerns"," Conviction Overturned in Texas Yogurt Shop Killings"," U.S. Opens Inquiry Into Civilian's Death in a Marine Raid"," Hedge Funds Draw Critics in Europe's Market Wars"," China Cellphone Giant Ready to Bid for Emerging Markets"," High Price of Comedy: Fox Just Says No"," It's Dixie Chicks vs. Country Fans, but Who's Dissing Whom?"," Parents Making Use of TV Despite Risks"," What Price Happiness? ($67.50)"," Mets Hold Impromptu Tryouts for Openings in Rotation"," World Business Briefing | Europe: France: Eurotunnel Debt Deal"," TODAY IN BUSINESS"," Arts, Briefly; Chili Peppers Hold On to No. 1"," World Business Briefing | Asia: India: Airline Extends Offering"
"2006-05-26","1"," Pataki Switches Endorsements"," Bail Troubles for Accused in  Insider Trading Case"," More Upside for Univision Stock in a Buyout?"," Talk to the Newsroom:<br />Business Editor Larry Ingrassia"," Yet Another Company Added to S.E.C. Stock Options Probe"," Atop Hedge Funds, Richest of the Rich Get Even More So"," Mueller Water Prices I.P.O."," Intel Puts the Kibosh on I.P.O. Rumors"," Bill Would Fully Reopen Statue of Liberty"," Atop Hedge Funds, Richest of the Rich Get Even More So"," Nevada Backs Wiccan Symbol on Soldier's Headstone"," State Campaign Finance Rules Need Tightening, Study Says"," Pataki Seeks Greater Cuts in Mercury Emissions"," Small Markets. Big Results."," Raiders From Sudan Killed 118 in Chad, Rights Watch Reports"," Taiwan: President's In-Law Charged With Insider Trading"," Hey, You Have a Problem Paying Alpha Fees and Getting Beta Returns?"," Here Comes the Bride (but Not From Afar, Emirates Hope)"," Ian Copeland, 57, Music Agent, Is Dead"," The Books Perform at the World Financial Center Gallery"," Brooklyn Jazz Renaissance: High-Quality Music in Casual Cafés"," Two Enron Chiefs Are Convicted in Fraud and Conspiracy Trial"," A Kiss for a Fallen Soldier  "," TODAY IN BUSINESS"," Paid Notice: Deaths  HOPENWASSER, ALAN"
"2006-05-27","0"," Caterpillars"," Opened Files Show Kissinger's Pragmatism"," Virginia Is One to Beat, in Case You Missed It"," Gas Prices Aren’t Deterring Summer Travelers"," U.S. Is Debating Talks With Iran on Nuclear Issue"," Schumer Bars Vote on Trade Nominee"," Vaccine to Cut Risk of Shingles in Older People Is Approved"," James B. McClatchy, 85, Patriarch of a Newspaper Family, Is Dead"," Senate Backs Several Nominees, Including Those for FEMA and Interior"," French Open Adds Day; Clay Stays the Same"," Lower-Priced Housing Is Vanishing at a Faster Pace"," Russia: Moscow Court Bars Gay Parade"," How the Home Depot Board Sets Its C.E.O.'s Pay (1 Letter)"," A Decade of Soaring and a Month of Stumbling for India's Stocks"," World Briefing | Europe: Russia: Moscow Court Bars Gay Parade"," How the Home Depot Board Sets Its C.E.O.'s Pay"
"2006-05-28","0"," Trial Opens Window on Shadowing of Muslims"," Afghan Parliament Rejects Chief Justice Nominee"," No Shortcuts for Penske: Fastidious Means Fast"," British Academics' Debate Sharpens as Vote on Israel Nears"," Myanmar Extends Dissident's House Arrest"," The Price of Iraq"," In a Turbocharged Age, a Nod to the Lollipop Man"," Whew: Relief From Bad News in the Markets"," Face to Face With Risk, and Learning How to Handle It"," Dear Graduates: Money Is a Means"," Eminent Domain's Pre-Eminence"," Ol' Blue Eyes and the Boss; Dissatisfaction With a Bus Company; 125-Year-Old Elephant Needs a Hand (3 Letters)"," Opening That Wallet for a Bicycle Built for You"," Jaime McCarthy and David Hollander"," Melissa Vogel and Brian McViney"," Helping Mississippi in Scarsdale; Do Citizens Lose Jobs to Immigrants? (2 Letters)"," Affordable Housing in Garden City; A Maritime Museum; Giant Trash Trucks (3 Letters)"," Nassau Inches Closer to Saving Open Land"," Check the Numbers: Rumors of Classical Music's Demise Are Dead Wrong"," Free Advertising"," Corps Issues"," With 'Cars,' Pixar Revs Up to Outpace Walt Disney Himself"," Cancún Reopens in Time for Another Hurricane Season"," A Symbol of Carefree, Innocent Fun? Not in Oyster Bay"," Helping Mississippi In Scarsdale"," Light Sabers? Yes, They're Bamboo  "," A Maritime Museum Not to Be Missed"," MISSING WOMEN"," Mutant Dogs And Yellow Duckies"," Four Departing School Leaders See Finances as the Big Test"," It's a Holiday Weekend and the Dogs Are Ready  "," Russian Police Thwart a Gay Rights Parade in Moscow  "," Those Backwater Folks in Dogpatch"," Dissatisfaction With a Bus Company"," New Section of Bridge Opens Over Housatonic"," Not Quite Yasgur's Farm, But Close"," Affordable Housing In Garden City"," WINE UNDER $20; A Peppery Prize From Austria"
"2006-05-29","0"," Profiles in Courage on Animal Welfare"," The Emirate Strikes Back"," Endorsements for Faso and McFarland"," Pentagon Seeks Nonnuclear Tip for Sub Missiles"," Some Close Calls and Sour Moods at the French Open"," Roddick Expects to Be Ready for Opener"," Ken Loach's 'Wind That Shakes the Barley' Wins Top Prize at Cannes"," Goldman Sachs Tries to Halt Sale of a Big Stake by Arcelor"," Investor in Advertising Firms Makes His Move on a Rival"," A New Javits Center, With Open Spaces (2 Letters)"," A New Javits Center, With Open Spaces"," A New Javits Center, With Open Spaces"," TODAY IN BUSINESS"
"2006-05-30","0"," Suozzi Dogs"," Collapsed Hedge Fund Bayou Wants Its Money Back"," Kinder Morgan Stock Soars on Buyout Proposal"," Marsh Supermarkets Gets a Higher Takeover Bid"," Disc Jockey Seeks Dismissal of Charges"," Scrushy Lawyer Takes Issue With Lay's Defense"," As Hedge Funds Set Sights on Start-Ups, V.C.'s Get Nervous"," A Brewer, Thai Beverage, Falls on Opening"," Custodial Banks Are Missing the Hedge Fund Boat"," Investor in Advertising Firms Makes His Move on a Rival"," Stocks Fall Sharply as Inflation Fears Grow"," Justices Set Limits on Public Employees' Speech Rights"," European Markets Move Down in Light Trading"," Holiday Travelers Hit the Road, but Scrimped a Bit"," George Field, Defender of Human Rights, Is Dead at 101"," China Begins Effort to Curb Piracy of Computer Software"," Henry Bumstead, 91, Production Designer for Noted Films, Dies"," Minimizing the Risks"," Intelligent Beings in Space!"," Bacterial Evolution in the Yogurt Ecosystem"," Age Is No Barrier to Lifting Depression's Heavy Veil"," An Assault on Rights (1 Letter)"," An Assault on Rights"," The Epidemic as Avalanche: A Two-Part Series Documents 25 Years of AIDS"," TODAY IN BUSINESS"," Paid Notice: Deaths   VISSON, MIRRA, RENEE"
"2006-05-31","1"," Standard Life Members Vote for Stock Float"," Scrushy's Stock Option Grants Raise Questions, Report Says"," Harrah's and Pinnacle to Exchange Casinos"," Stock Option Inquiries Bring an Ouster and a Lawsuit"," Credit Suisse Mulls Play for All3Media, Report Says"," Marsh Supermarkets Gets Second Bid from Consortium"," Hedge Funds Continue to Oppose Lexar-Micron Deal"," Rice ProposesPath to TalksWith Iran on Nuclear Issue"," U.S. Stocks Rebound From Tuesday's Decline"," Report Shows AIDS Epidemic Slowdown in 2005"," Treasury Nominee Faces a Change in Pay and Control"," Merck Admits a Data Error on Vioxx"," Bayou Hedge Funds File for Chapter 11"," Director of City's Campaign Finance Board to Leave Job for a Philanthropic Post"," Stock Option Inquiries Bring an Ouster and a Lawsuit"," A Match Made in Product Placement Heaven"," In 'Ham Lake,' a Narcissist Stuck in Adolescence, Whether He Wants It or Not"," 'The Hills,' a Follow-Up to 'Laguna Beach,' Makes Its Premiere on MTV"," Metro Briefing | New York: Manhattan: Disc Jockey Seeks Dismissal Of Charges"," TODAY IN BUSINESS"," Paid Notice: Deaths   MCCORMICK, WILLIAM W."," A Change in Finances And in Control"," World Business Briefing | Asia: India: I.B.M. Triples Support Staff to 20,000"," World Business Briefing | Asia: India: G.E.'s Chief Forecasts Rapid Growth"," World Business Briefing | Asia: Malaysia: Theme Park Project Is Pursued"
