"Date","Direction","Headline"
"2008-09-01","0"," Other Stops: John McCain Needs a Plan"," McCain Raises $47 Million in August"," U.S. Open Attendance Record"," Broken Windows and Pepper Spray Mark Protests"," A Risk Neither Candidate Seemed Willing to Take"," Pressing the Gambling Issue"," Response to Storm Shows Changes in McCain Campaign"," Friday Night Lights:  An Interview With Buzz Bissinger"," Mr. McCain and Iraq"," John McCain’s Challenge"," 3rd Union Leader on Leave Amid Financial Inquiry"," Oil and Gas Production Is Suspended, but Prices Are Stable"," Party’s Plans Are Unsettled; McCain Visits Gulf"," McCain’s Pick May Foster Bigger Campaign Role for Clinton"," Storm Politics Present Risks and Rewards"," G.O.P. Rallies in Support of McCain, Poll Shows"," Sabathia Misses No-Hitter, but He Isn’t Complaining"," Operatic Cargo of Tragic Love, Unloaded on a Brooklyn Pier"," Everyone Out of the Pool (Yes, That Means You)"," Apple Imperfect"," The New Browser From Microsoft"," TODAY IN BUSINESS"
"2008-09-02","0"," McCain Cancels Larry King Interview"," Bush Touts McCain's Leadership on Iraq"," U.S. Open, Day Nine"," Officers Not Unanimous About the 'Surge'"," Neglected Houses Worsen Price Drops"," First Estimates of Gustav's Financial Damage"," McCain, Obama Campaigns Release Dueling Ads"," Margaret Thatcher's Open Secret"," Dementieva Moves On to Semifinals"," In Singapore, Taxis Trade Charm for Cleaner Emissions"," Paulson Said to Cut Price of Hamptons Home"," Ask About New York's Dog Runs"," Recessions, Good for Health"," Running a Hedge Fund Is Causing Headaches"," Price of Dresdner Deal Worries Commerzbank Investors"," Alitalia Unions to Bargain with Berlusconi on Bailout"," Citi Sees Opportunity in Asia-Pacific Hedge Funds"," Putting a Price Tag on the Sound of Music"," The Lego Mini-Figure at 30"," Mississippi Takes Another Hit"," Mississippi Takes Another Hit"," It's Opening Day in the K.H.L."," Lower Auto Insurance"," U.S. Open, Day Eight"," Oprah to Open Season With Olympians"," Target to Open Designer-Focused Stores in New York"," Missouri Star Maclin Expected to Return"," Mississippi State Linebacker Out"," Foreign Markets Decline on Economic Anxieties"," Demand and Price Are Falling for Lobster"," A Balancing Act on Emissions"," Ex-Premier of Thailand Sells Team in Britain"," Microsoft Faces New Browser Foe in Google"," When Fear and Chaos Are Normal, Peace and Safety Become Unimaginable"," Hazards: Toxic Metals Found in Health Products"," Superintelligent Machines (1 Letter)"," With Focus on Storm, Scaled-Back Convention Opens"," Price of Dresdner Deal Worries Commerzbank Investors"," The End of Summer? It's Only Symbolic"," TODAY IN BUSINESS"
"2008-09-03","1"," Are Personal Finances the Boss's Business?"," Sneak Peek | T's Men's Fall Fashion Issue"," McCain Defends V.P. Choice"," Google's Chrome Kills the Lucrative Toolbar Business"," Safina Cruises Into Semifinals"," Pointers for Palin's Premiere"," Answers About New York's Dog Runs"," Palin Family Welcomes McCain to Twin Cities"," Coca-Cola's Coup in China"," ""Who Is John McCain?"""," Bits Upgrade Means No Commenting Until Mid-Afternoon"," To Punish CNN, McCain Campaign Cancels Larry King Interview"," Forget Apple - Let's Speculate About the Microsoft Zune"," Ospraie's Flagship Hedge Fund to Close"," Merrill Hires Head of Mortgages and Securitization"," Missouri Guard Transfers to Seton Hall"," Jets Complete Relocation and Open Practice Facility"," Bush and Lieberman Hail McCain as a Leader"," Lieberman Highlights His Kinship With McCain"," Ospraie to Close Flagship Hedge Fund After 27% Tumble"," Events in Iraq Likely to Be Key Theme for McCain"," McCain’s Effort to Woo Conservatives Is Paying Off"," Candidate McCain’s Big Decision"," Two Top Men Are Pushed to the Limit at U.S. Open"," Despite Lower Oil Prices, Little Relief for Consumers"," Texas Ballet Theater in Financial Trouble"," McCain’s McGovern Moment"," K. K. Birla, a Leader of Indian Business, Dies at 89"," To Pry Open Tight Wallets, Two Retailers Stress Innovation"," Agent Says Israelis Let a Nazi Escape"," Russia President Dismisses Georgia’s Leader as a ‘Political Corpse’"," McCain and Palin, in a New Light"," A Regeneron Drug Minimized Recurrence of Gout in Clinical Trial"," Away Down South, 2 Museums Grapple With the Civil War Story"," English Soccer Club Sale Reveals Emirates’ Rivalry"," Apple Hints at iPod News"," Boeing Awaits Machinists’ Contract Vote"," From a Distance, Bush Praises McCain"," Oil Prices Plunge to Five-Month Low"," TODAY IN BUSINESS"," OPENING LATER"
"2008-09-04","0"," Live From St. Paul: McCain's Big Night"," Martin-Chang Open for Djokovic-Roddick"," McCain on Deck"," From Fight Dog to Man’s Best Friend"," Obama Appears on Fox on McCain's Night"," Previewing Senator McCain's Speech"," Condo-hotels are 'flawed business strategy,' developer's lawyer says"," U.S. Davis Cup Team Announced"," McCain Checks Out Convention Hall"," Cindy McCain Honored at Lunch"," McCain's Speech: What to Watch For"," McCain and the Actuarial Tables"," Answers About New York's Dog Runs, Part 2"," Tightening Up on How ExxonMobil Promotes Its Gas Business"," Red Meat With a Side of Mean"," European Roundup: Opening Night in Germany"," Another Day, Another Stock Drop for Lehman"," Height Linked With Prostate Cancer Risk"," Senator John McCain’s Convention Speeches"," New LG Blu-ray Player Streams Netflix - With Drawbacks"," The Early Word: It's McCain's Night"," Speculation Over Lehman's Plans"," Procter & Gamble Buys Maker of Thinning-Hair Products"," Blackstone to Open West Coast Advisory Arm"," Russian Steel Maker Takes Beta Steel for $400 Million"," Bulgaria, Slovakia, Russia and Hong Kong showing big price increases, report finds"," U.S. Open, Day 10"," Federal Lawsuit Against Chess Officials Is Dismissed in Dispute Over Online Messages"," From Bush to McCain: The Handoff"," Northern Ireland: I.R.A. Threat Ends, Watchdog Says"," McCain Policies Differ Sharply From Party Plank"," Old Friends in the Media See a New Side of McCain"," Investor Jitters Produce Mixed Markets"," Germany: Deere to Open Center"," Murray Grinds Out Breakthrough Victory to Gain Semifinals"," Kansas Teammates Kicked Out of Seminar "," Swiss and Swedish Rugs for Less"," A Printer That Won’t Blemish a Stylish Workspace"," Free Music Downloads Without the Legal Peril"," After Strike Vote, Boeing Union Agrees to Resume Talks"," Pfizer Acquires Rights to Alzheimer’s Drug"," TODAY IN BUSINESS"
"2008-09-05","1"," U.S. Open, Day 12"," As They Grind It in Seattle, the Yanks Miss Jorge Posada"," McCain and the Green Screen"," European Roundup: 100 Years of the Swiss League"," Serena Williams in Open Final"," Three U.S. Juniors Make Semifinals"," Answers About New York's Dog Runs, Part 3"," Ratings: McCain Has Slight Edge on Obama"," Tensions Between G.O.P. Lawmakers and McCain on Display"," Ratings: McCain Has Slight Edge on Obama; Could Be Decided by Supreme Court"," McCain and Palin Kick Off Post-Convention Tour"," Dog Days for Deal Watchers"," Now Online | T's Fall Men's Issue"," McCain Missed the Mark"," Goldman Puts 'Sell' Rating on Merrill Stock"," The un-recession"," Yahoo's Stock Hits 5-Year Low"," British Companies Emigrating Over Taxes"," Credit Suisse Broker Arrested in Securities Sale"," General Electric Sells Warranty Business"," Online Spectrum Exchange to Launch"," Ice in Fuel Seen as Culprit in Jan. 17 Boeing 777 Crash"," McCain Accepts Nomination"," U.S. Open, Day 11"," Death of a Boondoggle"," The Real John McCain"," Missed Opportunity for a Team With Few Left"," Bill Melendez, ‘Peanuts’ Animator, Dies at 91"," Overworking the Workhorse: Risk or Reward?"," Michael Hammer, Business Writer, Dies at 60"," E.P.A. Issues New Engine Rules"," Arthritis Drugs Linked to Risks From Infection"," After Testing Free Agency, Culpepper Retires "," As Oil Prices Fall, OPEC Faces a Balancing Act"," British Companies Emigrating Over Taxes"," McCain Vows to End ‘Partisan Rancor’"," TODAY IN BUSINESS"," Wide-Open Spaces Just Outside the Door"," THREE FOR SALE | Wide-Open Spaces Just Outside the Door"," THREE FOR SALE | Wide-Open Spaces Just Outside the Door"
"2008-09-06","0"," On the Republican Convention: McCain Is Right About School Vouchers"," On the Republican Convention: McCain Is Wrong About School Vouchers"," In Beijing, a Sublimely Spectacular Opening Ceremony"," U.S. Paralympians 'Amazed' at Opening Ceremony"," McCain and Obama Plan Ground Zero Appearance"," Expert Analysis With Thomas Blake"," Dog Day"," Experts Confirm Open Water Circling Arctic"," Federer Awaits His U.S. Open Final Opponent"," Respond to Today's Column: McCain's Grizzly Politics"," The Two Weeks You Missed"," McCain Makes His Pitch to America"," McCain’s Grizzly Politics"," Canada: Parliament to Be Dissolved"," Men’s Semifinals Moved Up an Hour"," Stocks Rebound After Early Losses"," Risky Loans Hurt Lender in California"," Making a Business of Family Loans"," Big Summer Sell-Off Hits the Russian Stock Market"," Defamation Suit by Italian Premier Is Rejected"," Nokia Lowers Forecast for Market Share"," Microsoft Works to Perfect Windows Vista"," Tensions Between G.O.P. Lawmakers and McCain on Display"," Machinists Union at Boeing Says It Will Strike"," U.S. Missiles Killed at Least Six People on Afghanistan-Pakistan Border, Residents Say"," Stocks Withstand Jump in Jobless Rate"
"2008-09-07","0"," Paperback Business Best Sellers"," Hardcover Business Best Sellers"," 'Entourage' Opens Doors for Wahlberg"," Wachovia Hires a New Finance Chief"," European Roundup: Who Can Stop Morozov and Ak Bars?"," Photos From Depression-Era Playland"," 'If Cindy McCain Were a Plane ...'"," Expert Analysis: Williams vs. Jankovic"," Jennifer Palumbo, Michael Siscoe"," 'McCain Came Out Swinging'"," John McCain’s Energy Follies"," A Free-Market-Loving, Big-Spending, Fiscally Conservative Wealth Redistributionist"," Space Station to Mission Control: It’s Your Move"," Notre Dame Avoids an Upsetting Opener"," Palin and McCain’s Shotgun Marriage"," Bonds Gain, Stocks Lose and Jobs Vanish"," The Semisweet Smell of Success"," On Dividend Taxes, It’s a Post-Partisan Race"," Boeing, With an Order Backlog, Is Hit by a Strike"," When Academia Puts Profit Ahead of Wonder"," Rejuvenated Federer Returns to U.S. Open Final"," Federer Reaches Fifth Straight Open Final"," An Adviser Molds a Tighter, More Aggressive McCain Campaign"," From Classics to a ‘Toxic’ Premiere"," Dinner and a Show, in One Spot, at One Price"," Available Soon Online: Fun From Depression-Era Playland"," Fuel Prices Squeeze School Districts"," He’s No Narcissist"," Open Up and Say {hellip} A NEW LABEL HAS THE LATEST WORD IN PANTS AND SUSPENDERS"," Pickup Pix | GREAT LINES AT EVEN GREATER PRICES"," The Risky Leap From Screen to Stage"," Paid Notice: Memorials   WEXLER, MELISSA ANN"," Boeing, With an Order Backlog, Is Hit by a Strike"
"2008-09-08","1"," Palin’s Bailout Statement Raises Questions"," Despite Hopeful Report, Lehman’s Stock Slumps"," Spooky Conspiracy on Sci-Fi Frontier"," Roger Federer Wins U.S. Open"," McCain and Economic Benefits"," Federer Overwhelms Murray to Win Fifth U.S. Open"," Photo of the Moment | United Bamboo, Saturday, 12:45 P.M."," Photo of the Moment | United Bamboo, Saturday, 12:37 P.M."," The Riders Pay"," Don't Miss the Other Art Museum in Villa Borghese...."," Affirmative Action, '60s Style"," Bank Stocks Lift on Fannie and Freddie Bailout"," Blues for a Bailout"," Deprivatization"," Bailout Forces Big Payouts in C.D.S. Market"," Huntsman-Hexion: The Pregame Analysis"," Feminist Critique"," Few Stand to Gain on This Bailout, and Many Lose"," Bailout Provides Relief to Asian Investors"," V.C.'s Serve Up $2 Million to Eco-Products"," A Second-Generation Fink Rises in Finance"," Ex-Goldman Trader to Raise $5 Billion for Hedge Fund, Report Says"," Nasdaq OMX Gets Nod for Pan-European Platform"," Fairfield Merges With Swiss Bank"," Goodbye, Dog Days"," Mccarville Sends Liberty Past Sky"," Powell Wins 100 but Misses World Mark"," Serena Williams Wins U.S. Open, Retaking No. 1"," A Former Finance Chief Takes the Reins at Freddie Mac"," In Rescue to Stabilize Lending, U.S. Takes Over Mortgage Finance Titans"," Murray Finishes Off Nadal to Reach His First Open Final"," A Financial Veteran Brings Wall Street and Washington to Job at Fannie Mae"," New-Look Falcons Open With Win"," Few Stand to Gain on This Bailout, and Many Lose"," A Mission to Moscow, Without High Hopes"," Fannie, Freddie and You: What It Means to the Public"," New CDs | EMILíANA TORRINI"," TODAY IN BUSINESS"
"2008-09-09","0"," Lehman’s Stock Hits 10-Year Low"," Shocker! Steve Jobs Blames It All on Hedge Funds"," Apple Offers Networks More Price Options for TV Shows"," AT&T and Verizon Wireless Offer New Services for Friends"," Microsoft Refugee Becomes a Social Technologist"," McCain Campaign Relocates Va. School Event"," New Reality Show ""Fixes"" Small Businesses"," McCain Campaign Fires Back at Paterson"," Looking Back at the U.S. Open"," McCain: I'm Like Jack Bauer"," 'Seen That New Microsoft Commercial?'"," Pot-Stickers, Meet Swiss Chard"," Obama's and McCain's 'Worst Ideas'"," At Apple Event, a New iPod but No Big Surprises"," Palin Still at McCain's Side, to Enthusiastic Crowds"," New York Fashion Week | Iguatemi Party"," A Bailout and a Tax Break to Boot"," Watch the iPod Price Points"," Highflying Hedge Funds Play It Safe"," A Risky High-Wire Act"," U.S. and Britain Share Top Spot on Financial Index"," Chairman Buys $100 Million of Dell Stock"," Rumors of a Pfizer Deal Lift Bayer Shares"," Computer Breakdown Hits London Exchange"," Templeton Aims to Grow Sovereign Wealth Fund Business"," DNA Profile Provider Is Cutting Its Prices"," The Bailout’s Big Lessons"," Favre Is Missing, but Excitement Isn’t as Packers Win"," Google Strikes Partnership With NBC to Expand in TV Advertising"," Big Payments Are Expected in Credit Default Swaps"," Computer Breakdown Halts Trading at London Exchange"," Fox Searchlight Wins Rights to ‘Wrestler’ Film"," Bipolar Disorder Tied to Age of Fathers"," Risks: For Heavy Snorers, Artery Concerns"," Times Will Shut Down Its Distribution Subsidiary"," Stocks Soar on Takeover Plan"," TODAY IN BUSINESS"," Bipolar Disorder Tied to Age Of Fathers"
"2008-09-10","1"," Lehman’s Stock Opens Higher"," A Conspiracy Theorist, Closing in on That Smoking Gun"," McCain-Palin: A Dynamic Duo"," McCain Ad: The Wolves Are Out Against Palin"," Downgrading McCain"," From China, News on Quake Risks and Liquid Fuels"," Photo of the Moment | Behnaz Sarafpour, Tuesday, 2:58 P.M."," Small Businesses Seek Clarity From Presidential Candidates"," Park Slope Is Abuzz About a Missing Maple"," The Key to Wedded Bliss? Money Matters"," Second Lawsuit Against Federation Is Dismissed"," McCain, Palin Draw Big Crowd in Va."," A Stock-Killer Fueled by Algorithm After Algorithm"," 'Always a Brief Hug, but No Kissing'"," Injury Risk for Girls Not Much to Cheer About"," Steve Jobs on Apple"," For the Best TV Prices, Stay Online"," 'Teammates Will Miss His Ability to Score'"," Sarah Palin, Action Figure"," Steve Jobs Blames It All on Hedge Funds"," Naming Rights and Historical Wrongs"," Coca-Cola to Seek Approval from China on Juice Deal"," Giving Businesses Their Wings"," Missions of Hate and Love, With 9/11 at the Center"," Mississippi: Lawsuit Over Senate Ballot Placement"," Meaner Streets in Washington"," Weighing Euro, Airbus Says Cost-Cutting Means Less Production in Europe"," McCain Calls for Limited U.S. Role in Schools"," Boeing’s Strong Results Alter Strike Dynamics"," The Bailout, Free Markets and History"," Naming Rights and Historical Wrongs"," Iraqi Parliament Returns to Tackle Issue of Election Law"," Apple Turns Spotlight Back on iPod"," Thrift Shops Thriving, but Running Low on Stock"," Fresh Apple Griddle Cakes"," It’s Open House at Last at Altria’s Midtown Home"," OPEC Takes Steps to Cut Oil Production"," In Japan, a Rare Free-for-All for Premier"," Wall Street’s Fears on Lehman Bros. Batter Markets"," North Korea’s Leader Is Seriously Ill, U.S. Intelligence Officials Say"," Thai Court Forces Premier From Office Over TV Cooking Show"," TODAY IN BUSINESS"
"2008-09-11","1"," Lehman’s Stock Slide Continues"," Hurricanes and the Price of Fear"," Stock Can Take a Fall Break"," McCain Honors the Dead of Flight 93"," In Focus | Amanda Means"," Minimalists and Mexicans"," The Worthy Netflix Picks You Nix"," McClatchy Chief Counters Chatter About Going Private"," Apple Executives Settle Backdating Suit"," Pak Supports L.P.G.A.ON. Language Issue"," New Shanghai World Financial Center forced to settle for the title of world's third tallest building"," Mississippi: Conviction Overturned"," Mississippi’s Ballot Trick"," Saudis Vow to Ignore OPEC Decision to Cut Production"," With Palin at His Side, McCain Finds Energized Crowds"," The Netherlands: Srebrenica Lawsuit Dismissed"," Simplicity in a Cellphone, for the Inner Minimalist"," Cellphone and Software Open Up an Alternate Route to the Internet"," Nominees for Latin and Country Music Honors"," Download the Game, Then Keep the Change"," Shopping for Baby Gear With Christiane Lemieux"," Washington Mutual Stock Falls on Investor Fears"," TODAY IN BUSINESS"
"2008-09-12","0"," No Government Help in a Lehman Bailout, Reports Say"," Bloggingheads: Do Issues Matter?"," Mississippi's Dirty-Trick Senate Ballot Foiled - for Now"," 'The View' Couch Not So Cozy for McCain"," Analysis: Palin and Foreign Policy"," The McCain Design Challenge"," Did I say ""in""? I meant ""de""."," SNL Premiere: Obama Will Play Obama. Who Will Play Palin?"," SNL Premiere: Obama Will Play Obama. Who Will Play Palin?"," The Early Word: Dissecting the Palin Interview"," Hedge Fund Glory Days Fading Fast"," Washington Mutual Acts to Shore Up Stock"," S.E.C. Said to Have Opened Inquiry into UAL Stock Drop"," Speculative Bets by Index Funds Didn't Push Oil Prices Up, Report Says"," Nakheel exec says Dubai sales are on the rise, dismisses idea of speculators driving the market"," Texas: No New Hearing for Ex-Agents"," Bassinets by Another Product Name"," The Social Animal"," A Message From John McCain"," Indictments Dismissed for 5 in Steroid Case"," Washington Mutual Acts to Shore Up Stock"," France: Job Loss Figure Raised"," Health Care Issue, Not Quite Hot, Remains Strong"," Speculative Bets by Index Funds Didn’t Push Oil Prices Up, Report Says"," After Bailout, Senators Ask for a Delay in Foreclosures"," With Palin, the Issue Isn’t Faith and Family"," Hedge Fund Glory Days Fading Fast"," A Home in Idaho Where Water Is the Premium"," China Tells Businesses to Unionize"," Figure in Rosenberg Case Admits to Soviet Spying"," Trade Deficit Rose to 16-Month High in July as Oil Prices Hit a Record"," TODAY IN BUSINESS"," Sigur Ros"
"2008-09-13","0"," Wall Street and the Fed Seek a Financial Crisis Plan"," 'Something John McCain Has Never Done'"," Portraying McCain as a Man of the Past"," Speculation on Identity of Hospital That Prosecutors Say Paid Legislator"," As Financial Empires Shake, City Feels No. 2 on Its Heels"," McCain Barbs Stirring Outcry as Distortions"," Rapper Is Issued Visa"," Obama, Trying to Rally Jittery Backers, Attacks McCain as Out of Touch"," Wayne Wang Film to Open Online"," Stuck in Google’s Doghouse"," Markets, Distracted by Lehman’s Woes, Close Mixed"," British Premier Faces Leadership Challenge From Ally"," Russia Stock Market Fall Is Said to Imperil Oil Boom"," The Safety of the Chemical BPA"," Defibrillators Are Lifesaver, but Risks Give Pause"," Allianz Drops Bid for Naming Rights"," Judge Dismisses Corruption Charges Against Leader of South Africa’s Ruling Party"
"2008-09-14","0"," Lehman Expected to File for Bankruptcy Protection"," What a Lehman Bankruptcy Filing Might Look Like"," A Weekend in San Francisco’s Mission District"," The Dog Diaries, or the Luxe Life"," Balancing National Security and the Rights of Visitors"," When is not a bailout a bailout"," Linked to Bush, McCain Faces Gore's Conundrum"," Open Thread on Patriots-Jets: Gloating Is Allowed"," McCain Appears at Nascar Event"," Other Stops: Alaska: Where Ignorance Is Bliss"," European Roundup: Salavat Tripped Up by an Unlikely Foe, and a Wild Premiere in Berlin"," Open Tryouts Draw Crowd of Hopefuls"," 2 Young Players Take a Risk by Relying on One Opening"," Nixon Cited Missed Clues in Defense of a Rosenberg"," Abigail Adams, Michael McCumber"," Daniel Pinello, Lee Nissensohn"," States Restore Voting Rights for Ex-Convicts"," We May Miss Kim Jong-il (and Maybe Musharraf)"," Gas Prices Rise as Industry Assesses Storm Damage"," A Financial Drama With No Final Act in Sight"," Are We Experienced | Fact-Finding Mission"," That Dividend Tax Rate"," Bailout Hide and Seek"," The Titans&#8217; Finnegan Is Keeping the Chatter to a Minimum"," English Channel Tunnel Reopens, Though Travel Chaos Continues"," The Poetry of Scissors and Glue"," From Kingston’s Streets to the Wide-Open Spaces"," A Dog’s Lie"," The Bipolar Puzzle"," Bridging Generations and Hemispheres"," Apple City World-Champion Baby-Back Ribs"," THE WAY WE EAT: 09-14-08: APPLE CITY WORLD-CHAMPION BABY-BACK RIBS"," DO THE PACKERS HAVE THE N.F.L.'S BEST BUSINESS MODEL"," Assessing the Risk of a Big Hurricane"
"2008-09-15","0"," How TV Business Networks Covered the Bank Failures"," Why Ken Lewis Likes Investment Banking Again"," Obama and McCain Weigh In on Wall St. Turmoil"," Lehman’s Big Bankruptcy Filing"," Lehman in Bankruptcy; Merrill to Be Sold; A.I.G. Struggles"," Lehman Says It Will File for Bankruptcy"," Banks Lost Fight to Halt Bets Against Financial Firms"," Global Markets React to Bank Woes"," McCain at Bill Clinton Event"," Comparing Political Animals"," An Innocent in Love and Show Business"," McCain-Obama on Science"," Obama and McCain: No Climate Doubt"," Economic Issues Rise to the Surface"," Joba's Future: The Issue That Won't Go Away"," Financial Assurances: 'We Planned for a Day Like Today'"," Biden Calls McCain 'Bush 44'"," Treasury Chief on Financial Turmoil"," Feminism's Party Lines"," Financial Services Firms and Campaign Donations"," Bush Remarks on Financial Turmoil"," Biden’s Remarks on McCain’s Policies"," Cheney and a Truth Commission"," TV Business Networks Cover Bank Failures"," A.I.G. Plunges in Market Open"," New iPhone Chip Will Cost an ARM and a Missile"," Jittery Road Ahead for U.S. Stocks"," Nation's Financial Industry Gripped by Fear"," U.S. Futures Contracts Fall With the Dollar"," Poems on Aging: 'Not for Sissies'"," Risks Found for Youths in New Antipsychotics"," Financial Russian Roulette"," Gas Prices Climb Quickly as Refineries Remain Closed"," Squadron’s Agenda: A More Open Albany"," Rays' Price Makes Impressive Debut in Tradition-Filled Setting"," In California Train Crash, Riders Had Destinations and Death in Common"," As Oil and Gas Prices Rise, Wood Stoves Gain Converts"," Premiumize or Perish"," Linked to Bush, McCain Faces Gore’s Conundrum"," Peter Camejo, Green Party Figure, Is Dead at 68"," Folks Who Brought You Slate Build a Business Site for the Facebook Set"," Frozen Peach Yogurt"," Open Your Ears to the Primitivist Murk"," Don’t Buy That Textbook, Download It Free"," Nation’s Financial Industry Gripped by Fear"," Lehman Files for Bankruptcy; Merrill Is Sold"," TODAY IN BUSINESS"
"2008-09-16","1"," Fed to Offer Bridge Loan to A.I.G. and Take Control of Firm"," BofA’s Merrill Deal Brings Risks and Opportunity"," Wall St.’s Turmoil Sends Stocks Reeling"," What Wall Street’s Woes Mean for New York"," Lehmans Failure Is Another Blow for Hedge Funds"," European Roundup: Avangard Coach Dismissed, and a Day for the Radulovs"," The Opening of Lincoln Center"," Ferry Workers Rescue Missing Teacher"," 'McCain's Attack Ads Have Gone Too Far'"," Fiorina Sets off Flap, Saying Palin Not Ready for Big Business"," McCain Spars With MSNBC Host"," Even prices for country homes in the U.K. sliding, study finds"," Political Prediction Markets"," Ex-Dog Biscuit Factory Is Among 5 Landmarks"," Obama Scoffs at McCain Economic Panel"," Goldman Sachs: Happy to Be Bankless"," A Lehman-Backed Biotech Braves the Markets"," Democrats Sue Michigan G.O.P. on Voter Issue"," McCain Toughens Talk on Wall Street 'Crisis'"," McCain and the BlackBerry Phenom"," McCain Spars With 'Morning Joe' Co-Host"," Journal Disputes McCain's Health Care Claims"," M.T.A. to No. 7 Riders: Rate This Line"," A Fall Visit to Stockbridge, Mass., in the Berkshires"," Apple's Capricious Rules for iPhone Apps"," CSX Loses Appeal on Hedge Fund Nominees"," Microsoft and the Culture Wars"," OSHA Issues Violations in Collapse of Crane"," Sell the Naming Rights and You May Sell Much More"," Asian Stocks Down Sharply in Wall Street Turmoil"," What Changes in the Financial World Mean to Customers"," Mad Dog Is Unleashed"," As Simpson Robbery Trial Opens, Motive Is the Focus"," McCain’s Radical Agenda"," Business or Pleasure? More Are Choosing Both"," Saluting a Change Agent and a Maverick of Dance"," In Spanish, McCain Criticizes Obama on Immigration"," A Dissenting Voice as the Genome Is Sifted to Fight Disease"," That Dog Is Bald, and Now We Know Why"," Redefining Depression as Mere Sadness"," A Jukebox on MySpace That Takes Aim at Apple"," Hirst’s Art Auction Attracts Plenty of Bidders, Despite Financial Turmoil"," Presidential Candidates’ Positions on Science Issues"," Nominee for Premier Divides Thai Party"," As Economy Slows, China Eases Monetary Policy"," Wall St.’s Turmoil Sends Stocks Reeling"," Comparing Political Animals"," TODAY IN BUSINESS"," McCain at Bill Clinton Event"
