"Date","Direction","Headline"
"2006-09-19","0"," Jim McCann"," Missouri Senate"," Hertz Adds Ford Bankruptcy Scenario to I.P.O. Filing"," Apple"," Virgin Group's Sir Richard Opens a Charity in America"," Amaranth's Loss Rattles Nerves, Not Markets"," Mutual Funds Put Their Money on Private Equity"," Former Deutsche Banker to Launch Japan Hedge Fund"," EMC Announces Deal for Network Intelligence"," Actavis Folds, Leaving Barr Holding a Very Pricey Pliva"," Motorola to Buy Symbol Technologies for $3.9 Billion"," Hedge Funds: Superhuman No More?"," Princeton Stops Its Early Admissions, Joining Movement to Make Process Fairer"," Yahoo Says Ad Growth Is Slowing; Stock Dives"," Columbia Alters Financial Aid for Low-Income Students"," Motorola to Buy Symbol Technologies for $3.9 Billion"," Tales of the City: Dog on the Track"," Seeing Huge Losses, Chrysler Slashes Production"," Trenton: Senate Panel Approves Nominee"," Judge Dismisses Lawsuit Challenging Tennis Officials"," Truckers Testify That Halliburton Put Lives at Risk"," A Hedge Fund’s Loss Rattles Nerves"," Princeton Stops Its Early Admissions, Joining Movement to Make Process Fairer"," Trying to Figure Out How Much Tease Is Too Much"," Gore Calls for Immediate Freeze on Heat-Trapping Gas Emissions"," BP Delays Opening of Big Oil Platform"," Entrepreneur From Britain Opens Charity in America"," Inflation Fears and Rising Oil Prices Bring Rally to a Halt"," U.N. Rights Chief Urges Monitors for Sri Lanka"," Dietary Factors: Vitamin D Is Said to Cut Pancreatic Cancer Risk"," Where Jazz, Show Business and Politics Converge"," Radio Programming for Women, Whatever That Means"," Time to Move the Mississippi, Experts Say"," Issues Along Party Lines"," TODAY IN BUSINESS"," World Business Briefing | Europe: Britain: Brokerage Firm Plans Breakup"
"2006-09-20","1"," When Apple Hit Bottom"," Profiting From a Hedge Fund's Woes"," The South Plaquemines Hurricanes"," Goldman Taps into Climate Exchange"," Financial Players Circle Time's Magazines, Report Says"," Silicon Graphics Gets Approval to Exit Bankruptcy"," China Should Let Insurers Invest More in Market, Exchange Chief Says"," When Apple Hit Bottom"," Chicago Exchange to Exert Takeover Restraint"," Envisioning the Merger of Three European Exchanges"," Florida: U.S. Aide Admits Explicit Exchanges"," Wandering Canine Gives Train Riders a Tail of the City"," Uganda: Rebel Leaders Miss Deadline to Gather Under Peace Deal"," Hedge Fund Shifts to Salvage Mode"," As Yankees March On, a Reminder of Rodriguez’s Summertime Swoon"," Doubts Rise on Iraqi Premier’s Strength"," Mob Figure Is Investigated in Plot to Kill Judge in Case"," With Premier at U.N., Thai Military Stages Coup"," Boeing Said to Be Selected to Lead Border Program"," Shuttle Mission Is Extended to Allow a Search for Damage"," World Business Briefing: Europe and Americas"," Hitting the Road With Brands in Tow"," Yemen Leader Is Now Paying for Providing Open Election"," Motorola Buys Symbol Technologies to Widen Reach"," A Lively Opener, With the Spotlight on a Young Violinist"," A Calvados Meant for the Cook"," Enforcer Is Missing From N.C.A.A. Rule Book"," Recipe: Apple, Cranberry and Goat Cheese Salad"," Arts, Briefly; Dissecting Dylan"," A Calvados Meant For the Cook"," TODAY IN BUSINESS"
"2006-09-21","0"," The Business Case for Diversity"," Race and College Admissions"," Learning By Extremism"," Eliot Reaches Out to Business"," Recent Openings"," Times Reader Launches in Limited Beta"," Revolving Door: Bank of America, Credit Suisse"," Warner Chilcott's I.P.O. Prices Below Expected Range"," Chinese Firms Spearhead Nasdaq Listings"," Lehman Takes Stake in Electronic Exchange"," YouTube Has $1.5 Billion Price Tag, Report Says"," In a Reversal, Germany's Merck Wins Serono for $13 Billion"," More Deal Speculation About Facebook, YouTube"," It Was Loud. It Was Fast. But What Did It Mean?"," 3 Riders Suspended"," France: Le Pen Opens Presidential Campaign on Symbolic Battlefield"," Yemen: Turnout Brisk for Competitive Presidential Election"," Set to Lead, Japan’s Next Premier Reconsiders Postwar Era"," Suits Say U.S. Impeded Audits for Oil Leases"," Debate Over Chemical Plant Security Focuses on Strictness of Rules"," Wal-Mart to Test Price Cuts on Range of Generic Drugs"," White House Presents Plans to Cut Emissions"," Hedge Fund Sheds Assets in Energy"," F.D.A. Nominee Advances; Hurdles Linger"," More Small Women’s Colleges Opening Doors to Men"," When Jeans Don’t Fit a Woman Past Adolescence, a Business Is Born"," British Science Group Says Exxon Misrepresents Climate Issues"," Ellen Unloads"," A High-Rise Speaker Tower for Your Highly Esteemed iPod"," The Complex Business of Living While War Rages in Nigeria"," World Briefing | Middle East: Yemen: Turnout Brisk For Competitive Presidential Election"," World Briefing | Europe: France: Le Pen Opens Presidential Campaign On Symbolic Battlefield"," TODAY IN BUSINESS"," Arts, Briefly; Philadelphia Orchestra To Market Downloads"
"2006-09-22","0"," Brisket Is on the Menu"," No Rush to Deregister Among Hedge Funds"," Cablevision Awarded Stock Options to Dead Employee"," Branson Pledges to Finance Clean Fuels"," NYSE Addresses Regulatory Concerns in Euronext Deal"," The Minutia of Anime vs. the Lure of Love"," Nike Profit Falls 13%"," Colorado: Videotape Shows Missing Marine, Police Say"," Focus Turns to the Chief of H.P.; Stock Falls"," Branson Pledges to Finance Clean Fuels"," Limits Used in Terror Cases Are Imposed on a Mob Figure"," German Drug Business Is Sold"," Russia Makes a Gamble Against U.S. in Davis Cup"," G.O.P. Nominee for Governor Worked With Governor’s Office on Stock Sale"," Cablevision Restates Results Because of Stock Options"," Germany’s Merck Buying Biotech Concern"," Missing Indians Join Lichtenstein Show"," Iran Leader, at U.N., Skirts Issue of Hezbollah’s Disarmament"," Stock-Car Racing: A Last Blast of Speed in the Fall"," Arts, Briefly; HBO Films Acquires Rights For a Katrina Mini-Series"," TODAY IN BUSINESS"," Art in Review; Natalie Jeremijenko"," Iran Leader, at U.N., Skirts Issue Of Hezbollah's Disarmament"
"2006-09-23","0"," Roddick and Blake Lose, Putting U.S. on Brink of Davis Cup Defeat"," Spain: Government Ends Church Subsidy"," Dipietro Struggles in Opener"," State Commission Hints at Inquiry Into Legality of Faso’s Lobbying Activity"," Dean E. Wooldridge, 93, Missile System Developer, Is Dead"," Decline in Gas Prices Isn’t Buoying Detroit"," Gas Pipeline Has Risks, U.S. Says"," Energy Prices and a Hedge Fund Take a Tumble"," Chamber Music Society Opens With New Directors"," Feisty Bohemia of Tunes and Teddy Bears"," Does My Illness Have to Be Your Business? (1 Letter)"," The Day of the Dogs"," The Education of a Dog Show Judge"," A Voyage in Bronze and Bamboo"," Berlin Mayor, Symbol of Openness, Has National Appeal"," What’s a Couple of Hundred Trillion When You’re Talking Derivatives?"," Paid Notice: Deaths  STOCKHAUSEN, THOMAS C."," Does My Illness Have to Be Your Business?"," TODAY IN BUSINESS"," World Briefing | Europe: Spain: Government Ends Church Subsidy"
"2006-09-24","0"," ‘Forgetfulness’"," Commissioner's Report: Minding Your Q's"," Harvard Lives Up to Top Billing in Opener"," McCareins Is a Wide Receiver Often Caught in the Middle"," Helicopter Carrying 24 Is Missing in Nepal"," Regulating Hedge Funds"," With Prices Falling, Gas May Lose Its Electoral Punch"," After a Bit of Good News, Stocks Fall for the Week"," A Dog’s Life, Upgraded"," In an Emissions-Free Lap of Luxury"," Industrious Thinking for Affordable Housing; Bitter Disagreement Over School Boards; Vocational Education: A Nationwide Need (6 Letters)"," Costa Careyes, Mexico: A Pacific Resort Where the Air Kisses Are Understated"," The Quiet Season at National Parks Means Discounts and Elbow Room"," An Uptown Renaissance (Again)"," The Education of a Dog Show Judge"," The Day of the Dogs"," The Remix; The New New List: Fall '06"," The Day of the Dogs"," Ticket Raises Questions For Newark Police Nominee"," The Other Side Of Lower Oil Prices"," The Day of the Dogs"," Success Breeds Chemistry"," A Voyage in Bronze and Bamboo"," The Education of a Dog Show Judge"," The Remix; It's All About ..."," The Remix; High-Low | Stockholm Eats"," Industrious Thinking For Affordable Housing"," The Day of the Dogs"," The Remix; Forward Look | Boston's Art Star"," The Remix; Case works"," The Remix; Air Supply"," The Education of a Dog Show Judge"," The Education of a Dog Show Judge"
"2006-09-25","1"," For Globe-Spanning Law Firm, Bankruptcy Court Is Last Stop"," Hedge Fund's Post-Katrina Trades Said to Spark Inquiry"," The Razing of Rights"," Chiquita Hurt in Spinach Scare, Cuts Dividend and Considers Asset Sale"," Alcoa Sells Home Exteriors Business for $305 Million"," British Building Supplies Concern Wolseley Slips on Share Issue"," Are Business Students Less Ethical, or More Honest?"," Bond Traders Lost $1 Billion in Commissions After New Rules"," In Sluggish Real Estate Market, Kozlowski Can't Unload Property Fast Enough"," Putin Dismisses Concern Over EADS Deal"," Credit Suisse Bankers Told to Rein in Spending"," British Troops in Iraq Kill Senior Qaeda Figure"," Oil Prices Fall as Speculators Retreat"," Homes Post Price Drop for August"," Putin Offers to Sell Natural Gas to Europe Instead of U.S."," Showing Support for Faso Now Comes at a Price"," Chemical Plants, Still Unprotected"," Armin Jordan, 74, Swiss Conductor Known for French Music, Dies"," In Italy, Nike Makes Light of the Famous World Cup Head Butt"," Not So Funny Anymore: Squabbling and Spiraling Costs Dissolve a Comedy Mill"," Stock Offerings This Week"," Missing a Winning Move, Topalov Eventually Loses"," Showing Support for Faso Now Comes at a Price"," TODAY IN BUSINESS"," Stock Offerings This Week"
"2006-09-26","1"," Spitzer and Faso on the Issues"," Intelligence Update"," Acquicor to Acquire Jazz Semiconductor for $260 Million"," Butler Charged With Insider Trading in Elvis Deal"," NikeAdForum"," Johnson & Johnson Seeks $5.5 Billion in Suit Over Guidant"," Practical Traveler: New Passport Rules May Mean Delays"," British Hedge Funds Cleared of Suspicion of Inside Dealmaking"," Feds Ramp Up Stock-Option Investigations"," Hedge Fund Manager Pleads Not Guilty to Insider Trading"," Softbank May Miss Loan Deadline"," Coca-Cola Eyes Deal for Philippines Unit"," As Oil Prices Fall, Russian Stock Prices Suffer"," Thai Junta to Stay After Appointing Premier"," Big Victory, but Ailing Johnson Will Miss a Start"," Censored Affidavit Issued in National Security Case"," Canada: Inquiry Into Air India Attack Opens"," University of Virginia Drops Early Admissions"," Israeli Premier and Saudi Said to Hold Secret Meeting"," High Winds, Then Premiums"," Revlon to Cut Jobs and Cancel Products"," Oil Contract Dips Briefly Below $60 a Barrel, as Speculators Bet on Lower Prices"," Manhattan: Suit Against Minnelli Is Dismissed"," Manhattan: Scholar Denied Visa"," For Giants and Manning, Sound and Fury Mean Nothing"," Gunmen Kill Afghan Official Who Backed Women&#8217;s Rights"," Homes Post Price Drop for August"," Nasdaq Leads a Rally as Benchmark Rates and Oil Prices Fall"," Farming Bluefin Tuna, Through Thick Stocks and Thin"," Ailing Johnson to Miss Last Start"," With Eye on Presidency, Pataki Is to Open Office in Iowa"," Senators Call for Release of Intelligence Estimate on Terrorism"," Inquiry Builds Case on Bombing That Killed Lebanon&#8217;s Ex-Premier"," After Weathering Turmoil and Isolation, Cambodian Museum Rejoins the World"," Emblem of the West Is Dying, and No One Can Figure Out Why"," The Claim: Chlorine in Drinking Water Can Increase the Risk of Cancer"," At Risk: Smoking Tied to Increased Risk of H.I.V."," Baseball’s Oldest Old-Timer Opens a Window on the Past"," Paid Notice: Deaths   COURTISS, DICK"," Smoking Tied to Increased Risk of H.I.V."," TODAY IN BUSINESS"," Johnson Will Miss Last Start  "," World Briefing | Americas: Canada: Inquiry Into Air India Attack Opens"," With Eye on Presidency, Pataki Is to Open Office in Iowa"," Psychiatrists at Risk"
"2006-09-27","1"," From the Department of Symbolic Bandwagons"," Open and Shut"," Icahn Puts Federated Stock on His Shopping List"," Times Reader Beta Launches"," China Energy, or the Case of the Missing Chairman"," Political Intelligence"," Mutual Fund Is Sued by Spitzer Over Trades"," S.E.C. Investigates Pirate Capital Hedge Fund, Report Says"," Judge Limits Scope of Advanced Micro's Suit Against Intel"," Goldman Sachs Powers Up GridPoint"," Intel Commits $40 Million to Chinese Start-Up"," Hong Kong Real Estate Firm Finally Completes Its Stock Offer"," Stock-Options Scandal Has Cost Investors a Tidy Sum"," Mindray Medical's Shares Open With a Gain"," Aer Lingus Prices I.P.O. at the Low End of Its Range"," Citigroup in Pole Position in Debt Markets"," G.M. Puts Multibillion Dollar Price Tag on Tie-Up, Report Says"," Bronfman Gearing Up for Another Go at EMI, Report Says"," More Travelers, Still at Home, Meeting Online"," Judge Limits Scope of Suit by A.M.D. Against Intel"," With Matsui Back in Left, One Less Issue for Yankees"," Backing Policy, President Issues Terror Estimate"," Rubin Advances in Luxembourg"," Deal to Put Live Concerts on Internet Is Dissolved"," Race Is Top Issue in Bid to Represent Memphis"," Intel Fires Back at A.M.D. Over Bragging Rights on Chip"," Gas Prices Lift Consumer Mood; Some Concerns Persist on Jobs"," Boof? Twins Know What It Means"," Insider Trading Alerts Rise"," Declassified Key Judgments of the National Intelligence Estimate on Global Terrorism"," City University Plans to Open a Graduate School of Public Health"," Johnson & Johnson Sues Boston Scientific, Guidant and Abbott Laboratories Over Deal"," Jury Backs Merck in Vioxx Lawsuit"," Coming to Times Square, an Advertising Campaign by the Nets"," Auto Parts Supplier to Miss Forecasts"," A New Orleans Project Is Missing Some Pieces"," New Premier Seeks a Japan With Muscle and a Voice"," At Long Last, a Shostakovich Premiere"," There’s More Than Heat to a Pepper’s Personality"," Judge Dismisses Murder Charge Against New Suspect in a 1990 Case"," Recipe: Turkey Kebabs With Urfa Pepper"," Coming to Times Square, an Advertising Campaign by the Nets"," City University Plans to Open a Graduate School of Public Health"," THE 2006 CAMPAIGN: Candidates and Issues; With Administrations Bickering Over Terrorism, Senator Clinton Joins the Fray"," TODAY IN BUSINESS"
"2006-09-28","1"," The Costs of Extremism"," Newly Forged Arcelor-Mittal Plans Rich Dividend"," NYSE's Stock Surge Prompts Mad Money Mea Culpa"," Merrill Predicts Another Semiconductor L.B.O. - in Europe"," Ackman Preps $2 Billion Bid for McDonald's Stake"," Bowing to Hedge Fund, Nabi Considers Sale"," Could Microsoft Bid for eBay?"," Dow Flirts With Record but Just Misses It"," Yonkers: Police Commissioner to Retire"," Hungary: Premier Sorry for Foul Language"," California: Schwarzenegger Signs Gas Emissions Act"," Dispute on Intelligence Report Disrupts Republicans’ Game Plan"," McDonald’s Raises Its Dividend by 49%"," Montoya Set for Stock Car Debut"," Amgen Prices Colon Cancer Drug 20% Below ImClone Rival"," At German Conference on Muslim Relations, One Vote Is Unanimous: Mozart Must Go On"," In 10 Days, Sheffield Tries to Figure Out First"," Iranian and Europe Envoy Open Talks on Uranium Enrichment"," Verizon Details Its Fiber Optic Spending"," Qaeda Figure Tied to Pearl Case"," Iva Toguri D’Aquino, Known as Tokyo Rose and Later Convicted of Treason, Dies at 90"," Chemical Plant Security (1 Letter)"," For the iPod or Cellphone With Everything, a DVR of Its Own"," Kerik Is Again a Figure in an Official Investigation"," Avoiding Risks in Game 4, Kramnik Draws Again"," TODAY IN BUSINESS"," Chemical Plant Security"
"2006-09-29","0"," The Healthy Apple"," Turning the Torture Issue Over to the Voters"," My Times – Markets and Stock Quotes"," PNC Financial: Pittsburgh's Other Turnaround"," R.I.M. Says It's Reviewing Stock Option Practices"," EMI Offloads Hollywood Landmark"," GATX to Sell Aircraft Business To Investors"," Nasdaq Not Expected to Make Sudden Move on L.S.E."," Ardor and Abandonment in the Animal Pack"," Recent Openings"," Nigeria and Venezuela to Cut Oil Production"," Seagate to Open a Third Plant in Singapore"," Mets Pitcher to Miss Postseason With Injury"," Iva Toguri, American"," In Teeming India, Water Crisis Means Dry Pipes and Foul Sludge"," Hedge Fund Shrinks Staff and Faces S.E.C. Inquiry"," R.I.M. Says It’s Reviewing Stock Option Practices"," Kerkorian Pushes G.M. for Renault-Nissan Deal"," Microsoft&#8217;s Rival Device Will Be Priced Similar to iPod: $249.99"," Trouble in Queens as Lentil Prices Rise"," Stick Figures and New Math"," Trampling Rights to Fight Terrorism (6 Letters)"," Let’s Face It: There Are Risks to Flying (3 Letters)"," The Other Red Hot Chili Peppers Come to the Brooklyn Botanic Garden"," St. Regis Resort & Residences, Costa Rica; Club Casa Mina"," At Ole Miss, the Tailgaters Never Lose"," Let's Face It: There Are Risks to Flying"," Art in Review; The Filipino Roots of Minimalism"," Art in Review; Jessica Stockholder"," Art in Review; Seth Price"," TODAY IN BUSINESS"," Trampling Rights to Fight Terrorism"
"2006-09-30","0"," Commissioner's Report: You Make the Call"," Martínez to Miss 8 Months Following Shoulder Surgery"," Jetliner With 155 Aboard Is Missing Over Amazon"," Venezuela and Nigeria, Both OPEC Members, Say They Will Cut Their Oil Production"," She Leads, She Scats, She Plays a Mean Bass"," F.D.A. Says Bayer Failed to Reveal Drug Risk Study"," Finance Office of Disease Control Agency Is Slipshod, Federal Report Says"," Hedge Fund With Big Loss Says It Will Close"," Watching Prices Swing in Health, Housing and Stocks"," Change in Goldman Index Played Role in Gasoline Price Drop"," Islamic Extremism and Our Response (5 Letters)"," Finances Slip, and a Ski Area Closes"," Jagshemash, Premier Bush"," Where Fetching Water Means Waiting for the Train  "," Islamic Extremism And Our Response"
